created_at,full_text,screen_name,location,description,followers_count,friends_count,statuses_count,verified,full_retweet_text
2020-04-13 23:51:09+00:00,RT @laurenthomas: NEW: The #coronavirus is already causing a spike in commercial mortgage delinquencies in hotel and retail. The data speak…,rsrohit38,noida india,मैं हिन्दू हु मुझे हिन्दू होने पर गर्व है जय श्री राम जय श्री श्याम I am an ordinary person and my thoughts are also simple,446,5001,11250,False,NEW: The #coronavirus is already causing a spike in commercial mortgage delinquencies in hotel and retail. The data speaks to a bigger fear haunting the commercial real estate industry: That Covid-19 could spark an even bigger mortgage crisis than in 2008- https://t.co/5wYH51RcZN
2020-04-13 23:51:10+00:00,"RT @IYC: We applaud the dedication &amp; hard work of every member of @IYCKerala in ensuring food, health and safety for the elderly, the poor,…",haldankarSudeep,thane india,"🛩Fly High but Stay Grounded🙏🏻
☠️🛑Bhakts Stay Away🛑☠️",193,227,121542,False,"We applaud the dedication &amp; hard work of every member of @IYCKerala in ensuring food, health and safety for the elderly, the poor, migrant workers and all those residing in the state. #MeriZimmedari 

Contribute to help. Donate to the Corona Relief Fund:
https://t.co/Ou9XgFYHvO https://t.co/tAedvvjDHi"
2020-04-13 23:51:14+00:00,RT @TarekFatah: So the Obama Administration gave the Chinese lab in Wuhan a million dollar grant to perform experiments on bats? https://t.…,PehlaSuraj,india,An Indian with an opinion on everything..RTs & likes are not endorsements.,175,170,25246,False,So the Obama Administration gave the Chinese lab in Wuhan a million dollar grant to perform experiments on bats? https://t.co/pnSUwWUN7u
2020-04-13 23:51:42+00:00,"RT @NorbertElekes: BREAKING: Number of reported cases of coronavirus in India has reached 10,000.",SRKKOLHAPURCFC,kolhapur india,Welcome To Official ❤Shah Rukh Khan❤ Fan Club Of Kolhapur (M.H.). Branch Of @SRKCHENNAIFC.♡Pride Of SRKian♡City Admin: @Daradeking WhatsApp: 8550951162,712,132,32978,False,"BREAKING: Number of reported cases of coronavirus in India has reached 10,000."
2020-04-13 23:51:43+00:00,"RT @AyshaRenna: This is what our govt told exactly a month ago. 
Apart from demonising Muslims, Poor Testing Rates, No Protective Gear for…",ndpsr,delhi india,"science journalist, secular, love music .......",1375,2066,38278,False,"This is what our govt told exactly a month ago. 
Apart from demonising Muslims, Poor Testing Rates, No Protective Gear for health workers, stranded migrant workers, PM must tell what have we earned from the lockdown as he addresses the nation again tomorrow.
#अगला_ड्रामा_कल10बजे https://t.co/wj21ZeFJX8"
2020-04-13 23:51:49+00:00,Tummy got no chill https://t.co/yatQEiDAEb,mrrightneel,new jersey usa india,It's complicated.,138,200,10185,False,
2020-04-13 23:51:50+00:00,RT @UnSubtleDesi: The Quint sends 45 employees on indefinite leave without pay due to Coronavirus lockdown https://t.co/vhbfQIFiHP,jaijawan1000,india,"proud indian.
FOE is nt limited 2 shit librals,fake secularism nd anti national naxal idology.
 marine engineer by http://profesion.",191,400,12737,False,The Quint sends 45 employees on indefinite leave without pay due to Coronavirus lockdown https://t.co/vhbfQIFiHP
2020-04-13 23:51:52+00:00,"RT @stamen: In the time of #COVID19, understanding #dataviz is more important than ever. We're reworking our teaching materials to include…",currankelleher,india,"Data Visualization Consultant, Software Craftsman & Educator",1937,918,4113,False,"In the time of #COVID19, understanding #dataviz is more important than ever. We're reworking our teaching materials to include many coronavirus examples to help you develop better data literacy &amp; grow your data visualization skills. Sign up now for our first all-virtual workshop: https://t.co/wWIZIXvnaF"
2020-04-13 23:51:54+00:00,"RT @ShivAroor: Likh ke le lo, when this shit has passed, they’ll quietly give this chap the Nobel Peace Prize.",brandingbuddy,india,"Small town guy, NAMO fan, Branding, communications | Avani's Father",112,944,15372,False,"Likh ke le lo, when this shit has passed, they’ll quietly give this chap the Nobel Peace Prize. https://t.co/LFxj0sxh0H"
2020-04-13 23:51:55+00:00,"RT @insecticidesltd: This Bihu, home is the best place to celebrate. Stay in &amp; pray for the good health of your loved ones #HappyBihu #Stay…",Deveshs15462621,kushinagar india,,35,247,144,False,"This Bihu, home is the best place to celebrate. Stay in &amp; pray for the good health of your loved ones #HappyBihu #StayHomeStaySafeStayhealthy https://t.co/etH9qoa9og"
2020-04-13 23:51:55+00:00,RT @ndtv: Indian in Dubai sacked by firm over alleged hate speech in Facebook post https://t.co/TfFCDeTavd https://t.co/cImtdfm6YU,shashank_singh2,new delhi india,"Anchor @NDTV, Sports Buff, Tweets are Personal.
https://t.co/B0hrccsXhB",347,166,1575,True,Indian in Dubai sacked by firm over alleged hate speech in Facebook post https://t.co/TfFCDeTavd https://t.co/cImtdfm6YU
2020-04-13 23:51:59+00:00,RT @CovidKarnataka: Karnataka has been at the forefront of the war on #Covid_19 &amp; has used technology to keep track of the pandemic. The Co…,advssjoshi,katghora korba c g india,Advocate,1055,2351,44602,False,Karnataka has been at the forefront of the war on #Covid_19 &amp; has used technology to keep track of the pandemic. The Covid-19 dashboard was  inaugurated by hon’ble minister @mla_sudhakar at State War Room . It will contain micro data which will also be accessible to the public. https://t.co/BcC3Nucy1i
2020-04-13 23:52:00+00:00,"RT @KtSukhalu: In view of the uncertainty of the Covid-19 pandemic, all schools will remain closed till further orders for the safety and w…",SethiNagaland,nagaland india,"Chairman, Minority Department & Secretary
Nagaland Pradesh Congress Committee",203,675,18990,False,"In view of the uncertainty of the Covid-19 pandemic, all schools will remain closed till further orders for the safety and well-being of our students @MyGovNagaland @Neiphiu_Rio @NDPPofficial"
2020-04-13 23:52:16+00:00,RT @AFP: Rio de Janeiro's statue of Christ the Redeemer is lit up on Easter Sunday with images of medical workers in honour of all those fi…,_AkashSunil,cochin india,Introvert | cinephile | Bibliophile | sapiosexual | Egalitarian | Views are personal. IND 📚,186,52,11825,False,"Rio de Janeiro's statue of Christ the Redeemer is lit up on Easter Sunday with images of medical workers in honour of all those fighting the COVID-19 pandemic around the world 

📸 Carl De Souza https://t.co/ENb9IsKVvX"
2020-04-13 23:52:20+00:00,"RT @timesfactcheck: FAKE: Kavita Krishnan, Prashant Bhushan, Punya Prasun Bajpai, etc falsely claim that a UP woman was forced to drown her…",real_Swapnilk,india,"Nation First 
🇮🇳
नमस्ते सदा वत्सले मातृभूमि...",164,1743,3915,False,"FAKE: Kavita Krishnan, Prashant Bhushan, Punya Prasun Bajpai, etc falsely claim that a UP woman was forced to drown her five kids since she was unable to feed them due to the nationwide lockdown https://t.co/JrAWwt7p5q"
2020-04-13 23:52:24+00:00,Stay Home,SanjayS59972780,bihar india,Teacher,3,24,2,False,
2020-04-13 23:52:27+00:00,"RT @aseemsundan: Two of the pharma companies in the country, that are helping us fight against the COVID19 are Cipla &amp; Wockhardt, both owne…",Sk_Zub,maharashtra india,"‏‏‏‏‏‏ہم وہاں ہیں جہاں سے ہم کو بھی  ۔ 
      کچھ    ہماری    خبر    نہیں    آتی ",171,357,10376,False,"Two of the pharma companies in the country, that are helping us fight against the COVID19 are Cipla &amp; Wockhardt, both owned and run by Muslims. The next time you don't want something a Muslim sells because they spit on it avoid buying medicines.

Buy a bottle of gaumutra instead."
2020-04-13 23:52:31+00:00,"RT @BDUTT: Where do India's Poor Non-Covid patients go? I met Rajesh, a pavement dweller diagnosed with lip cancer, so poor, so alone, he d…",virdikuldeep,ludhiana punjab india,Die hard Congress Supporter. Followed back by @INCIndia .,712,984,106232,False,"Where do India's Poor Non-Covid patients go? I met Rajesh, a pavement dweller diagnosed with lip cancer, so poor, so alone, he didnt even know that.  He was turned away from the now COVID-only hospital. We blurred some of these images, but not fully, because this is the Truth. https://t.co/eY81dVscrQ"
2020-04-13 23:52:35+00:00,"RT @IYC: There are no words that can express this heartbreak.

The Modi govt must explain how they expect the poor to survive the lockdown…",haldankarSudeep,thane india,"🛩Fly High but Stay Grounded🙏🏻
☠️🛑Bhakts Stay Away🛑☠️",193,227,121542,False,"There are no words that can express this heartbreak.

The Modi govt must explain how they expect the poor to survive the lockdown without food. The Centre must align with the states to mitigate this worsening crisis of the poor.

Govt must act now. https://t.co/ANDbw8XxF9"
2020-04-13 23:52:40+00:00,"RT @ANI: #WATCH Today, the number of samples that are positive are 98. Of these 98, 91 are from a 'single source' and 7 are from contacts:…",abvspl,presently chennai india,"On the move always forever, aimer la vie.
Fight Discrimination and spread truth.                              Passionate writer and crusader 'Food for All'",245,714,21304,False,"#WATCH Today, the number of samples that are positive are 98. Of these 98, 91 are from a 'single source' and 7 are from contacts: : Tamil Nadu Health Secretary Beela Rajesh. #COVID19 https://t.co/LZZn6rpu5P"
2020-04-13 23:52:43+00:00,"RT @IndiaPOCO: Do you think you have the funniest social distancing picture with someone? 😉
If yes, share with us in the reply below and ge…",Rakesh806Rakesh,jaipur india,Web developer,14,49,2350,False,"Do you think you have the funniest social distancing picture with someone? 😉
If yes, share with us in the reply below and get a chance to get featured. #TheHappinessProject https://t.co/EF0WIUKWrf"
2020-04-13 23:52:45+00:00,"RT @ANI: As #COVID19 continues to spread, vulnerable communities within Pakistan are fighting hunger and to keep their families safe and he…",Vishnuv48980141,tiruchirapalli india,,78,46,24887,False,"As #COVID19 continues to spread, vulnerable communities within Pakistan are fighting hunger and to keep their families safe and healthy. Food aid must not be denied because of one’s faith: US Commission on International Religious Freedom Commissioner, Anurima Bhargava. https://t.co/cowA4rbuYd"
2020-04-13 23:52:52+00:00,RT @RatanRanjan016: Take a bow @TheOliveKnife you are always ahead of the curve with your inputs,Prashantspeakst,india,proud Indian and die hard NaMo Bhakt .student of guru kalam || #swayamsevak,380,730,20830,False,Take a bow @TheOliveKnife you are always ahead of the curve with your inputs https://t.co/7Yz4FrVFGs
2020-04-13 23:52:56+00:00,COVID-19: What is it exactly? @dailystarnews https://t.co/etHsSA4j0q,myawarbaig,hyderabad india,"Opening the World, One mind at a time.  Account Managed by Communications Team. Tweets by Mirza Yawar Baig signed MYB

YT: https://t.co/E3tcYKVq2e…",8671,16,30639,False,
2020-04-13 23:52:58+00:00,"Wishing You a Happy #Vishu &amp; Tamil #Puthandu Vazthukal 💫

#StaySafeStayHome https://t.co/BDHcd6ACns",prakashnikki,chennai india,"│▌▌│▌▌▌│▌▌│▌▌▌│▌▌│▌▌▌│ └└└└└└└└└└└└└└└└└ Music Director -  Movies - Rowthiram, Kalam,",329,399,752,False,
2020-04-13 23:53:02+00:00,The Public should still continue to stay safe at home. Social distancing is a must at all public places when buying essentials.  - https://t.co/7M4ohWdFvH,RSRINIVASABABU1,hyderabad india,,3,7,13479,False,
2020-04-13 23:53:04+00:00,Record oil output cuts fail to make waves in coronavirus-hit market https://t.co/9AyuzhCDM5 https://t.co/ixD8Wpv0bx,KennedyPaul79,bengaluru india,"#RoyalEnfield lover...biker for life!!!

SEO Content Writer - Acko General Insurance",534,1116,36949,False,
2020-04-13 23:02:48+00:00,What we can learn from COVID19 lockdown. https://t.co/T9ip6iYbgu,debasish_sinha,india,Entrepreneur | Blogger | Author | CEO & MD of @Insysd | Founder of @InsysdNet | RTs do not imply endorsement,3339,1382,26636,False,
2020-04-13 23:03:12+00:00,Two flight attendants share what it's like to work for an airline during the COVID-19 crisis https://t.co/mLSFBgdLZO,v_shakthi,bengaluru india,"Tech Analyst, Tech Blogger, Disability Rights Activist ♿,  Cloud and AI evangelist, Owner of @thequill_in. Email: shakthi@thequill.in",141334,107233,424312,True,
2020-04-13 23:03:15+00:00,"RT @republic: #BengalCovidMystery | West Bengal: Doctors forum urge CM Mamata to ensure 'transparency' in COVID-19 data

https://t.co/UHsFv…",iamSoumikS,bengaluru india,Straight forward,2,138,44,False,"#BengalCovidMystery | West Bengal: Doctors forum urge CM Mamata to ensure 'transparency' in COVID-19 data

https://t.co/UHsFvdRQr5"
2020-04-13 23:03:36+00:00,RT @vijaita: Meanwhile Rs 922 cr to be spent on new Parliament building. How can any of us sleep after watching this.,RohensinghINC,allahabad india,"Engineer, LLB, Sportsman, Writer, Fighter, Security consultant, Member of Executive Committee Uttar Pradesh Congress Social Media Department",213,1940,8163,False,Meanwhile Rs 922 cr to be spent on new Parliament building. How can any of us sleep after watching this. https://t.co/Od1aPaRFiP
2020-04-13 23:03:42+00:00,RT @narendramodi: Mata @Amritanandamayi Ji is known for her selfless service and work towards helping the downtrodden. She has added immens…,KumarRohitsing,patna india,Proud  INDIAN. भारत माता की जय,227,202,29141,False,Mata @Amritanandamayi Ji is known for her selfless service and work towards helping the downtrodden. She has added immense strength to the fight against COVID-19 by contributing to PM-CARES and other efforts being undertaken by her team. #IndiaFightsCorona
2020-04-13 23:03:45+00:00,"Durng this lockdown period.we are so blessed tolearn the most powerfulbreathingtechnique""sudershan kriya ""online.dis is  bestopportunity to learn dis technique to control your https://t.co/mkCwrJYqEZ learn along withyour family.Iam going toregister to my parents. are not you ??? https://t.co/2RRfjGmoIw",RuchiJa28116575,bareilly india,"Volunteer and Blesser at the Art of Living and 
Certified Teacher of Nav chetna and Bal chetna shivir at art of living",17,98,59,False,
2020-04-13 23:03:58+00:00,RT @PeterSweden7: Retweet if you don't believe anything Communist China says anymore.,rocksudd,india,"believe in truth
India comes first
Humanity
अहिंसा परमो धर्मः धर्म हिंसा तथैव च: l
#Life_Skills
#Youtuber #SSFilms",209,653,16802,False,Retweet if you don't believe anything Communist China says anymore.
2020-04-13 23:03:59+00:00,"RT @Microsoft: Things to do today:

1. #StayHome
2. Share an Excel doc through #MicrosoftTeams with a friend or coworker.
3. Play tag. http…",AbhiForTweeting,bengaluru india,"A Computer Science Fanboy and nature lover, Azure Expert",148,403,1911,False,"Things to do today:

1. #StayHome
2. Share an Excel doc through #MicrosoftTeams with a friend or coworker.
3. Play tag. https://t.co/gWGCBJYVEb"
2020-04-13 23:04:13+00:00,@Alyssa_Milano America is going to be communist government because people are so stupid they are electing the people who later take away their rights..look at china for instance..!!,niilvashi,india,Don't mind RTs,295,4259,5354,False,
2020-04-13 23:04:30+00:00,"#PMCARES
Citizens who want to donate funds and help the government in fighting against the coronavirus in India, can visit the official website https://t.co/gZnyR0jiJv and make a contribution. Payments can be made through debit and credit cards, internet banking, UPI (BHIM,",RISHIRAJ203040,allahabad india,"I am Father, Husband, Son, Businessman, Citizen, Hindu. But above all I am INDIAN.",0,168,500,False,
2020-04-13 23:04:30+00:00,Lockdown violated inside containment zone https://t.co/rWOzyLod0z #IndiaNews,APLatestNews,india usa,https://t.co/zSIZkXNBgK is a single source for all India(including Andhra and Telangana) and USA latest news videos,763,225,576310,False,
2020-04-13 23:04:39+00:00,Agricultural equipment market in slow lane amid coronavirus lockdown https://t.co/PNFlhoMBGw https://t.co/6IC8HQd4wj,newsofnasik,nashik india,"Business, entertainment and lifestyle News for and about people of Nasik!
Join Telegram Groups 
https://t.co/dMUCAtyNmf

Nashik Market
https://t.co/XLk87IO3dq",529,121,15916,False,
2020-04-13 23:04:48+00:00,RT @ashoswai: Modi's #COVID2019 #Lockdown - A BJP Minister having fun in his Pool with his kids while a poor man retrieves split milk with…,ajitkhosla,new delhi india,congressman. Will follow every congress supporter. let's be together and fight this out.  Truth always wins.,648,1101,72387,False,Modi's #COVID2019 #Lockdown - A BJP Minister having fun in his Pool with his kids while a poor man retrieves split milk with dogs probably for his kids from a road in Agra! https://t.co/D3XUTh6L1S
2020-04-13 23:05:00+00:00,Note : mostly keralites are not working at kerala ..In that state have no factories till the date .And no one working with that many of keralites working out of state and out of country ..In this pandemic they didn't support tamil people why r  u supporting. Like this #hatekerala https://t.co/Jd6JPSJWOe,krishnaloyal007,tamil nadu india,"social activitiest , தமிழன் , Junior engineer , citizen , liberalist , Fun seeker . Mechanical engineer , hiring for good heart , especially 90's kids😜",43,297,92,False,
2020-04-13 23:05:01+00:00,"@TimesNow Terrible, tremendous  setback ,to consciously disregard social distancing norms, push back well thoughtout ,widely acclaimed  national lockdown efforts by NaMo to cut the thread to prevent transitionfrom phase II to phase III  community spread stage resulting in many more deaths",DattaPinge,mumbai maharashtra india,Am a lawyer by profession interested in the happenings around the world so as to give solution & succour peace & solace the indian way to the mankind @ large,30,374,3644,False,
2020-04-13 23:05:08+00:00,"RT @ShivAroor: Likh ke le lo, when this shit has passed, they’ll quietly give this chap the Nobel Peace Prize.",BrittoIvor,mumbai india,Hindustani Christian/Vande Mataram/India First/I Believe In Religion Of Humanity/Live&Let Live/Animal&Nature Lover/#NaMo Admirer-Supporter. RT's Not Endorsement,214,671,78895,False,"Likh ke le lo, when this shit has passed, they’ll quietly give this chap the Nobel Peace Prize. https://t.co/LFxj0sxh0H"
2020-04-13 23:05:13+00:00,@UPGovt Mercedes make the designs of the new breathing aid they have helped develop freely available to aid the fight against coronavirus https://t.co/5vCxowMUy9,Abhi_Ram8,coimbatore india,,42,736,1402,False,
2020-04-13 23:05:15+00:00,"#PMCARES
The PM CARES was created to enable citizens to contribute to Govt’s containment and relief efforts against the COVID-19 outbreak.  The govt has brought in an ordinance to make donations to PM CARES Fund eligible for 100% deduction under section 80G of the IT Act.",RISHIRAJ203040,allahabad india,"I am Father, Husband, Son, Businessman, Citizen, Hindu. But above all I am INDIAN.",0,168,500,False,
2020-04-13 23:05:16+00:00,"RT @CMOMaharashtra: A Task Force of Specialist Doctors to suggest measures to minimise the death rate, for clinical management &amp; treatment…",amitk99154112,patna india,"i am a politician 
& 100% follow back 
बीजेपी मेरा परिवार है..!!
RSS मेरा संस्कार है 🇮🇳 तिरंगा मेरी जान है! भगवा मेरी शान हैं! मोदीजी मेरा अभिमान हैं!",11758,10985,42764,False,"A Task Force of Specialist Doctors to suggest measures to minimise the death rate, for clinical management &amp; treatment of critically ill COVID-19 patients particularly in specialised designated Hospitals has been constituted by the State Government.
#WarAgainstVirus https://t.co/QYrDrkQGUq"
2020-04-13 23:05:22+00:00,RT @imjadeja: Running is my strength!! Perfect time to repair my body. #powerrun #speedat24 #staysafestayhome https://t.co/kIsK6YXeuw,ModicareR,gujarat india,"💯% Follow  Back 
मोदीकेर नेटवर्क बिजनेस से आप बिना इन्वेस्टमेंट अपनी लाइफ बना शकते है ।modicare_business_rajeshbhai",3407,4998,8852,False,Running is my strength!! Perfect time to repair my body. #powerrun #speedat24 #staysafestayhome https://t.co/kIsK6YXeuw
2020-04-13 23:05:27+00:00,"3446.0.30739 Coronavirus in USA: aids BA green wall on left, invV white ceiling to green wall, invV one green wall to another.",HariSgapp,kerala india,"If it's a game, I'll play it. I'll gladly support YouTube channels that  are still starting up. Hopefully I'll have my own channel eventually",16,15,45059,False,
2020-04-13 23:05:43+00:00,@preetid23245746 @covid @PMOIndia @Manekagandhibjp @RandeepHooda @iTIGERSHROFF @myogiadityanath @JohnAbrahim__ Stay blessed,Hunnyraina48,ambala india,"Politician & Social woker,
Former Secretary @IncHaryana
Greavances & Social media Cell ,
Spokesperson @IHROworld Haryana",1032,1660,10011,False,
2020-04-13 23:05:45+00:00,@InfoGujarat @narendramodi Yes we All country mates Are waiting For The official update from @PMOIndia  About the next steps for covid 19.,imkaraan,ahmadabad city india,"Are you bored of being bored? My boring tweets are all you need to bore yourself to death!

I Belong to Oldest Religion on Earth! 🕉Hindu🇮🇳",17,45,667,False,
2020-04-13 23:05:51+00:00,"RT @i_theindian: 12 February: Rahul Gandhi alerts Modi govt about deadly #Coronavirus pandemic, asks them to be prepared

13 March: Modi go…",Jha14140571,kolkata india,A busy man has time for everything Disclaimer: views are personal. RT's or likes not necessarily an endorsement.,19,79,7601,False,"12 February: Rahul Gandhi alerts Modi govt about deadly #Coronavirus pandemic, asks them to be prepared

13 March: Modi govt declares #Coronavirus is not a health emergency

13 April: Positive cases rise by a massive 1,241 in a day, total cases cross 10,000

#अगला_ड्रामा_कल10बजे https://t.co/nMbcemk3a8"
2020-04-13 23:05:51+00:00,RT @rajnikant07: PPE is need of hour now....congratulations for ur contributions  @iamsrk,shubhsrktiwari,gurgaon india,"Profession➡️Aviation. 
Memes Lover by choice
भगवा दिल से 🧡चेले 2 km कि दूरी बनाए रखे #srkaddict star ni duniya h wo meri💕
Fld by @mallikasherawat
नमो फिर से🙏",397,1208,3511,False,PPE is need of hour now....congratulations for ur contributions  @iamsrk https://t.co/4PfZ2ejAsV
2020-04-13 23:05:52+00:00,Hospitals using plasma of the recovered as COVID treatment - NJTV News...,newsnation_24,new delhi india,,567,131,14728,False,
2020-04-13 23:05:56+00:00,"Coronavirus Lockdown Effective In Most States, Kerala Tops List - NDTV News...",newsnation_24,new delhi india,,567,131,14728,False,
2020-04-13 23:06:02+00:00,"RT @BjpBiplab: I believe, with the blessings of Mata Tripurasundari she will recover very soon.

I Pray to Mata Tripurasundari so that the…",KumarRohitsing,patna india,Proud  INDIAN. भारत माता की जय,227,202,29141,False,"I believe, with the blessings of Mata Tripurasundari she will recover very soon.

I Pray to Mata Tripurasundari so that the state turns Corona free soon."
2020-04-13 23:06:03+00:00,Q&amp;A: Apple and Google discuss their coronavirus tracing efforts https://t.co/5fpzQbVk44 https://t.co/5eoyXNQIaA,raazwebcity,india,A blog which teaches For education purposes only...,74,4,3067,False,
2020-04-13 23:06:09+00:00,RT @WhiteHouse: LIVE: Press Briefing with Coronavirus Task Force https://t.co/IoHRJuAFbT,MerajUd98043859,kolkata asansol india,"( international challenge in speech hindi )   
                                                                   paisa  population ke hisaab se chapna chahiye",201,4289,17913,False,LIVE: Press Briefing with Coronavirus Task Force https://t.co/IoHRJuAFbT
2020-04-13 23:06:12+00:00,"RT @jasonhickel: Kerala's COVID-19 response has been humane, caring and successful.  They've kept their death toll to 2, and new cases are…",BrutuTweets,kerala india,AEM Engineer @honeywell_aero Singapore Future Padmarajan 🤪🙏,7407,4425,120710,False,"Kerala's COVID-19 response has been humane, caring and successful.  They've kept their death toll to 2, and new cases are falling thanks to widespread community testing.  

It puts the so-called ""first world"" to shame.

https://t.co/flH9jV6w6T"
2020-04-13 23:06:12+00:00,"RT @AskAnshul: Now, two returnees of Deoband tested positive for COVID-19 in Telangana's Nirmal

Several people from Telangana went to Deob…",AdityaR48918598,india,"I  am a lost boy , traveller , movie lover , believe in Hinduism . aspirants to become a doctor.
 अभी तो फिलहाल पढ़ाई कर रहा हूं ‌‌‍।",72,185,3360,False,"Now, two returnees of Deoband tested positive for COVID-19 in Telangana's Nirmal

Several people from Telangana went to Deoband at Mohammadi Masjid, just adjacent to Darul Uloom Islamic University

After Tablighi Jamaat, will Deoband be the next challenge?
https://t.co/6FgacdpmTN"
2020-04-13 23:06:23+00:00,People know only to object to every thing this is the sign of non achieves https://t.co/yeETxvK14F,MedirattaSudhir,delhi india,Marketing/Management Consultant,3,48,84,False,
