created_at,full_text,screen_name,location,description,followers_count,friends_count,statuses_count,verified,full_retweet_text
2020-04-13 19:00:42+00:00,"@DeanObeidallah Adding onto that, Flu cases do not rise exponentially  but Covid-19 cases do. 
Consider the following NEW cases:
                 Flu | Covid-19
Week 1.  1000   10   
Week 2.  1000   100
Week 3.  1000   1000
Week 4.  1000   10000

I hope you understand the severeness of Covid-19",TusharJhakra007,new delhi india,Making my own rules ....Enjoying life my way,13,34,692,False,
2020-04-13 19:00:43+00:00,RT @iamsrk: Thank you sir for all your help to source the kits. We are all together in this endeavour to protect ourselves and humanity. Gl…,NitaliBogati,india,✨ Waiting for some magical moments to Happen.,51,30,1929,False,Thank you sir for all your help to source the kits. We are all together in this endeavour to protect ourselves and humanity. Glad to be of service. May your family &amp; team be safe and healthy. https://t.co/DPAc7ROh7i
2020-04-13 19:00:45+00:00,@AUThackeray sir 🙏 do something please. Please sir @PuneCityPolice vimannagar jst got the news from a friend. People are on the road and bursting crackers. Save Pune from fools please 🙏 Covid toh baddmei bigadega halat inse koi bachaye,Isshshsh,pune india,"Sympathetic, Emphatic, Cool and Cautious. Love my four pawie Muffin. He z my Life.❤🐶",874,682,4235,False,
2020-04-13 19:00:46+00:00,"RT @ndtv: #Coronavirus - Man, dogs sharing spilt milk in Agra shows #lockdown desperation
https://t.co/38ILNsY603 https://t.co/ZtUFof4KIX",MdArafatAzmi,patna india,FQA Engineer at Power Mech Project LTD.,50,140,212,False,"#Coronavirus - Man, dogs sharing spilt milk in Agra shows #lockdown desperation
https://t.co/38ILNsY603 https://t.co/ZtUFof4KIX"
2020-04-13 19:00:46+00:00,RT @sgurumurthy: Covid-19: Huge Embarrassment To DMK After An Audio Of A Senior Leader With Activist Of Islamic Outfit SDPI Goes Viral http…,YatriDhara,mumbai india,"Father, Nation First, Seeking Truth, Trail the path of Jagat Guru's Bharat Yatra, Indophile",38,1078,2596,False,Covid-19: Huge Embarrassment To DMK After An Audio Of A Senior Leader With Activist Of Islamic Outfit SDPI Goes Viral https://t.co/YgaAfAowzL via @swarajyamag
2020-04-13 19:00:47+00:00,"RT @WIONews: #Gravitas | A report has claimed that animal traders in China will be given tax breaks to export wild animals. 
Is China now e…",NandkumarJethan,pune india,"I am proud to join #MainBhiChowkidar movement. 
As a citizen who loves India, I shall do my best to defeat corruption, dirt, poverty & terrorism.",2581,4679,152364,False,"#Gravitas | A report has claimed that animal traders in China will be given tax breaks to export wild animals. 
Is China now exporting its wet markets to the world? @palkisu brings you the story https://t.co/BPDulylrtM"
2020-04-13 19:00:47+00:00,RT @PTI_News: Coronavirus is not a health emergency: officials,sudanimon,india,Blank is better,135,367,2461,False,Coronavirus is not a health emergency: officials
2020-04-13 19:00:50+00:00,RT @bolisetti_satya: #COVID2019 exposed Industrial pollution is killing our pristine national rivers @narendramodi ji @gssjodhpur @waterman…,MaheshR97265135,hyderabad india,"live and let live.,",2,269,717,False,"#COVID2019 exposed Industrial pollution is killing our pristine national rivers @narendramodi ji @gssjodhpur @watermanofindia @PawanKalyan must
 #ActNow to protect rivers to  improve quality of life in India
https://t.co/IrbPbAqh0n

#ManaNudiManaNadi
#JSPForNewAgePolitics
#CPCB https://t.co/Kly6auIVgt"
2020-04-13 19:00:51+00:00,"RT @Chellaney: A new study shows China is damming the Mekong to environmental hell. Using a natural-flow data model, it finds that 11 Chine…",Navi_ator,mumbai india,,500,397,24428,False,"A new study shows China is damming the Mekong to environmental hell. Using a natural-flow data model, it finds that 11 Chinese mega-dams currently in operation on the Mekong (with more dams coming up) are causing severe drought and devastation downstream. https://t.co/qODgIaoFA5"
2020-04-13 19:00:53+00:00,"RT @NorbertElekes: NEW: Number of confirmed coronavirus deaths in New York has reached 10,000.",RakshithBJ2,bengaluru india,"Civil Engineer, Veggie, Crickie, Yuvraj Singh fan, Love Indian Army and Indian Cricket team 😍",510,187,392980,False,"NEW: Number of confirmed coronavirus deaths in New York has reached 10,000."
2020-04-13 19:00:54+00:00,"RT @RanaAyyub: One of India's finest academic, civil rights activist and the grandson in law of Baba Saheb Ambedkar all set to be arrested…",iammsk,india,Hola........:),1290,1037,233852,False,"One of India's finest academic, civil rights activist and the grandson in law of Baba Saheb Ambedkar all set to be arrested tomorrow for dissent. We are in the peak of the pandemic and this is our priority. Morality much ? #AnandTeltumbde https://t.co/GtY7QS60fw"
2020-04-13 19:00:55+00:00,"RT @ANI: We urge the Pakistani government to ensure that food aid from distributing organizations is shared equally with Hindus, Christians…",rishabh_bhatt98,bhopal india,"MANIT Bhopal
Krishna Devotee
Interested in Spirituality,History and Culture, International Relations",152,436,2361,False,"We urge the Pakistani government to ensure that food aid from distributing organizations is shared equally with Hindus, Christians, and other religions minorities: US Commission on International Religious Freedom Commissioner, Anurima Bhargava. https://t.co/ilM8cAy2nd"
2020-04-13 19:00:59+00:00,"RT @timesfactcheck: FAKE: Kavita Krishnan, Prashant Bhushan, Punya Prasun Bajpai, etc falsely claim that a UP woman was forced to drown her…",Nimitiwari,mumbai india,"Content Expert - Digital Marketing, SEO, Social Media Influencer. Brand launcher. Weekend Golfer 🏌️‍♀️ https://t.co/JxQOlx5qZc and https://t.co/R48DNwgaVU",3203,495,8883,False,"FAKE: Kavita Krishnan, Prashant Bhushan, Punya Prasun Bajpai, etc falsely claim that a UP woman was forced to drown her five kids since she was unable to feed them due to the nationwide lockdown https://t.co/JrAWwt7p5q"
2020-04-13 19:01:00+00:00,"RT @ndtv: #Coronavirus - Man, dogs sharing spilt milk in Agra shows #lockdown desperation
https://t.co/38ILNsY603 https://t.co/ZtUFof4KIX",muskan2017,india,"Aisi konsi cheez hai jise log jitna bhi chahe, tumse cheen nahi sakte? Tumhari muskan



Deepika Retweeted on:- 13th Jan 2020❤️",551,265,57037,False,"#Coronavirus - Man, dogs sharing spilt milk in Agra shows #lockdown desperation
https://t.co/38ILNsY603 https://t.co/ZtUFof4KIX"
2020-04-13 19:01:00+00:00,RT @Sandeep71121431: ‘It’s definitely more than a virus’: Author Arundhati Roy reads from ‘The Pandemic is a Portal’ https://t.co/dqqhr76Jn…,Sandeepan1702,new delhi india,,945,2511,26098,False,‘It’s definitely more than a virus’: Author Arundhati Roy reads from ‘The Pandemic is a Portal’ https://t.co/dqqhr76JnS via @scroll_in
2020-04-13 19:01:02+00:00,"RT @rajeshtope11: Many thanks Mr. Shah Rukh Khan for your kind contribution of 25,000 PPE kits. This will go a long way in supporting our f…",NARESHRMEHTA,india,"Do din ki Zindagi hai, Raho to Fulo ki Tarah aur Bikhre to Khushboo ki Tarah.. 
(RTs AREN'T ENDOSED)",270,552,42589,False,"Many thanks Mr. Shah Rukh Khan for your kind contribution of 25,000 PPE kits. This will go a long way in supporting our fight against COVID19 &amp; protecting our frontline medical care team @iamsrk @MeerFoundation @CMOMaharashtra"
2020-04-13 19:01:05+00:00,"RT @narendramodi: Had a good discussion on phone today with Prime Minister Nguyen Xuan Phuc of Vietnam, about how we can support each other…",NaveenMundaragi,hubli india,#Gdg|mund®gian😍😘|We build wo®|d🌍E&C🔋🔌kle'ian Hbl..💞|Mu$ic i$ m¥ LoV£😍 🎶🎼🎸Wi$h m£ on 1st F£b🎂🍫|#PKMKB PARTY MEMBER|Ip®oudToB£an🇮🇳indian🕉☪️✝🦂🦂,355,2357,36130,False,"Had a good discussion on phone today with Prime Minister Nguyen Xuan Phuc of Vietnam, about how we can support each other in the fight against COVID-19.  Vietnam is an important pillar of our Act East policy."
2020-04-13 19:01:07+00:00,"@mylivelearning @nsitharaman @ianuragthakur @RBI @narendramodi @IDBI_Bank Dear Sir, the Bank is offering a 3 month moratorium. For more details, please refer the below link https://t.co/8BOXRlu7lk",IDBIBankCares,india,"Welcome to the official IDBI Bank Care handle. We are here to help you with your banking queries during working days, 9am-6pm/call us: 18002094324/1800221070",1256,8,6517,False,
2020-04-13 19:01:07+00:00,"RT @ANI: As #COVID19 continues to spread, vulnerable communities within Pakistan are fighting hunger and to keep their families safe and he…",Dharmen77859169,india,,1460,2072,229314,False,"As #COVID19 continues to spread, vulnerable communities within Pakistan are fighting hunger and to keep their families safe and healthy. Food aid must not be denied because of one’s faith: US Commission on International Religious Freedom Commissioner, Anurima Bhargava. https://t.co/cowA4rbuYd"
2020-04-13 19:01:08+00:00,RT @nhm_assam: Hon'ble Minister Health Dr. @himantabiswa receiving Rs 5000/- &amp; a personal memento from Smt. Sangeeta Chetry as support towa…,justphookan,guwahati india,⭐I have a third point of view. For me the glass is always full : half with water and half with air. NAMO.⭐,206,1902,7883,False,"Hon'ble Minister Health Dr. @himantabiswa receiving Rs 5000/- &amp; a personal memento from Smt. Sangeeta Chetry as support towards the fight against #Covid19 #Assam

@drharshvardhan @MoHFW_INDIA @WHO @CMOfficeAssam @Pijush_hazarika @samirsinha69 @diprassam @AssamFinDept https://t.co/CCIPRlojtw"
2020-04-13 19:01:08+00:00,"RT @sneha2986: RaGa: Economy, Farmers, Migrant workers, daily wagers, business owners... 

Modi: LIGHTS! CAMERA! ACTION! 💡🎥🎬

#अगला_ड्रामा_…",aasthaboli,new delhi india,"""I can’t help but feel the energy of places, towns, cities, rivers, mountains, prairies, etc. Perhaps I’m a Placitarian.",213,878,1961,False,"RaGa: Economy, Farmers, Migrant workers, daily wagers, business owners... 

Modi: LIGHTS! CAMERA! ACTION! 💡🎥🎬

#अगला_ड्रामा_कल10बजे https://t.co/WmxzWxf6MQ"
2020-04-13 19:01:09+00:00,RT @iamsrk: Thank you sir for all your help to source the kits. We are all together in this endeavour to protect ourselves and humanity. Gl…,its_aayush_GG,bengaluru india,"Be the reason someone believes in the goodness of people !!! 😇
Simplicity is the key to brilliance !!! 💯
Biggest inspiration :- @iamsrk ❤️",356,12,47861,False,Thank you sir for all your help to source the kits. We are all together in this endeavour to protect ourselves and humanity. Glad to be of service. May your family &amp; team be safe and healthy. https://t.co/DPAc7ROh7i
2020-04-13 19:01:09+00:00,RT @mygovindia: PM @narendramodi will address the nation on 21st Day of the Lockdown i.e tomorrow at 10AM. Watch live here: https://t.co/vK…,rajkapoorbjym,india,"पूर्व जिला मीडिया प्रभारी भारतीय जनता युवा मोर्चा,मुरादाबाद

🏹🚩I_Support_CAA_NRC_PCB🚩🏹

🏹#राष्‍ट्रहित🇮🇳#सर्वोपरी🏹
BJP & RSS🚩",9260,8213,40328,False,PM @narendramodi will address the nation on 21st Day of the Lockdown i.e tomorrow at 10AM. Watch live here: https://t.co/vKVqS9keYr  #IndiaFightsCorona https://t.co/XVTFEMIBeC
2020-04-13 19:01:10+00:00,"RT @ANI: We have also started an initiative to help the people who are stuck in different countries. To those residents of Assam, we have t…",RakshithBJ2,bengaluru india,"Civil Engineer, Veggie, Crickie, Yuvraj Singh fan, Love Indian Army and Indian Cricket team 😍",510,187,392980,False,"We have also started an initiative to help the people who are stuck in different countries. To those residents of Assam, we have transferred US$ 1000: Assam Minister Himanta Biswa Sarma https://t.co/3AAuttUAGg"
2020-04-13 19:01:10+00:00,"RT @ANI: 134 new #Coronavirus positive cases reported in Maharashtra today - Mumbai 113, Raigad, Amravati, Bhiwandi, Pimpri-Chinchwad 1 eac…",Captainanjan,west bengal india,"If SRK have only one FAN and that is me;
If SRK has no fan's that means I'm no more on the earth. Simply, I found the God in him. ⭐✨",884,450,72655,False,"134 new #Coronavirus positive cases reported in Maharashtra today - Mumbai 113, Raigad, Amravati, Bhiwandi, Pimpri-Chinchwad 1 each, Pune 4, Mira Bhayandar 7 and Navi Mumbai, Thane &amp; Vasai Virar 2 each. The total positive cases in the state rise to 1895: State Health Department https://t.co/Awb7GJ3RsK"
2020-04-13 19:01:13+00:00,"@SBICard_Connect 

It's the time u need to assist your customer in a better way. But you are doing worst. Not even responding the issues Properly.... https://t.co/XzdUXu6xQz",hariharaachary,rajendra nagar india,"A Passionate Cyclist & Traveller.
Volunteering @Indiacares_2020",118,1094,842,False,
2020-04-13 19:01:14+00:00,"They are still hiding facts . We are not really sure they have found a cure and, if they have they are not telling the world about it . https://t.co/LDvjzbl9b3",Palaiborn,india,An engineer disgruntled with clutter that manifests thinking . My country is in peril. Citizens are protesting .  And now my country is being invaded .,526,605,31470,False,
2020-04-13 19:01:15+00:00,"RT @orfonline: In its combat efforts against #COVID19, the government must allow civil society organisations, counsellors, mental health or…",TanushreeChand4,new delhi india,Junior Fellow at @orfonline DSE'19 । Citibank GMA'17 | SRCC'16,238,338,301,False,"In its combat efforts against #COVID19, the government must allow civil society organisations, counsellors, mental health organisations and providers to come to the rescue of the women facing #DomesticViolence. https://t.co/O0BDyUKxyM https://t.co/3qn2Xp8Itr"
2020-04-13 19:01:15+00:00,"RT @WIONews: #Gravitas | The President of the United States, @realDonaldTrump, is still relying on his own expertise about the Coronavirus…",udata_teer,uttar pradesh india,Optimist,203,823,36525,False,"#Gravitas | The President of the United States, @realDonaldTrump, is still relying on his own expertise about the Coronavirus crisis. He is not only contradicting some real experts but may fire one of them.  @palkisu decodes the Trump-Fauci row https://t.co/wm5pv3hGzI"
2020-04-13 19:01:16+00:00,"So wonderful and heart warming to watch Prf Nandini sardesai. She is evergreen, as energetic as ever. ❤
https://t.co/psFnolcS9t",RanalviMasooma,noida india,"FGM survivor, Founder of @SpeakOutonFGM, committed to #ENDFGM. @AspenNewVoices fellow 2020, Storyteller @themoth",707,292,1890,False,
2020-04-13 19:01:16+00:00,"RT @rajeshtope11: Many thanks Mr. Shah Rukh Khan for your kind contribution of 25,000 PPE kits. This will go a long way in supporting our f…",IAmJigs1,india,I love Books😍,80,624,7975,False,"Many thanks Mr. Shah Rukh Khan for your kind contribution of 25,000 PPE kits. This will go a long way in supporting our fight against COVID19 &amp; protecting our frontline medical care team @iamsrk @MeerFoundation @CMOMaharashtra"
2020-04-13 19:01:18+00:00,"RT @rajeshtope11: Many thanks Mr. Shah Rukh Khan for your kind contribution of 25,000 PPE kits. This will go a long way in supporting our f…",its_aayush_GG,bengaluru india,"Be the reason someone believes in the goodness of people !!! 😇
Simplicity is the key to brilliance !!! 💯
Biggest inspiration :- @iamsrk ❤️",356,12,47861,False,"Many thanks Mr. Shah Rukh Khan for your kind contribution of 25,000 PPE kits. This will go a long way in supporting our fight against COVID19 &amp; protecting our frontline medical care team @iamsrk @MeerFoundation @CMOMaharashtra"
2020-04-13 19:01:19+00:00,"RT @spectatorindex: Coronavirus deaths in the US

1st of March: 1

1st of April: 5,100

Now: 22,100",Banti_2300,india,If nothing else facts and humour will save us 🤗  #Follow for #FollowBack,1002,1205,4096,False,"Coronavirus deaths in the US

1st of March: 1

1st of April: 5,100

Now: 22,100"
2020-04-13 19:01:20+00:00,"RT @narendramodi: Had a good discussion on phone today with Prime Minister Nguyen Xuan Phuc of Vietnam, about how we can support each other…",YusufDFI,bangalore india,"Editor, Indian Defence Forum https://t.co/xpbuZAFzVr Blogs at https://t.co/oHy4YvGhiz   YusufUnjhawala@mastodon.social",41248,1545,134317,True,"Had a good discussion on phone today with Prime Minister Nguyen Xuan Phuc of Vietnam, about how we can support each other in the fight against COVID-19.  Vietnam is an important pillar of our Act East policy."
2020-04-13 19:01:21+00:00,"RT @NorbertElekes: NEW: Number of confirmed coronavirus deaths in Italy has reached 20,000.",RakshithBJ2,bengaluru india,"Civil Engineer, Veggie, Crickie, Yuvraj Singh fan, Love Indian Army and Indian Cricket team 😍",510,187,392980,False,"NEW: Number of confirmed coronavirus deaths in Italy has reached 20,000."
2020-04-13 19:01:23+00:00,RT @TarekFatah: In Indian state of Tamilnadu a hospitalized #TablighiJamat #coronavirus patient spits on the nurse treating him. Booked by…,ANILPAREKH,mumbai india,,84,260,14558,False,In Indian state of Tamilnadu a hospitalized #TablighiJamat #coronavirus patient spits on the nurse treating him. Booked by police. What is wrong with India’s Jamaati Muslims? #coronavirusinindia  https://t.co/YPLEh96Mhe
2020-04-13 19:01:24+00:00,RT @Atheist_Krishna: World should go for complete lockdown for a month every year to keep the environment clean.,Abhislays,new delhi india,"Jamia Millia Islamia 





















































Retweets are not my views, I do sometimes to save things. 😉",17,770,371,False,World should go for complete lockdown for a month every year to keep the environment clean.
2020-04-13 19:01:24+00:00,"RT @FeignShourie: MP has Chief Minister with no Health Minister &amp; no Cabinet.

Principal Secretary Health is Corona +ve. 

45+ IAS officers…",Saleem_AamAadmi,delhi india,"I want to transform society where all can lead dignified life@equality,truth,peace & justice prevails #free from poverty unemployment,terrorism,crime,Corruption",119,623,5000,False,"MP has Chief Minister with no Health Minister &amp; no Cabinet.

Principal Secretary Health is Corona +ve. 

45+ IAS officers are Corona +ve,

75+ Other officers from Health Department are Corona +ve!

Media is silent because it is paid for not reporting incompetence of BJP. Enjoy!"
2020-04-13 19:01:25+00:00,"RT @ishafoundation: 1/3 Mr Srivatsa,
A team of Isha volunteers is out in the nearby villages, supporting the district administration to off…",ygpusa,india,"Nation First.
Universal Peace & Love.
VishwaGuru Bharat.",925,1622,176371,False,"1/3 Mr Srivatsa,
A team of Isha volunteers is out in the nearby villages, supporting the district administration to offer protective gear to healthcare workers &amp;  policemen: distributing medical supplies, food &amp; immunity boosting herbal drink in 17  Panchayats around Isha center. https://t.co/6scnL9OoTQ https://t.co/gy9V1s24Ul"
2020-04-13 19:01:29+00:00,"RT @ANI: We urge the Pakistani government to ensure that food aid from distributing organizations is shared equally with Hindus, Christians…",1729Coolabhi,india,"हम दीवानों की क्या हस्ती, आज यहाँ कल वहां चले
मस्ती का आलम साथ चला, हम धूल उड़ाते जहां चले।",23,673,1293,False,"We urge the Pakistani government to ensure that food aid from distributing organizations is shared equally with Hindus, Christians, and other religions minorities: US Commission on International Religious Freedom Commissioner, Anurima Bhargava. https://t.co/ilM8cAy2nd"
2020-04-13 19:01:33+00:00,Successfully Completed the 20th day of Lockdown against Covid 19 Stay Home and gets India fight back and win in this National Medical Emargency... Jai Hind ... https://t.co/P9nbhpcQUj,SubhaDgupta,agartala india,,37,134,6,False,
2020-04-13 19:01:34+00:00,"RT @SaketGokhale: For those who still get their facts from Whatsapp, here’s some mandatory reading on this:

https://t.co/pKGudQhisI",SRKs_Wolverine,india,"ProudIndianMuslim🇮🇳🤲

My religion is perfect but i m not,

If I make a mistake blame it on me, not on my religion.

Fan Account",2926,856,95118,False,"For those who still get their facts from Whatsapp, here’s some mandatory reading on this:

https://t.co/pKGudQhisI"
2020-04-13 19:01:37+00:00,"RT @Gelong_Thubten: Training our minds in love and compassion helps to dissolve the difference between ourselves and others.

#MeditationMo…",GeetaPrakash,pune india,,154,366,476,False,"Training our minds in love and compassion helps to dissolve the difference between ourselves and others.

#MeditationMonday
#StayHome #Meditate https://t.co/FBg4LyVerY"
2020-04-13 19:01:37+00:00,"RT @ANI: #WATCH Today, the number of samples that are positive are 98. Of these 98, 91 are from a 'single source' and 7 are from contacts:…",AVIRAL96,india,"Like Cooking, Dancing, Animal Rights Activist, Believes in Egalitarianism, Interested in East Asia. Studying MA(IR) at @SAU! RT are not Endorsement.",43,1997,16915,False,"#WATCH Today, the number of samples that are positive are 98. Of these 98, 91 are from a 'single source' and 7 are from contacts: : Tamil Nadu Health Secretary Beela Rajesh. #COVID19 https://t.co/LZZn6rpu5P"
2020-04-13 19:01:37+00:00,RT @Being_Humor: She’ll just say “Transfer PM care fund to PMNRF” 😂,Arnav_Rupde,gujarat india,#RW | Almost sarcastic | Hyper Nationalist | RTs ≠ endorsements | I tweet on facts and opinions | I love my India,243,116,29929,False,She’ll just say “Transfer PM care fund to PMNRF” 😂 https://t.co/Un2mAprqAp
2020-04-13 19:01:39+00:00,"RT @Vishj05: @nsitharaman Oh please no, Economy can't survive Coronavirus and you together.",senthilchandr,bangalore india,"Be the change that you want to see in the world - Mahatma Gandhi 
மதம் விடுத்து மனிதம் பழகு..
சாதி விடுத்து சமத்துவம் பழகு.. 🙏🏼🙏🏼",390,152,41270,False,"@nsitharaman Oh please no, Economy can't survive Coronavirus and you together."
2020-04-13 19:01:39+00:00,"RT @iMac_too: Kaka @PawarSpeaks, I told you it won't spare anyone. Not even your closest aide. Get real. Attack the root cause
https://t.co…",hitesh093,india,"Interested in politics, sports.",94,490,44418,False,"Kaka @PawarSpeaks, I told you it won't spare anyone. Not even your closest aide. Get real. Attack the root cause
https://t.co/1DvpGJ3dfg"
2020-04-13 19:01:40+00:00,RT @rohini_mohan: BBC report: 108 of 159 people in a Chattisgarh list assumed to be Tableeghis are actually just people who happened to be…,Balachandran_R,india,,181,197,13812,False,"BBC report: 108 of 159 people in a Chattisgarh list assumed to be Tableeghis are actually just people who happened to be in Nizamuddin in March, as per mobile phone tower records. They had Hindu names. 
The central govt's #covid contact tracing is accurate, the framing communal. https://t.co/vG4hA5OQwT"
2020-04-13 19:01:40+00:00,RT @HannahEP: Coronavirus conspiracy theories targeting Muslims spread in India https://t.co/Pk6uNl4GgN,TrueToIndia,india,Proud Indian Muslim | Human Rights Warrior | Against Fascism | Stands for @TribalArmy and @BahujanSamajh,45,214,653,False,Coronavirus conspiracy theories targeting Muslims spread in India https://t.co/Pk6uNl4GgN
2020-04-13 19:01:41+00:00,@PTI_News Officials using 1nternet explorer to check Corona updates. Can't blame them,sudanimon,india,Blank is better,135,367,2461,False,
2020-04-13 19:01:42+00:00,RT @nsui: Telangana NSUI workers continuously disturbuted food and fruits to needy people who are facing problem during this lockdown in ma…,AfzalKhan_INC,gujarat india,"National Coordinator Social Media @NSUI Incharge @nsuimp Sm. @OfficeOfRG @IncIndia @NSUI supporter | Tweets are strictly personal,RT Are Not Endorsement.",3962,977,147645,False,"Telangana NSUI workers continuously disturbuted food and fruits to needy people who are facing problem during this lockdown in many districts.
#LadengeAurJeetenge https://t.co/77iEVD6hnP"
2020-04-13 19:01:43+00:00,"RT @narendramodi: Aarogya Setu is an important step in our fight against COVID-19. By leveraging technology, it provides important informat…",Vishaldhoni07,karimnagar india,|@msdhoni💪||@chay_akkineni😎||Anushka Shetty❤||@BeingSalmankhan☺||@Johncena😍||@Cristiano🤗|,351,378,63747,False,"Aarogya Setu is an important step in our fight against COVID-19. By leveraging technology, it provides important information. As more and more people use it, it’s effectiveness will increase. I urge you all to download it.

https://t.co/VaiPIjhxM2

https://t.co/8Irj6ApmOQ https://t.co/L91vaLlCCq"
2020-04-13 19:01:45+00:00,"RT @rajeshtope11: Many thanks Mr. Shah Rukh Khan for your kind contribution of 25,000 PPE kits. This will go a long way in supporting our f…",siddheshsawant_,mumbai india,Political & Social Activist ◆ Potterhead⚡️ ◆ Movie Buff ◆ Foodie ◆ Cyclist ◆ Dog Lover ◆ Avid Reader.,3208,820,42427,False,"Many thanks Mr. Shah Rukh Khan for your kind contribution of 25,000 PPE kits. This will go a long way in supporting our fight against COVID19 &amp; protecting our frontline medical care team @iamsrk @MeerFoundation @CMOMaharashtra"
