created_at,full_text,screen_name,location,description,followers_count,friends_count,statuses_count,verified,full_retweet_text
2020-03-16 03:00:04+00:00,"RT @ManagerHeritage: Part (2/2)- Doctor's advice on corona..
#CoronaKoDhona #COVID2019 #COVID19india #coronavirusindia #CoronaVirusUpdates…",amitabhkr111,new delhi india,,120,853,2416,False,"Part (2/2)- Doctor's advice on corona..
#CoronaKoDhona #COVID2019 #COVID19india #coronavirusindia #CoronaVirusUpdates #CoronaOutbreak #Coronaindia #COVIDー19 https://t.co/Ni8fuDLx2T"
2020-03-16 03:00:08+00:00,Coronavirus: EU states record highest one-day death toll https://t.co/JEQIU0dtYe,Kartik_mish,new delhi india,"Manager of Business Development- International, SACA, Adelaide Oval.   Asia Pacific. Fan of Walt Disney.",121,256,438,False,
2020-03-16 03:00:22+00:00,No wonder I saw so many people buying camphor yesterday. So #coronavirus has a nose? https://t.co/MR1tRtmWnk,nandu79,india,"New Media Editor @IndianExpress. Also, tech journalist, retired desk hand, pagemaker and photographer. Views are personal. https://t.co/8MvVkXbB3L",14366,3318,41578,True,
2020-03-16 03:00:24+00:00,"RT @Ra_Bies: Hats off to Yogi ji. This man has balls of steel. Never seen any other CM with so much guts &amp; courage. If he’d a choice, he wo…",rajeevnadkarni1,mumbai india,"i am a bhakt of namo,rw  proud of being hindu",243,226,52118,False,"Hats off to Yogi ji. This man has balls of steel. Never seen any other CM with so much guts &amp; courage. If he’d a choice, he would write a separate constitution for UP https://t.co/12MX5PcZmT"
2020-03-16 03:00:25+00:00,"RT @Atheist_Krishna: No Government in this world even will all the resources can fight something like Coronavirus, unless the public takes…",AnjiiiiG,india,,83,77,34304,False,"No Government in this world even will all the resources can fight something like Coronavirus, unless the public takes the responsibility and follows instructions issued for safety."
2020-03-16 03:00:30+00:00,RT @bsindia: The aviation industry is expected to make a loss of $67 billion in 2020 and several airlines are expected to file for bankrupt…,rammy_srk,india,After a hiatus,37,1177,5596,False,"The aviation industry is expected to make a loss of $67 billion in 2020 and several airlines are expected to file for bankruptcy in the coming months

#AirIndia #Coronavirus

@ParagonWorli18

https://t.co/PQzoDSi6wA"
2020-03-16 03:00:37+00:00,"RT @ANI: Union Ministry of Health and Family Welfare: A total of 110 confirmed #COVID19 cases reported across India, including 17 foreign n…",Sandipbind1,mumbai india,"student,reader and writer !!! #proud to be Indian Hindu.",76,128,1212,False,"Union Ministry of Health and Family Welfare: A total of 110 confirmed #COVID19 cases reported across India, including 17 foreign nationals, as of 11:30 pm, 15th March. https://t.co/UdaxIw5H2D"
2020-03-16 03:00:42+00:00,"RT @Ra_Bies: Hats off to Yogi ji. This man has balls of steel. Never seen any other CM with so much guts &amp; courage. If he’d a choice, he wo…",jitendra1582,chennai india,,42,35,1537,False,"Hats off to Yogi ji. This man has balls of steel. Never seen any other CM with so much guts &amp; courage. If he’d a choice, he would write a separate constitution for UP https://t.co/12MX5PcZmT"
2020-03-16 03:00:45+00:00,"RT @TarekFatah: You know very well @ShekharGupta that the women at #ShaheenaBagh are mere puppets in the hands of their husbands, brothers…",Saurabh81939202,dadra and nagar haveli india,🚩सनातनी🚩,367,1096,29276,False,"You know very well @ShekharGupta that the women at #ShaheenaBagh are mere puppets in the hands of their husbands, brothers and fathers. If the mullahs feel these women can help spread a pandemic to kill Hindus, these Begums will play their roll in their jihad. They desire death. https://t.co/v5FBq4Ht8j"
2020-03-16 03:00:47+00:00,RT @karlmehta: Big Thank You &amp; Gratitude to all healthcare professionals around the world for their hard work and selfless service during t…,Chavivohra,india,#SkillsGirls | Advocate #SDGs Co-curator - @SDG2030 l #ChildRights l #Equality I #EndGBV l #WebWonderWomen l #Mindfulness l #SocialImpact l ♻️ I @mobile_Creches,2494,461,31352,False,Big Thank You &amp; Gratitude to all healthcare professionals around the world for their hard work and selfless service during this #coronavirus crisis. It is amazing and we can never repay. Hope #Pharma companies find a cure soon. #COVID19
2020-03-16 03:00:48+00:00,RT @sudhirchaudhary: Pakistan has once again lived up to its reputation of being a rogue nation. To raise #Kashmir at a #SAARC #coronavirus…,amitanish0309,varanasi india,"आपके कर्म ही आपकी पहचान है.. वरना एक नाम के तो हजारों इंसान होते है..
#जय_श्री_राम
#FanOfModiJi",449,1149,14345,False,"Pakistan has once again lived up to its reputation of being a rogue nation. To raise #Kashmir at a #SAARC #coronavirus conference was cheap. It shows how low Pak can stoop to push its hateful agenda, even when Indian offers a helping hand. What a wasted opportunity for Islamabad!"
2020-03-16 03:00:49+00:00,"RT @Atheist_Krishna: No Government in this world even will all the resources can fight something like Coronavirus, unless the public takes…",Sanjays0809,new delhi india,,171,222,479,False,"No Government in this world even will all the resources can fight something like Coronavirus, unless the public takes the responsibility and follows instructions issued for safety."
2020-03-16 03:00:50+00:00,"RT @AmitShah: As Prime Minister of 1.25Bn people, PM @narendramodi has done a commendable job in getting together SAARC countries to combat…",HariomGour15,india,"🙏राष्ट्रहित सर्बोपरि🙏
        🇮🇳🇮🇳",335,1457,6930,False,"As Prime Minister of 1.25Bn people, PM @narendramodi has done a commendable job in getting together SAARC countries to combat COVID-19.
India has risen to the occasion and it was heartening to see regional cooperation to overcome the menace of Corona, which is impacting everyone."
2020-03-16 03:00:50+00:00,RT @rishibagree: India should decide a TOTAL LOCK DOWN DATE . We should stop every movement for 10-15 days and all Covid 19 patient will be…,Karthik_BNK,bangalore india,Engineer 🎓 | Travelling 🚴 | ದೈವ ಭಕ್ತ 🙏| ಸ್ವಲ್ಪ serious 😬 -  Swalpa ತರಲೆ 😛 | Friends❤ |,32,145,257,False,"India should decide a TOTAL LOCK DOWN DATE . We should stop every movement for 10-15 days and all Covid 19 patient will be zeroed down.

This is the only way we can stop the spreading if #COVIDー19 in India."
2020-03-16 03:17:51+00:00,RT @spectatorindex: BREAKING: First dose for possible coronavirus vaccine to be trialled tomorrow in the United States,snehasishpat,bhubaneswar india,I dont binge watch.,57,60,717,False,BREAKING: First dose for possible coronavirus vaccine to be trialled tomorrow in the United States
2020-03-16 03:17:53+00:00,@sambitswaraj @narendramodi Still the representative of Pakistan was talking about Kashmir issue so cheap he was not at all concerned about COVID 19 rather he was interested in Kashmir,royjadunath,assam india,"I am in love with gadgets, a gadgets freak.",336,1247,2369,False,
2020-03-16 03:17:53+00:00,"RT @news18dotcom: While China remains the country with the most deaths with 3,199, the pandemic is now spreading more rapidly in Europe, wi…",Rajp160494,new delhi india,I have nothing except truth,193,190,4152,False,"While China remains the country with the most deaths with 3,199, the pandemic is now spreading more rapidly in Europe, with 1,907 deaths in the continent's worst-hit country Italy. 

https://t.co/2yGBQhRtl0"
2020-03-16 03:17:56+00:00,"RT @SalmanNizami_: CANADA: No one should have to worry about paying rent, buying groceries, hospital expenses. We will help Canadians finan…",pravieen,chennai india,,32,107,4539,False,"CANADA: No one should have to worry about paying rent, buying groceries, hospital expenses. We will help Canadians financially; PM Justin Trudeau.

INDIA; Modi Govt has cancelled the notification of ex- gratia &amp; cost of hospitalisation of Coronavirus patients.

SHAME!"
2020-03-16 03:17:57+00:00,Coronavirus lockdown reminds me of Birdbox movie. 😟,SolankiNimisha,mumbai india,,389,488,2462,False,
2020-03-16 03:17:58+00:00,RT @kunfaaya: Does Cow urine look like this?🤔🤔🤔,usman_gms,bhavnagar india,"Worked at Ehtesham & Co (Charterted Accountants) Mumbai for 15 years.

Now living in Bhavnagar Gujarat.",232,483,34451,False,Does Cow urine look like this?🤔🤔🤔 https://t.co/CvgFvPalB8
2020-03-16 03:17:59+00:00,"RT @Abhina_Prakash: Two cities, Xiaogan and Tianmen in Hubei, locked down again after opening for only one day. China has being lying conti…",bobkhanna,new delhi india,"Love journeys,sunrises, sunsets,trees,skies,mountains,rivers, words,music,yoga,meditation,and matters of the spirit and the heart.",141,94,21237,False,"Two cities, Xiaogan and Tianmen in Hubei, locked down again after opening for only one day. China has being lying continuously about the extent of the Wuhan virus epidemic since November. Not just lying but also waging a propaganda war on rest of the world."
2020-03-16 03:17:59+00:00,"This is incredible.#coronavirus

Context here, is that there has not ever been a successful vaccine produced for any type of coronavirus before. Efforts have been focussed on influenza. https://t.co/bkZK6MvYIC",nikhilneema,india,Interested in Sports - Politics - Entertainment !,210,335,9621,False,
2020-03-16 03:18:00+00:00,"@tnsdma @CMOTamilNadu Not to cause a panic, but the low numbers of Corona Virus in India, especially in TN could be due to lack of mass testing facilities! I came back home to Chennai from Blr. People here are so casual and not at all worries! Please advice to take necessary step",siddyvenky,bengaluru india,Research Scholar/Research fellow @ Indian Institute of Science,30,120,240,False,
2020-03-16 03:18:03+00:00,RT @narendramodi: Some ideas on how SAARC nations can work together to tackle the COVID-19 Novel Coronavirus. https://t.co/b9K8tpPSzr,anand1160830,hyderabad india,,1,114,27,False,Some ideas on how SAARC nations can work together to tackle the COVID-19 Novel Coronavirus. https://t.co/b9K8tpPSzr
2020-03-16 03:18:05+00:00,RT @mygovindia: India is ready to play a leadership role in the global pushback against #COVID19 . Hon PM @narendramodi has committed an in…,impankajmani,lucknow india,"SwayamSewak , Modified ~ PM  @narendramodi follows me ~~ जो मन से मस्त है उसके पास समस्त है",11063,501,74529,False,"India is ready to play a leadership role in the global pushback against #COVID19 . Hon PM @narendramodi has committed an initial $10 million for the SAARC emergency fund. Yes, there are ""miles to go before we sleep"" but India will walk the talk, all the way. https://t.co/QWCBCkxGjR"
2020-03-16 03:18:08+00:00,".@narendramodi @drharshvardhan @MoHFW_INDIA
Provide CISF/CRPF security to quarantine centres. #CoronaVirus is a national security threat.

Also BAN home quarantine.

""Advising"" people to isolate won't help. Quarantine must be enforced with help of police.

https://t.co/z5mG9zENbH",VaradManiyar,india,"Impossible is just an opinion.

RTs ≠ Endorsements",55,1516,2156,False,
2020-03-16 03:18:08+00:00,"RT @MajorPoonia: Dear Dr. Zafar Mirza @zfrmrza ,
Min of Heath,Pakistan
Forget abt Indian Kashmiris, India is doing it’s best to deal with C…",adi2889,india,Enjoying myself as much as i can :))))))))))),194,706,26875,False,"Dear Dr. Zafar Mirza @zfrmrza ,
Min of Heath,Pakistan
Forget abt Indian Kashmiris, India is doing it’s best to deal with Corona..from lifting it’s citizens from China,Iran &amp; Italy.
Your SHAMELESS Govt refused to get back own Pakistanis from China &amp; Iran.They DIED there only👎 https://t.co/BgsbyhfxhK"
2020-03-16 03:18:09+00:00,RT @sharma_jyo: West following India 🙏,amburravi,new delhi india,"Nobody gets out alive. Enjoy each moment. Love can happen many times in life.
True love is only once in life.",280,280,14058,False,West following India 🙏 https://t.co/7PqUeUrJVX
2020-03-16 03:18:09+00:00,Swag life 😂😎😎 https://t.co/e500aFq1Ue,JagadekaMalla,india,"Traveler, iPhone app Developer, Kannada translator. ಆಸಕ್ತಿಗಳು: #ಪುಸ್ತಕ  #Politics #History  #ಕೃಷಿ #iOSdev
~ಅಹಿಂಸಾ ಪರಮೋ ಧರ್ಮ~
~ಧರ್ಮಹಿಂಸಾ ತಥೈವಚ~",71,66,1057,False,
2020-03-16 03:18:10+00:00,"RT @MCU_Direct: The productions of the first three MCU @disneyplus series - #TheFalconAndTheWinterSoldier, #WandaVision and #Loki - have al…",AksheitKakani1,hyderabad india,"Big fan of Heena Parmar Mugdha Shweta Basu Prasad Sonarika Bhadoria Daniel Radcliffe Rupert Grint Emma Watson Tom  Paridhi
Iam Painting Artist 2d  Artist!",17,486,37347,False,"The productions of the first three MCU @disneyplus series - #TheFalconAndTheWinterSoldier, #WandaVision and #Loki - have all been halted due to #COVIDー19... https://t.co/v21pSoL0rq https://t.co/CkzVGKIacX"
2020-03-16 03:18:15+00:00,"RT @RamLalJ57053118: #GodMorningMonday
Its mention in Rigved Mandal 10 sukt 161 mantra 2 prove that God can increase the age of his true de…",RAJUTHAKRE17,indore india,,247,585,6715,False,"#GodMorningMonday
Its mention in Rigved Mandal 10 sukt 161 mantra 2 prove that God can increase the age of his true devotees.
True worship kill Cancer.
#MondayMotivaton
- Saint Rampal Ji Maharaj
Must Watch Sadhana TV 07:30PM (IST).
China italy America
https://t.co/G9HgJDdLZE"
2020-03-16 03:18:21+00:00,"RT @RohitBJP: First, when I landed at Delhi, all passengers from Singapore were screened for temperature and at immigration, address and ph…",ksmsundaram1975,mumbai india,"कौण्डिन्य गोत्र। Koundinya Gotra.

कह दो उनसे झुके अगर तो जग में यश पाएंगे, अड़े रहे तो ऐरावत पत्तों से बह जाएंगे - 'दिनकर' (समर शेष है)

#TestCricket #BJP #NaMo",2896,996,327268,False,"First, when I landed at Delhi, all passengers from Singapore were screened for temperature and at immigration, address and phone number were recorded. Immi officers carefully scanned passports to see any visits to China/Japan/Korea."
2020-03-16 03:18:23+00:00,"RT @ganeshmantra: Rahul spoke about women empowerment, you called him Pappu.

Rahul said there is 7.5% or more unemployment rate, you didn'…",VSecularCenCom,india indian indians,"To anyone who has suffered, been discriminated, been abused, been hurt, we are sorry; We hope we can be better again!",76,371,4271,False,"Rahul spoke about women empowerment, you called him Pappu.

Rahul said there is 7.5% or more unemployment rate, you didn't believe him.

Rahul proposed NYAY, you didn't understand the circulation of money.

Rahul warned about how dangerous Corona is but, you gave no ear."
2020-03-16 03:18:27+00:00,RT @RohitBJP: Government of India is doing its best. It’s not an easy thing. India is a vast country and we don’t have the luxury of granul…,ksmsundaram1975,mumbai india,"कौण्डिन्य गोत्र। Koundinya Gotra.

कह दो उनसे झुके अगर तो जग में यश पाएंगे, अड़े रहे तो ऐरावत पत्तों से बह जाएंगे - 'दिनकर' (समर शेष है)

#TestCricket #BJP #NaMo",2896,996,327268,False,"Government of India is doing its best. It’s not an easy thing. India is a vast country and we don’t have the luxury of granular data of people and their movements. Despite all these constraints, India is doing well to contain the pandemic. 

We as citizens need to be responsible."
2020-03-16 03:18:28+00:00,"RT @Ra_Bies: At Yoga class
Guruji: Neha, you’re continuously sneezing coughing and not breathing properly. Are you ok?
Neha: Guruji, I’m de…",Abhijitdongre99,akola india,"।।जय हिंद,जय महाराष्ट्र।।Teacher BY Profession 🇮🇳🙏",758,549,50747,False,"At Yoga class
Guruji: Neha, you’re continuously sneezing coughing and not breathing properly. Are you ok?
Neha: Guruji, I’m detected with Coronavirus 
G: You must leave &amp; go to hospital
N: I won’t, it’s mah lyf mah rulz
* giggles shamelessly*
G: what’s your surname
N: It’s Dhupia"
2020-03-16 03:18:29+00:00,"RT @AbhishBanerj: How irresponsible can people be?

11 Coronavirus suspects flee hospital in Maharashtra. 

Impose huge fines on these peop…",meetKool,india usa,"A Techie, Runner, Traveler, Religion agnostic,Centrist.Tweets Politics & Tech & anything that doesn’t spread hatred. Welcome logical discussions n arguments!",151,897,30120,False,"How irresponsible can people be?

11 Coronavirus suspects flee hospital in Maharashtra. 

Impose huge fines on these people. 

Bring ordinance declaring severe civil and criminal penalties."
2020-03-16 03:18:30+00:00,"RT @PriyaZore: Great, Really proud of My PM...
@narendramodi Ji
Modi Hai to munkin Hai...
https://t.co/jwoSK1Cyon",ashish_dagwar,maharashtra india,"Bjp member RSS Turbine specialist Entrepreneur , love cars ,fighter jets indianarmedforces fan wildlife lover save 🐯🐯🐅🐅 flby @piyushgoeloff @priyasethibjp",1257,4969,78452,False,"Great, Really proud of My PM...
@narendramodi Ji
Modi Hai to munkin Hai...
https://t.co/jwoSK1Cyon"
2020-03-16 03:18:33+00:00,"RT @ssrajamouli: It's shocking to see the world come to a standstill. However, in a scenario like this it's imperative to avoid spreading p…",KHALEELBASHASH9,vijayawada india,"Inspired by CBN sir
Fan of TDP
we are all with you @Ncbn sir #TDPTwitter",6,27,124,False,"It's shocking to see the world come to a standstill. However, in a scenario like this it's imperative to avoid spreading panic. Follow the standard recommendations to prevent the spread of the #COVID19 infection and stay alert. https://t.co/dzzDfuDP9k"
2020-03-16 03:18:33+00:00,RT @PiyushGoyal: Combating #Coronavirus: Watch the proactive efforts taken by Railways to sanitise things prone to passenger touch in train…,RAMESHPAGILLA6,hyderabad india,Telangana. sate .   Nalgonda  .munugodu.   marriguda. lenkalapally,136,298,76872,False,"Combating #Coronavirus: Watch the proactive efforts taken by Railways to sanitise things prone to passenger touch in trains, making the journey more safe &amp; hygienic for all passengers. https://t.co/aE5vXUOmda"
2020-03-16 03:18:34+00:00,"RT @IvankaTrump: During the coronavirus lockdown, people all over Italy took to their balconies playing instruments &amp; singing together.

It…",yogivimal,india,"journalist with a brain that has no heart and a heart that has no brain.that's why when i speak my mind I am heartless n when i speak my heart, i am thoughtless",3077,4889,51105,False,"During the coronavirus lockdown, people all over Italy took to their balconies playing instruments &amp; singing together.

Italians are showing the best of humanity in bonding together yet staying apart! 

Sending ❤️ our brothers and sisters at home and across the 🌎. https://t.co/oT9nECiCuG"
2020-03-16 03:18:35+00:00,"RT @news18dotcom: For their journey back home from Lucknow, the South African cricketers have chosen ""safest city"" Kolkata as their stopove…",Rajp160494,new delhi india,I have nothing except truth,193,190,4152,False,"For their journey back home from Lucknow, the South African cricketers have chosen ""safest city"" Kolkata as their stopover, from where they will return to their country via Dubai. 

https://t.co/KSCzmh7E8z"
2020-03-16 03:18:39+00:00,"RT @ssrajamouli: It's shocking to see the world come to a standstill. However, in a scenario like this it's imperative to avoid spreading p…",jakkuva_dheeraj,vishakhapatnam india,"Interested in mysterious things😌,Batminton is first love,Love cars🏎a lot
My Dream to drive my own private jet🛩",62,157,655,False,"It's shocking to see the world come to a standstill. However, in a scenario like this it's imperative to avoid spreading panic. Follow the standard recommendations to prevent the spread of the #COVID19 infection and stay alert. https://t.co/dzzDfuDP9k"
2020-03-16 03:18:39+00:00,"RT @davidfrawleyved: While China recommends Traditional Chinese Medicine with herbs and acupuncture for treating the coronavirus, the left…",ArtiSharma001,india bharat,"Mother, Wife; Teacher ( MA, MEd )🕉️ #IndiaNeedsSubramanianSwamyAsFinanceMinister_For10%GDP                    { *RTs/Likes Not Necessarily Endorsements #}",2283,4996,160996,False,"While China recommends Traditional Chinese Medicine with herbs and acupuncture for treating the coronavirus, the left in India and its western media allies tries to humiliate India as primitive for recommending Yoga, Ayurveda and Homeopathy."
2020-03-16 03:18:39+00:00,"RT @ShobhaBJP: Even if you are stuck on Mars, Indian embassy is there to help you!

4th Batch of 53 Indians have arrived from Tehran &amp; Shir…",RABalajeeSubra1,chennai india,"Hate Presstitutes,Sickular Hindus , Evil Forces Sickular Politicians and Lutyens.
Patriotic Right Wing Hindu Nationalist,
BJP and NDA Supporter,Nation First",272,1007,14936,False,"Even if you are stuck on Mars, Indian embassy is there to help you!

4th Batch of 53 Indians have arrived from Tehran &amp; Shiraz of Iran!

PM Sri @narendramodi Ji's Govt is commited to rescue/bring back each &amp; every Indian from the #COVID19 affected areas!

The legacy continues! https://t.co/ptRLoH0JyK"
2020-03-16 03:18:41+00:00,RT @Sesefox2: Pray for our beautiful planet #كورونا #COVIDー19 https://t.co/2m2p6lSdHR,vikasbhansali88,india,,1440,686,23421,False,Pray for our beautiful planet #كورونا #COVIDー19 https://t.co/2m2p6lSdHR
2020-03-16 03:18:46+00:00,"RT @desimojito: When PM Modi ji showed a good gesture by including Pakistan to fight CoronaVirus, they invoked Kashmir issue. 

The only th…",ModifiedAkki,india,"Mahadev Devotee!!!!!
Proud Indian, Proud Bhakt (Mahadaev & Modi), Messi fan forever 😍😍",615,1017,158677,False,"When PM Modi ji showed a good gesture by including Pakistan to fight CoronaVirus, they invoked Kashmir issue. 

The only thing terr0rlst country Pakistan deserve is getting their name eliminated from the world map."
2020-03-16 03:18:50+00:00,RT @PMOIndia: I propose we create a COVID-19 Emergency Fund. This could be based on voluntary contributions from all of us. India can start…,rajiwana,india,,136,379,20055,False,I propose we create a COVID-19 Emergency Fund. This could be based on voluntary contributions from all of us. India can start with an initial offer of 10 million US dollars for this fund: PM @narendramodi #SAARCfightsCorona
2020-03-16 03:18:51+00:00,RT @PMOIndia: Prime Minister Sheikh Hasina of Bangladesh thanks PM @narendramodi for bringing back 23 students of her country from Wuhan #S…,ShahGurbinder,india,"Hello eyeryone 
    
im actor and model....instagram @gurbindershah333...🌹🌹🌷🌷💕💕",777,1822,11722,False,Prime Minister Sheikh Hasina of Bangladesh thanks PM @narendramodi for bringing back 23 students of her country from Wuhan #SAARCfightsCorona
2020-03-16 03:18:51+00:00,"RT @TeluguChegu: Sir  @olivierveran ,

various vernacular media is reporting that you have advised Paracetamol as conclusive treatment for…",rc_nithin,bengaluru india,"Pawan Kalyan Fan/
Janasena Party Follower",771,851,20975,False,"Sir  @olivierveran ,

various vernacular media is reporting that you have advised Paracetamol as conclusive treatment for #COVID19 . Kindly clarify .

@TeluguChegu 
Indian citizen"
2020-03-16 03:18:54+00:00,"RT @NorbertElekes: BREAKING: Italy reports 3,590 new cases of coronavirus and 368 new deaths.

A total of 24,747 cases and 1,809 deaths.",naveen_gupta14,mumbai india,,240,180,46571,False,"BREAKING: Italy reports 3,590 new cases of coronavirus and 368 new deaths.

A total of 24,747 cases and 1,809 deaths."
2020-03-16 03:18:56+00:00,"RT @Shehla_Rashid: Appeal to the government of India to revoke recent controversial decisions such as CAA, NPR, nationwide NRC, etc. in the…",AbdulMannanaik,dharwad india,"LOVE where you work, Working as a Mechanical Engineer, visited UK for company project, and Social worker",245,1855,10022,False,"Appeal to the government of India to revoke recent controversial decisions such as CAA, NPR, nationwide NRC, etc. in the wake of Coronavirus outbreak. There are mass protests in the country everywhere due to these decisions, please halt them for now. @narendramodi @AmitShah #nCov"
2020-03-16 03:18:59+00:00,"RT @mvmeet: Four Musl!ms who returned from Dubai

Have refused to undergo Coronavirus test in Bhatkal town of Karnataka 
&amp; also threatened…",vishalanand1212,bihar india,keep it Real.,90,197,5377,False,"Four Musl!ms who returned from Dubai

Have refused to undergo Coronavirus test in Bhatkal town of Karnataka 
&amp; also threatened the health officials 

They objected to medical tests claiming !slam did not permit them

Now these religious lunatics have risked lakhs of people"
2020-03-16 03:18:59+00:00,These simulations show how to flatten the #coronavirus growth curve https://t.co/WhFCPhxDji,guffawer,bengaluru south india,"Friendly Introvert, Animal Lover, Thinker, History Buff, Chronic Infoholic & an avid Reader.",1257,603,26354,False,
2020-03-16 03:19:00+00:00,Awareness of Corona Virus Covid 19 https://t.co/A2bXEWJmqj,nadimji18,pune india,Im B.Sc. in Biology and M.A. in Economics.,732,2848,12870,False,
