created_at,full_text,screen_name,location,description,followers_count,friends_count,statuses_count,verified,full_retweet_text
2020-02-14 01:32:48+00:00,"RT @KiranKS: Lot of advice after the #CoronaVirusOutbreak in China. Three prominent ones seen on social media:

1) Burn the dead bodies, no…",nagabhushanb,india,"||प्रज्ञानम् ब्रह्म|| ➡️I seek Truth⬅️ ||Bharatiya🇮🇳|| || Jai Maa Bharati|| ||Vande Mataram||  **RTs &❤️are not Endorsements** Tweets in ಕನ್ನಡ, हिंदी, English",1301,1575,63141,False,"Lot of advice after the #CoronaVirusOutbreak in China. Three prominent ones seen on social media:

1) Burn the dead bodies, not bury.
2) Don't eat much meat. High risk of virus infections.
3) Avoid shaking hands.

Guess what? Those have been very popular in India for millennia!"
2020-02-14 01:32:53+00:00,"RT @manureetbath: @vips1031 @TrulyMonica @vivekagnihotri In cold season, I start taking turmeric milk shots if I don’t have time to cook In…",gopalkumar1111,india,"All things bright and beautiful, Retweets are not endorsement, Views personal",62,85,6531,False,"@vips1031 @TrulyMonica @vivekagnihotri In cold season, I start taking turmeric milk shots if I don’t have time to cook Indian food. There was a time when everyone around me had cold except me (I am generally cold prone). Not sure about Corona virus (no intention to verify). I Love turmeric."
2020-02-14 01:32:58+00:00,RT @ImtiazMadmood: Saying greetings instead of shaking hands. Not eating animals but only vegetarian. Cremating the dead instead of burying…,shrisurendraa,jaipur india,"एक ॐकार सतनाम, कर्तापुरख, निर्मोह निर्वैर, अकाल मूरत, अजूनी सभं. गुरु परसाद ॥",361,674,13117,False,"Saying greetings instead of shaking hands. Not eating animals but only vegetarian. Cremating the dead instead of burying them.

Since Corona virus the world is becoming Hindu?"
2020-02-14 01:33:43+00:00,"RT @abhishaek: @catcheronthesly @TrulyMonica A lot of diseases like coronavirus, H1N1, bird flu, SARS, MERS, Ebola etc have originated when…",gopalkumar1111,india,"All things bright and beautiful, Retweets are not endorsement, Views personal",62,85,6531,False,"@catcheronthesly @TrulyMonica A lot of diseases like coronavirus, H1N1, bird flu, SARS, MERS, Ebola etc have originated when humans have come in close contact with animals. Being veg eliminates that possibility. Plague was caused by rats &amp; encephalitis probably by pigs. You missed the point."
2020-02-14 01:33:44+00:00,The number of coronavirus cases has seen a drastic jump #SkimmLife https://t.co/ESWp3kaGcd via @theSkimm,vajapeyam,india,"When will Indians in general get out of ""DYNASTY POLITICS SYNDROME"",if at all they can? 😡😔😕😬",3224,4296,269753,False,
2020-02-14 01:33:53+00:00,"RT @VishnuNDTV: How Air India rose to the occasion to rescue hundreds from Wuhan. Our exclusive with Capt Amitabh Singh.

https://t.co/FsNk…",samantaanupam69,india,Student and Defence enthuastic,12,49,654,False,"How Air India rose to the occasion to rescue hundreds from Wuhan. Our exclusive with Capt Amitabh Singh.

https://t.co/FsNkrlf8jg

Shared via NDTV News App (Android - https://t.co/c2uSlWlb3b | iPhone - https://t.co/GN49E8tUM6 )"
2020-02-14 01:33:56+00:00,"RT @drthomasisaac: Just as in the case of Nipah, Kerala has won battle with Corona Virus. All the 3 patients identified have been confirmed…",sunilsonia,mangalore india,"Social Worker II Reader  II Observer II Thinker II Tweet Personal View, RT
 #BharatJaldiBadlega https://t.co/xQP8nVXOa8",1058,2915,45381,False,"Just as in the case of Nipah, Kerala has won battle with Corona Virus. All the 3 patients identified have been confirmed by Central authorities to have fully recovered. No case of secondary spread. Number under quarantine observation drastically coming down.Congats Health Dept."
2020-02-14 01:34:08+00:00,#Coronavirus scare making investors jittery across Asia again. Death toll in #Hubei province double the previous day count. Meanwhile #China sacks senior officials as it attempts to mitigate the pandemic https://t.co/Tx0x99yhu1,ETNOWlive,india,"Youtube:
https://t.co/CPdYqOLlJo   
Facebook:
https://t.co/XoAifE1q1A 
Instagram:
https://t.co/IvXWmqtHtw",519670,110,442073,True,
2020-02-14 01:34:11+00:00,"RT @MohanTh80694870: @SaintRampalJiM If we act against God constitution, then we have to suffer a huge loss as Coronavirus has spread so fa…",RamTira69126499,sultanpur u p india,"जीव हमारी जाती हैं मानव धर्म हमारा 
हिन्दू मुस्लिम शिख इसाई कोई धर्म नही है न्यारा",30,37,3741,False,"@SaintRampalJiM If we act against God constitution, then we have to suffer a huge loss as Coronavirus has spread so fast in China that the people there have been the cause of death, only God can save now.
#MustListen_Satsang
Watch Ishwer T.V-8:30pm
#FridayThoughts 
 https://t.co/93TwdZ73nP"
2020-02-14 01:34:14+00:00,"2.7k km away, nCoV scare keeps foodies from Chinatown https://t.co/MMtEHQF1MF",TOIKolkata,kolkata india,Your city. Your neighborhood. Your block. Covered for you by https://t.co/VSKi1mCAsZ,2179,30,32369,True,
2020-02-14 01:34:16+00:00,Nation- #Passenger on board Bangkok-Delhi suspected of coronavirus: SpiceJet https://t.co/tbSqCwxzhw,NewstoLive1,gurgaon india,View Daily latest news,29,9,7884,False,
2020-02-14 01:34:17+00:00,"RT @TrulyMonica: Saying Namaste instead of shaking hands

Cremating dead body instead of burying 

Eating Satvik vegetarian food instead of…",g_mahendru,mumbai india,"sales professional | loves the mountains, treks, long motorcycle rides | enjoy good debates and arguments | reading books | views are personal",216,269,36409,False,"Saying Namaste instead of shaking hands

Cremating dead body instead of burying 

Eating Satvik vegetarian food instead of animals full of diseases

Our civilisation’s record of keeping us trouble-free is very underrated 😃 https://t.co/wgYwfa7CgK"
2020-02-14 01:34:25+00:00,@livecrisisnews Afraid the whole China shd get sanitised? Any possibility for expats to return to China in the near future?,Visalmama,india,SATYAMEVA JAYATHEY!,31,131,7053,False,
2020-02-14 01:34:28+00:00,RT @ImtiazMadmood: Saying greetings instead of shaking hands. Not eating animals but only vegetarian. Cremating the dead instead of burying…,KarunaGopal1,hyderabad india,"Special Invitee BJP State Exec Committee TS | Member Sub Committee BJP National Manifesto | President FFC | MRICS ,UK | IVLP Fellow | Harvard Kennedy School USA",38545,713,14191,False,"Saying greetings instead of shaking hands. Not eating animals but only vegetarian. Cremating the dead instead of burying them.

Since Corona virus the world is becoming Hindu?"
2020-02-14 01:34:37+00:00,RT @Thoton: Tokyo cab driver who has tested positive for #COVID19 had neither traveled to China nor carried a passenger who appears to be a…,lamakayaj,chennai india,"Liberty & Prosperity. Interests in Economics, Politics. | 経済学。現在、日本語翻訳・通訳として働いています。J-pop、演歌も好きです。",241,754,26730,False,Tokyo cab driver who has tested positive for #COVID19 had neither traveled to China nor carried a passenger who appears to be a foreigner recently. https://t.co/264KhVyWWl
2020-02-14 01:34:42+00:00,"RT @Arun2981: He personally monitored Demonetisation 

Personally monitored GST 

Personally monitored Kashmir 

Ab darr lag raha hai.... g…",kamalesh_Tyagi2,india,"IT professional & Social Activist. 
Living for the cause which is bigger than my dream.",839,1077,159929,False,"He personally monitored Demonetisation 

Personally monitored GST 

Personally monitored Kashmir 

Ab darr lag raha hai.... god bless India 🇮🇳 https://t.co/LUe4TGD5up"
2020-02-14 01:34:45+00:00,RT @gadget_diary: Xiaomi Mi 10 and Mi 10 Pro launched in China with SD 865 SoC and 108MP quad rear camera https://t.co/MqORyAmwjD @gadget_d…,swapnilsilver,india,"Lecturer, Tech Lover, Sketch Artist",132,448,31201,False,Xiaomi Mi 10 and Mi 10 Pro launched in China with SD 865 SoC and 108MP quad rear camera https://t.co/MqORyAmwjD @gadget_diary
2020-02-14 01:34:49+00:00,RT @spectatorindex: BREAKING: Coronavirus death toll reaches 1483,Nksagar,new delhi india,"Sagar Media Inc. Online Media,Theosophist, MSME- Mentor, Enterpreuner,  Branding, Social transform, Multifacet, Motivator.Intutive mind.",1261,3062,135837,False,BREAKING: Coronavirus death toll reaches 1483
2020-02-14 01:34:50+00:00,RT @CGTNOfficial: Live: Leishenshan Hospital in use as construction goes on to receive more #coronavirus patients. #COVID19 https://t.co/kD…,965febc1d78d439,noida india,You are the only game changer.....,31,89,33,False,Live: Leishenshan Hospital in use as construction goes on to receive more #coronavirus patients. #COVID19 https://t.co/kDBWhy56Bw
2020-02-14 01:35:05+00:00,"RT @KiranKS: Lot of advice after the #CoronaVirusOutbreak in China. Three prominent ones seen on social media:

1) Burn the dead bodies, no…",satymeva_jayate,india,,355,1529,68717,False,"Lot of advice after the #CoronaVirusOutbreak in China. Three prominent ones seen on social media:

1) Burn the dead bodies, not bury.
2) Don't eat much meat. High risk of virus infections.
3) Avoid shaking hands.

Guess what? Those have been very popular in India for millennia!"
2020-02-14 01:35:06+00:00,"""He's A Senior Leader..."": Minister On Rahul Gandhi's Coronavirus Tweet https://t.co/gmqdt1U576",nayanamadhavan7,jahanabad india,"I am Nayana Madhavan, a free minded businesswoman. I have a milk dairy and a garment shop.",13,0,3272,False,
2020-02-14 01:35:19+00:00,"RT @shreyaraman18: More power to @IshaArora94 . I had planned to hide her identity but she said, ""What’s to be afraid of? Harassers should…",TheHatmanTweets,chennai india,"Not famous enough to get paid by someone else to tweet out stuff.

Also, I write about cinema at @XpressCinema
 
Thanking you, 
Ungal...  Naan",1304,389,13779,False,"More power to @IshaArora94 . I had planned to hide her identity but she said, ""What’s to be afraid of? Harassers should be afraid.🤷🏽‍♀"" Damn right! https://t.co/cGOcm74PSb"
2020-02-14 01:35:25+00:00,"RT @sunandavashisht: Say Namaste, become vegetarian and save the planet:)",Sreekant0123,belgaum india,,47,417,2014,False,"Say Namaste, become vegetarian and save the planet:) https://t.co/hQfLoyk70R"
2020-02-14 01:35:47+00:00,@agarwal_ishanvi Muzlims will not b affected by coronavirus 😊,undrtyu,india,"Dharma not hvng equal word inEnglis values,laws of univers2b followd so it is eternal=Sanaathan not changes wt time Hindu is culture best lifestyle not religion",381,3206,20961,False,
2020-02-14 01:35:54+00:00,"RT @TrulyMonica: Saying Namaste instead of shaking hands

Cremating dead body instead of burying 

Eating Satvik vegetarian food instead of…",ashishmehta_77,india,,115,255,13079,False,"Saying Namaste instead of shaking hands

Cremating dead body instead of burying 

Eating Satvik vegetarian food instead of animals full of diseases

Our civilisation’s record of keeping us trouble-free is very underrated 😃 https://t.co/wgYwfa7CgK"
2020-02-14 01:35:55+00:00,RT @ImtiazMadmood: Saying greetings instead of shaking hands. Not eating animals but only vegetarian. Cremating the dead instead of burying…,tripathick03,india,,34,148,7652,False,"Saying greetings instead of shaking hands. Not eating animals but only vegetarian. Cremating the dead instead of burying them.

Since Corona virus the world is becoming Hindu?"
2020-02-14 01:35:59+00:00,"RT @CGTNOfficial: Recently, there have been videos online showing patients and medical staff doing square dancing inside makeshift hospital…",divesh_ray,jaunpur india,I study and do social service along with studies...,67,294,2587,False,"Recently, there have been videos online showing patients and medical staff doing square dancing inside makeshift hospitals for those with mild #coronavirus symptoms, stirring a social media reaction.

A CCTV reporter visits one hospital in #Wuhan for a closer look. https://t.co/OY0TeAh1kd"
2020-02-14 01:36:02+00:00,"RT @NorbertElekes: BREAKING: Number of confirmed coronavirus cases rises to 64,000+",mak_ynwalfc,chandrapur india,"Power Systems Engineer working at HVDC Terminal Station......
Liverpool RED through thick and thin... a diehard & proud KOPite... #YNWA",677,1010,157458,False,"BREAKING: Number of confirmed coronavirus cases rises to 64,000+"
2020-02-14 01:36:02+00:00,RT @ImtiazMadmood: Saying greetings instead of shaking hands. Not eating animals but only vegetarian. Cremating the dead instead of burying…,naradeshpande,bengaluru india,"Cricketers and Commentators Sports News, TV and Scores Breaking News Government and Politics Politicians and Pol Parties",146,209,20141,False,"Saying greetings instead of shaking hands. Not eating animals but only vegetarian. Cremating the dead instead of burying them.

Since Corona virus the world is becoming Hindu?"
2020-02-14 01:36:06+00:00,"RT @TIinExile: Fool.

Maharaja consulted the people's assembly of Jammu and Kashmir.

The then prime minister of Jammu Kashmir, Mehr Chand…",ultapultanikhil,india,Retweets are not endorsements.,822,3014,114264,False,"Fool.

Maharaja consulted the people's assembly of Jammu and Kashmir.

The then prime minister of Jammu Kashmir, Mehr Chand Mahajan approved the move.

Even Sheikh Abdullah welcomed the move then.

Even when the country was under a brutal invasion, he followed the due process. https://t.co/BVnWlYjn3k"
2020-02-14 01:36:12+00:00,"RT @drthomasisaac: Just as in the case of Nipah, Kerala has won battle with Corona Virus. All the 3 patients identified have been confirmed…",Alekh_AA,mumbai india,"Journalist @cogencis, ex-@livemint/
Views own/peace/Bangda is bae",325,1626,4473,False,"Just as in the case of Nipah, Kerala has won battle with Corona Virus. All the 3 patients identified have been confirmed by Central authorities to have fully recovered. No case of secondary spread. Number under quarantine observation drastically coming down.Congats Health Dept."
2020-02-14 01:36:41+00:00,"RT @Pun_Starr: Health Minister Harshvardhan has said, PM Modi is personally monitoring Coronavirus.

Considering that the last time Modiji…",jockey_ayush,delhi india,"Machine at mind, Pope at Heart, chasing my soul inwards...",68,481,10348,False,"Health Minister Harshvardhan has said, PM Modi is personally monitoring Coronavirus.

Considering that the last time Modiji personally monitored anything, it was the economy, this isn't a very comforting thought."
2020-02-14 01:37:04+00:00,"In China, political fallout from novel coronavirus outbreak continues https://t.co/nE7NNLdDWe #USANews",APLatestNews,india usa,https://t.co/zSIZkXNBgK is a single source for all India(including Andhra and Telangana) and USA latest news videos,744,145,574156,False,
2020-02-14 01:37:11+00:00,"RT @FinancialXpress: Another mysterious virus named #Yaravirus has been traced in Brazil, which is baffling scientists!
 https://t.co/7V1T9…",ashuji2k7,jharkhand india,'I' for Iconoclast,179,4997,6772,False,"Another mysterious virus named #Yaravirus has been traced in Brazil, which is baffling scientists!
 https://t.co/7V1T9pMwjR"
2020-02-14 01:37:15+00:00,RT @sardesairajdeep: Full marks to Kerala Govt for tackling corona virus with speed and efficiency. Public health systems do work well at t…,BabuRaj23827753,coimbatore india,,7,31,2677,False,Full marks to Kerala Govt for tackling corona virus with speed and efficiency. Public health systems do work well at times!! https://t.co/GpwCbT0TFo
2020-02-14 01:37:23+00:00,RT @ImtiazMadmood: Saying greetings instead of shaking hands. Not eating animals but only vegetarian. Cremating the dead instead of burying…,ardamavtonda,hyderabad india,singles ni recchagokkakandi,57,188,14179,False,"Saying greetings instead of shaking hands. Not eating animals but only vegetarian. Cremating the dead instead of burying them.

Since Corona virus the world is becoming Hindu?"
2020-02-14 01:37:44+00:00,RT @ImtiazMadmood: Saying greetings instead of shaking hands. Not eating animals but only vegetarian. Cremating the dead instead of burying…,hareee10,chennai india,தமிழன் வாழ ஆன்மீகம் ஓங்க வேண்டும்!,995,4998,49370,False,"Saying greetings instead of shaking hands. Not eating animals but only vegetarian. Cremating the dead instead of burying them.

Since Corona virus the world is becoming Hindu?"
2020-02-14 01:37:48+00:00,"RT @sunandavashisht: Say Namaste, become vegetarian and save the planet:)",singh_expresss,mumbai india,"always right, always on the right.",43,0,8292,False,"Say Namaste, become vegetarian and save the planet:) https://t.co/hQfLoyk70R"
2020-02-14 01:37:55+00:00,"@RowdyTalks (Boyfriend nicknamed virus)
Bf- what's the mood baby?
Horny gf- corona virus.
😜😜😀",LSPunni,rajasthan india,be responsible........,22,202,595,False,
2020-02-14 01:38:10+00:00,"RT @drthomasisaac: Just as in the case of Nipah, Kerala has won battle with Corona Virus. All the 3 patients identified have been confirmed…",pareshsancheti,pune india,Sab Moh Maya Hai,269,1321,13893,False,"Just as in the case of Nipah, Kerala has won battle with Corona Virus. All the 3 patients identified have been confirmed by Central authorities to have fully recovered. No case of secondary spread. Number under quarantine observation drastically coming down.Congats Health Dept."
2020-02-14 01:38:13+00:00,"RT @AltNewsScience: As with other homeopathic drugs, Arsenicum album 30 has never been tested or proven to reduce coronavirus infections or…",Brajesh71500046,gujarat india,सबसे उच्चा धर्म है इंसानियत । No to Hypocrits,165,197,20477,False,"As with other homeopathic drugs, Arsenicum album 30 has never been tested or proven to reduce coronavirus infections or to prevent coronavirus infections. #SciCheck #AltNewsScienceCheck | @AltNews | @Neurophysik 

https://t.co/Xfk7l2L3jI https://t.co/th6TeBZ0pO https://t.co/Vcb8NXcIVi"
2020-02-14 01:38:17+00:00,"RT @TrulyMonica: Saying Namaste instead of shaking hands

Cremating dead body instead of burying 

Eating Satvik vegetarian food instead of…",Mridul152708,new delhi india,"Being human😁

Nation first, blood is hindutva",40,382,757,False,"Saying Namaste instead of shaking hands

Cremating dead body instead of burying 

Eating Satvik vegetarian food instead of animals full of diseases

Our civilisation’s record of keeping us trouble-free is very underrated 😃 https://t.co/wgYwfa7CgK"
2020-02-14 01:38:32+00:00,CDC offers glimpse into new virus response center https://t.co/t1qFn07oqK #USANews,APLatestNews,india usa,https://t.co/zSIZkXNBgK is a single source for all India(including Andhra and Telangana) and USA latest news videos,744,145,574156,False,
2020-02-14 01:38:37+00:00,"Coronavirus: Bug could infect two-thirds of globe, research shows, Europe News &amp; Top Stories - The Straits Times https://t.co/FD6muy1kuG",TrehanKailash,mumbai india,"Japanese company director Mumbai.  Interest Japan, Japanese language, indian economy,  education, jobs, business culture, EVs, Electronics. RT not endorsement",110,685,11321,False,
2020-02-14 01:38:38+00:00,RT @BBCWorld: Coronavirus: Why have two reporters in Wuhan disappeared? https://t.co/hwzWAHEFTI,iajaysharma94,kolkata india,📚 | No Complains | No Demands | Just See the World 🌍 Through my eyes 👀 | 👋@Officialneha’s Fraternity - Good Vibes Only 💖 |,82,180,5770,False,Coronavirus: Why have two reporters in Wuhan disappeared? https://t.co/hwzWAHEFTI
2020-02-14 01:38:41+00:00,"#CoverStory | Why is my daughter still on a ship that has 218 Corona-positive cases? 

Mira Road-based father of Sonali Thakkar – who is stuck aboard Diamond Princess at Yokohama – says there has been no help from the government

https://t.co/po6zthooKi",MumbaiMirror,mumbai india,India's largest compact newspaper.,322803,226,61536,True,
2020-02-14 01:38:59+00:00,RT @ImtiazMadmood: Saying greetings instead of shaking hands. Not eating animals but only vegetarian. Cremating the dead instead of burying…,drmohannair,india,Surgeon. India First.,115,371,4501,False,"Saying greetings instead of shaking hands. Not eating animals but only vegetarian. Cremating the dead instead of burying them.

Since Corona virus the world is becoming Hindu?"
2020-02-14 01:39:02+00:00,"RT @SadhguruJV: As the governments handle the #Coronavirus outbreak situation, we can choose to respond to these sensitive times in a nasty…",babu_nataraj,kanchipuram india,,9,44,989,False,"As the governments handle the #Coronavirus outbreak situation, we can choose to respond to these sensitive times in a nasty way or a graceful way. Whether it is isolation or any other precaution, we can conduct it with compassion. https://t.co/QmEts74UtJ"
2020-02-14 01:39:06+00:00,"My grandma called my mom to warn us about the Corona Virus. She’s so sweet, I love her",srinivasanujan,gujarat india,Oxford ‘24 RIP Grandma 1929-2008 💔🖤,94,143,1809,False,
2020-02-14 01:39:11+00:00,RT @ImtiazMadmood: Saying greetings instead of shaking hands. Not eating animals but only vegetarian. Cremating the dead instead of burying…,mak_ynwalfc,chandrapur india,"Power Systems Engineer working at HVDC Terminal Station......
Liverpool RED through thick and thin... a diehard & proud KOPite... #YNWA",677,1010,157458,False,"Saying greetings instead of shaking hands. Not eating animals but only vegetarian. Cremating the dead instead of burying them.

Since Corona virus the world is becoming Hindu?"
2020-02-14 01:39:11+00:00,US officials announce country's 15th confirmed case of new #coronavirus.,airnewsalerts,new delhi india,"Official account of News Services Division, All India Radio.

हिंदी के समाचारों के लिए @AIRNewsHindi को फॉलो करें!
Follow @AIRNewsUrdu for news updates in Urdu",2315986,13,264903,True,
2020-02-14 01:39:13+00:00,"RT @TrulyMonica: Saying Namaste instead of shaking hands

Cremating dead body instead of burying 

Eating Satvik vegetarian food instead of…",akagniak,india,"survived J & K , survived Congo ... now trying to survive Remitting Relapsing Multiple sclerosis.",282,741,27019,False,"Saying Namaste instead of shaking hands

Cremating dead body instead of burying 

Eating Satvik vegetarian food instead of animals full of diseases

Our civilisation’s record of keeping us trouble-free is very underrated 😃 https://t.co/wgYwfa7CgK"
2020-02-14 01:39:14+00:00,RT @ContextMatters4: India at - 2.4% and yet borrowers of India and government of India wants interest rates to further fall. Despite knowi…,jumbosocialmed,mumbai jabalpur india,"Day trader & trainer,maker of unique complete trading system PONDS,Nifty Bank Nifty options trader, CFP ,EQUITY RESEARCH ANALYST(no buy or sell, only trade )",621,1544,4506,False,India at - 2.4% and yet borrowers of India and government of India wants interest rates to further fall. Despite knowing that reducing rates can never boom economy. Examples r Japan and US. https://t.co/lkffANMmnx
2020-02-14 01:39:24+00:00,"#SagarmediaInc 

#Coronavirus death toll is  1483.

2nd highest number of rapes in the world per capita.Socialism Nazism communism are  left claimed it was just a ""conspiracy theory""
Justice minister admit, Sweden has a rape problem. https://t.co/5NPHXDLOvu",Nksagar,new delhi india,"Sagar Media Inc. Online Media,Theosophist, MSME- Mentor, Enterpreuner,  Branding, Social transform, Multifacet, Motivator.Intutive mind.",1261,3062,135837,False,
2020-02-14 01:39:35+00:00,"RT @TIinExile: Fool.

Maharaja consulted the people's assembly of Jammu and Kashmir.

The then prime minister of Jammu Kashmir, Mehr Chand…",Dr_jayadevsk,kerala india,"Nationalist, Traveller, Proud Hindu, Photography enthusiast",790,1922,72435,False,"Fool.

Maharaja consulted the people's assembly of Jammu and Kashmir.

The then prime minister of Jammu Kashmir, Mehr Chand Mahajan approved the move.

Even Sheikh Abdullah welcomed the move then.

Even when the country was under a brutal invasion, he followed the due process. https://t.co/BVnWlYjn3k"
2020-02-14 01:39:37+00:00,"RT @Diya_BJPLover: For @narendramodi, India &amp; it's citizens always comes first!

&amp; for those who are trending #घंटा_सबका_साथ_सबका_विकास her…",khojinindia,new delhi india,"https://t.co/O5Uizlqm7q is India's Largest #B2B #Online #Marketplace For Assists #Manufacturers, #Suppliers & #Exporters to #Trade with each other & Global Marketplace.",2311,480,37690,False,"For @narendramodi, India &amp; it's citizens always comes first!

&amp; for those who are trending #घंटा_सबका_साथ_सबका_विकास here are some facts on How different country treated their own citizens stuck in #Coronavirus stricken Wuhan. https://t.co/LitS3O6C22"
2020-02-14 01:39:59+00:00,"RT @ChinaDaily: In the name of #JHope, fans of k-pop group #BTS's member Jeong Ho-seok donated 1,640 masks to the north district of Gwangju…",RuchuKent,northeast india,"Be Kind and have Courage and all will be well.
AFBF(ARMY FOREVER BTS FOREVER) 💜💜💜",31,36,976,False,"In the name of #JHope, fans of k-pop group #BTS's member Jeong Ho-seok donated 1,640 masks to the north district of Gwangju, South Korea in celebration of his birthday. These masks will be used to help vulnerable groups in the face of the #coronavirus. @BTS_twt #JhopeBirthday https://t.co/Bwh2BmGS0a"
