created_at,full_text,screen_name,location,description,followers_count,friends_count,statuses_count,verified,full_retweet_text
2020-02-16 22:58:05+00:00,RT @NHSuk: The Government and NHS are well prepared to deal with coronavirus.,kathill2016,india,,191,234,12084,False,The Government and NHS are well prepared to deal with coronavirus.
2020-02-16 22:58:19+00:00,"RT @AFP: The coronavirus epidemic could damage global economic growth this year, the IMF head said Sunday, but a sharp and rapid economic r…",selberan,india kerala kollam uae,YOU ARE LOOKING GOOD,736,4973,87671,False,"The coronavirus epidemic could damage global economic growth this year, the IMF head said Sunday, but a sharp and rapid economic rebound could follow https://t.co/d9K228ERkh"
2020-02-16 22:58:26+00:00,"RT @AFPphoto: #Japan 
Evacuation of US passengers from quarantined ship begins

📷 @BEHROUZZZZ #AFP #coronavirus https://t.co/RiAz1pzyYP",selberan,india kerala kollam uae,YOU ARE LOOKING GOOD,736,4973,87671,False,"#Japan 
Evacuation of US passengers from quarantined ship begins

📷 @BEHROUZZZZ #AFP #coronavirus https://t.co/RiAz1pzyYP"
2020-02-16 22:58:30+00:00,RT @spectatorindex: BREAKING: 100 new coronavirus deaths in Hubei province,TeJay29,india,"What we sow is what we reap.
Traversing twitter for trivia & trivial.
All characters in tweets are fictional. Typos happen.
🍻☕🏏📚💹📝♊🇮🇳",1654,722,314887,False,BREAKING: 100 new coronavirus deaths in Hubei province
2020-02-16 22:58:33+00:00,RT @Kari81709371: Retweet if you think #Shaheenbaghvirus is more dangerous than #coronavirus For India,mkpaul17,mumbai india,"Capricorn, Single, Independent",93,445,529,False,Retweet if you think #Shaheenbaghvirus is more dangerous than #coronavirus For India
2020-02-16 22:59:05+00:00,@ImtiazMadmood as temp rises corona will feel the heat flee the patient through fluids patient will be dead 🙂,MBilalY,india usa,A minimum requirement of a human being is to show mercy and compassion neverthless always stand for truth & always fight tyranny in all its manifestations!,582,882,24961,False,
2020-02-16 22:59:22+00:00,@DrSJaishankar @MEAIndia why are we not bringing our people back and Qurantine them here in our country every other is doing that #DiamondPrincess Qurantine seems to be big mess they still have not tested everyone. https://t.co/LIog4TyPWl,BeingMaverick_,india,"Follows you;

not left or right just correct and politically incorrect",35,625,7675,False,
2020-02-16 22:59:28+00:00,I guess the bio warfare weapon backfired unexpectedly on China. suspect there are more than the 66k casualties mentioned by China. #coronavirus #Coronavirius,krit_hika_21,chennai india,Quite the challenge - describing myself in the 160 character limit. What I can say is that this is my space to just be myself. What you see is what you get.,41,43,391,False,
2020-02-16 22:59:37+00:00,RT @spectatorindex: BREAKING: 100 new coronavirus deaths in Hubei province,shaarng,new delhi india,"The bow of Bhagavan Ram, the axe of Bhagavan Parshuram, the Sudarshan of Bhagavan Krsna. सीधे तो ""राम"", पलटे तो ""परशुराम""|",738,100,80483,False,BREAKING: 100 new coronavirus deaths in Hubei province
2020-02-16 22:59:39+00:00,"RT @ANI: China virus toll reaches 1,765 as new cases rise, government says: AFP news agency #COVID2019 #coronavirus",shaarng,new delhi india,"The bow of Bhagavan Ram, the axe of Bhagavan Parshuram, the Sudarshan of Bhagavan Krsna. सीधे तो ""राम"", पलटे तो ""परशुराम""|",738,100,80483,False,"China virus toll reaches 1,765 as new cases rise, government says: AFP news agency #COVID2019 #coronavirus"
