created_at,full_text,screen_name,location,description,followers_count,friends_count,statuses_count,verified,full_retweet_text
2020-05-28 23:00:59+00:00,"RT @realDonaldTrump: All over the World the CoronaVirus, a very bad “gift” from China, marches on. Not good!",NiteshJ18923740,new delhi india,"जय श्री राम ।गर्व से कहो हिन्दू है हम।भारत माता की जय।
वंदे मातरम।💯",952,867,11658,False,"All over the World the CoronaVirus, a very bad “gift” from China, marches on. Not good!"
2020-05-28 23:01:08+00:00,"RT @NorbertElekes: OPINION: Getting many questions about India's response to the pandemic.

Imo, India has managed the pandemic well compar…",varun_iiml,delhi india,#HR @Samsung #Quiz @IQL_India @IIML #Catholic. Left of Centre. Happily #Married! Tweets reflect personal opinion. Follow @AndrewYang @humanityforward #UBI,1144,616,38179,False,"OPINION: Getting many questions about India's response to the pandemic.

Imo, India has managed the pandemic well compared to other large countries, with decisive action and early lockdown.

It's too early to draw a conclusion though. Coming weeks will be crucial. Be safe!"
2020-05-28 23:01:16+00:00,"PM. @narendramodi

I urge that #Migrant crisis is dealt with all resources available on P1 basis. We all know our country has the resources. #Rains will only worsen the #CoronaVirus #Covid19 situation.

Every Indian Life Matters!!

@mygovindia @PMOIndia @HMOIndia @MoHFW_INDIA https://t.co/h3rASZKLTq",80sArmyBRAT,india,"Army BRAT/तोपची का बेटा! 
Political Incorrectness Hurts? Don't Follow!
Bhakts 👉 Maintain Permanent Distancing. Not Caution, Warning 🚫 RTs≠Endorsements",42,117,2115,False,
2020-05-28 23:01:27+00:00,"RT @tonygoldmark: Well nerds, I fuckin' did it.

Took me a global pandemic and a damn quarantine, but I did it.

I figured out the precise…",AKMIITIIM,dhanbad india,,5,46,295,False,"Well nerds, I fuckin' did it.

Took me a global pandemic and a damn quarantine, but I did it.

I figured out the precise chronological order of all the MCU movies (so far) BY SCENE.

I'm out of my Goddamn mind. You're welcome. https://t.co/3VXjqk4kjQ"
2020-05-28 23:01:33+00:00,RT @ajay43: Who’d have thought! This is next level brilliance 👋👋,mojav_ind,india,"Humanity First |  Belief in Liberal, Secular, Democratic & Progressive India | Congress supporter | Abusers and bigots will be blocked immediately.",538,977,17913,False,Who’d have thought! This is next level brilliance 👋👋 https://t.co/ek9Hza4lnt
2020-05-28 23:01:37+00:00,"This is what health officials feared.

Once contained to richer parts of the country exposed to international travelers, #coronavirus is spreading to parts of Brazil that lack clean water. 

Read more in @business: https://t.co/nePP7ePVcY https://t.co/vqk8AC6iWD",v_shakthi,bengaluru india,"Tech Analyst, Tech Blogger, Disability Rights Activist ♿,  Cloud and AI evangelist, Owner of @thequill_in. Email: shakthi@thequill.in",141247,107207,425526,True,
2020-05-28 23:01:38+00:00,RT @SadhguruJV: Beat the Virus with a NAMASKAR. -Sg @WHO @narendramodi @Oprah @SrBachchan @sachin_rt @priyankachopra @DalaiLama @mangeshkar…,FaizalFaazil,mumbai india,"Independent thinker, social activist, IT buff, travel freak and last but not the least a proud Odia. but loves to speak Mumbaiya and Bihari language sometimes.",60,813,2385,False,Beat the Virus with a NAMASKAR. -Sg @WHO @narendramodi @Oprah @SrBachchan @sachin_rt @priyankachopra @DalaiLama @mangeshkarlata @rustyrockets @MirzaSania @msdhoni @rajinikanth @shekharkapur @drharshvardhan @yogrishiramdev @netanyahu @MoHFW_INDIA @doctorsoumya #Coronavirus https://t.co/wM8KiTAfXc
2020-05-28 23:01:47+00:00,"RT @ashishkjha: India is slowly coming out of a massive 2+ month lockdown.

Has it been worth it? And what should happen next?

In case you…",shezad1446,india,,75,73,3959,False,"India is slowly coming out of a massive 2+ month lockdown.

Has it been worth it? And what should happen next?

In case you missed it -- I had a chance to sit down with 
@RahulGandhi  to talk through these issues. https://t.co/ycN63pTujP"
2020-05-28 23:02:26+00:00,"Great piece by my dearest Ritika. So many of us are delusional about our likings, and I admit that I’m one of those. I never knew that I would enjoy cooking, and it will work like a stress buster in my daily routine. Very well said my girl 💕 https://t.co/ukQj8i60xS",nikita20sharma,mumbai india,Co-founder @Zapprep Brand Manager at @tatahousing | #Marketing #DigitalMarketing,176,51,736,False,
2020-05-28 23:02:27+00:00,Important To Get Clear About Source Of COVID-19 https://t.co/1YakjlvZ7v,in_dinx,goa india,always to help peoples,55,79,52780,False,
2020-05-28 23:02:40+00:00,"""Pandemics are part of us as humans.""

Archaeologist @Chirikure explains how ancient Africans used social distancing to manage pandemics https://t.co/PRx8SgQsxi",v_shakthi,bengaluru india,"Tech Analyst, Tech Blogger, Disability Rights Activist ♿,  Cloud and AI evangelist, Owner of @thequill_in. Email: shakthi@thequill.in",141247,107207,425526,True,
2020-05-28 23:02:51+00:00,"Face Masks at Home Reduce COVID-19 Risk, Study Says https://t.co/l8C0TMlffO",hscelebrities,hyderabad india,,101,172,62299,False,
2020-05-28 23:02:57+00:00,RT @iJayP_: Pls retweet and try to help this gal. She is my sister's friend. @BSYBJP @BJP4Karnataka @INCKarnataka @Karnataka_DIPR @DgpKarna…,rajkuma41454563,mannargudi india,Believe in myself,16,91,804,False,Pls retweet and try to help this gal. She is my sister's friend. @BSYBJP @BJP4Karnataka @INCKarnataka @Karnataka_DIPR @DgpKarnataka @nimmasuresh @HMOKarnataka https://t.co/fcAgyKoLtp
2020-05-28 23:03:10+00:00,"During lockdown many people leaving their bad habits like drinking &amp; smoking 🙏🏻
So be clam👏🏻 and believe in God ☝🏻",Debasis41451273,india,🔥BAS ABHI SOCHA NAHI🔥,0,5,5,False,
2020-05-28 23:03:21+00:00,RT @AsYouNotWish: Why are you on earth? When you can simply fly a carpet or get a horse to take you to the moon.,pranmond,kolkata india,"Proud Indian. You unfollow me after following, I unfollow you immediately.",31,132,3912,False,Why are you on earth? When you can simply fly a carpet or get a horse to take you to the moon. https://t.co/MiVBhqR4tX
2020-05-28 23:03:23+00:00,George Floyd was out of work during coronavirus before he was killed https://t.co/NMvwpVBALu,ReTargetingN,india,True News Targeting Again And Again For Truth,8,30,2070,False,
2020-05-28 23:03:41+00:00,"RT @BiharHealthDept: #BiharFightsCorona 
2nd update of the day. 
➡️95 more #COVIDー19 +ve cases in Bihar taking the total to 3185. The detai…",DeepakK27829394,new delhi india,"सीoएसoसीoमेरी पहचान

CSC SPV Vaishali Bidupur Kathauliya",72,381,1544,False,"#BiharFightsCorona 
2nd update of the day. 
➡️95 more #COVIDー19 +ve cases in Bihar taking the total to 3185. The details are as following. We are ascertaining their trail of infection.
#BiharHealthDept https://t.co/NWa5OMqR2k"
2020-05-28 23:03:50+00:00,"@BJP4Karnataka @RahulGandhi Such a pathetic tweet ......

How Can you connect this Covid-19 situation  to the Nehru,Rajiv n Indra gandhi....??

The migrant issue shows the system failure by the govt. ...
Lockdown was implemented without any  plan...
#MigrantsOnTheRoad
#SpeakUpIndia",AbNhi_TohKb,india,,98,437,8954,False,
2020-05-28 23:03:52+00:00,EU Took Big Step With Coronavirus-Recovery Proposal—Now Comes the Hard Part https://t.co/qN4hHh7Pax,AjayStfc,india,Let’s follow each other!😉,270,154,17434,False,
2020-05-28 23:03:53+00:00,"""Just 4 meat processing plants account for about 80% of production in the United States.""

@RenitaDYoung explains how lower productivity and higher costs due to the #coronavirus could raise chicken prices up to 30% https://t.co/oen1lEOh4z",v_shakthi,bengaluru india,"Tech Analyst, Tech Blogger, Disability Rights Activist ♿,  Cloud and AI evangelist, Owner of @thequill_in. Email: shakthi@thequill.in",141247,107207,425526,True,
2020-05-28 23:03:56+00:00,RT @Drkamalesh7: Andaman discharged it's last coronavirus patient from hospital 20 days back. https://t.co/z1rqFjN2be,chepuri_83,hyderabad india,"Software Bidding professional/PG in Electrical Engineering

Always India First",126,103,73769,False,Andaman discharged it's last coronavirus patient from hospital 20 days back. https://t.co/z1rqFjN2be
2020-05-28 23:04:04+00:00,"#Yemen was facing the world’s worst humanitarian crisis. Then the #coronavirus hit

What followed, happened because of internal turmoil and lack of unity: CIVIL WAR. 
Plus Foreign Player interference.

And it all BEGAN WITH THE #ARAB_SPRING  
 https://t.co/KqNuj9bYhE",CryoPerSea,mumbai india,"Hidden from the second sight, 
the third eye,
the fourth horseman, the fifth element, the sixth sense & the seventh son !

NOBODY IS PERFECT ! --- I AM NOBODY !",345,603,76123,False,
2020-05-28 23:04:10+00:00,"RT @NorbertElekes: NEW: New Zealand has discharged its last coronavirus patient from hospital.

Leading by example. https://t.co/83a9KLQ8lr",khn_ausaf,new delhi india,reminder to self:- Modi is a fascist and the rebirth of Hitler. The zionist and wahabi movement will never ever win and nor will the hindutva one.,45,227,7133,False,"NEW: New Zealand has discharged its last coronavirus patient from hospital.

Leading by example. https://t.co/83a9KLQ8lr"
2020-05-28 23:04:28+00:00,"New York's MTA bought ultraviolet light devices to help kill the coronavirus in subways, buses and commuter trains https://t.co/CyA3RH55fC",v_shakthi,bengaluru india,"Tech Analyst, Tech Blogger, Disability Rights Activist ♿,  Cloud and AI evangelist, Owner of @thequill_in. Email: shakthi@thequill.in",141247,107207,425533,True,
2020-05-28 23:04:34+00:00,"RT @gatewaypundit: Boston Police Commissioner William Gross Blasts Liberal Judges Releasing Violent Offenders Over Coronavirus Fears: ""Let…",MayTkt,sultanpur india,"तमसो मा ज्योतिर्गमय। सर्वे भवन्तु सुखिनः।
 as you sow so shall you reap. RT doesn't mean endorsement. may God bless all of us.",2483,3329,177683,False,"Boston Police Commissioner William Gross Blasts Liberal Judges Releasing Violent Offenders Over Coronavirus Fears: ""Let Them Stay at Your House With Your Family"" https://t.co/tTcU0NjI5Y via @gatewaypundit @KristinnFR"
2020-05-28 23:04:35+00:00,"RT @Muslima00968165: No can beats India on Racism, anti-Muslim and bigotry. It reacted to a pandemic by blaming Muslims, assaulting and dem…",_MurdaVipaksh,mumbai india,"‏‏⠀

بسم الله
                                   In the name of ALLAH, 
I depend on ALLAH, 
there is no power and might except from ALLAH.

ला इलाहा इल्लल्लाह….",2993,3016,55167,False,"No can beats India on Racism, anti-Muslim and bigotry. It reacted to a pandemic by blaming Muslims, assaulting and demonizing us, arresting n brutalising pregnant Muslim woman n boycotting Muslim businesses, arresting only Muslim activists n peaceful protesters
#SpeakUpIndia"
2020-05-28 23:04:54+00:00,"The U.N. World Food Program warns that at least 14 million people could go hungry in Latin America, as jobs and economies decline during the Covid-19 pandemic https://t.co/9CI6d91qRG",v_shakthi,bengaluru india,"Tech Analyst, Tech Blogger, Disability Rights Activist ♿,  Cloud and AI evangelist, Owner of @thequill_in. Email: shakthi@thequill.in",141247,107207,425533,True,
2020-05-28 23:05:08+00:00,"#Coronavirus patients are no longer infectious after 11 days of being sick — even though some may still test positive, a new study from Singapore found https://t.co/37LKWaBbE1",v_shakthi,bengaluru india,"Tech Analyst, Tech Blogger, Disability Rights Activist ♿,  Cloud and AI evangelist, Owner of @thequill_in. Email: shakthi@thequill.in",141247,107207,425533,True,
2020-05-28 23:05:08+00:00,AT&amp;T will credit some sports subscriptions during COVID-19 cancellations https://t.co/Pst232pCtx,NewsEverything_,india,News Everything provides 24/7 coverage of breaking news stories from hundreds of sources across a variety of platforms.,570,1126,27998,False,
2020-05-28 23:05:16+00:00,"Covid may never go away.... There are four endemic coronaviruses that are present, causing the common cold

Experts believe that COVID-19 will become the fifth..
 https://t.co/nwxijEJdwK",SKAmbulanceHyd,hyderabad india,Professional Emergency Medical Services | #AmbulanceServices | 🚑 #RoadAmbulance #AirAmbulance Call Us Now +91-7330-108-108 https://t.co/N1DEin8ow7,43,103,370,False,
2020-05-28 23:05:45+00:00,"@realDonaldTrump This guy passes an Executive Order, because one of his Tweets was removed. In the midst of a pandemic. Where 100,000 Americans have died. 

This has to be the most ridiculous, most petty thing I have EVER seen a President of the US do! 

Seriously, Americans, this guy?!This guy??",Menenners,noida india,"My philosophy, summarized by Robert Frost....Two roads diverged into the woods, and I, I took the one less traveled by, and that has made all the difference.",376,216,3271,False,
2020-05-28 23:05:45+00:00,UN chief warns leaders pandemic may cause historic famine  (via @NewsfusionApps #World #News) https://t.co/xF1yZwD4ZD,tn_haokip,imphal india,"Former President,Manipur Pradesh Congress Committee.Former Minister and Speaker, Manipur Legislative https://t.co/ZHdTXLqMAf reading & traveling",1430,68,27074,True,
2020-05-28 23:05:51+00:00,RT @SharmilaLaunda: Looks like the dog hairdresser has reopened illegally in lockdown!! 🤔😂 https://t.co/2BhZYcmjxZ,SSR_favourite,india,"*My personality is not for everyone 🤷🏼‍♀️...
#highOnlife✌️",1842,373,21803,False,Looks like the dog hairdresser has reopened illegally in lockdown!! 🤔😂 https://t.co/2BhZYcmjxZ
2020-05-28 23:06:13+00:00,"RT @MaskoorUsmani: Former Cabinet Member, AMUSU @FarhanZuberi1 has been arrested by the police for participating in Anti CAA movement &amp; has…",ghouse544,hyderabad india,"#PoliticalActivist Campaigns for Social Change 
#ProudToBeAnIndian",31,35,9705,False,"Former Cabinet Member, AMUSU @FarhanZuberi1 has been arrested by the police for participating in Anti CAA movement &amp; has been continuously providing ration to the poor during lock-down.This is definitely being done to intimidate the particular community and suppress their voice"
2020-05-28 23:06:17+00:00,"RT @CMOMaharashtra: COVID care centres and dedicated COVID hospitals are being created at the Racecourse, Dahisar, Goregaon, Mulund with ov…",RR4900,india,RT is not endorsement,1943,431,143279,False,"COVID care centres and dedicated COVID hospitals are being created at the Racecourse, Dahisar, Goregaon, Mulund with over 7,000 beds in two weeks. 

By May 31, a total of 2,475 beds at NSCI Worli, Mahalaxmi, Bandra, NESCO, Goregaon, will be made available. https://t.co/vbP8EsJQHt"
2020-05-28 23:06:22+00:00,"See what is this very important news about Aviation industry
https://t.co/Gz8viX3unZ
Pls check
#img20plus #IRCTC #PapaPennyAhee #ArnabGoswami #ACAB #SidNaaz #Delhi #Dolar #GeorgeFloydWasMurdered #GeorgeLloyd #GirlTalkZA #HBOMax #HospitalPlaylistS1Finale #HistoryMakerV https://t.co/6Khaf1y6mQ",OmkarDesh_,pune india,"omkar Deshmukh
member of Yuvasena pcmc
looking in matter of rescue flights
dm for help
with co-ordination of Aditya thakrey",25,820,768,False,
2020-05-28 23:06:23+00:00,"RT @fayedsouza: Migrants die during train ride

'Every Country has had Covid-19 but none of them have faced the kind of humanitarian crisis…",ghouse544,hyderabad india,"#PoliticalActivist Campaigns for Social Change 
#ProudToBeAnIndian",31,35,9705,False,"Migrants die during train ride

'Every Country has had Covid-19 but none of them have faced the kind of humanitarian crisis that we are facing.
Now is the time to speak up and demand better accountability from our Government.' https://t.co/MFElks8nXn"
2020-05-28 23:06:33+00:00,"How Americans can help prevent another 100,000 coronavirus deaths https://t.co/qtWIaoQHY9",GettingSuperb,india,,73,231,8807,False,
2020-05-28 23:06:39+00:00,RT @timesofindia: India now No. 9 among Covid-hit countries as cases cross 1.6 lakh https://t.co/7ibUby5bQ3 https://t.co/Ethd47yS8e,YasaswiKodali,india,"Mech. Engg., Working Professional, once a cricket fanatic, wants to get away from synthetic lifestyle.",255,3947,162492,False,India now No. 9 among Covid-hit countries as cases cross 1.6 lakh https://t.co/7ibUby5bQ3 https://t.co/Ethd47yS8e
2020-05-28 23:06:41+00:00,"#IndiaFightsCorona
No directives issued by the Govt are to be diluted until the end of the lockdown. Wearing face cover is compulsory in all public places. Spitting in public places is punishable with a fine.
via NaMo App",AjayKum87437777,arwal india,भारतीय जनता पार्टी जिला अध्यक्ष अरवल बिहार,187,976,786,False,
2020-05-28 23:06:44+00:00,"RT @specsysou: ""Hum hain aapke Ronakshi aur ham bahut jald hi aa rahe hai apse milne!!!""

Wish we cud hear it on our screens soon!! 🤞✌️

#K…",VijayaPriyadar1,india,You are the inspiration ❤️💕 @priyankachopra one day hoping to meet you,131,78,13704,False,"""Hum hain aapke Ronakshi aur ham bahut jald hi aa rahe hai apse milne!!!""

Wish we cud hear it on our screens soon!! 🤞✌️

#KahaanHumKahaanTum 

@StarPlus @DisneyPlusHS After the Corona chaos you are giving us Season 2!! Right?"
2020-05-28 23:06:44+00:00,RT @rkhuria2: BJP Govt in Gujarat is following a strange policy of not testing even symptomatic patients. While it helps Govt show lower nu…,rukhsarsaleem,india,"Founder https://t.co/kodaqU61qW l Storyteller l NLP-MSP Practitioner.
Trying to earn my own bread.
RTs are not endorsements.",965,344,7584,False,"BJP Govt in Gujarat is following a strange policy of not testing even symptomatic patients. While it helps Govt show lower numbers and show success in combating Covid, it deprives people of treatment. An explosive situation. https://t.co/CpxdWidRix"
2020-05-28 23:06:45+00:00,"#IndiaFightsCorona
MNREGA work will also be allowed by following social distancing and use of protective gear. Priority to be given to irrigation and water conservation works under MNREGA.
via NaMo App",AjayKum87437777,arwal india,भारतीय जनता पार्टी जिला अध्यक्ष अरवल बिहार,187,976,786,False,
2020-05-28 23:06:54+00:00,"RT @Equateall: Delhi 1024 CoronaVirus cases in 24 hours! 🤦🏽‍♂️

For a city state that's advertising heavily on TV everyday, this spike tell…",meenavyas50,india,Ardent devotee of kanchi Paramacharya. Hare Krishna,2025,728,164972,False,"Delhi 1024 CoronaVirus cases in 24 hours! 🤦🏽‍♂️

For a city state that's advertising heavily on TV everyday, this spike tells that aam aadmi doesn't watch TV channels Kejriwal loves to spend money on."
2020-05-28 23:24:44+00:00,"U cannot change UR future,
but U can change UR habits 
&amp; surely UR habits will change your future. 
-- APJ Kalam Sir 

Covid19, can't stop us 4 dreaming so lets take precaution from it &amp; start follow UR dreams &amp; passion.

Gratitu…https://t.co/zMfjxBFMiN https://t.co/PzZTZcOLfR",StillSouls247,mumbai india,"World's 1st Mindfulness Startup with AI Technology, specially design for pre-school students, primary students, secondary students & university students.",4,92,5,False,
2020-05-28 23:24:50+00:00,"RT @HillaryClinton: Over the last 24 hours, the 100,000th American died of COVID-19 on Trump’s watch.

He’s spent the last 24 hours sharing…",farha_haneef,india,,14,95,283,False,"Over the last 24 hours, the 100,000th American died of COVID-19 on Trump’s watch.

He’s spent the last 24 hours sharing videos that begin ""The only good Democrat is a dead Democrat"" while complaining Twitter’s censoring him.

We need a real president. https://t.co/bqnPUACScf"
2020-05-28 23:24:56+00:00,RT @ndtv: #CoronavirusPandemic may push 86 million children into household poverty by 2020-end: report https://t.co/pojtwhYHfL https://t.co…,AmarKumarSafi1,gujarat india,I’ve learned I don’t know anything.  Have also learned that people will pay for what I know.  Life is good.#Engineer #Photographer #Quotes_Lover.,16,167,3375,False,#CoronavirusPandemic may push 86 million children into household poverty by 2020-end: report https://t.co/pojtwhYHfL https://t.co/BARQw4RfQV
2020-05-28 23:25:02+00:00,"RT @RealNews3362: “If you look at all these people who are wearing bandanas, they’re just hanging down. That’s not good because aerosols wi…",RealNews3362,bh rat hindustan india,"News without bias and politics. ""When we are no longer able to control the situation we are forced to change ourselves."" Follow us for breaking news and updates",92,655,11847,False,"“If you look at all these people who are wearing bandanas, they’re just hanging down. That’s not good because aerosols will just flow right around,” she says. “Aerosols are really light. If you can feel a breeze, they will be in that breeze.” https://t.co/yE0o9LHPVe"
2020-05-28 23:25:08+00:00,"RT @TheQuint: As arrests against activists in the #lockdown continue, AMU student Farhan Zuberi was arrested and sent to jail today for inv…",MuqthiyarPasha5,bengaluru south india,,2,21,246,False,"As arrests against activists in the #lockdown continue, AMU student Farhan Zuberi was arrested and sent to jail today for involvement in anti-#CAA protests, reports @AlizaNoor1501.
https://t.co/FL78zcxIyt"
2020-05-28 23:25:12+00:00,"@IEA The concept of just-in-time or JIT has received a big knock post-outbreak era, with global supply chains getting broken severely. Efficiency in inventory management was taken to a new level before COVID-19. Firms that enjoyed negative working capital may have to rework.",vrk100,hyderabad india,CFA Charterholder. Vested interest. Biased. Sceptic but opinionated. RTs and Likes aren't endorsements. https://t.co/abT1jGolVh,2014,123,30809,False,
2020-05-28 23:25:33+00:00,RT @gabydvj: the city is deploying dozens (maybe hundreds?) of cops to arrest protesters in the middle of a fucking pandemic. the nypd is s…,startertart,india,,437,369,39866,False,"the city is deploying dozens (maybe hundreds?) of cops to arrest protesters in the middle of a fucking pandemic. the nypd is sending people to jail, where distancing is impossible, for protesting state-sanctioned murder https://t.co/mB0t2ACjuy"
2020-05-28 23:25:35+00:00,"@TimesNow Surely in covid case... Will top.., 🤣",ArvindRai070,gurgaon india,,57,45,394,False,
2020-05-28 23:25:37+00:00,"RT @AudreyTruschke: In pandemic times, it can seem like the world is on hold. But, I assure you, Hindutva hate is not on hold. Actually, it…",virdikuldeep,ludhiana punjab india,Oppose Modi/RSS & Others who use Cast/Religion for Political gain and spread Communal poison in Society. Followed by @INCIndia .,715,984,106447,False,"In pandemic times, it can seem like the world is on hold. But, I assure you, Hindutva hate is not on hold. Actually, it is accelerating.

In my corner, this piece of filth came in this morning, from anujayant070@gmail.com

#hatemail #Hindutva #RSS #misogyny #hate https://t.co/lx8CINuQTt"
2020-05-28 23:25:48+00:00,"RT @RamdevC61493925: Stay in home🏠, Do Yoga🙆‍♀️, Eat healthy🥗 and invest your time ⌚ in yourself 😊... 
#YogaAtHome_with_SwamiRamdevJi_on_In…",manojsgnrraj,ganganagar india,"मनोज चनाणी अग्रवाल,
सोशल मीडिया प्रभारी,
पतंजलि योग समिति,भारत स्वाभिमान ट्रस्ट 
जिला श्री गंगानगर राजस्थान
ॐ सर्वे भवन्तु सुखिनः।
सर्वे सन्तु निरामयाः।",1072,2063,5299,False,"Stay in home🏠, Do Yoga🙆‍♀️, Eat healthy🥗 and invest your time ⌚ in yourself 😊... 
#YogaAtHome_with_SwamiRamdevJi_on_IndiaTV https://t.co/dTag2Y0HcW"
2020-05-28 23:25:59+00:00,"RT @BDUTT: ""We're Highly Educated""-a citizen's simple summary of the Kerala Model. ""Kerala is the Best, says another. There's obviously mor…",arfatahmad,bombay india,Your fellow human being | We are all in this together,284,1770,16559,False,"""We're Highly Educated""-a citizen's simple summary of the Kerala Model. ""Kerala is the Best, says another. There's obviously more to it, but after months being on the road am sure of a North South Divide in the COVID response. Kerala is the happiest state Ive been to in 72 days. https://t.co/AwHBeqfO6q"
2020-05-28 23:26:02+00:00,"RT @Mhatre_Sheetal: I live in @mybmcWardRN , thou our ward is amongst d least cases, V’ve d 2nd largest slum pocket after Dharavi, @mybmcHe…",SanjayV_INC,mumbai maharastra india,🇮🇳 बेरोजगार आम नागरिक🤚 @RahulGandhi का समर्थक #RahulGandhi #MyLeaderRG 🙏,13486,634,294706,False,"I live in @mybmcWardRN , thou our ward is amongst d least cases, V’ve d 2nd largest slum pocket after Dharavi, @mybmcHealthDept doctor has been vigilant enough 2 keep fever camps along wid oxymeter, door 2 door surveys 2 ensure dat d situation doesn’t escalate like Dharavi! https://t.co/A5uMRhPMWv"
2020-05-28 23:26:07+00:00,RT @BBCWorld: Coronavirus: How Turkey took control of Covid-19 emergency https://t.co/vuYeSy10jl,bkattaluri1,ongole india,Balu,77,1702,31386,False,Coronavirus: How Turkey took control of Covid-19 emergency https://t.co/vuYeSy10jl
2020-05-28 23:26:34+00:00,"Astrologer hospitalized: Family says pneumonia, AMC says Covid https://t.co/nZ8aSVc7sa",TOIAhmedabad,ahmadabad city india,Your city. Your neighborhood. Your block. Covered for you by https://t.co/VSKi1mCAsZ,133840,9,82046,True,
