created_at,full_text,screen_name,location,description,followers_count,friends_count,statuses_count,verified,full_retweet_text
2020-01-24 22:58:21+00:00,"LOOK: China has started construction on a special hospital in Wuhan to be used to treat coronavirus-infected patients.

The hospital is designed to have 1,000 beds and they say it will be open by Feb. 3. https://t.co/IJ5avouGN7",v_shakthi,bengaluru india,"Tech Analyst, Tech Blogger, Disability Rights Activist ♿,  Cloud and AI evangelist, Owner of @thequill_in. Email: shakthi@thequill.in",143357,108350,396532,True,
2020-01-24 22:54:45+00:00,"RT @desimojito: China To Build 1,000 Bed Hospital In Just 10 Days To Treat Coronavirus Patients In Wuhan

It’s possible because China has n…",rishav_suvarna,mangalore india,"Never forget, Never forgive


proud indian

proud hindhu

indian army lover

MODHI🙏🏻 fan

#modioncemore

#MSDian",264,860,23493,False,"China To Build 1,000 Bed Hospital In Just 10 Days To Treat Coronavirus Patients In Wuhan

It’s possible because China has no Aarey activists, environmentalists or JNU

https://t.co/1qwjXJAC9N"
2020-01-24 22:52:05+00:00,"RT @StockBoardAsset: 24 Jan - 07:47:06 AM  - NEPAL HEALTH MINISTRY SAYS A STUDENT WHO HAD RETURNED FROM WUHAN, CHINA HAS BEEN FOUND INFECTE…",commonraj,assam india,"Kokrajhar District Congress Committee
(General Secretary)
🐦",448,725,42597,False,"24 Jan - 07:47:06 AM  - NEPAL HEALTH MINISTRY SAYS A STUDENT WHO HAD RETURNED FROM WUHAN, CHINA HAS BEEN FOUND INFECTED WITH CORONAVIRUS - ANI - [RTRS]"
2020-01-24 22:50:30+00:00,RT @detresfa_: Video via social media alleges the work on site has begin even with rainy conditions the workers will work round the clock t…,shammibhagat,new delhi india,"Punjabi, Dreamer, Thinker, Crypto Enthusiast🙄 , पतंगबाज़💖, Proud Indian🇮🇳................
blood group AB+",68,34,2892,False,"Video via social media alleges the work on site has begin even with rainy conditions the workers will work round the clock to deliver the project 

Contractor : Wuhan Shengshi Hongyu Construction Company https://t.co/6byhTe96AD"
2020-01-24 22:50:58+00:00,RT @CGTNOfficial: Construction began on the night of January 23 for a new specialized hospital for #coronavirus patients in central China's…,DevilQuencher,india,😎 Life is Fragile so be Agile and Acrobatic🤸⛹️🏋️यथा राजा तथा प्रजा యధా రాజా తథా ప్రజా. Be Brave and have Courage,42,152,1222,False,"Construction began on the night of January 23 for a new specialized hospital for #coronavirus patients in central China's #Wuhan City. 

The hospital is designed to have an area of 25,000 square meters with 1,000 beds and will be put into use by February 3 https://t.co/ePQoxJnM0y"
2020-01-24 22:46:12+00:00,RT @CGTNOfficial: Construction began on the night of January 23 for a new specialized hospital for #coronavirus patients in central China's…,shammibhagat,new delhi india,"Punjabi, Dreamer, Thinker, Crypto Enthusiast🙄 , पतंगबाज़💖, Proud Indian🇮🇳................
blood group AB+",68,34,2892,False,"Construction began on the night of January 23 for a new specialized hospital for #coronavirus patients in central China's #Wuhan City. 

The hospital is designed to have an area of 25,000 square meters with 1,000 beds and will be put into use by February 3 https://t.co/ePQoxJnM0y"
2020-01-24 22:43:16+00:00,"France confirmed the country's first 2 cases of the #WuhanCoronovirus, the first in Europe.

New for @businessinsider: https://t.co/ImYmpxf49y",v_shakthi,bengaluru india,"Tech Analyst, Tech Blogger, Disability Rights Activist ♿,  Cloud and AI evangelist, Owner of @thequill_in. Email: shakthi@thequill.in",143357,108350,396532,True,
2020-01-24 22:43:19+00:00,"RT @desimojito: China To Build 1,000 Bed Hospital In Just 10 Days To Treat Coronavirus Patients In Wuhan

It’s possible because China has n…",MindfulAdoption,india usa,"Tweets on Mindful adoptions, bringing different perspective & #NewIndia | RT for public awareness and are NOT My Endorsements | Movie & Food Lover.",141,805,16127,False,"China To Build 1,000 Bed Hospital In Just 10 Days To Treat Coronavirus Patients In Wuhan

It’s possible because China has no Aarey activists, environmentalists or JNU

https://t.co/1qwjXJAC9N"
2020-01-24 22:41:12+00:00,"RT @QuickTake: LOOK: China has started construction on a special hospital in Wuhan to be used to treat coronavirus-infected patients.

The…",rameshprajuli,nepal india nepal canada,"ऋगवेदका ऋचा र रुद्रीका कन्निका पाठ गर्न सक्ने वाहुन । संगै #SharePoint, #EDMS, #InformationGovernance #O365 #ServiceNow मा दख्खल र रुचि राख्ने 🙃",761,726,5135,False,"LOOK: China has started construction on a special hospital in Wuhan to be used to treat coronavirus-infected patients.

The hospital is designed to have 1,000 beds and they say it will be open by Feb. 3. https://t.co/mBgIJyzpgd"
2020-01-24 22:39:41+00:00,"RT @AJEnglish: “Nobody’s come to manage this.” 

This video allegedly shows dead bodies lying in hospital aisles in Wuhan Red Cross Hospita…",AplusCFC,kolkata india,"@ChelseaFC fan. 
Free from all qualms. #CFC",84,150,15475,False,"“Nobody’s come to manage this.” 

This video allegedly shows dead bodies lying in hospital aisles in Wuhan Red Cross Hospital, the city where the #coronavirus originated. 

The virus has killed 26 people and infected at least 830 https://t.co/ThQQSVQHKX https://t.co/qgs0E1GdgU"
2020-01-24 22:37:44+00:00,"With Wuhan virus genetic code in hand, scientists begin work on a vaccine https://t.co/rU39dOueJi",moomblr,mumbai india,"Information at your fingertips from top social media news on topics to share on Facebook, YouTube, Google, Twitter and More.",1144,1921,241669,False,
2020-01-24 22:30:00+00:00,"#InPics | Authorities in China's #Wuhan city have imposed transport lockdown on all in and out public transport including flights from Wuhan as cases of the new #coronavirus disease rose to 571

https://t.co/PZmRYOTvT4",WIONews,india,#WION: World Is One | Welcome to India’s first global news network. We present global stories with an Indian perspective. | https://t.co/V3tpBavoXE,125924,95,108503,True,
2020-01-24 22:28:34+00:00,"RT @CGTNOfficial: #MostWatched 

Construction began on the night of January 23 for a new specialized hospital for #coronavirus patients in…",rameshwarbhand3,bengaluru india,Aeronautical engineer ✈️,33,836,1020,False,"#MostWatched 

Construction began on the night of January 23 for a new specialized hospital for #coronavirus patients in central China's #Wuhan City. 

The hospital is designed to have an area of 25,000 square meters with 1,000 beds and will be put into use by February 3 https://t.co/Iz7JUcDioj"
2020-01-24 22:27:10+00:00,"RT @desimojito: China To Build 1,000 Bed Hospital In Just 10 Days To Treat Coronavirus Patients In Wuhan

It’s possible because China has n…",DoghliDuniya,india,Sarcastic. Intolerant! Bharat Mata Ki Jai!,169,528,33879,False,"China To Build 1,000 Bed Hospital In Just 10 Days To Treat Coronavirus Patients In Wuhan

It’s possible because China has no Aarey activists, environmentalists or JNU

https://t.co/1qwjXJAC9N"
2020-01-24 22:26:10+00:00,Chicago Woman Is Second Patient in U.S. With Wuhan Coronavirus https://t.co/DHQ2BAbfzN,AjayStfc,india,Let’s follow each other!😉,282,156,9118,False,
2020-01-24 22:21:22+00:00,"RT @PravitR: There’s​ a derogatory saying that Chinese eats everything with four legs except table. After the Wuhan virus spread, South Chi…",g_e_,chennai india,,60,813,7906,False,"There’s​ a derogatory saying that Chinese eats everything with four legs except table. After the Wuhan virus spread, South China Morning Post came up with a list of meat you can buy at a local wholesale market there. Pretty disturbing. #China #Wuhan #ไวรัสโคโรนา #ไวรัสอู่ฮั่น https://t.co/fPw1pV4wnl"
2020-01-24 22:19:24+00:00,RT @RetoGregori: We have a map. Here’s where cases of coronavirus have been identified. https://t.co/BNk3fvHnC1 via @bbgvisualdata,SaurabhJoshi,new delhi india,"Editor, @StratPost & @DelhiDurbar. Sciency. Lapsed lawyer. Fascinated by flight. Lucky. Not normally a nice guy. Tweets are mine. Retweets are somebody else's.",6289,2237,64486,True,We have a map. Here’s where cases of coronavirus have been identified. https://t.co/BNk3fvHnC1 via @bbgvisualdata
2020-01-24 22:17:59+00:00,"RT @RT_com: A woman eats a whole bat in disturbing footage which has recently surfaced on the internet, as scientists link the deadly #coro…",AVIRAL96,india,"#LikeCooking,dancing.Bilingual but aim to be a Multilingual. Studying MA(IR) at @SAU! RT r nt endorsement!
RT r nt
My motto is ""Connais Toi pour T'am elioner""",29,1529,10689,False,"A woman eats a whole bat in disturbing footage which has recently surfaced on the internet, as scientists link the deadly #coronavirus to the flying mammals.

Bat soup is a popular dish in #Wuhan, #China, where the virus originated. https://t.co/HzEMcqNr9e"
2020-01-24 22:14:54+00:00,"RT @Chellaney: ""In 2004, a SARS virus 'leaked' from a lab in Beijing. And when China set up a lab in Wuhan in 2017 to study some of the mos…",g_e_,chennai india,,60,813,7906,False,"""In 2004, a SARS virus 'leaked' from a lab in Beijing. And when China set up a lab in Wuhan in 2017 to study some of the most dangerous pathogens, U.S. scientists warned of a similar leak from Wuhan."" https://t.co/Jap6MtIkKp via @IndoPac_Info"
2020-01-24 22:13:50+00:00,"RT @badiucao: Another video showing medics from #wuhan completely burn out &amp; melt down.
really sad and angry to see this happening
they nee…",commonraj,assam india,"Kokrajhar District Congress Committee
(General Secretary)
🐦",448,725,42597,False,"Another video showing medics from #wuhan completely burn out &amp; melt down.
really sad and angry to see this happening
they need much more support than now.
where the fuck is the government support after  #wuhanquarantine ?!
#coronoavirus 
#WuhanPneumonia 
 https://t.co/N69mDGlQd4"
2020-01-24 22:13:10+00:00,RT @BTCVector: Googled bout the #Wuhan #Coronavirus just to find out the world had a new plague starting around the same date for the last…,g_e_,chennai india,,60,813,7906,False,Googled bout the #Wuhan #Coronavirus just to find out the world had a new plague starting around the same date for the last few centuries. https://t.co/fTCUe4nIPp
2020-01-24 22:09:33+00:00,"RT @WIREDScience: A team of Chinese researchers claimed snakes were the origin of a novel coronavirus. Soon, stories about China’s “snake f…",varunvd,vadodara india,"|Mindless Retweeter|
Interested in meaningful social interactions and living active and fulfilling life...",1276,4999,76986,False,"A team of Chinese researchers claimed snakes were the origin of a novel coronavirus. Soon, stories about China’s “snake flu” began spreading through social media. There’s just one problem: Other researchers think it’s probably not true. https://t.co/J4cOdnzaTk"
2020-01-24 22:07:47+00:00,Track everone who travelled from Wuhan to United states and diagnose them...This is a very serious issue and take necessary steps to prevent that from spreading https://t.co/A2iPkkDqxS,Nav1911,vishakhapatnam india,,197,615,28371,False,
2020-01-24 22:07:58+00:00,"RT @desimojito: China To Build 1,000 Bed Hospital In Just 10 Days To Treat Coronavirus Patients In Wuhan

It’s possible because China has n…",ajaysaradigi,bengaluru india,Travel enthusiast,132,985,6231,False,"China To Build 1,000 Bed Hospital In Just 10 Days To Treat Coronavirus Patients In Wuhan

It’s possible because China has no Aarey activists, environmentalists or JNU

https://t.co/1qwjXJAC9N"
2020-01-24 22:05:56+00:00,"RT @MarParNews: Chicago has the 2nd confirmed case of Coronavirus in the US 

The patient is a woman in her 60s

She had traveled to Wuhan…",Nav1911,vishakhapatnam india,,197,615,28371,False,"Chicago has the 2nd confirmed case of Coronavirus in the US 

The patient is a woman in her 60s

She had traveled to Wuhan in late December, flew back to Chicago January 13

@cbschicago https://t.co/znSl5Cgiym"
2020-01-24 22:02:34+00:00,"RT @Chellaney: ""In 2004, a SARS virus 'leaked' from a lab in Beijing. And when China set up a lab in Wuhan in 2017 to study some of the mos…",GiridharMamidi,india,Bhaarateeya 1st and last. Son of Akhanda Bhaarat.,525,554,13347,False,"""In 2004, a SARS virus 'leaked' from a lab in Beijing. And when China set up a lab in Wuhan in 2017 to study some of the most dangerous pathogens, U.S. scientists warned of a similar leak from Wuhan."" https://t.co/Jap6MtIkKp via @IndoPac_Info"
2020-01-24 22:11:12+00:00,"RT @TheresaAFallon: ""The Centers for Disease Control and Prevention announced Friday the first confirmed case of the coronavirus in Chicago…",SaurabhJoshi,new delhi india,"Editor, @StratPost & @DelhiDurbar. Sciency. Lapsed lawyer. Fascinated by flight. Lucky. Not normally a nice guy. Tweets are mine. Retweets are somebody else's.",6289,2237,64486,True,"""The Centers for Disease Control and Prevention announced Friday the first confirmed case of the coronavirus in Chicago.""https://t.co/yCRpVam1AC"
2020-01-24 22:57:54+00:00,"RT @TheQuint: Health ministry said that of these 11 people, two persons who were kept under observation at a Mumbai hospital and one person…",abhinitk,mumbai india,"Independent Arts Manager, Writer & Curator. Art Think South Asia Fellow 2019-2020, YCI Fellow at @SalzburgGlobal",1080,4155,21726,False,"Health ministry said that of these 11 people, two persons who were kept under observation at a Mumbai hospital and one person each under watch in Hyderabad and Bengaluru have tested negative for coronavirus.
https://t.co/Mmo73D9l3o"
2020-01-24 22:57:18+00:00,#Coronavirus explained: Here's what you should know https://t.co/O8t42766Av,v_shakthi,bengaluru india,"Tech Analyst, Tech Blogger, Disability Rights Activist ♿,  Cloud and AI evangelist, Owner of @thequill_in. Email: shakthi@thequill.in",143357,108350,396532,True,
2020-01-24 22:56:31+00:00,"The streets of Beijing, normally packed with Lunar New Year celebrations this time of year, are almost empty because of the #coronavirus outbreak.

@Selinawangtv checked out precautions taken in the city https://t.co/Hp8GODJ72K",v_shakthi,bengaluru india,"Tech Analyst, Tech Blogger, Disability Rights Activist ♿,  Cloud and AI evangelist, Owner of @thequill_in. Email: shakthi@thequill.in",143357,108350,396532,True,
2020-01-24 22:56:16+00:00,"Wearing a face mask does help if you do it properly.

Seto Wing Hong of Hong Kong University demonstrates the correct way to wear a face mask #coronavirus https://t.co/I8rbKnSp6W",v_shakthi,bengaluru india,"Tech Analyst, Tech Blogger, Disability Rights Activist ♿,  Cloud and AI evangelist, Owner of @thequill_in. Email: shakthi@thequill.in",143357,108350,396532,True,
2020-01-24 22:55:55+00:00,"Face masks are running out across Asia because of coronavirus fears.

The virus has killed at least 25 and sickened hundreds https://t.co/BnP96RwJoP",v_shakthi,bengaluru india,"Tech Analyst, Tech Blogger, Disability Rights Activist ♿,  Cloud and AI evangelist, Owner of @thequill_in. Email: shakthi@thequill.in",143357,108350,396532,True,
2020-01-24 22:55:59+00:00,TOTAL 11 PEOPLE ARE BEING OBSERVED IN INDIA FOR DEADLY CORONAVIRUS. 7 IN KERALA 3 IN MUMBAI AND ONE IN HYDERABAD. Coronavirus: More Than 80 Being Medically Observed In India https://t.co/OQ2ISa2QFY,DilipMirchanda3,pune india,,7,43,785,False,
2020-01-24 22:54:58+00:00,"RT @CancerTruthNews: 2 cased of #coronavirus reported in US. Meanwhile, over 100,000 (reported cases only) killed by properly prescribed pr…",TruthSpeaksTuff,us ap ts ka india,"FOLLOW DHARMAॐ, PERIOD. Hindu, NRIndian, తెలుగు(Telugu), MEngineer,IT,QA,Dad. #Autism #Vaccines #Health #Yoga #Sanskrit #ChineseVirus #WuhanVirus
RT≠endorsement",2149,560,324652,False,"2 cased of #coronavirus reported in US. Meanwhile, over 100,000 (reported cases only) killed by properly prescribed prescription drugs each year as reported by FDA. 

Tell me again what the real danger is? Hmm...

Begs the question: What's the real agenda here? What do you think?"
2020-01-24 22:55:05+00:00,RT @spectatorindex: BREAKING: Number of confirmed coronavirus cases surpasses 1000,TheangaMattae,india,Varumkaalam Vandumurugan. Grass fed. Virginity Assured.,117,2184,6551,False,BREAKING: Number of confirmed coronavirus cases surpasses 1000
2020-01-24 22:54:48+00:00,RT @spectatorindex: BREAKING: Number of confirmed coronavirus cases surpasses 1000,commonraj,assam india,"Kokrajhar District Congress Committee
(General Secretary)
🐦",448,725,42597,False,BREAKING: Number of confirmed coronavirus cases surpasses 1000
2020-01-24 22:54:16+00:00,"RT @AuroraIntel: #CoronaVirus officially surpasses 1,000 confirmed cases around the world.",iam_vishalsingh,india,💯% pure nuance. I am the one who bakes at the weekend.,2192,984,19054,False,"#CoronaVirus officially surpasses 1,000 confirmed cases around the world."
2020-01-24 22:54:03+00:00,JUST IN: The World Health Organization says the new strain of coronavirus at the root of a viral illness that’s sickened hundreds is not yet a global health emergency https://t.co/vQvHf2af4d,v_shakthi,bengaluru india,"Tech Analyst, Tech Blogger, Disability Rights Activist ♿,  Cloud and AI evangelist, Owner of @thequill_in. Email: shakthi@thequill.in",143357,108350,396532,True,
2020-01-24 22:52:04+00:00,"NEW: France just announced a third confirmed case of the deadly coronavirus, Europe's first instances of the outbreak https://t.co/yOMnCe6pZR",v_shakthi,bengaluru india,"Tech Analyst, Tech Blogger, Disability Rights Activist ♿,  Cloud and AI evangelist, Owner of @thequill_in. Email: shakthi@thequill.in",143357,108350,396532,True,
2020-01-24 22:52:08+00:00,What the Coronavirus Means So Far for the Travel Industry https://t.co/443qgxbovd https://t.co/4M27zJVt4J,EShinoy,bengaluru india,Business Development Manager,2,9,1536,False,
2020-01-24 22:51:47+00:00,Here are 5 things we learned Friday about the coronavirus outbreak that's killed dozens in China and stranded more than 36 million amid Lunar New Year celebrations https://t.co/h8gRc78FAu,v_shakthi,bengaluru india,"Tech Analyst, Tech Blogger, Disability Rights Activist ♿,  Cloud and AI evangelist, Owner of @thequill_in. Email: shakthi@thequill.in",143357,108350,396532,True,
2020-01-24 22:50:45+00:00,"China has quarantined 14 cities as the mysterious coronavirus continues its rapid spread. Hundreds of people have been infected and more than 20 have died

https://t.co/smb4Ddjh2d",v_shakthi,bengaluru india,"Tech Analyst, Tech Blogger, Disability Rights Activist ♿,  Cloud and AI evangelist, Owner of @thequill_in. Email: shakthi@thequill.in",143357,108350,396532,True,
2020-01-24 22:41:26+00:00,RT @russian_market: FRENCH HEALTH MINISTER CONFIRMS TWO CORONAVIRUS CASES,commonraj,assam india,"Kokrajhar District Congress Committee
(General Secretary)
🐦",448,725,42597,False,FRENCH HEALTH MINISTER CONFIRMS TWO CORONAVIRUS CASES
2020-01-24 22:41:31+00:00,RT @DeItaOne: FRENCH HEALTH MINISTER SAYS THE FRENCH CASES OF CORONAVIRUS ARE THE FIRST IN EUROPE,commonraj,assam india,"Kokrajhar District Congress Committee
(General Secretary)
🐦",448,725,42597,False,FRENCH HEALTH MINISTER SAYS THE FRENCH CASES OF CORONAVIRUS ARE THE FIRST IN EUROPE
2020-01-24 22:40:24+00:00,RT @EndGameWW3: Leading US health experts predict coronavirus could kill 65million https://t.co/bFKfAL2NNl via @MailOnline,purohitAsh99,ujjain india,ब्राह्मण,124,261,1445,False,Leading US health experts predict coronavirus could kill 65million https://t.co/bFKfAL2NNl via @MailOnline
2020-01-24 22:40:06+00:00,Six graphics to explain coronavirus https://t.co/C9VPlIu1fX https://t.co/K2y3MqY4SL,BigMirrorNews,chennai india,Stay Updated with https://t.co/HgrKi3hPmX. To be a part of The Big Mirror DM us and get exciting pay.,254,424,8005,False,
2020-01-24 22:38:02+00:00,Trump: U.S. appreciates China’s ‘efforts and transparency’ on coronavirus https://t.co/gkB41UBVjq,moomblr,mumbai india,"Information at your fingertips from top social media news on topics to share on Facebook, YouTube, Google, Twitter and More.",1144,1921,241669,False,
2020-01-24 22:37:19+00:00,RT @realDonaldTrump: China has been working very hard to contain the Coronavirus. The United States greatly appreciates their efforts and t…,KidwaiSalim,india,"Tweets Personal RT's not Endorsements. Asli Desh Bhakt Bharat ka, kissi Yuvak ya Party ka NAHi.",324,1098,64962,False,"China has been working very hard to contain the Coronavirus. The United States greatly appreciates their efforts and transparency. It will all work out well. In particular, on behalf of the American People, I want to thank President Xi!"
2020-01-24 22:35:17+00:00,New post (Coronavirus study finds 'otherwise healthy' patients can contract virus) has been published on ApzWeb - https://t.co/hfLDh85IEf,Vsplusonline,india,Web Hosting India | Web Hosting Space Unlimited | Free Domain Registration | Top Hosting India | Unlimited Domains | Reseller | VPS | Dedicated Server,149,32,38077,False,
2020-01-24 22:35:23+00:00,Coronavirus study finds ‘otherwise healthy’ patients can contract virus https://t.co/hfLDh85IEf,Vsplusonline,india,Web Hosting India | Web Hosting Space Unlimited | Free Domain Registration | Top Hosting India | Unlimited Domains | Reseller | VPS | Dedicated Server,149,32,38077,False,
2020-01-24 22:33:41+00:00,"RT @ETNOWlive: What’s the #coronavirus? Should you be worried, if in India? Here’s everything you need to know about its origin and prevent…",kazmi_kalbe,lucknow india,"Only God will judge me , I m person hv to much emotions ...",20,144,311,False,"What’s the #coronavirus? Should you be worried, if in India? Here’s everything you need to know about its origin and prevention
#WuhanVirus #China #SARS #virus @WHO @China_Amb_India @MoCA_GoI @CDCgov @MoHFW_INDIA @drharshvardhan https://t.co/duaGwryaBb"
2020-01-24 22:32:54+00:00,"RT @AFP: #BREAKING Two cases of coronavirus confirmed in France, first in Europe, says minister https://t.co/xcpmdCOCr5",CNX500,mumbai india,#Learning #AttitudeOfGratitude,143,35,14003,False,"#BREAKING Two cases of coronavirus confirmed in France, first in Europe, says minister https://t.co/xcpmdCOCr5"
2020-01-24 22:30:33+00:00,Lessons from Sars outbreak help in race for coronavirus vaccine https://t.co/Z9r2Y5JsqU https://t.co/2kMn9lK96s,amhyk2,new delhi india,#mechanical engineer #proud Indian #amiability #dreamer #thinker,409,603,16546,False,
2020-01-24 22:28:43+00:00,Uncertainty over Fed Cup in China following the outbreak of the coronavirus in some parts https://t.co/j1cYcBxjwJ,Vsplusonline,india,Web Hosting India | Web Hosting Space Unlimited | Free Domain Registration | Top Hosting India | Unlimited Domains | Reseller | VPS | Dedicated Server,149,32,38077,False,
2020-01-24 22:28:50+00:00,RT @988Patrick: It’s not a joke . Share guys and stay safe #coronavirus https://t.co/nmcciR8up3,Samratravikanti,hyderabad telangana india,,431,778,25850,False,It’s not a joke . Share guys and stay safe #coronavirus https://t.co/nmcciR8up3
2020-01-24 22:28:37+00:00,New post (Uncertainty over Fed Cup in China following the outbreak of the coronavirus in some parts) has been published on ApzWeb - https://t.co/j1cYcBxjwJ,Vsplusonline,india,Web Hosting India | Web Hosting Space Unlimited | Free Domain Registration | Top Hosting India | Unlimited Domains | Reseller | VPS | Dedicated Server,149,32,38077,False,
2020-01-24 22:27:59+00:00,"RT @BloombergQuint: #Coronavirus explained: Here's what you should know.

Read: https://t.co/Jv0sbCgVZu https://t.co/iFOihAaT4C",imrajesh678,india,,60,755,5774,False,"#Coronavirus explained: Here's what you should know.

Read: https://t.co/Jv0sbCgVZu https://t.co/iFOihAaT4C"
2020-01-24 22:25:09+00:00,Trump thanks China’s Xi Jinping for handling of coronavirus https://t.co/KBHHMG7puK https://t.co/vnEeLdAyZn,jobgujnews3,india,,31,250,20272,False,
2020-01-24 22:19:57+00:00,"RT @WHO: Q: What is a #coronavirus?

A: Coronaviruses are a large family of viruses that are known to cause illness ranging from the common…",nikhilk58309252,patna india,"🚩जननी जन्मभूमिश्च स्वर्गादपि गरीयसी🚩 माँ भारती,गौरवान्वित भारतीय सेना और भारतीय संस्कृति के लिए सर्वस्व न्योछावर🙏🚩 #नमो_नमः",41,828,4432,False,"Q: What is a #coronavirus?

A: Coronaviruses are a large family of viruses that are known to cause illness ranging from the common cold to more severe diseases such as Middle East Respiratory Syndrome (MERS) and Severe Acute Respiratory Syndrome (SARS) https://t.co/PKzKaO2yfK https://t.co/mhEa7LFVhx"
2020-01-24 22:18:44+00:00,"RT @FundamentalGems: Share guys and stay safe

#Retweet to spread awareness

#coronavirus 
#coronarovirus 
#VirusCorona https://t.co/oWTChX…",Azgharalikhan1,hyderabad deccan india,Hardest thing to answer: Describe yourself.,49,119,2355,False,"Share guys and stay safe

#Retweet to spread awareness

#coronavirus 
#coronarovirus 
#VirusCorona https://t.co/oWTChXgLDH"
2020-01-24 22:17:24+00:00,"RT @AFTvitaliy: Novavax exec: Making a coronavirus vaccine could take a long time https://t.co/QxmpU2zK2u
#YahooFinance #Traffic #Transport…",ManishS10090357,noida india,,111,3,8973,False,"Novavax exec: Making a coronavirus vaccine could take a long time https://t.co/QxmpU2zK2u
#YahooFinance #Traffic #Transportation #Shipping #Logistics
Follow @AFTvitaliy for #Trucking News"
