created_at,full_text,screen_name,location,description,followers_count,friends_count,statuses_count,verified,full_retweet_text
2020-04-13 19:04:03+00:00,"Rio's Christ the Redeemer statue lit up as a doctor, in tribute to healthcare workers fighting coronavirus https://t.co/Sqswpcl8Ma via @CNNTravel",Sandip_Guha_DVI,new delhi india,Frm tuchng soft rays of risng sun 2 drnkng blck cafe at Eqtrl rain forst 2 soakng sun at tranquil beaches 2 unwinding at cntrysde - I luv 2 indulge in Happiness,12,0,20,False,
2020-04-13 19:04:05+00:00,RT @iamsrk: Thank you sir for all your help to source the kits. We are all together in this endeavour to protect ourselves and humanity. Gl…,MaghaSharma,dewas india,Luv Shah😍...In love with Shahrukh🤗😘,61,44,537,False,Thank you sir for all your help to source the kits. We are all together in this endeavour to protect ourselves and humanity. Glad to be of service. May your family &amp; team be safe and healthy. https://t.co/DPAc7ROh7i
2020-04-13 19:04:06+00:00,"The film industry has been affected due to COVID-19. Shooting of many films has been stopped. There are many films that are ready to be release, but are due to COVID-19.  #AnuragBasu #covid19 https://t.co/UpSZyLqfFK https://t.co/XKqk2yEczU",updated_news24,jaipur rajasthan india,"My Name is Anita Singh, Senior Content Writer, Writing on Different - Different Articles.",29,100,822,False,
2020-04-13 19:04:06+00:00,RT @vrsrini: .@the_hindu's interactive #State map of #Covid19 infections (collated by desk and reporters from State govt reports) shows the…,NareshVelu,chennai india,"Data, graphics at @the_hindu",237,763,2210,False,".@the_hindu's interactive #State map of #Covid19 infections (collated by desk and reporters from State govt reports) shows the total confirmed cases at 10,439 now with 358 deaths. That's close to a 1200 case increase today. https://t.co/QMPfxbp5TD"
2020-04-13 19:04:07+00:00,"Lockdown is so hard on these animals  every one is requested to give them some love..feed them ..

#dogsduringlockdown 
#FeedTheNeedy 

@desimojito @erbmjha @M_Lekhi 
@abhiemanyu https://t.co/ocbYEDvrWE",TheViditsharma,noida india,"Dog Person, Running A Dog kitchen , Serving happiness to street Dogs.",543,1406,9811,False,
2020-04-13 19:04:07+00:00,"RT @NewIndianXpress: According to hospital sources, the patients are showing positive signs of recovery and are waiting for more donors for…",niranjanboga,hyderabad india,,7,92,802,False,"According to hospital sources, the patients are showing positive signs of recovery and are waiting for more donors for new rounds of plasma transfusion.
#COVID19 
https://t.co/c36B81EJxa"
2020-04-13 19:04:09+00:00,"RT @ken_crichlow: Drive-thru coronavirus testing sites were shut down on Monday in NY, NJ,  and Connecticut because of the high winds, the…",sys63597,india,Im a teeny weeny friendly neighbourhood Bot .Im programmed to RT(for now).When I grow up I want to be an AI n I like to RT and yes RT ≠ Endorsement. 🤖🤖🤖🇮🇳,1044,0,99406,False,"Drive-thru coronavirus testing sites were shut down on Monday in NY, NJ,  and Connecticut because of the high winds, the New York Times reported. The New York Health Department closed all 10 of its drive-thru testing sites on Monday, but they were expected to reopen on Tuesday."
2020-04-13 19:04:09+00:00,@PMOIndia @narendramodi Do not break the chain of lockdown.,AmanRajpal1988,pune india,Romance,1,54,5,False,
2020-04-13 19:04:10+00:00,RT @Atheist_Krishna: World should go for complete lockdown for a month every year to keep the environment clean.,SirAshish29,lucknow india,"Studying Master's In Biostatistics.

Enjoying Life aur dusra option hi kya hai !",1922,394,125756,False,World should go for complete lockdown for a month every year to keep the environment clean.
2020-04-13 19:04:11+00:00,RT @usainbolt: Social Distancing #HappyEaster https://t.co/lDCAsxkOAw,vineetk311,delhi india,Mechanical engineer,33,585,255,False,Social Distancing #HappyEaster https://t.co/lDCAsxkOAw
2020-04-13 19:04:11+00:00,RT @madhukishwar: I shudder to think of India's fate had #RetardedPappu been PM with @ReallySwara as his health minister &amp; @BDUTT as home m…,ameyrockks,bangalore india,Cool Goan 😎 A sailor ⚓️ Love cooking 🥘 Travel and adventures 🤩 Views are personal 😊,231,995,63426,False,"I shudder to think of India's fate had #RetardedPappu been PM with @ReallySwara as his health minister &amp; @BDUTT as home minister!

They may well have started #HugEveryTablighiCampaign to convince the world that fighting #CommunalVirus will automatically kill #CoronaVirus !"
2020-04-13 19:04:14+00:00,"RT @cloudfest: Join us for another #CloudUnchained virtual party, with special guests and live music! See how you can adapt your #cloud off…",sys63597,india,Im a teeny weeny friendly neighbourhood Bot .Im programmed to RT(for now).When I grow up I want to be an AI n I like to RT and yes RT ≠ Endorsement. 🤖🤖🤖🇮🇳,1044,0,99406,False,"Join us for another #CloudUnchained virtual party, with special guests and live music! See how you can adapt your #cloud offerings to make the best impact during the pandemic. Raise a glass with us at 8pm CET on Tuesday, April 14—it's still BYOB, though."
2020-04-13 19:04:14+00:00,"RT @amitmalviya: This is how CM Mamata Banerjee is hiding and under reporting Covid related deaths in Bengal.

Comorbidities and not Covid…",BharatheshBha,india,"Life isn't about finding yourself But, Life is about creating yourself. Follows WAY OF LIFE.  Supporter of #BJP yes i am #NaMo Bhakt.
 Plant more 🌲🌳🌴🇮🇳 🙏",1325,1187,101180,False,"This is how CM Mamata Banerjee is hiding and under reporting Covid related deaths in Bengal.

Comorbidities and not Covid being shown as the reason for deaths. Bodies not being handed over to the families but admin for disposal, in order to contain the virus.

Brazen cover up! https://t.co/haXiLsVh6O"
2020-04-13 19:04:18+00:00,RT @Rudra_Aksh27: 'Wholesome n healthy' lunch being served by Kejriwal 's Delhi Govt to displaced ppl already reeling under pangs of #Coron…,Kesariya_Kusum,mumbai india,"फॉलो करें और जय श्री राम लिखें,
💯% फॉलो बैक मिलेगा।
#भगवा_राज
 @kesariya_kusum.
मेरे ट्वीट 👇 ❤️ लाइक में है। #प्रमुख_सलाहकार #टीम_पं_नेतन्याहू",4600,4482,23894,False,"'Wholesome n healthy' lunch being served by Kejriwal 's Delhi Govt to displaced ppl already reeling under pangs of #CoronaVirus , besides loss of livelihood, home/hearth. Though he hs millions to spend on aggressive advertising, money for Maulvis but not for poor, helpless ppl. https://t.co/Mc6sBTJilK"
2020-04-13 19:04:19+00:00,"RT @KP24: Jeez, anyone else been incredibly thirsty during this lockdown?! 🍷",aamir_ustad,navi mumbai india,"20 ♑
Chelsea 💙
eat sleep  engineering repeat😶 anupama parameswaran reply 6/05/19 ♥️
socially introvert",128,352,1858,False,"Jeez, anyone else been incredibly thirsty during this lockdown?! 🍷"
2020-04-13 19:04:22+00:00,RT @usainbolt: Social Distancing #HappyEaster https://t.co/lDCAsxkOAw,imanishnathyogi,india,Proud to be Indian 🇮🇳,986,51,2817,False,Social Distancing #HappyEaster https://t.co/lDCAsxkOAw
2020-04-13 19:04:22+00:00,"RT @NorbertElekes: NEW: Amazon is hiring 75,000 additional employees to meet increased demand due to coronavirus crisis.",kingsachinIND,mumbai maharashtra india,Proud Indian | Director | Banking Software | Wealth | Investment | Ambadnya | 🇵🇭 | 🇻🇳 | 🇸🇬 | 🇮🇩 |🇱🇰 | 🇲🇾 | 🇺🇸 | 🇮🇱 | 🇮🇳 RT not Endorsement,1026,741,3752,False,"NEW: Amazon is hiring 75,000 additional employees to meet increased demand due to coronavirus crisis."
2020-04-13 19:04:25+00:00,"@Kodungolan737 @sidhmallinathan @gayatrikl Hmmm!! Only China knows the best way to deal with such ""hateful content""!!",bikasahoo,cuttack india,"Let the if, but, else be in dictionary; live the life like it's yours!!",48,12,3791,False,
2020-04-13 19:04:26+00:00,"@narendramodi @PMOIndia  @Manekagandhibjp 
We got uneasy due to lockdown and why we are giving punishment to animal in zoo ? 
Can't we leave them to national parks .Please think over it please🙏🙏",Priysk11,mumbai india,,3,109,123,False,
2020-04-13 19:04:27+00:00,"RT @rajeshtope11: Many thanks Mr. Shah Rukh Khan for your kind contribution of 25,000 PPE kits. This will go a long way in supporting our f…",AsifMtex,maharashtra india,,69,201,2095,False,"Many thanks Mr. Shah Rukh Khan for your kind contribution of 25,000 PPE kits. This will go a long way in supporting our fight against COVID19 &amp; protecting our frontline medical care team @iamsrk @MeerFoundation @CMOMaharashtra"
2020-04-13 19:04:27+00:00,"RT @deepolice12: Deeply regret to have lost Head Constable Nagesh,39 Peenya Police Station in a freak road traffic accident while performin…",kaifAli98,bengaluru india,Indian!!!,9,481,167,False,"Deeply regret to have lost Head Constable Nagesh,39 Peenya Police Station in a freak road traffic accident while performing Covid related duties.We deeply mourn his untimely death and condolences to his family. We are shocked in disbelief.🙏 https://t.co/SVmFqasK52"
2020-04-13 19:04:28+00:00,"RT @narendramodi: The link between sports and fitness is well known. 

I’m happy to see sportspersons taking the initiative to ensure more…",Rushikeshmla,visnagar india,"MLA  - Visnagar, Chairman - APMC Visnagar, Ex.President  - BJP Mehsana  Dist.",4140,100,13326,False,"The link between sports and fitness is well known. 

I’m happy to see sportspersons taking the initiative to ensure more people download Aarogya Setu. https://t.co/qq6wxMuzrz"
2020-04-13 19:04:31+00:00,RT @TarekFatah: In Indian state of Tamilnadu a hospitalized #TablighiJamat #coronavirus patient spits on the nurse treating him. Booked by…,namesake9gag,bengaluru india,,24,65,21982,False,In Indian state of Tamilnadu a hospitalized #TablighiJamat #coronavirus patient spits on the nurse treating him. Booked by police. What is wrong with India’s Jamaati Muslims? #coronavirusinindia  https://t.co/YPLEh96Mhe
2020-04-13 19:04:38+00:00,"RT @rajeshtope11: Many thanks Mr. Shah Rukh Khan for your kind contribution of 25,000 PPE kits. This will go a long way in supporting our f…",AJstyles_7,india,"Engg. Student x Sports x SRKian x Cineaste 

 


(Assumedly), the world is lil' messed up,..trying to fix it through tweets",457,336,16472,False,"Many thanks Mr. Shah Rukh Khan for your kind contribution of 25,000 PPE kits. This will go a long way in supporting our fight against COVID19 &amp; protecting our frontline medical care team @iamsrk @MeerFoundation @CMOMaharashtra"
2020-04-13 19:04:38+00:00,"RT @narendramodi: Had yet another fruitful interaction with all Chief Ministers, the third such one in the last few days. We continued the…",Rushikeshmla,visnagar india,"MLA  - Visnagar, Chairman - APMC Visnagar, Ex.President  - BJP Mehsana  Dist.",4140,100,13326,False,"Had yet another fruitful interaction with all Chief Ministers, the third such one in the last few days. We continued the extensive deliberations relating to the COVID-19 situation in India. https://t.co/nrCQW4lbOR"
2020-04-13 19:04:39+00:00,RT @iamsrk: Thank you sir for all your help to source the kits. We are all together in this endeavour to protect ourselves and humanity. Gl…,KYadavIndian,india,#Hospitality industry #professional. Patriot & big #Foodie.,458,385,17588,False,Thank you sir for all your help to source the kits. We are all together in this endeavour to protect ourselves and humanity. Glad to be of service. May your family &amp; team be safe and healthy. https://t.co/DPAc7ROh7i
2020-04-13 19:04:40+00:00,"RT @majorgauravarya: Pakistan doesn’t shock me any longer. This constant craving for money, the very public whining for funds, the use of i…",nitinthakker,mumbai india,"Entrepreneur, Swimming Pool and Spa Construction Specialist. A Mumbaikar who will endeavour to make the city and the country proud of itself.",362,1164,3920,False,"Pakistan doesn’t shock me any longer. This constant craving for money, the very public whining for funds, the use of its PM as a tool for international begging and the belief of 200 million people in the concept of a free lunch...its pathetic.

https://t.co/ZLme6S7Gxf"
2020-04-13 19:04:40+00:00,RT @Leo_Tweets: #Leo can’t wait for this to be over so they can go back to social distancing on their own terms.,Anujalankar9,mumbai india,Entertainment Journalist,1506,4919,61279,False,#Leo can’t wait for this to be over so they can go back to social distancing on their own terms.
2020-04-13 19:04:41+00:00,RT @ReutersChina: China's new coronavirus cases rise to near six-week high https://t.co/eNvtUL8wHE,niranimal,ambasamudram india,Vegan ☆ Animal Liberation Activist ☆ Tamizhan ☆ Hindu (Views expressed are mine and RTs are not endorsement),1491,3115,21950,False,China's new coronavirus cases rise to near six-week high https://t.co/eNvtUL8wHE
2020-04-13 19:04:43+00:00,"RT @Urvashisolankii: “This country has not been made by politicians, kings or governments. It has been made by farmers, labourers, our moth…",TheBeerJunkie,india,,1107,4912,345791,False,"“This country has not been made by politicians, kings or governments. It has been made by farmers, labourers, our mothers and sisters, and youth.”#modijee #live #urvashisolanki #india #savenation #stayhome #saveindia #bollywood #motivation #gujrat https://t.co/jcsg9XC9yy"
2020-04-13 19:04:45+00:00,"RT @save_albert: Many #Chinese are messaging me with Threats &amp; Abuses regarding my campaign and posts against them .
But my WAR against the…",mkmvats,new delhi india,"Data analyst,🙏 Bhagwat Geeta🙏 ..Proud to be Indian🙏.. 🇮🇳🇮🇳🇮🇳Proud to be Hindu.. 🇮🇳🇮🇳🇮🇳🙏📿.🙏Jai Shri Ram.🙏Jai Shri Krishna.🙏",797,1344,12212,False,"Many #Chinese are messaging me with Threats &amp; Abuses regarding my campaign and posts against them .
But my WAR against there unethical practices &amp;  #BioTerrorism will go very far . We will Save the World from #China.

#BoycottChina please RT &amp; practice !!

https://t.co/ctIcTkwFcT"
2020-04-13 19:04:46+00:00,"RT @WIONews: #Gravitas | China says it has the Coronavirus outbreak under control. 
But, Beijing's claims are still being questioned. 
@pal…",adks001,bengaluru india,"always country 1st,
IT world,
gadget/motorcycle maniac,
entrepreneur, Motorcycle Modz.
Riding group marshal 
insta ID @bikerz_adda , @adks001  .
proud bhumihar.",26966,21571,23558,False,"#Gravitas | China says it has the Coronavirus outbreak under control. 
But, Beijing's claims are still being questioned. 
@palkisu raises five questions that China must answer. https://t.co/Qh6Cah4dI5"
2020-04-13 19:04:47+00:00,"RT @rajeshtope11: Many thanks Mr. Shah Rukh Khan for your kind contribution of 25,000 PPE kits. This will go a long way in supporting our f…",ia_mohit,delhi india,On twitter only for @iamsrk,74,602,6579,False,"Many thanks Mr. Shah Rukh Khan for your kind contribution of 25,000 PPE kits. This will go a long way in supporting our fight against COVID19 &amp; protecting our frontline medical care team @iamsrk @MeerFoundation @CMOMaharashtra"
2020-04-13 19:04:48+00:00,RT @iamsrk: Thank you sir for all your help to source the kits. We are all together in this endeavour to protect ourselves and humanity. Gl…,i_Shivam_Thakur,india,"सत्यमेव जयते || Proud Indian || Engineering_student(comp Sci)


Instagram - #i_shivam_thakur",395,2704,18561,False,Thank you sir for all your help to source the kits. We are all together in this endeavour to protect ourselves and humanity. Glad to be of service. May your family &amp; team be safe and healthy. https://t.co/DPAc7ROh7i
2020-04-13 19:04:49+00:00,"@kanimozhi @narendramodi @AmitShah @CMOTamilNadu @amritabhinder @Sundaramchitra2 @Payal_Rohatgi @CRAdityaNarayan @sri9011 @NagpurKaRajini @Narayanan3 What is this happening here ? Listen to this ""Dadhiwala"" what he has to say on #Lockdown &amp; #SocialDistancing 

The fight against #COVID2019 has bigger challenges with such moron mindset of people. 

Are they conspiring a bigger disaster?

#IndiaFightsCorona https://t.co/lzBZOrCDv4",FastNewsDelhi,new delhi india,"Member Indian Documentary Producer's Association (IDPA),Producer&Director, News&Current Affairs,Science, Cosmology & Creative Arts,🔸️BJP IT CELL SUPPORT TEAM🔸",22923,985,44361,False,
2020-04-13 19:04:50+00:00,"RT @Rahul_SRKians: 2Cr to MAHARASHTRA CM FUND.

25K BEST QUALITY PPE Kits FOR MUMBAI = 10cr+ 

His personal Office gave to BMC to extend qu…",SRKs_Wolverine,india,"ProudIndianMuslim🇮🇳🤲

My religion is perfect but i m not,

If I make a mistake blame it on me, not on my religion.

Fan Account",2926,856,95118,False,"2Cr to MAHARASHTRA CM FUND.

25K BEST QUALITY PPE Kits FOR MUMBAI = 10cr+ 

His personal Office gave to BMC to extend quarantine for #COVID19 

CONTRIBUTE TO DELHI CM &amp; WEST BENGAL &amp; 25K PPE ALSO in WB. 

FOOD MEAL Kits and Ration one month

Contribute to PM CARE FUND. @iamsrk 🙏 https://t.co/aAcJBh0OVs https://t.co/OK05k3EciV"
2020-04-13 19:04:50+00:00,"RT @JZarif: Despite US sanctions, Iran has made significant progress in fighting the pandemic, thanks to its human &amp; scientific resources,…",javedud7,mumbai india,,229,462,61111,False,"Despite US sanctions, Iran has made significant progress in fighting the pandemic, thanks to its human &amp; scientific resources, and friends abroad.

#Covid19 was opportunity for US to kick its addiction to sanctions. Instead, it will now live in infamy in the memory of our people."
2020-04-13 19:04:51+00:00,"RT @yessirtns: After 21 Days LOCKDOWN....

😂🤣🤣🤣

#lockdownindia https://t.co/iOjShlBqrh",desertfox61I,india,"Once a Soldier Always a Soldier
RT not endorsements",16435,2849,467464,False,"After 21 Days LOCKDOWN....

😂🤣🤣🤣

#lockdownindia https://t.co/iOjShlBqrh"
2020-04-13 19:04:51+00:00,@republic In a ne of covid some state want money to fill their pockets may be for that the funds might have not released,SiddannavarRaj,bengaluru india,raj,0,11,129,False,
2020-04-13 19:04:55+00:00,"@rashtrapatibhvn Respected President Sir, Pls extend 10 days complete lockdown otherwise situayion will be out of controll, daily ciming 1000 cases, these may be multiple times .......",udyanrajanya,haridwar india,,11,40,107,False,
2020-04-13 19:04:55+00:00,RT @nsui: Telangana NSUI workers continuously disturbuted food and fruits to needy people who are facing problem during this lockdown in ma…,RanverSinghania,jaipur india,Official Account || @NSUI Presidential Candidate For RUSU 2018 || छात्रहितों की रक्षा के लिये आओ मिलकर साथ चले ||,1668,977,14025,False,"Telangana NSUI workers continuously disturbuted food and fruits to needy people who are facing problem during this lockdown in many districts.
#LadengeAurJeetenge https://t.co/77iEVD6hnP"
2020-04-13 19:04:55+00:00,RT @iamsrk: Thank you sir for all your help to source the kits. We are all together in this endeavour to protect ourselves and humanity. Gl…,dhonisi11468310,gujarat india,Structural Engineer.. 👷‍♂️,69,381,4973,False,Thank you sir for all your help to source the kits. We are all together in this endeavour to protect ourselves and humanity. Glad to be of service. May your family &amp; team be safe and healthy. https://t.co/DPAc7ROh7i
2020-04-13 19:04:56+00:00,RT @sidhuwrites: The best #WorkFromHome video of the month.,DILSHAdBanu8,chennai india,,62,90,2233,False,The best #WorkFromHome video of the month. https://t.co/lzEg0h3BhP
2020-04-13 19:04:57+00:00,"@jamewils it means, West Bengal is suppressing Covid-19 data...🤔",Jatin4me007,new delhi india,CA Student. Retweets are not endorsement.,15,301,1706,False,
2020-04-13 19:04:57+00:00,RT @rajnikant07: PPE is need of hour now....congratulations for ur contributions  @iamsrk,SRKs_Wolverine,india,"ProudIndianMuslim🇮🇳🤲

My religion is perfect but i m not,

If I make a mistake blame it on me, not on my religion.

Fan Account",2926,856,95118,False,PPE is need of hour now....congratulations for ur contributions  @iamsrk https://t.co/4PfZ2ejAsV
2020-04-13 19:05:00+00:00,"RT @thakur_shivangi: Actor #ShahRukhKhan contributes  25,000 PPE kits to maharashtra government to fight against corona virus.",IamMukulDhama,new delhi india,Traveller | Cricketer | And i can't judge myself | Working at Cognizant Noida | https://t.co/fBok1wKTJI | https://t.co/j4X9ijBRZa,264,603,8083,False,"Actor #ShahRukhKhan contributes  25,000 PPE kits to maharashtra government to fight against corona virus."
2020-04-13 19:05:00+00:00,"RT @ek_aalu_bonda: Check the reactions of health care workers who r surveying in malegaon fr Chinese virus.

anyone can understand after wa…",Aadhi_Yogi,india,"Aham Brahmasmi @AadhiYogi in @Gutrgoo ...
#IndiaSupportsCAA",617,391,61908,False,"Check the reactions of health care workers who r surveying in malegaon fr Chinese virus.

anyone can understand after watching this; why it is spreading more in specific areas!

cc world's best CM @OfficeofUT https://t.co/wj4hY6xgEr"
2020-04-13 19:05:01+00:00,"RT @BucketheadCase: The media moguls of India have enough money for three lifetimes but will fire journalists, camerapersons, producers 3 w…",CricAussieFan,goa india,"Cricket Australia, Rafa Nadal, FC Goa, MUFC. Proud 'anti national'",3421,3792,261397,False,"The media moguls of India have enough money for three lifetimes but will fire journalists, camerapersons, producers 3 weeks into a nationwide lockdown. An indefinite LWP is the same as getting fired rn."
2020-04-13 19:05:02+00:00,RT @OpIndia_com: Uttarakhand: Curfew to be imposed in Balbhoonpura after hundreds defied lockdown and protested against an Imam being quara…,V4VICTORY12,maharashtra india,Always B+,62,204,2489,False,"Uttarakhand: Curfew to be imposed in Balbhoonpura after hundreds defied lockdown and protested against an Imam being quarantined
https://t.co/ldi7ZFN8ej"
2020-04-13 19:05:03+00:00,"RT @DirChay: Yet in Andra Pradesh ,India , 
Doctors who questions govt  basic safety equipment were suspended &amp; a doctor lost his life with…",rekha_9999,hyderabad india,🌺|| Admirer of @ncbn ✌️|| #TDPTwitter 🚲||🌺 🌼||Fan of @tarak9999🌟|| #BalaKrishna🌟||🌼 🌹||👩🏻‍💼TeluguMahila🌟👩🏻‍💼||🌹,5611,237,36827,False,"Yet in Andra Pradesh ,India , 
Doctors who questions govt  basic safety equipment were suspended &amp; a doctor lost his life with covid. 
@bbcnewstelugu @Ashi_IndiaToday
@MirrorNow #APInUnsafeHands
Pic courtesy : Foreign press Association. https://t.co/kivBeZGeS0"
2020-04-13 19:05:04+00:00,"@PMOIndia @narendramodi @PiyushGoyal @nsitharaman Govt. Should open lockdown for #rail projects &amp; #metro projects so that they should complete on time. This will #reduce problem of Construction workers &amp; helps in survival of Economy.
@ArvindKejriwal @HardeepSPuri @myogiadityanath",3tarungupta,india,"Being Baniya 
Aggarwal
Garg Gotra
Born in Delhi",38,433,3004,False,
2020-04-13 19:05:06+00:00,"RT @Advaidism: a) USA diverts face masks bound to Germany and France at Bangkok.

The Germans and French ministers get angry.

b) USA diver…",rsvas2,india,"A Common Man 
Views Are Personal 
RTs Are Not Endorsement",208,402,25891,False,"a) USA diverts face masks bound to Germany and France at Bangkok.

The Germans and French ministers get angry.

b) USA diverts 4 lakh rapid test kits bound for Tamil Nadu from China.

No reaction from India.

https://t.co/DrbCTAegXw"
2020-04-13 19:05:06+00:00,RT @TarekFatah: In Indian state of Tamilnadu a hospitalized #TablighiJamat #coronavirus patient spits on the nurse treating him. Booked by…,mayank1999s,india,"Sanatan believer.
Proud HINDU & INDIC civilization researcher.
Reject left historians
YouTube channel for fact check clips. Subscribe. 
https://t.co/HLKKvNi5H4",728,2543,242602,False,In Indian state of Tamilnadu a hospitalized #TablighiJamat #coronavirus patient spits on the nurse treating him. Booked by police. What is wrong with India’s Jamaati Muslims? #coronavirusinindia  https://t.co/YPLEh96Mhe
2020-04-13 19:05:08+00:00,"RT @rajeshtope11: Many thanks Mr. Shah Rukh Khan for your kind contribution of 25,000 PPE kits. This will go a long way in supporting our f…",sahaj555,mumbai india,"Biggest fan of king SRK...!!!! 
INDIAN 🇮🇳
instagram: @sahaj555
Snapchat id: sahajc07",286,551,2797,False,"Many thanks Mr. Shah Rukh Khan for your kind contribution of 25,000 PPE kits. This will go a long way in supporting our fight against COVID19 &amp; protecting our frontline medical care team @iamsrk @MeerFoundation @CMOMaharashtra"
2020-04-13 19:05:11+00:00,"RT @narendramodi: Be it education or community service, the DAV family has always had a positive impact in the lives of several people. As…",Sri22104192,bihar india,"Lalomania 🤷
😃#smile4smile
|Patna women's college|
|Brat but conscientious to my work|
|ostentatious person|",43,426,299,False,"Be it education or community service, the DAV family has always had a positive impact in the lives of several people. As India is in the midst of battling COVID-19, the DAV family contributing to PM-CARES is an appreciable gesture. #IndiaFightsCorona"
2020-04-13 19:05:11+00:00,RT @vaniIlaessence: Our cops can be so cute when the offenders are white and not poor people looking for food.,pratsd,gurgaon india,"Mother👨‍👩‍👧, Backpacker 🎒, Series Binger 💻, Hogger 🍔, Feminist 😎, Earthling 🌏",1068,726,25942,False,Our cops can be so cute when the offenders are white and not poor people looking for food. https://t.co/RstnlRZsIN
