created_at,full_text,screen_name,location,description,followers_count,friends_count,statuses_count,verified,full_retweet_text
2020-02-14 01:45:45+00:00,RT @ImtiazMadmood: Saying greetings instead of shaking hands. Not eating animals but only vegetarian. Cremating the dead instead of burying…,Nilakurinji,bangalore india,"Die hard Trump Fan! Unapologetically Hindu!!! Bharatvasi, ProudOdia, ProudTelugu!!! Pakka Berhampuriya",210,12,86937,False,"Saying greetings instead of shaking hands. Not eating animals but only vegetarian. Cremating the dead instead of burying them.

Since Corona virus the world is becoming Hindu?"
2020-02-14 01:45:46+00:00,@andnowsheisnot Are you claiming that your sun has coronavirus even though he went in sun?,IndianNewsViews,india,https://t.co/Dhudik6wM5,578,549,34160,False,
2020-02-14 01:45:46+00:00,"#coronavirus: China reports 63,767 confirmed cases of #COVID19, 505 cases reported from 24 other countries. Death toll 1487 in China, 2 abroad. Death toll in #Hubei rise to 116 taking total toll to 1426 https://t.co/NvYZ1YKq6e",DDNewslive,new delhi india,"Official Twitter account of DD News, the Public Broadcaster of India. हिंदी में @DDNewsHindi. Follow us on- https://t.co/hUdIpLotbt",2754896,28,158428,True,
2020-02-14 01:45:52+00:00,RT @spectatorindex: BREAKING: Coronavirus death toll reaches 1483,thewittyshitt,mumbai india,Rational || Pragmatist || Capitalist || Views: Personal,384,648,9665,False,BREAKING: Coronavirus death toll reaches 1483
2020-02-14 01:46:00+00:00,RT @ImtiazMadmood: Saying greetings instead of shaking hands. Not eating animals but only vegetarian. Cremating the dead instead of burying…,AshutoshGawade4,pune india,Intuition! That's how it works...,28,113,3338,False,"Saying greetings instead of shaking hands. Not eating animals but only vegetarian. Cremating the dead instead of burying them.

Since Corona virus the world is becoming Hindu?"
2020-02-14 01:46:07+00:00,"@rssurjewala How many Votes Nehru Got? Just 1. Patel got 13
Yet Nehru played the dirty game of Congress politics and became PM. Agreed to Partition. 
Then started the real mess of Parivaar led Party
Tibet
Jeep Scam
China War..... Too long a list
So just keep off",Dewdrop59486561,gujarat india,"Trust the NaMo Government. 
You Abuse, I Block.",194,392,8913,False,
2020-02-14 01:46:07+00:00,RT @CNBCFastMoney: Is Wall Street underestimating the impact of the coronavirus? @ScottMinerd says that could be the case. The @GuggenheimP…,macroguru9,hong kong dubai bali india,"CIO at Macro Family Office, Ex Sell side EM Trader. 
Wharton Alumni
Supporter of Indian Cricket & Modi.
Not a signal seller
We do managed accounts.",3549,1122,10385,False,"Is Wall Street underestimating the impact of the coronavirus? @ScottMinerd says that could be the case. The @GuggenheimPtnrs CIO joins our desk tonight to explain along with Laura Kane, head of thematic investing at @UBS. https://t.co/uoqmMeA9nB"
2020-02-14 01:46:08+00:00,RT @TheWolfpack71: Just In: Social media reports from Kashmir mention that JIO has succesfully managed to block most VPNs which were used t…,HiteshGngr18,india,🏊🏊People like you makes people like me like people like you.🏊🏊,647,620,130885,False,"Just In: Social media reports from Kashmir mention that JIO has succesfully managed to block most VPNs which were used to bypass social media block.
They also reportedly managed to block Tor (although it's doubtful since Tor has too many obfs4, which even China can't fully block)"
2020-02-14 01:46:25+00:00,RT @ImtiazMadmood: Saying greetings instead of shaking hands. Not eating animals but only vegetarian. Cremating the dead instead of burying…,asitava2k,new delhi india,"Civil Engineer, President of C R Park Kali Mandir Delhi,President of Probashi Bongiyo Samaj Delhi, a proud Indian",933,1330,24718,False,"Saying greetings instead of shaking hands. Not eating animals but only vegetarian. Cremating the dead instead of burying them.

Since Corona virus the world is becoming Hindu?"
2020-02-14 01:46:31+00:00,"RT @TrulyMonica: Saying Namaste instead of shaking hands

Cremating dead body instead of burying 

Eating Satvik vegetarian food instead of…",shuklaakash244,uttar pradesh india,#राम_नाम_ने_जिसके_जीवन_में_प्रवेश_किया #उनकी_हर_मन_की_मुरादे_आपो_आप_पूरी_हो_जाती_है.🚩जयश्रीराम🚩,759,426,15957,False,"Saying Namaste instead of shaking hands

Cremating dead body instead of burying 

Eating Satvik vegetarian food instead of animals full of diseases

Our civilisation’s record of keeping us trouble-free is very underrated 😃 https://t.co/wgYwfa7CgK"
2020-02-14 01:46:32+00:00,"RT @SanjeevSanskrit: Vedic Rishis were smart. 
Namaste is safer than handshake. 
Sattvik food is safer than animals causing all forms of vi…",atmlt2016,new delhi india,Social Worker,270,485,15057,False,"Vedic Rishis were smart. 
Namaste is safer than handshake. 
Sattvik food is safer than animals causing all forms of virus outbreaks. 
Gauseva is better than beef - most polluting, unhealthy, poverty-inducing.
Water is good for drinking, alcohol is good for washing hands &amp; toilets https://t.co/IyqtdRpqq4"
2020-02-14 01:46:38+00:00,"Happy to see this sand art from @sudarsansand during a rapid response discussion on corona virus organised by World Affairs Council n Washington State China Relations Council at Seattle, starting just now. https://t.co/5t1LPn7TuN",AshokPradhanTOI,bhubaneswar india,Journalist @timesofindia. Alumnus @stateIVLP. Views personal. RTs not endorsement,4575,1315,7782,False,
2020-02-14 01:47:04+00:00,"RT @mdaleembasha: 😢😢😢😢😢
Heart Breaking 💔
Kid with corona virus 
https://t.co/KSHJqeTLz2",ADiravia,pudukottai district india,A SIMPLE but DEDICATED ACTIVIST OF INC.,1256,4997,166416,False,"😢😢😢😢😢
Heart Breaking 💔
Kid with corona virus 
https://t.co/KSHJqeTLz2"
2020-02-14 01:47:05+00:00,"RT @QuickTake: A Japanese cruise liner with more than 3,000 people on board was in quarantine Tuesday after a passenger, who had already le…",ParjapatiRustam,haryana india,"सभी भक्तों को दास का सत साहिब 💖💖💖💖💖💖💖💖💖💖💖💖💖💖💖💖💖💖💖💖💖💖💖💖💖
🙏बंदी छोड़ सतगुरु रामपाल जी महाराज की जय हो

                🙏  सत साहेब🙏",3709,80,28035,False,"A Japanese cruise liner with more than 3,000 people on board was in quarantine Tuesday after a passenger, who had already left the boat, tested positive for the #coronavirus https://t.co/0PrQYFIwmF"
2020-02-14 01:47:08+00:00,"RT @DDNewslive: #coronavirus: China reports 63,767 confirmed cases of #COVID19, 505 cases reported from 24 other countries. Death toll 1487…",angshchak1,kolkata india,Enthusiast.,175,132,51512,False,"#coronavirus: China reports 63,767 confirmed cases of #COVID19, 505 cases reported from 24 other countries. Death toll 1487 in China, 2 abroad. Death toll in #Hubei rise to 116 taking total toll to 1426 https://t.co/NvYZ1YKq6e"
2020-02-14 01:47:19+00:00,"RT @sunandavashisht: Say Namaste, become vegetarian and save the planet:)",k_ra_mr,bengaluru india,Investor [Retweets are not endorsements],211,1062,20790,False,"Say Namaste, become vegetarian and save the planet:) https://t.co/hQfLoyk70R"
2020-02-14 01:47:23+00:00,RT @BBCWorld: Coronavirus: Why have two reporters in Wuhan disappeared? https://t.co/hwzWAHEFTI,centristatheist,india,24,75,123,107,False,Coronavirus: Why have two reporters in Wuhan disappeared? https://t.co/hwzWAHEFTI
2020-02-14 01:47:24+00:00,RT @prudentgoa: Widespread panic in a housing society at Dona Paula as a Chinese national who returned from China on 1st Feb was allegedly…,yogeshgoa27,new delhi india,|Consultant| Human Values| RTs not endorsement|Goa-Mumbai-Delhi|,228,350,36411,False,Widespread panic in a housing society at Dona Paula as a Chinese national who returned from China on 1st Feb was allegedly released into general population without tests for corona virus
2020-02-14 01:47:35+00:00,RT @ImtiazMadmood: Saying greetings instead of shaking hands. Not eating animals but only vegetarian. Cremating the dead instead of burying…,ramulu,hyderabad india,,153,86,26338,False,"Saying greetings instead of shaking hands. Not eating animals but only vegetarian. Cremating the dead instead of burying them.

Since Corona virus the world is becoming Hindu?"
2020-02-14 01:47:37+00:00,"#coronavirusec 
China sent people back to work, this is how they are working! Retweet to share with others #china #Coronavius #wuhan #corona #death #CoronavirusOutbreak #coronavirus https://t.co/PFLjbkU8Pe",SYSCARE20,lucknow india,News / Current Affairs /Covering Political news / Social Activist / Support,676,244,22798,False,
2020-02-14 01:47:43+00:00,"#CrudeOil &amp; Dow futures didn't move as i was expecting.. ruling out any ""black friday"" move today 

probably big players still holding long positions. they may need some more time to squareoff full

recession looks inevitable (China's impact) but for how long will it be delayed? https://t.co/Bns5FkJIAi",PanigrahiSuresh,pune india,Investment consultant | Speculator | Sub-broker | Harmonics | Waves | Gann | Astro | FnO specialist | Spiritual |  BTech(@NITJ)|MBA(Fin-@SPJIMR) | Ph 8408971710,1685,3,4656,False,
2020-02-14 01:47:52+00:00,"RT @drthomasisaac: Just as in the case of Nipah, Kerala has won battle with Corona Virus. All the 3 patients identified have been confirmed…",sindhan,tamil nadu india,"Comrade ! , @cpimspeak   -  https://t.co/fz7Rh7LAaf",42193,194,19886,False,"Just as in the case of Nipah, Kerala has won battle with Corona Virus. All the 3 patients identified have been confirmed by Central authorities to have fully recovered. No case of secondary spread. Number under quarantine observation drastically coming down.Congats Health Dept."
2020-02-14 01:47:57+00:00,"@mattreevesLA 
Batman affected by corona virus just look at him...
And his eye mask worst than zoro's mask.. https://t.co/J858NUPAyD",sudh_hindustani,varanasi india,𝕱𝖔𝖑𝖑𝖔𝖜 𝖒𝖊 𝕴'𝖑𝖑 𝖋𝖔𝖑𝖑𝖔𝖜 𝖞𝖔𝖚.!,413,489,1018,False,
2020-02-14 01:48:01+00:00,RT @rvaidya2000: I am amazed you have fallen for Church propaganda--due to severe caste problem 60% of South Korea and many in Taiwan/China…,nagasarpa,india,"he who abuses the holy practice which is being performed by us, may the heavens surround with fire the hater of holy practices!",300,218,3690,False,I am amazed you have fallen for Church propaganda--due to severe caste problem 60% of South Korea and many in Taiwan/China/Japan got converted to Xtianity?It us the Dharma of Church to convert--If no caste they would gave invented it:)) RT https://t.co/1fW2VAlptq
2020-02-14 01:48:07+00:00,"RT @drthomasisaac: Just as in the case of Nipah, Kerala has won battle with Corona Virus. All the 3 patients identified have been confirmed…",Lalsalam90,cochin india,Living a simple life with a dream of equality,36,95,5446,False,"Just as in the case of Nipah, Kerala has won battle with Corona Virus. All the 3 patients identified have been confirmed by Central authorities to have fully recovered. No case of secondary spread. Number under quarantine observation drastically coming down.Congats Health Dept."
2020-02-14 01:48:10+00:00,"RT @onlyyoontv: #HubeiProvince reports 4,823 new cases, 116 new dead. Global total now at 65,236 and 1,487 dead, based in #China media stat…",raizooi,india,Currently in China. Completing Masters in Law & Chinese Foreign Policy. Doggos ❤️,322,1899,27837,False,"#HubeiProvince reports 4,823 new cases, 116 new dead. Global total now at 65,236 and 1,487 dead, based in #China media stats. #coronavirus"
2020-02-14 01:48:22+00:00,RT @rvaidya2000: I am amazed you have fallen for Church propaganda--due to severe caste problem 60% of South Korea and many in Taiwan/China…,nonexpertvivek,india,"I sometime agrees with tweets I RT, 
sometimes I agree only partially, Sometimes I just RT it to learn more from other's reply.",63,479,14841,False,I am amazed you have fallen for Church propaganda--due to severe caste problem 60% of South Korea and many in Taiwan/China/Japan got converted to Xtianity?It us the Dharma of Church to convert--If no caste they would gave invented it:)) RT https://t.co/1fW2VAlptq
2020-02-14 01:48:26+00:00,"RT @NorbertElekes: BREAKING: Number of confirmed coronavirus cases rises to 64,000+",Ro__183,bengaluru india,"Indian , Musicophile, Memophile, Science enthusiast. love Cricket , F1 .
supporter of #TeamIndia🇮🇳",76,630,16792,False,"BREAKING: Number of confirmed coronavirus cases rises to 64,000+"
2020-02-14 01:48:30+00:00,"FOX BIZ NEWS: Coronavirus shuts China hotels, stocks take a hit https://t.co/xbAaefRV2l",beeplusmind,tamil nadu india,"Hi nice to meet you,  I'm finished PG course , now I'm doing tax consultant course and I'm doing market analyzing and trend productions work. I'm 32+ thank you",3,1,2219,False,
2020-02-14 01:48:30+00:00,Pilot Who Carried Out Coronavirus-Hit Wuhan Evacuation Speaks To NDTV Thank You 🙏🏼 ⁦@airindiain⁩ crew Country is blessed to have such committed crew during every emergency https://t.co/gstIGMGlMB,ramavshree,new delhi india,"Passionate about Power of Technology to transform India, and now ‘running’  hard to help everyone stay safe and secure.",678,106,731,False,
2020-02-14 01:48:37+00:00,"Mobile World Congress (MWC) is a huge deal, which means canceling it is a huge deal https://t.co/xzxwTIG4zZ via @MorningBrew",vajapeyam,india,"When will Indians in general get out of ""DYNASTY POLITICS SYNDROME"",if at all they can? 😡😔😕😬",3224,4296,269753,False,
2020-02-14 01:48:42+00:00,"In 2014, a group of single people in China bought every odd-numbered seat at a movie theater on Valentine's Day so that couples couldn't sit together.",MRoopchand143,india,"Life ... 😌📸📽️😂📱💵😓🐦🎧... 


[DON'T WISH ME ON MY BIRTHDAY, BECAUSE I DON'T WANT FILTERED AND FAKE WISHES.]",1613,472,1001613,False,
2020-02-14 01:48:45+00:00,RT @RahulGandhi: The Corona Virus is an extremely serious threat to our people and our economy. My sense is the government is not taking th…,roopsinghchadar,bina etawa india m p,Government Primary Teacher,687,13,12339,False,"The Corona Virus is an extremely serious threat to our people and our economy. My sense is the government is not taking this threat seriously. 

Timely action is critical.

#coronavirus 

https://t.co/bspz4l1tFM"
2020-02-14 01:48:52+00:00,RT @sardesairajdeep: Full marks to Kerala Govt for tackling corona virus with speed and efficiency. Public health systems do work well at t…,deena_jacob,bangalore india,Corporate Communications| Brand Manager| Loves travelling| Shopping| Social Media enthusiast|Dreamer ! Views / opinions expressed are personal,962,1043,11472,False,Full marks to Kerala Govt for tackling corona virus with speed and efficiency. Public health systems do work well at times!! https://t.co/GpwCbT0TFo
2020-02-14 01:48:57+00:00,RT @ImtiazMadmood: Saying greetings instead of shaking hands. Not eating animals but only vegetarian. Cremating the dead instead of burying…,dwl75,new delhi india,"FINANCIAL PLANNER and WEALTH MANAGER..Loves to work out and eat PIZZAS..by political ideology, I am BHAKT..",278,852,7535,False,"Saying greetings instead of shaking hands. Not eating animals but only vegetarian. Cremating the dead instead of burying them.

Since Corona virus the world is becoming Hindu?"
2020-02-14 01:49:00+00:00,RT @ImtiazMadmood: Saying greetings instead of shaking hands. Not eating animals but only vegetarian. Cremating the dead instead of burying…,nirmaity,kolkata india,Associated with College teaching - Ardent follower of Swami Vivekananda - Believe that Indian Culture and Hindu Sanatan Philosophy can save India and world.,297,449,4345,False,"Saying greetings instead of shaking hands. Not eating animals but only vegetarian. Cremating the dead instead of burying them.

Since Corona virus the world is becoming Hindu?"
2020-02-14 01:49:18+00:00,"RT @chai2kul: Westerners were jealous of Japan
Westerners were jealous of S Korea
Westerners are jealous of China
Westerners are jealous of…",parth1054,mumbai india,An Indian citizen!!Passion -Science Interest-National Politics.,588,193,36014,False,"Westerners were jealous of Japan
Westerners were jealous of S Korea
Westerners are jealous of China
Westerners are jealous of Israel
Westerners will be jealous of India

Culture is our strength."
2020-02-14 01:49:18+00:00,RT @rvaidya2000: I am amazed you have fallen for Church propaganda--due to severe caste problem 60% of South Korea and many in Taiwan/China…,ganesh_kala59,chennai india,,449,225,255242,False,I am amazed you have fallen for Church propaganda--due to severe caste problem 60% of South Korea and many in Taiwan/China/Japan got converted to Xtianity?It us the Dharma of Church to convert--If no caste they would gave invented it:)) RT https://t.co/1fW2VAlptq
2020-02-14 01:49:21+00:00,U.S. Charges Chinese Tech Giant Huawei With Racketeering. China’s Huawei Technologies Co. and two of its U.S. subsidiaries were charged with racketeering and conspiracy to steal trade secrets in a new federal indictment.  https://t.co/MOyf4Aziva,ketan72,india,Political & Social Analyst. #IndiaFirst Privilege - PM @narendramodi ji follows me. All views are Strictly Personal. RTs are not endorsements #VandeMataram,8210,179,254941,False,
2020-02-14 01:49:36+00:00,"The story of India's heroic Wuhan evacuation. ""What are the Chances of Infection asked the Heroic Rescue Crew of Air India"" #ProudAirIndian #CoronaOutbreak
https://t.co/10b2KSzoy3",ketan72,india,Political & Social Analyst. #IndiaFirst Privilege - PM @narendramodi ji follows me. All views are Strictly Personal. RTs are not endorsements #VandeMataram,8210,179,254941,False,
2020-02-14 01:49:37+00:00,RT @ANI: China reports 116 more deaths in coronavirus epicentre: AFP news agency.,rahul08_kumar,durgapur india,"VENI VIDI VICI 
I came I saw I conquered",125,63,38870,False,China reports 116 more deaths in coronavirus epicentre: AFP news agency.
2020-02-14 01:49:58+00:00,"RT @DDNewslive: #coronavirus: China reports 63,767 confirmed cases of #COVID19, 505 cases reported from 24 other countries. Death toll 1487…",Mukesh1Bhardwaj,queen of hills shimla india,"Graduated( https://t.co/05ObmaIK4t mathematics honours), aspirant , love peace",374,257,23459,False,"#coronavirus: China reports 63,767 confirmed cases of #COVID19, 505 cases reported from 24 other countries. Death toll 1487 in China, 2 abroad. Death toll in #Hubei rise to 116 taking total toll to 1426 https://t.co/NvYZ1YKq6e"
2020-02-14 01:50:04+00:00,@ranjona This spineless BJP ministers like @drharshvardhan can’t take a glass of water without taking @narendramodi name. But truly speaking Modi is god to blind bhakts else after uttering so much lies he won’t have survived. Now he will treat corona virus with cow urine @waglenikhil,KT62779984,india,"Technocrat, Free thinker, liberal,atheist, believes in humanity only,hate religious fanaticism & prejudices.Opinion are personal.RT not endorsement,Read n write",137,230,7233,False,
2020-02-14 01:50:04+00:00,"India superpower? No. Not anytime soon.
However economic and military strength of India will grow and India may become fourth largest economy (after USA, EU, China) in next five years.",GargBharatvarsh,new delhi india,Engineer by education. Teacher by profession. Student of Veda. Striving to provide advice for betterment of society. Tamaso ma jyotirgamay. Om shanti.,12,2,2053,False,
2020-02-14 01:50:04+00:00,RT @sardesairajdeep: Full marks to Kerala Govt for tackling corona virus with speed and efficiency. Public health systems do work well at t…,prasan_kumar,chennai india,,241,342,63242,False,Full marks to Kerala Govt for tackling corona virus with speed and efficiency. Public health systems do work well at times!! https://t.co/GpwCbT0TFo
2020-02-14 01:50:04+00:00,"RT @USIBC: Read the @USIBC newsletter for the latest policy and event updates: President Trump sets a date for his 1st visit to India, #USI…",MayankRohatgi,ghaziabad india,The tweets are in my individual capacity and represent my thoughts only.,128,348,3481,False,"Read the @USIBC newsletter for the latest policy and event updates: President Trump sets a date for his 1st visit to India, #USIndia trade talks continue, #UnionBudget2020 receives mixed reviews and #coronavirus is a wildcard for the global economy https://t.co/jM9xplmNVf https://t.co/qMfC1PZQrU"
2020-02-14 01:50:19+00:00,"RT @Vishj05: Health Minister Harsh Vardhan: PM Modi is personally monitoring Coronavirus situation.

Journalist: Why?

Harshvardhan: He wan…",priyapyadav18,new delhi india,"I see humans.....but no humanity.
Jinhe naaz hai Hind par woh kahan hai...",11912,1000,22988,False,"Health Minister Harsh Vardhan: PM Modi is personally monitoring Coronavirus situation.

Journalist: Why?

Harshvardhan: He wants to go to China."
2020-02-14 01:50:27+00:00,RT @ImtiazMadmood: Saying greetings instead of shaking hands. Not eating animals but only vegetarian. Cremating the dead instead of burying…,sunil__pareek,jaipur india,IAF Veteran,437,67,9789,False,"Saying greetings instead of shaking hands. Not eating animals but only vegetarian. Cremating the dead instead of burying them.

Since Corona virus the world is becoming Hindu?"
2020-02-14 01:50:54+00:00,"RT @SindhiChokroVB: This!! This is what I was thinking 

Will this #CoronavirusOutbreak and the unrest there off topple the Chinese governm…",ArpanChatterji,mumbai india,Student Engineer Dreamer Collator Analyst Manager in the making,221,143,3628,False,"This!! This is what I was thinking 

Will this #CoronavirusOutbreak and the unrest there off topple the Chinese government and will China move towards a more democratic form of government!!?? https://t.co/uilAbDiB0y"
2020-02-14 01:51:03+00:00,"China’s coronavirus death toll rises to 1,483, more than 64,600 people infected
https://t.co/3xusA1yLhn",fpjindia,india,The voice of #Mumbai. The Free Press Journal is one of the oldest English daily newspapers from Mumbai with a heritage of more than 90 years.,11729,511,185811,True,
2020-02-14 01:51:04+00:00,"RT @drthomasisaac: Just as in the case of Nipah, Kerala has won battle with Corona Virus. All the 3 patients identified have been confirmed…",worldm_22,chennai india,Following 💙🖤 politics..,11,51,267,False,"Just as in the case of Nipah, Kerala has won battle with Corona Virus. All the 3 patients identified have been confirmed by Central authorities to have fully recovered. No case of secondary spread. Number under quarantine observation drastically coming down.Congats Health Dept."
2020-02-14 01:51:06+00:00,"RT @TrulyMonica: Saying Namaste instead of shaking hands

Cremating dead body instead of burying 

Eating Satvik vegetarian food instead of…",kunjee,india,"Functional Programmer for hire. F#, Scala, Kotlin. For web, mobile, cloud and everything around. Founder FuzzyCloud.",580,841,65957,False,"Saying Namaste instead of shaking hands

Cremating dead body instead of burying 

Eating Satvik vegetarian food instead of animals full of diseases

Our civilisation’s record of keeping us trouble-free is very underrated 😃 https://t.co/wgYwfa7CgK"
2020-02-14 01:51:21+00:00,"RT @nillkool9: According to the health ministry, there will be 7 types of corona viruses on February 14th..

1.  Corona..
2.  Aur Corona..…",ani_royal007,india,"☞जय शिव-राम-कृष्ण-ਵਾਹਿਗੁਰੂ IRespect humans instantly born on janamashtmi
Sallufan
!!  I keep changin m dp n pinned tweet.!! 
Insta-aniel_ani 
tweets links below",15539,10827,216107,False,"According to the health ministry, there will be 7 types of corona viruses on February 14th..

1.  Corona..
2.  Aur Corona.. 
3.  Bas Corona..
4. Mat corona..
5.  Dheere se Corona.. 
6.  Zor se Corona.. 
7.  Ek baar aur Corona!! 😄

#ValentinesDay 
#ValentinesDay2020"
2020-02-14 01:51:40+00:00,"RT @drthomasisaac: Just as in the case of Nipah, Kerala has won battle with Corona Virus. All the 3 patients identified have been confirmed…",pythoroshan,india,"Anaesthesiologist  (Human painkiller) ¦¦ 
Winner #TOIWriteIndia - S01 & 02 ¦¦ Finding #HeroesOfKindness across the world",8525,1918,66652,True,"Just as in the case of Nipah, Kerala has won battle with Corona Virus. All the 3 patients identified have been confirmed by Central authorities to have fully recovered. No case of secondary spread. Number under quarantine observation drastically coming down.Congats Health Dept."
2020-02-14 01:51:45+00:00,RT @nowthisnews: American televangelist Jim Bakker is selling a liquid that allegedly ‘kills’ the coronavirus for $300 https://t.co/sQYL9eJ…,MRoopchand143,india,"Life ... 😌📸📽️😂📱💵😓🐦🎧... 


[DON'T WISH ME ON MY BIRTHDAY, BECAUSE I DON'T WANT FILTERED AND FAKE WISHES.]",1613,472,1001613,False,American televangelist Jim Bakker is selling a liquid that allegedly ‘kills’ the coronavirus for $300 https://t.co/sQYL9eJTq6
2020-02-14 01:51:55+00:00,"RT @Nagendr94863129: @drharshvardhan
# corona virus
Dear Sir , 
Let you know, till now no check up, not a single doctor available in such t…",Dipti555,puri bbsr odisha india,Advisor | Cyber Risk | Cyber Security | Audit | eGov | Blog | Die-cast toys | Space Science  |  Photography | Books | Nature | Leadership,436,2323,4418,False,"@drharshvardhan
# corona virus
Dear Sir , 
Let you know, till now no check up, not a single doctor available in such type serious issues, whole thing manage by single nurse. And moreover the ward which is provided is so unhygienic and dirty, please see the photograph."
