created_at,full_text,screen_name,location,description,followers_count,friends_count,statuses_count,verified,full_retweet_text
2020-05-28 23:51:19+00:00,"RT @friendsofrss: 52 Units of blood have been donated by RSS Swayamsevaks for corona infected patients at Sanganer, Rajasthan. https://t.co…",bhagirathi29,mumbai india,Retweets are in no terms endorsements. Tweets are not personalized.,1230,638,207397,False,"52 Units of blood have been donated by RSS Swayamsevaks for corona infected patients at Sanganer, Rajasthan. https://t.co/j3TVXx0gTd"
2020-05-28 23:51:33+00:00,"All over the World the CoronaVirus, a very bad “gift” from China, marches on. Not good!",DrPoonamS135,india,"Consultant - Gastroenterologist & Therapeutic Endoscopist MBBS, MD (Internal Medicine)",5636,4422,5498,False,
2020-05-28 23:51:58+00:00,"Spain will open gradually to tourism, with Europe first
https://t.co/fdYVBBpB1L",tn_haokip,imphal india,"Former President,Manipur Pradesh Congress Committee.Former Minister and Speaker, Manipur Legislative https://t.co/ZHdTXLqMAf reading & traveling",1430,68,27074,True,
2020-05-28 23:52:21+00:00,RT @SanirSayyed: I wonder why BJP spokesperson #SambitPatra is in hospital when gaumutra and cowdung are available. #COVID19 https://t.co/J…,AMERGULAM,hyderabad india,Save India from Islamophobia.Strongly believe that India is Secular country. Be united. Work for Idea of India. Save India. Save Constitution.,768,2305,6400,False,I wonder why BJP spokesperson #SambitPatra is in hospital when gaumutra and cowdung are available. #COVID19 https://t.co/JjRtKcMxxC
2020-05-28 23:52:22+00:00,"RT @keyakahe: India has managed Covid 19 like no other country. When the world average of Covid positive patients per lakh is 62, India has…",IvanaPoddar,kolkata india,,371,199,2729,False,"India has managed Covid 19 like no other country. When the world average of Covid positive patients per lakh is 62, India has only 7.9 positive cases per Lakh !! Incredible is the only word to appreciate this. 
@narendramodi
#IndiaUnitedAgainstCovid https://t.co/ISUpZw2HKo"
2020-05-28 23:52:25+00:00,"RT @yusufpore: Now, in the midst of the #COVID19 #Pandemic, mounting deaths and the consequences of a cyclone (he is in-charge of #WestBeng…",AbbasAnsario786,mau india,"Politician,
Athlete (International Shooter)",723,159,284,False,"Now, in the midst of the #COVID19 #Pandemic, mounting deaths and the consequences of a cyclone (he is in-charge of #WestBengal), a national level General Secretary of the ruling party, calls for the scrapping of Article 30, related to minority rights.

Priorities anyone? https://t.co/EAa4rq898R"
2020-05-28 23:52:28+00:00,"#70beans #save70beans #covid_19 #pandemic 
—————————————————Challenging times for everyone! Particularly horrid times for the f&amp;b industry! Only 50% restaurants would survive post lockdown opening! 

Support… https://t.co/lPbwWsBlwH",ankitnavarkizzi,powai mumbai india,,660,2949,3539,False,
2020-05-28 23:52:31+00:00,"All your daily essentials are just a call away. Here is a list of our stores that are home delivering. Order now &amp; stay tuned to our page for more information.
#IndiaFightsCorona #StaySafe24Seven #24SevenStores https://t.co/6tr3zfpc4O",24SevenIN,new delhi india,"Over 100 stores in Delhi NCR and CHD Tricity #WeDeliver #Convenience #RoundTheClock - Fresh Food, Daily Essentials & Services ranging from Bill Payments to ATM",1310,69,2153,False,
2020-05-28 23:52:36+00:00,FII ownership in Nifty-500 hits five-year low during Q4; promoter holdings up post-COVID-19 outbreak: Motilal Oswal – Firstpost https://t.co/OS5NqhY7KC,newsiconicindia,india,"Newsiconic is your Newspaper, news, entertainment, music fashion website. We provide you with the latest breaking news & videos straight from the entertainment.",10,16,12288,False,
2020-05-28 23:52:44+00:00,"RT @Atul_Gawande: Doctors are being asked: Is working safe for me? When a 60 yr old nursing home cleaner asked @LarochelleMarc, he advised…",salmanravi,new delhi india,"Sufi by genes, Proud Indian first, BBC Correspondent covering insurgency, conflicts,mafia gangs, national/international politics. Views mine, not of the BBC.",10984,3139,6020,True,"Doctors are being asked: Is working safe for me? When a 60 yr old nursing home cleaner asked @LarochelleMarc, he advised her on protection at work. But she got COVID19 and died. Out of grief, he drafted this useful framework for when to say it’s not safe. https://t.co/fulMrqLCLr"
2020-05-28 23:52:46+00:00,RT @rohini_sgh: In this whole pandemic @HemantSorenJMM has been one CM who has consistently not only thought of the well being of migrants…,tripurarangchak,agartala india,"Proud to be a Tripuri,Dreamer,Fighter and a Civil Engineer by profession.",20,117,3837,False,In this whole pandemic @HemantSorenJMM has been one CM who has consistently not only thought of the well being of migrants but also their dignity. Everyone deserves to reach home- safely and with their dignity intact. Great gesture. https://t.co/bcZZbt46Ch
2020-05-28 23:52:53+00:00,"RT @RohitKohli236: Me: Lockdown maybe extended

Wife: stop watching news channels

Me: Economy is in shambles

Wife: stop watching news cha…",Mayankvatsya,new delhi india,"आवारा हू❤

No DM",1415,600,73477,False,"Me: Lockdown maybe extended

Wife: stop watching news channels

Me: Economy is in shambles

Wife: stop watching news channels

Me: when will this Vaccine come

Wife:stop watching news channels

Me:

Wife:stop watching news channels

Me:

Wife: stop watching news channels"
2020-05-28 23:53:03+00:00,"RT @kishanreddybjp: Mr.Ranjit Deb from Paikan, Hailakandi district of Assam received financial assistance under Pradhan Mantri Kisan Vikas…",BKanakaraju15,hyderabad india,CO-CONVENER BJP OBC MORCHA CANTONMENT ASSEMBLY SECUNDERABAD HYDERABAD TELANGANA..,58,231,5568,False,"Mr.Ranjit Deb from Paikan, Hailakandi district of Assam received financial assistance under Pradhan Mantri Kisan Vikas Yojana in #lockdown. Here’s a video of Ranjit extending his gratitude to Hon’ble PM @narendramodi ji for his timely support under #PMGKY. https://t.co/OaA2QExHEX"
2020-05-28 23:53:12+00:00,National Games Postponed Indefinitely Due To Coronavirus | Other Sports News https://t.co/qiOo0Y2SxQ,eRocketNews,india,https://t.co/lt0Puv1hBI,28,0,19762,False,
2020-05-28 23:53:12+00:00,"RT @GVMC_OFFICIAL: GVMC Permanent and Temporary Shelters for COVID-19.

#IndiaFightsCoronavirus https://t.co/LEyEUnP3Fe",taruntejaT13,vishakhapatnam india,😎😎😎,7,207,33,False,"GVMC Permanent and Temporary Shelters for COVID-19.

#IndiaFightsCoronavirus https://t.co/LEyEUnP3Fe"
2020-05-28 23:53:24+00:00,"Because of this corona, my one year gym membership is wasted. 

Warna is saal katrina figure to pakka tha by God.  

#morningworkout",Himmilicious,new delhi india,"Published, Scholar, Foodie and Quotes that matter, Just Not that fancy blue tick celebrity..",1606,19,16833,False,
2020-05-28 23:53:24+00:00,"RT @Kalpakkekre: #CoronaUpdates #Gujarat 
50% quota for #Corona Patients in Private Hospitals.

Govt makes it mandatory for Private  Hospit…",rrmallick,surat india,"#Banker,#Finance,#Politics,#Centrist,#Advaita,#Vedanta,#Bibliophile,#Blogger,#Music,#Movie,#Bollywood, #Diabetic,#Nature, #Healthy #Living",287,590,16903,False,"#CoronaUpdates #Gujarat 
50% quota for #Corona Patients in Private Hospitals.

Govt makes it mandatory for Private  Hospitals 🏥 and Nursing Homes with &gt; 20 beds 🛏  to provide 50% of their beds 🛌 for treatment of #Covid19 patients as per Rates fixed by GoG. https://t.co/2vGGFlBUre"
2020-05-28 23:53:26+00:00,"RT @LogicalIndians: Founded in 2016, Hidden Pockets Collective is a platform that connects young people with trusted professionals in #sexu…",BChudakkar,bihar india,"Old account @avbablu deleted, दो जवान बेटियों का बाप पर न फोन नंबर दूंगा न फोटो। बड़ी की......",136,249,3384,False,"Founded in 2016, Hidden Pockets Collective is a platform that connects young people with trusted professionals in #sexual and #reproductive #health care.

#EachOneReachOne #HeroesWithoutCape #CoronaWarriors #Coronavirus #COVID_19

https://t.co/Aljv9xg98o"
2020-05-28 23:53:31+00:00,"Considering Covid 19 crises we “Adiyogi” started a monthly yoga sessions for your societies by providing fixed trainer for one an half hour at very nominal charges (Rs. 500 Per Family)where we can assure everyone healthy and safe life,as yoga increase immunity. #healthcare https://t.co/7ErtfiI5Qu",DrAnjali2020,new delhi india,I’m a Wellness Expert as well i’m working with Adiyogi Organisation as a Director,10,61,27,False,
2020-05-28 23:53:36+00:00,It's again Good news for Barabanki. https://t.co/zdKISIWwaw,MauryaVipin88,lucknow india,mauryavipin,40,44,44,False,
2020-05-28 23:53:37+00:00,RT @kishanreddybjp: Our #CoronaWarriors have been at the forefront of India’s fight against the #COVID19 pandemic. Their valour in taking t…,BKanakaraju15,hyderabad india,CO-CONVENER BJP OBC MORCHA CANTONMENT ASSEMBLY SECUNDERABAD HYDERABAD TELANGANA..,58,231,5568,False,"Our #CoronaWarriors have been at the forefront of India’s fight against the #COVID19 pandemic. Their valour in taking the battle head-on and their service to humanity during difficult times like these is truly phenomenal. 
A big Thank you!
#IndiaUnitedAgainstCovid https://t.co/MAqNkxmtNC"
2020-05-28 23:53:51+00:00,RT @CNN: What questions do you have about the coronavirus pandemic? Tweet your questions with #CNNTownHall and we will feature some during…,trilok_pandit,patna india,followed by @JohnCena😳😍,339,764,34609,False,What questions do you have about the coronavirus pandemic? Tweet your questions with #CNNTownHall and we will feature some during a two-hour special tonight at 8 p.m. ET.
2020-05-28 23:53:53+00:00,"RT @khanumarfa: To counter Rahul Gandhi,anchor of a major news network lied abt 50,000 lives being saved due to lockdown without any eviden…",ForevrCongressi,india,Nehruvian ☆ Strongly influenced by PM Indira Gandhi & Rajiv Gandhi ☆ Forever with @INCIndia 🤚,2423,174,7083,False,"To counter Rahul Gandhi,anchor of a major news network lied abt 50,000 lives being saved due to lockdown without any evidence to support this stupid claim.
Whatsapp fwds making way to news bulletins now.
No fact-check,no accountability.
TV News is a joke &amp; anchors the new jokers."
2020-05-28 23:53:56+00:00,"RT @kishanreddybjp: In this #lockdown, the @narendramodi government introduced PM Garib Kalyan Yojana to assist the needy.
Here’s Mr. Nripe…",BKanakaraju15,hyderabad india,CO-CONVENER BJP OBC MORCHA CANTONMENT ASSEMBLY SECUNDERABAD HYDERABAD TELANGANA..,58,231,5568,False,"In this #lockdown, the @narendramodi government introduced PM Garib Kalyan Yojana to assist the needy.
Here’s Mr. Nripen Chandra Das from Hailakandi of Assam, thanking the PM for timely intervention providing free ration and gas under #PMGKY in this time of #COVID19 crisis. https://t.co/1QmtuZ1dT8"
2020-05-28 23:53:57+00:00,RT @SharmilaLaunda: Looks like the dog hairdresser has reopened illegally in lockdown!! 🤔😂 https://t.co/2BhZYcmjxZ,Mayankvatsya,new delhi india,"आवारा हू❤

No DM",1415,600,73477,False,Looks like the dog hairdresser has reopened illegally in lockdown!! 🤔😂 https://t.co/2BhZYcmjxZ
2020-05-28 23:53:58+00:00,"RT @pbhushan1: Strange! Empire strikes back? After the Guj HC made scathing remarks about Covid preparedness of Guj, &amp; called Ahmedabad Civ…",anirvan_y,uttar pradesh india,,121,493,12351,False,"Strange! Empire strikes back? After the Guj HC made scathing remarks about Covid preparedness of Guj, &amp; called Ahmedabad Civil hospital a dungeon, the bench dealing with the case is changed! Normally part heard cases are not shifted even if CJ changes the roster. https://t.co/9EIHnE69RO"
2020-05-28 23:54:04+00:00,"RT @RMBT_tweets: While woke Brahmin-Savarnas are demanding justice for George Floyd, let us draw your attention to what happened on Wednesd…",Bagria93deep,punjab india,"Not a keen observer/Engineer, love cold weather, Beardo, Foodie, Human made disaster, Impatient,  Philosuffer, Stubborn...",3905,3590,142622,False,"While woke Brahmin-Savarnas are demanding justice for George Floyd, let us draw your attention to what happened on Wednesday in your own backyard. A Brahmin priest in Odisha's cuttack chopped off a man's head inside temple to appease god and ward off Coronavirus. 1/2"
2020-05-28 23:54:06+00:00,"RT @IYC: Today marks the 64th day since IYC began serving food and water to people in need.

The human crisis of the pandemic is a tragedy…",abhijeet0284,india,A Nature Lover..Love Traveling..A Free Bird..Interested in Politics but not in Political Party..BBM PIN: 2B81B738  Email- abhijeet0284@gmail.com,1438,1978,65088,False,"Today marks the 64th day since IYC began serving food and water to people in need.

The human crisis of the pandemic is a tragedy that must be dealt with first and foremost. We appeal for direct money transfer to the poor. The poor needs help, not loans. https://t.co/IdJbqvcfG5"
2020-05-28 23:54:09+00:00,"RT @SharmilaLaunda: COVID 19 LOCKDOWN DAY 65

Telling your luggage there will be no vacation this year can be tough.

Emotional baggage is…",Mayankvatsya,new delhi india,"आवारा हू❤

No DM",1415,600,73477,False,"COVID 19 LOCKDOWN DAY 65

Telling your luggage there will be no vacation this year can be tough.

Emotional baggage is the worst!"
2020-05-28 23:54:20+00:00,"RT @Dev_Fadnavis: Sharing link of my complete conversation with @anjanaomkashyap on @aajtak on #coronavirus situation in Maharashtra.
https…",bhagirathi29,mumbai india,Retweets are in no terms endorsements. Tweets are not personalized.,1230,638,207397,False,"Sharing link of my complete conversation with @anjanaomkashyap on @aajtak on #coronavirus situation in Maharashtra.
https://t.co/JwlQ53xwA8
#CoronaInMaharashtra 
#coronainmumbai"
2020-05-28 23:54:27+00:00,RT @SirYuzvendra: People don't realize how tough a job it is being a parody account to this guy,KaranRitesh,india,,176,136,14548,False,People don't realize how tough a job it is being a parody account to this guy https://t.co/d9ETYHxbMC
2020-05-28 23:54:27+00:00,RT @KishanReddyOfc: Sri @kishanreddybjp responds to Sri @YashwantSinha's argument in @the_hindu last week that stimulus announced by Hon PM…,BKanakaraju15,hyderabad india,CO-CONVENER BJP OBC MORCHA CANTONMENT ASSEMBLY SECUNDERABAD HYDERABAD TELANGANA..,58,231,5568,False,"Sri @kishanreddybjp responds to Sri @YashwantSinha's argument in @the_hindu last week that stimulus announced by Hon PM @narendramodi ji is flawed. Hon MoS gave a point by point rebuttal proving the stimulus is rejuvenating &amp; lockdown has been effective.
https://t.co/7HrA15C16G https://t.co/sdLHS1Zqzx"
2020-05-28 23:54:29+00:00,"Lockdown World Need All Kind of Minds | The Latest Youtube Song 2020 | A Ventom International Video - Amayrruss Spreading A Noble Message Music Video To All Over The World That Every Human Brain Matters For The Development Of Technology,... https://t.co/02Qdvl8Xl8",VentomOfficial,new delhi india,Shanky RS Gupta Is The President Of Ventom Network India P.L,81,129,1129,False,
2020-05-28 23:54:29+00:00,Digital Strategy Tips For Businesses And Executives Amid Covid-19 https://t.co/gbVg7vEV1F,techworld_news,india,No.1 content for #technews | Turn On #notification bell for daily #technews | DM to know anything about #tech | Check out our link for latest #news,503,20,14893,False,
2020-05-28 23:54:33+00:00,"RT @TajinderBagga: I am giving Promise, After the Covid
 I will make a Documentary on Rajiv Gandhi Role in 1984 Massacre",Prem123414,mumbai india,"भाई हिन्दूवादी हूँ, साथ ही मोदी भक्त भी।
RT personal | किसी प्रकार के ज्ञान ना पेले",169,101,14717,False,"I am giving Promise, After the Covid
 I will make a Documentary on Rajiv Gandhi Role in 1984 Massacre"
