created_at,full_text,screen_name,location,description,followers_count,friends_count,statuses_count,verified,full_retweet_text
2020-03-16 20:42:37+00:00,"RT @amitbehere: Pakistani mullahs are treating coronavirus with onion &amp; wazeefas.

Meanwhile Indian bhakts are trying to treat it with cow…",namratapatne,mumbai maharashtra india,,98,161,8365,False,"Pakistani mullahs are treating coronavirus with onion &amp; wazeefas.

Meanwhile Indian bhakts are trying to treat it with cow urine while shouting slogans like ""corona shant ho""

CORONAVIRUS BE LIKE: I have been to every part of the world but never seen dumbasses like these anywhere"
2020-03-16 20:42:51+00:00,"RT @narendramodi: Harnessing innovation for a healthier planet. 

A lot of people have been sharing technology-driven solutions for COVID-1…",RanneetiR,india,"Ranneeti Research make videos for government performance, government schemes performance, people expectation from government, election opinion polls &exit polls",56,558,6635,False,"Harnessing innovation for a healthier planet. 

A lot of people have been sharing technology-driven solutions for COVID-19. 

I would urge them to share them on @mygovindia. These efforts can help many. #IndiaFightsCorona 

https://t.co/qw79Kjtkv2"
2020-03-16 20:42:53+00:00,"RT @AP: President Trump says the U.S. economy “may be” heading toward a recession amid the pandemic, and calls the virus the “invisible ene…",D91882373,india,running coder,22,118,8274,False,"President Trump says the U.S. economy “may be” heading toward a recession amid the pandemic, and calls the virus the “invisible enemy.” https://t.co/ASH0xwFYWi"
2020-03-16 20:43:06+00:00,"RT @ANI: US President: I'm pleased to report that a vaccine candidate has begun the phase-1 clinical trial, it's one of the fastest vaccine…",iabhayrp,lucknow uttar pradesh india,"Master in Manufacturing Engineering, IIT Bombay. Educator and mentor.
Unpredictable. Another brick in the wall.",450,537,51575,False,"US President: I'm pleased to report that a vaccine candidate has begun the phase-1 clinical trial, it's one of the fastest vaccine development launches in history. We're also racing to develop anti viral therapies &amp; other treatments, we have some promising early results. #COVID19 https://t.co/IPc6hCgb9t"
2020-03-16 20:43:06+00:00,"RT @VikasSaraswat: Filthy, squalid conditions in Taftan quarantine camp where Pakistan is housing its pilgrims returning from Iran. No medi…",Slea_Zilla,guragon india,"Patents mera #BreadAndButter, books aur writing ka ghar pe clutter, bike aajkal karti khatar khatar, bolta nahi mein bilkul patar patar!!!",258,303,39970,False,"Filthy, squalid conditions in Taftan quarantine camp where Pakistan is housing its pilgrims returning from Iran. No medicines, no food, no doctors. Inadequate bathrooms, stinking latrines.And Pak health minister @zfrmrza was lecturing India on how to attend #corona threat in J&amp;K https://t.co/f8Pzu03bq3"
2020-03-16 20:43:21+00:00,RT @ARanganathan72: The protesters of Shaheen Bagh are least bothered about kudrati corona. They are not bound by any man-made law. And the…,bikram_behera1,sonepur india,,31,192,562,False,"The protesters of Shaheen Bagh are least bothered about kudrati corona. They are not bound by any man-made law. And their handlers, the useful idiots, don't get this.

My views on @TimesNow with @navikakumar. #ShaheenBlocksCoronaWar https://t.co/Pihmg41GFJ"
2020-03-16 20:43:23+00:00,RT @PiyushGoyal: Combating #Coronavirus: Watch the proactive efforts taken by Railways to sanitise things prone to passenger touch in train…,oasis_jain,india,Oasis...,169,986,30363,False,"Combating #Coronavirus: Watch the proactive efforts taken by Railways to sanitise things prone to passenger touch in trains, making the journey more safe &amp; hygienic for all passengers. https://t.co/aE5vXUOmda"
2020-03-16 20:43:39+00:00,"RT @FutbolBible: 🇪🇸 R.I.P Francisco Garcia from Malaga.

Francisco was a 21 year old football coach in Spain, He was diagnosed with Coronav…",arka_cfc,kolkata india,"Editor/Correspondent at @IFManiacs  #CFC Fan since 2001
#DoubleEuropeanChampions #UTC
Plastics stay away....! #cfc #KTBFFH",1253,2760,43475,False,"🇪🇸 R.I.P Francisco Garcia from Malaga.

Francisco was a 21 year old football coach in Spain, He was diagnosed with Coronavirus and at the same time found he had cancer. Thoughts are with his family during this difficult time. https://t.co/NE1wehGjoo"
