created_at,full_text,screen_name,location,description,followers_count,friends_count,statuses_count,verified,full_retweet_text
2020-04-29 02:00:00+00:00,"RT @pradip103: You know what’s common between Kanhaiya Kumar, Jignesh Mevani, Hardik Patel, Mayawati, and Kavita Krishnan? All of them say…",BDodiya21,ahmadabad city india,"Ele. Engineer. 
I always stand with truth.
proud to be Hinduism.",14,87,802,False,"You know what’s common between Kanhaiya Kumar, Jignesh Mevani, Hardik Patel, Mayawati, and Kavita Krishnan? All of them say they are fighting for the poor. You know what’s other thing common between them? None of them is doing anything substantial for the poor during #lockdown."
2020-04-29 02:00:00+00:00,RT @ashokepandit: I am speechless &amp; my heart goes out to d security forces who are being treated worse than animals.Their only fault being…,kantichandel,jaipur india,,236,754,1239,False,"I am speechless &amp; my heart goes out to d security forces who are being treated worse than animals.Their only fault being that they want the people of d area to maintain #Lockdown so that they can b safe and secure. 
This visual is from #Howrah #Calcutta. 
#IndiaFightsCorona https://t.co/bRcsmHRhtj"
2020-04-29 02:00:00+00:00,"RT @BJP4Bengal: West Bengal Police personnel attacked by stone-pelting mob for trying to enforce lockdown in Tikiapara, Howrah. Thanks to M…",Pradeepraj2312,patna india,"नही बदल सकता हूं खुद को औरो के हिसाब से, एक लिबास मुझे भी दिया है मेरे भगवान ने अपने हिसाब से। जय श्री कृष्णा।🚩🚩🚩🚩🚩,BJP Supporter, राष्ट्र भक्त,",292,336,1231,False,"West Bengal Police personnel attacked by stone-pelting mob for trying to enforce lockdown in Tikiapara, Howrah. Thanks to Mamata Banerjee’ appeasement politics, her loyal voters are now attacking policemen, even while Bengal faces a tough fight against #Covid19 pandemic. https://t.co/TXzNreKvvR"
2020-04-29 02:00:01+00:00,"RT @Refugees: As you read this, refugees are:
🩺 Caring for the sick

🏥 Serving on front lines to fight coronavirus

💙 Saving lives

Learn m…",Periyarpriyan,india,"rationalist,socialist, anti religionist",54,371,2962,False,"As you read this, refugees are:
🩺 Caring for the sick

🏥 Serving on front lines to fight coronavirus

💙 Saving lives

Learn more about our work to prevent the spread of COVID-19: https://t.co/zR3SwSAQG7 https://t.co/V8qyK71tQt"
2020-04-29 02:00:01+00:00,"RT @majorgauravarya: Kuwait, Saudi Arabia, Qatar &amp; Oman jointly reject efforts of some of their citizens to accuse India of Islamophobia. I…",APointInTheXYZ,rajasthan india,No more tweets,339,524,7580,False,"Kuwait, Saudi Arabia, Qatar &amp; Oman jointly reject efforts of some of their citizens to accuse India of Islamophobia. Instead, they thank India for its “invaluable help” in fighting COVID-19.

⁦@OfficialDGISPR⁩ aur kitna zaleel hona chahte ho, bhai?  https://t.co/ehoPfMOjQX"
2020-04-29 02:00:05+00:00,"RT @MihirkJha: Just before Corona Lockdown, on some special intel, 100 Income Tax officers &amp; 200 CRPF Personnel took a chartered plane to R…",mukulbana,new delhi india,Proud Indian (nothing can top that!),30,30,286,False,"Just before Corona Lockdown, on some special intel, 100 Income Tax officers &amp; 200 CRPF Personnel took a chartered plane to Raipur, raided some top names in CG. 
Hundreds of crores found, the main target was seen rushing to CM @bhupeshbaghel's house with 5 Bags full of Papers"
2020-04-29 02:00:07+00:00,RT @taslimanasreen: Bangladesh's PM Sheikh Hasina is a friend of  a misogynist Islamist Ahmed Safi who is against education for girls. Paki…,abhinavim09,bengaluru india,Andh 'A'bhakts: please stay away!,272,813,48410,False,Bangladesh's PM Sheikh Hasina is a friend of  a misogynist Islamist Ahmed Safi who is against education for girls. Pakistan's PM  Imran Khan is a friend of a misogynist Islamist Tariq Jamil who blames women for Covid19. https://t.co/Dqx3kHnBYs
2020-04-29 02:00:08+00:00,"Separated By Lockdown, Esha Gupta Makes It Instagram Official With Spanish Boyfriend Manuel Campos Guallar https://t.co/t2RXYAOM5c https://t.co/ZQUESesyeE",TechWebking,hyderabad india,F1 digital tech top and trending 🔥🔥 news website 🔥hot Bollywood news 🇮🇳 hindi news 📱gadget and technology news 📰 https://t.co/Ck0mFi6ORB,34,142,8674,False,
2020-04-29 02:00:12+00:00,RT @listenshahid: Spent few hours in Red Zones. Visited houses as part of health survey teams.  Appreciate dedication of our team &amp; public’…,HappaNarinder,jammu j k india,"Born In Srinagar, J&K. Shifted to Jammu in 1990. Worked in Education Department, now retired. Interested in day to day affairs. Re-tweets are no endorsements.",1261,94,478620,False,"Spent few hours in Red Zones. Visited houses as part of health survey teams.  Appreciate dedication of our team &amp; public’s cooperation for City-wide survey. Sadly, we’ve a Covid +ve passing away today. Was 80+, diabetic, hypertensive. https://t.co/B5wmKufEAo"
2020-04-29 02:00:16+00:00,RT @7Rahulmishra: Many Thanks to our Border Road Organisation !,AJITKUM68809527,varanasi india,believe in simple living high thinking,10,35,976,False,Many Thanks to our Border Road Organisation ! https://t.co/Zi0HJlUXIw
2020-04-29 02:00:16+00:00,"RT @Sunil_Deodhar: A man beaten at Minister’s house

Accused Wadhawans enjoy ‘lockdown’ vacation

Sadhus die in barbaric #PalgharMobLynchin…",karthick_sk65,bengaluru india,🙂,278,47,135989,False,"A man beaten at Minister’s house

Accused Wadhawans enjoy ‘lockdown’ vacation

Sadhus die in barbaric #PalgharMobLynching

#ArnabGoswami attacked &amp; later grilled for 12 hrs for nothing serious.

This happened in Maharashtra when the state topped in #COVID19 cases.

#MahaEmergency"
2020-04-29 02:00:22+00:00,"RT @HasibaAmin: Why just vegetables? Stop buying oil from Muslim countries, stop buying medicines from Cipla and Wockhardt, stop taking hel…",noorulamin1989,kolkata india,,51,86,4304,False,"Why just vegetables? Stop buying oil from Muslim countries, stop buying medicines from Cipla and Wockhardt, stop taking help from Wipro. https://t.co/OT6O5wnua1"
2020-04-29 02:00:23+00:00,No use of blood donation plazma is not the treatment of corona kejriwal is a crook and bullshit master https://t.co/ySFwJbNTRe,vermakumarsuri1,delhi india,,6,18,2767,False,
2020-04-29 02:00:23+00:00,"RT @airnewsalerts: Maharashtra: With 729 new patients, the number of coronavirus cases climb to 9,318.",Dabangdubey18,mumbai india,I love my india,391,158,57140,False,"Maharashtra: With 729 new patients, the number of coronavirus cases climb to 9,318."
2020-04-29 02:00:25+00:00,"RT @GTUoffice: ""GSMS-GTU Webinar Series""

Graduate School of Management Studies, Gujarat Technological University is organizing Webinar Ser…",DrKaushalBhatt1,gujarat india,Academician in Management Education,43,69,62,False,"""GSMS-GTU Webinar Series""

Graduate School of Management Studies, Gujarat Technological University is organizing Webinar Series on ""International Business Beyond COVID-19""

REGISTER AT:- https://t.co/FbzodiRYNr
For any further query contact GSMS-GTU at: gsms@gtu.edu.in https://t.co/LXjf3RlzlH"
2020-04-29 02:00:25+00:00,"RT @bsindia: For 2021, the rating agency expects India’s growth to rebound to 6.2%

#COVIDー19 #coronavirus #economy

@indivjal reports

htt…",yellambal,mysore india,"advaita vedanta, indian culture,  economics and polity. disciple of sri Satchidanandendra Saraswati swamiji, holenarasipur",129,378,9231,False,"For 2021, the rating agency expects India’s growth to rebound to 6.2%

#COVIDー19 #coronavirus #economy

@indivjal reports

https://t.co/0PemavkEup"
2020-04-29 02:00:27+00:00,"RT @sambitswaraj: He needs someone who’s recovered from #COVID to donate plasma to help his ailing mother!
Please retweet and help so that…",AbhishikKarn,patna india,,45,74,3794,False,"He needs someone who’s recovered from #COVID to donate plasma to help his ailing mother!
Please retweet and help so that Faizan can save his mother🙏🙏 https://t.co/MRp7H1aLvj"
2020-04-29 02:00:28+00:00,"RT @AskAnshul: Around 40 people gathered at a Mosque for namaz in Aurangabad.

When some of the people were being arrested by police, mob p…",timeseek1970,india us,,217,1125,95037,False,"Around 40 people gathered at a Mosque for namaz in Aurangabad.

When some of the people were being arrested by police, mob pelted stones &amp; attacked police.

Till now, number of COVID-19 cases in Maharashtra stands at 8590 but still some people are not serious.

Pray at your home."
2020-04-29 02:00:28+00:00,"RT @GovernmentUpda1: Border Roads Organisation (BRO) has opened Rohtang Pass (13,500 feet above sea level) today, more than three weeks in…",AJITKUM68809527,varanasi india,believe in simple living high thinking,10,35,976,False,"Border Roads Organisation (BRO) has opened Rohtang Pass (13,500 feet above sea level) today, more than three weeks in advance amid Covid-19 lockdown after clearing snow. It is the arterial road connecting Lahaul and Spiti district of Himachal Pradesh from rest of the country. https://t.co/1mNN813AgX"
2020-04-29 02:00:29+00:00,"RT @CityLab: ""The two most obvious things that this pandemic has revealed in the little details of city living are sidewalk widths and balc…",alokita_sharma,rajasthan india,"State Coordinator (M&E, IEC) - Swachh Bharat Mission (Gramin), GoR | Development Practitioner | Urban Planner",842,92,221,False,"""The two most obvious things that this pandemic has revealed in the little details of city living are sidewalk widths and balcony depth,"" says city-planning consultant @BrentToderian. https://t.co/j0lHH7M43t"
2020-04-29 02:00:29+00:00,"RT @airnewsalerts: Two women beneficiaries of #UjjwalaYojana, in Rongo village in Changthang region in Leh, received the free cylinders dur…",radionews_kargi,kargil india,"Official account of Regional News Unit Kargil, All India Radio News",4423,153,7746,False,"Two women beneficiaries of #UjjwalaYojana, in Rongo village in Changthang region in Leh, received the free cylinders during the #Lockdown. 

Report @prasarbharti https://t.co/RvSMYwZ16a"
2020-04-29 02:00:31+00:00,"RT @HFWOdisha: District-wise data of #COVID19 positive cases &amp; recovered cases in #Odisha: As on 28th April. For any health assistance, cal…",prafulkrpatra,new delhi india,"Social Worker, Animal Lover 🐾            

सत्यमेव जायते ⚖ !!",1267,1571,106876,False,"District-wise data of #COVID19 positive cases &amp; recovered cases in #Odisha: As on 28th April. For any health assistance, call 104 Health Helpline. #coronavirus #OdishaFightsCorona https://t.co/FX4o6begvS"
2020-04-29 02:00:34+00:00,This is not good for attack of Corona Varriers.. https://t.co/Vzw68vtnl2,pankajaldyahoo,india,"My self Pankaj Mishra , working with Mesco steels Ltd manager Commercial in Orissa, basically home town in Allahabad (UP)",85,296,20,False,
2020-04-29 02:00:38+00:00,@rahulkanwal Pls stop giving e challans for speeding to essencial services employees in Delhi.We are already in stress and don't have any other option accept our own vehicles.Please cancel all the e challan of lockdown period.@ArvindKejriwal @dtptraffic @msisodia @ManishiChandra,sunilku46779167,ghaziabad india,Banker,4,50,41,False,
2020-04-29 02:00:39+00:00,"@awasthis Nice quote bro. But helpless in lockdown. As per government it's not going to end soon. Although people now understand, that a country will run smoothly without government also. In lockdown nothing is required.",annunkn,new delhi india,"Straight forward, strong Lad, sportsperson.Believes in Being Human Being Indian .",14,42,1735,False,
2020-04-29 02:00:40+00:00,"Good morning guys,how are you all,stay home stay safe #StayHome",Man_jupMan,india,"Working on my post graduation, hoping to get my dream job..... and promoter for Indexchain coin and a scammer destroyer. I hate scammers.i love being fair.",190,2133,19037,False,
2020-04-29 02:00:43+00:00,"RT @JhaSanjay: Malviya Maharaj

India is broke. You guys can’t take care of the middle class and the poor suffering migrants. And Rs 68000…",iqbalNafeesINC,uttar pradesh india,Zid karo Desh badlo ... kyuki zid ke aage jeet hai..,528,2935,13058,False,"Malviya Maharaj

India is broke. You guys can’t take care of the middle class and the poor suffering migrants. And Rs 68000 cr wilful defaulters debts written off ? Really? How come? Including Modi Ji’s  Mehul Bhai? 

Talk of priority, bro? https://t.co/ZoRKgyzGYP"
2020-04-29 02:00:43+00:00,RT @mmsimply: If only the virus would follow social distancing norms too!,tripathi1805,india,You always gain by giving love.,305,959,2774,False,If only the virus would follow social distancing norms too!
2020-04-29 02:00:43+00:00,"RT @AskAnshul: Around 40 people gathered at a Mosque for namaz in Aurangabad.

When some of the people were being arrested by police, mob p…",lost_vegabond,gaya india,"नमस्ते सदा वत्सले मातृभूमे 🇮🇳🙏
RW | Mechanical Engineer | Student | Teacher | Seeker | Loves Photography |
@IITGuwahati | @Chegg | @Cargill | @AdaniOnline",521,192,37968,False,"Around 40 people gathered at a Mosque for namaz in Aurangabad.

When some of the people were being arrested by police, mob pelted stones &amp; attacked police.

Till now, number of COVID-19 cases in Maharashtra stands at 8590 but still some people are not serious.

Pray at your home."
2020-04-29 02:00:44+00:00,RT @narendramodi: Had a warm exchange with PM @JustinTrudeau. Thanked him for looking after Indian citizens in Canada in these difficult ti…,mujahid_sajo10,meerut india,"निवर्तमान ज़िला मंत्री भाजपा (अ:स:)
वर्तमान मंडल उपाध्यक्ष(भाजपा) किठौर मेरठ",12,245,293,False,Had a warm exchange with PM @JustinTrudeau. Thanked him for looking after Indian citizens in Canada in these difficult times. Collaboration and partnership between India and Canada is vital to fighting the pandemic including through medical research and supply chain management.
2020-04-29 02:00:44+00:00,RT @republic: #ExtendLockdown | 5 days for lockdown 2.0 to end. What should be India’s next move?,Avi_Strong7775,new delhi india,Proud INDIAN | Hyper Nationalist | Unapologetic Bhakt | Rts not endorsements,156,501,41245,False,#ExtendLockdown | 5 days for lockdown 2.0 to end. What should be India’s next move?
2020-04-29 02:00:45+00:00,RT @narendramodi: Please thank Swetha for this creative and affectionate gesture. Her valuable wishes are a source of immense strength.,iVanditPatel,gujarat india,"“बीजेपी मेरा परिवार हैं, RSS मेरा संस्कार हैं, तिरंगा मेरी जान है, भगवा मेरी शान हैं, मोदीजी मेरा अभिमान हैं ” |",751,934,14843,False,Please thank Swetha for this creative and affectionate gesture. Her valuable wishes are a source of immense strength. https://t.co/diyow7Z7KO
2020-04-29 02:00:49+00:00,Dear sir please help ! @SaharanpurDm https://t.co/H6JRW8Gcep,BManjiet,rajasthan india,"Founder:  Samaj Vikas Anusandhan Sabha|
National Spokesperson -S.V.A.S |
हमारा आदर्श - न्यायिक , तार्किक व दूरदर्शी मानव हितकारी अनुसंधानात्मक विचारधारा।",62,115,774,False,
2020-04-29 02:00:49+00:00,"@AjazkhanActor Ukhad lena, waise bhi lockdown me sab band hai",kumar_rahul1987,india,,470,1170,14451,False,
2020-04-29 02:00:51+00:00,"RT @BillGertz: Breaking: Wuhan research laboratory ‘most likely’ origin of coronavirus, according to a U.S. government report obtained by @…",vikiitd,india,Stock Market Worshipper,756,555,16625,False,"Breaking: Wuhan research laboratory ‘most likely’ origin of coronavirus, according to a U.S. government report obtained by @WashTimes https://t.co/ecsjpc2s5q"
2020-04-29 02:00:53+00:00,"I've just posted a new blog: In Gujarat, 226 more cases of corona virus have been reported, total number 3,774 https://t.co/rKj6ule5PU",shiva46561290,india,Hello welcome to shiva iq govt jobs update here we provide you new govt jobs updates,6,0,1378,False,
2020-04-29 02:00:57+00:00,"RT @AmitAro87940490: Are you stranded in India due to unplanned lock down
Are you rich or politician- sending u a private charter
Are you s…",Madhuri18803720,bengaluru india,Teaching,77,95,1439,False,"Are you stranded in India due to unplanned lock down
Are you rich or politician- sending u a private charter
Are you student or labour- sending you buses
Are you tax paying  citizen-who cares about you moron
#resumedomesticflights @nsitharaman @AmitShah @narendramodi @PiyushGoyal"
2020-04-29 02:00:59+00:00,"PM asked us to stay where we are... Not to go home... Did you hear otherwise? 
Still Govt is a lot to get them home... UP for example is doing whatever it can to bring back its people... 
Check your facts before posting... https://t.co/wl8LRb6aPu",kohliarun123,noida india,A techy for as long as remember with much interest in current affairs...music has and will always be special to me:),52,153,132,False,
2020-04-29 02:00:59+00:00,RT @narendramodi: Had a warm exchange with PM @JustinTrudeau. Thanked him for looking after Indian citizens in Canada in these difficult ti…,yogeshb17155520,harda madhya pradesh india,"Bjp 
Wrestling and kabbadi",78,796,28,False,Had a warm exchange with PM @JustinTrudeau. Thanked him for looking after Indian citizens in Canada in these difficult times. Collaboration and partnership between India and Canada is vital to fighting the pandemic including through medical research and supply chain management.
2020-04-29 02:01:00+00:00,"RT @timesofindia: Trump says US will seek substantial damages from China for Covid 19 

Read: https://t.co/eExjEiKuSq https://t.co/ByAu0xKT…",PanditSwapnilH,dahanu india,Official Twitter Account,265,147,79774,False,"Trump says US will seek substantial damages from China for Covid 19 

Read: https://t.co/eExjEiKuSq https://t.co/ByAu0xKTSo"
2020-04-29 02:01:06+00:00,"RT @AtifBjp: Our Janata Rasoi is ready for those people who have become needy due to the lockdown, today with food for 600 people for the 3…",shrisurendraa,jaipur india,"एक ॐकार सतनाम, कर्तापुरख, निर्मोह निर्वैर, अकाल मूरत, अजूनी सभं. गुरु परसाद ॥",379,710,14956,False,"Our Janata Rasoi is ready for those people who have become needy due to the lockdown, today with food for 600 people for the 33rd consecutive day.
Today we prepared chana pulao, pakode, boiled safed chole and khajoor.
#IndiaFightsCoronavirus
#FeedTheNeedy 
@TajinderBagga https://t.co/Ic4cOYc2v6"
2020-04-29 02:01:08+00:00,"RT @DigambarPanchal: My 20 days experience of working in one of the largest Covid hospitals in Mumbai - 
1. We had 150 Covid positive patie…",drpoojarawat,india,,231,773,6087,False,"My 20 days experience of working in one of the largest Covid hospitals in Mumbai - 
1. We had 150 Covid positive patients when I joined(oropharyngeal swab tested), which increased rapidly within next 4-5 days to around 450 patients. Following are some of my clinical observations-"
2020-04-29 02:01:09+00:00,"RT @TheCricketerMag: Another top lockdown performance 👀

🎥 @cricketdistrict 

https://t.co/AcfoQ9Qlmx",RAGHAVVIJINC,panchkula india,http://Ex. SM State Co-ordinator~@SevadalHRY||Ex. Chairman Broadcast Committee~ @INCharyana||Ex. SM Secretary ~@INCharyana #SocialReformer #PoliticalActivist,1977,290,67701,False,"Another top lockdown performance 👀

🎥 @cricketdistrict 

https://t.co/AcfoQ9Qlmx"
2020-04-29 02:01:10+00:00,"RT @INCChandigarh: While other leaders are continuously working to help the needy in times of distress while maintaining social distancing,…",KuljitBachalINC,chandigarh india,"AICC Coordinator, Zonal Returning Officer at Youth Congress Election Authority.
Member Chandigarh Territorial Congress Committee.",393,487,10291,False,"While other leaders are continuously working to help the needy in times of distress while maintaining social distancing, our MP @KirronKherBJP ji can't even attend meetings being attended by Governor sir &amp; others. #ChandigarhWantsToKnow when will they see their MP in action? https://t.co/CNmXMGvIJQ"
2020-04-29 02:01:10+00:00,"RT @timesofindia: Tears of joy amid Corona Pandemic 

Haryana cops surprise elderly man living alone with cake on his birthday

The Retd. C…",NitinKhokhar11,karnal india,"ChOuDhArY 
RoR",36,68,313,False,"Tears of joy amid Corona Pandemic 

Haryana cops surprise elderly man living alone with cake on his birthday

The Retd. Colonel Saheb broke down at this gesture!

Have a look at the video here 👇 https://t.co/JmYWQqQng2"
2020-04-29 02:01:10+00:00,"@Uppolice @112UttarPradesh 

Your good intervention is needed for the animal as well as the two lil' kids stuck with this woman in question, for blatant violations of the PCA ACT as well as the DM Act. 

@gauri_maulekhi @TheDogMother_ @dogsneedhelp https://t.co/oA2LoDkv5b",ChetnaDJoshi,india,"I am time, the destroyer of all; I have come to consume the world.

Views Are Personal and Retweets Are Not Endorsements.",159,315,1623,False,
2020-04-29 02:01:10+00:00,"RT @fpjindia: Amid #coronavirus lockdown, Andhra Pradesh announces first of its kind fee reimbursement scheme for students
@ysjagan @Andhra…",sreedharredd,india,Be like a drug let them die for u,1412,857,5542,False,"Amid #coronavirus lockdown, Andhra Pradesh announces first of its kind fee reimbursement scheme for students
@ysjagan @AndhraPradeshCM 

#JaganannaVidyaDeevena #COVID19 #FeesReimbursement 

https://t.co/rksyg8vG9V"
2020-04-29 02:01:11+00:00,"RT @PitaRampal: #GodMorningWednesday
Use this lock down period to learn Who is the supreme God, who created this whole universe he can and…",DasPravinder,rewari india,on god duty,342,253,24987,False,"#GodMorningWednesday
Use this lock down period to learn Who is the supreme God, who created this whole universe he can and all your woes. to know why watch Ishwar TV 8:30 at pm https://t.co/D28MdSZZwV"
2020-04-29 02:01:12+00:00,"With mostly all major companies now either firing 60% of the staff or sending them on 3-4 months unpaid holidays, we are slowly moving into the fight to survive situation. Post lockdown will come with the highest rate of unemployment seen in the last 7 decades!",ashir93,new delhi india,"Well started leading one of the largest firms in Asia at age of 22, then co-founded a start up at age of 23, and now working to reach global market.",70,356,271,False,
2020-04-29 02:01:15+00:00,RT @sardesairajdeep: Here is a poignant ‘good’ news story: a man who saved up to go on Haj has now spent his savings on Covid relief instea…,sachinraj2706,india,"followed by @INCIndia. Moderate,  atheist , humanist n gazalcoholic. love swimming, moonlight n nature. RTs may nt be endrsmnts.",2216,2041,58997,False,Here is a poignant ‘good’ news story: a man who saved up to go on Haj has now spent his savings on Covid relief instead. Watch here! Yeh hai India! https://t.co/0Lb8PeYGbu
2020-04-29 02:01:20+00:00,"@samarr_and @WildCat_Mahi @CattyNiish @niveditapathakk @ImRiya69 @imjessica_twitz @Nehareeka15 @Vaishuiyermami @ImBellaBitch1 @vedzxx @badaditi @SizzlingShweta @ImAnjaliBhabhi @Ayisha_Mslut @Slux_Priya @rabia_anum_4567 @Randy_Ruchika @SlutMegha @__Vandana__ @aimaginary_girl @SuperSunnyTwitz @Darshni4u @Sluty_kanika @sluty_niharika @Ankita2688 @ehotnisa @GharwalAnkita @sinnersdiaries Good morning/afternoon /evening/night
Enjoy beautiful last 2 days of April of peace harmony  in love  happiness
 Happy  Wednsday
Stay safe stay home beautiful people
New day new hope
Happy new day Same story https://t.co/AvA517kE5F",sushilpershad,india,Understanding Humanity'??🌺,3996,348,118467,False,
2020-04-29 02:01:21+00:00,"RT @BJP4Bengal: West Bengal Police personnel attacked by stone-pelting mob for trying to enforce lockdown in Tikiapara, Howrah. Thanks to M…",kalna_biplab,west bengal india,"Books & Authors, Bengali कट्टर हिन्दु,

Hindusthan must be Hindu Rastra, 
भारतवर्षम् अवश्यमेव हिन्दुराष्ट्रम् भविष्यति
VHP Dakkshin Banga
🕉️🕉️🕉️🚩🚩🚩",646,781,16396,False,"West Bengal Police personnel attacked by stone-pelting mob for trying to enforce lockdown in Tikiapara, Howrah. Thanks to Mamata Banerjee’ appeasement politics, her loyal voters are now attacking policemen, even while Bengal faces a tough fight against #Covid19 pandemic. https://t.co/TXzNreKvvR"
2020-04-29 02:01:23+00:00,RT @dpradhanbjp: Women in Odisha have shown exemplary grit and determination and are playing a crucial role in the fight against #COVIDー19.…,RajeshM99271505,bhubaneshwar india,PROUD TO BE AN INDIAN🇮🇳,64,263,1936,False,"Women in Odisha have shown exemplary grit and determination and are playing a crucial role in the fight against #COVIDー19. 

Salute our #NariShakti for their #IspatiIrada for a happier and healthier Odisha. 
#OdishaFightsCorona
#IndiaFightsCorona https://t.co/CIPMeMWYto"
