created_at,full_text,screen_name,location,description,followers_count,friends_count,statuses_count,verified,full_retweet_text
2020-02-28 01:54:01+00:00,"RT @abhijitmajumder: Now imagine if the same barbarism was inflicted on an FBI sleuth in America, an FSB operative in Russia, an MSS offici…",kukkooraaz,new delhi india,Talent Acquisition Manager,241,2266,7971,False,"Now imagine if the same barbarism was inflicted on an FBI sleuth in America, an FSB operative in Russia, an MSS official in China, a Mossad man in Israel, or a DGFI guy in Bangladesh. We know how they would respond. I want to see how India responds. #delhivoilence https://t.co/Bci4fcVWfI"
2020-02-28 01:54:00+00:00,"RT @ScottGottliebMD: THREAD: We can confront #coronavirus with science. We need a concerted effort now to develop diagnostics, vaccines, an…",AyushBardhan99,kolkata india,"Medical student | Interested in XR, AI, and healthcare.",57,69,4462,False,"THREAD: We can confront #coronavirus with science. We need a concerted effort now to develop diagnostics, vaccines, and therapeutics. What does this entail? 1. We must put significant money behind these efforts now. We have window of opportunity but we must seize this moment 1/n"
2020-02-28 01:54:01+00:00,"RT @adgpi: #CORONAVIRUS

#IndianArmy quarantine facility near #Manesar receives 114 #Indian &amp; five Foreign nationals who were on board #Dia…",chidswami,mumbai india,महामण्डलेश्वर श्रीमहानिर्वाणी अखाड़ा,2702,702,35902,False,"#CORONAVIRUS

#IndianArmy quarantine facility near #Manesar receives 114 #Indian &amp; five Foreign nationals who were on board #DiamondPrincessCruiseShip off #Japan coast. They will be monitored by a qualified team of doctors, to watch for any signs of infection.

#NationFirst https://t.co/kTM2NMmLa1"
2020-02-28 01:53:55+00:00,Chang'e 4 rover reveals new details of the lunar surface https://t.co/Pun6LKwDM6  @wionews,vajapeyam,india,"When will Indians in general get out of ""DYNASTY POLITICS SYNDROME"",if at all they can? 😡😔😕😬",3222,4294,269753,False,
2020-02-28 01:53:56+00:00,"MKM suggests ‘stay at home’ stocks like Peloton, Netflix vs coronavirus https://t.co/7hcZLRxMTC https://t.co/2r4orGAuhU",jobgujnews3,india,,31,250,20272,False,
2020-02-28 01:53:50+00:00,"RT @eladgil: Playing with John Hopkins Coronavirus case data this AM. 

This is various Chinese regions (excluded Hubei/Wuhan due to scale)…",AyushBardhan99,kolkata india,"Medical student | Interested in XR, AI, and healthcare.",57,69,4462,False,"Playing with John Hopkins Coronavirus case data this AM. 

This is various Chinese regions (excluded Hubei/Wuhan due to scale)

Looks like first wave is flattening. https://t.co/VXeyjb36d5"
2020-02-28 01:53:46+00:00,@taehellabae @JM_Sparkle Bighit cancelled all the south korea concerts coz of the corona,girlwidluv,hyderabad india,"ʸᵉᵃʰ ʷᵉ ᵃʳᵉ ⁿᵒᵗ ˢᵉᵛᵉⁿ, ʷᶦᵗʰ ʸᵒᵘ",633,694,6547,False,
2020-02-28 01:53:44+00:00,RT @bsindia: #CoronavirusOutbreak: The govt is soon expected to take up for consideration a scheme that will aim at boosting the manufactur…,Srivastava58818,lucknow india,,68,1326,10178,False,"#CoronavirusOutbreak: The govt is soon expected to take up for consideration a scheme that will aim at boosting the manufacturing of smart phones, semi-conductors, and other high-value tech goods, report @aruproytweets &amp; @alnehaa 

#Coronavirus 

https://t.co/qmr6zqphJy"
2020-02-28 01:53:23+00:00,RT @choi_bts2: Bighit said Seoul Map of The Soul Tour concert which was scheduled on 4/11-12 &amp; 4/18-19 has been cancelled due to the preven…,Vante_bear_,india,"🅃🅁🄴🄰🅃 🄿🄴🄾🄿🄻🄴 🅆🄸🅃🄷 🄺🄸🄽🄳🄽🄴🅂🅂








































































🅘 🅟🅤🅡🅟🅛🅔 🅨🅞🅤",4527,4485,47128,False,Bighit said Seoul Map of The Soul Tour concert which was scheduled on 4/11-12 &amp; 4/18-19 has been cancelled due to the preventing the spread of COVID-19 (corona virus). The ticket fees will be refunded. @BTS_twt https://t.co/HAmk94KeNd
2020-02-28 01:53:24+00:00,"Hope some of them don't carry Corona.

https://t.co/vg5aTeEMYp",dksardana,india,"Mech Engr(75) from UOR, now IIT Roorkee.Power sector consultant. Sickulars,Pidis please stay away.RTs not endorsements. जननी जन्मभूमि स्वर्ग से महान है.",3862,1951,111261,False,
2020-02-28 01:53:10+00:00,"RT @Pardeep34762578: #GodMorningFriday

Sant Rampal Ji Maharaj is describing well what is written in our holy scriptures ?
Who is Supreme G…",kumarvijay4657,madhya pradesh india,Kabir is supreme god.,296,811,3530,False,"#GodMorningFriday

Sant Rampal Ji Maharaj is describing well what is written in our holy scriptures ?
Who is Supreme God?
 &amp; Who is worthy to be worshipped? 
✳️Must watch Sadhna TV  from 7:30 p.m. IST
Hindu muslim America iran china https://t.co/D0JLioiXen"
2020-02-28 01:53:04+00:00,"While whole world is fighting CV (Corona Virus), we Indians are fighting few decade old CV (Communal Violence). Cure will be found for Corona Virus, when will we find cure for Communal Violence???   #CoronavirusOutbreak #DelhiRiots2020 #India #DelhiViolence",gsshenoy,udupi india,,94,392,3234,False,
2020-02-28 01:52:21+00:00,RT @OH_mes2: Big Hit Entertainment announces BTS's concert 'MAP OF THE SOUL TOUR SEOUL' has been cancelled due to the Coronavirus outbreak…,jojo_munu,india,,262,195,229472,False,Big Hit Entertainment announces BTS's concert 'MAP OF THE SOUL TOUR SEOUL' has been cancelled due to the Coronavirus outbreak https://t.co/TWdk4Zv7YI
2020-02-28 01:52:15+00:00,"RT @satyug20201: #GodMorningFriday

Sant Rampal Ji Maharaj is describing well what is written in our holy scriptures ?
Who is Supreme God?…",kumarvijay4657,madhya pradesh india,Kabir is supreme god.,296,811,3530,False,"#GodMorningFriday

Sant Rampal Ji Maharaj is describing well what is written in our holy scriptures ?
Who is Supreme God?
 &amp; Who is worthy to be worshipped? 
✳️Must watch Sadhna TV  from 7:30 p.m. IST
Hindu muslim America iran china https://t.co/goZVKczlBv"
2020-02-28 01:52:15+00:00,The Bull market is infected with the Corona virus 🦠 #Darona_Virus 🤭 @Mitesh_Engr @Atulsingh_Asan @AnyBodyCanFly,SagarVVKarle,pune india,"Dog lover, Nature & Animal, 📉 Intraday Trader 📈..Dreamer..Optimist.. पुणेकर :) Aquarius",72,110,295,False,
2020-02-28 01:52:16+00:00,Japan Abe: Will Take Steps If Needed To Ensure Coronavirus Outbreak Doesn't Inflict Huge Damage To Japan's Economy,FirstSquawk,india,Firstsquawk is a global squawk service specialising in financial markets of India and global macro We get all of our news from our @RedboxWire terminal.,61853,1310,57472,False,
2020-02-28 01:52:07+00:00,RT @OH_mes2: Big Hit Entertainment announces BTS's concert 'MAP OF THE SOUL TOUR SEOUL' has been cancelled due to the Coronavirus outbreak…,Sindhureal2,india,Trust in yourself. Spread love and happiness. Forgive and forget. Peace✌️,134,734,6041,False,Big Hit Entertainment announces BTS's concert 'MAP OF THE SOUL TOUR SEOUL' has been cancelled due to the Coronavirus outbreak https://t.co/TWdk4Zv7YI
2020-02-28 01:52:01+00:00,"Global selling intensifies
Dow drops 1190 points, worst single-day point drop ever
US markets enter correction zone, down 11% from peak
Goldman Sachs sees no earnings growth this year
Virus cases balloon globally
CBOE Vix up 130% this week

#Markets #MarketWatch #coronavirus https://t.co/3FkuKrDzoO",deepdbhandari,mumbai india,"Anchor at @zeebusiness 
Catch Me On Air At 8:00-10:30 AM & 2:00-3:30 PM
Let’s talk Markets, Economy and Policymaking.",5401,1087,3850,True,
2020-02-28 01:52:01+00:00,"RT @jogakhichudi: Another example of cover fire to jihadi Tahir Hussain and his marauding mob by @irenaakbar 
Madam is equating already dis…",patriot11112,karnataka india,,11,17,1771,False,"Another example of cover fire to jihadi Tahir Hussain and his marauding mob by @irenaakbar 
Madam is equating already discovered n widely seen proof of - crates of bottled turned petrol bombs, acid packets, bricks &amp; rocks to her dainty rich China and ceramic sets!!! https://t.co/E7YFQOmIPu"
2020-02-28 01:52:02+00:00,RT @ImtiazMadmood: India and Pakistan are China's neighbours. Both are poor countries with low per capita income and low quality heath serv…,AmitDahiya26,haryana india,,36,232,3789,False,"India and Pakistan are China's neighbours. Both are poor countries with low per capita income and low quality heath services.

Case of reported Corona are too low to be true. It will hit b8g time soon like Iran."
2020-02-28 01:51:53+00:00,"RT @abhijitmajumder: Now imagine if the same barbarism was inflicted on an FBI sleuth in America, an FSB operative in Russia, an MSS offici…",rbavinash,varanasi india,proud INDIAN,218,201,55027,False,"Now imagine if the same barbarism was inflicted on an FBI sleuth in America, an FSB operative in Russia, an MSS official in China, a Mossad man in Israel, or a DGFI guy in Bangladesh. We know how they would respond. I want to see how India responds. #delhivoilence https://t.co/Bci4fcVWfI"
2020-02-28 01:51:52+00:00,"RT @AlArabiya_Eng: #Iran’s former Ambassador to Vatican Sayyed Hadi #Khosroshahi dies of the novel coronavirus infection, reports Iranian n…",iambhutia,bengaluru india,#Entrepreneur #Speaker #AI #ML #DataScience #EmpathyInAI #Mentor @fastercapital @aic_smutbif,8505,1226,59440,True,"#Iran’s former Ambassador to Vatican Sayyed Hadi #Khosroshahi dies of the novel coronavirus infection, reports Iranian news media.

https://t.co/m3krY3T5aq"
2020-02-28 01:51:53+00:00,"RT @EconomicTimes: Coronavirus Outbreak | 195 Indians, 41 foreign nationals evacuated from Wuhan, quarantined cruise ship

Download the ET…",AKOLKARNAKUL,gujarat india,"contemplative, analytical retweets do not necessarily mean endorsements",19,110,1579,False,"Coronavirus Outbreak | 195 Indians, 41 foreign nationals evacuated from Wuhan, quarantined cruise ship

Download the ET App here: https://t.co/OpmgPJ3iU4 https://t.co/qIPJtNtehg"
2020-02-28 01:51:48+00:00,RT @JohnArnoldFndtn: Coronavirus treatment or vaccine seems like perfect use case for a prize fund. $10 billion prize to first company that…,badshahs,hyderabad india,"India, Tech, Cricket, Movies etc....My tweets have nothing to do with my employer !!!!",353,391,4111,False,Coronavirus treatment or vaccine seems like perfect use case for a prize fund. $10 billion prize to first company that makes effective drug and freely licenses the IP globally.
2020-02-28 01:51:46+00:00,"#coronavirus infection rate in Iran is zooming. 
Deputy Minister of Health had a press-con day before &amp; yesterday he declared positive for #coronavirus while parliament was in session. Now their Ambassador is dead.
@balajis @AdityaRajKaul @ipradhan @sumitragoenka @imlakshmishenoy https://t.co/3fVc4518cm",iambhutia,bengaluru india,#Entrepreneur #Speaker #AI #ML #DataScience #EmpathyInAI #Mentor @fastercapital @aic_smutbif,8505,1226,59440,True,
2020-02-28 01:51:33+00:00,"RT @satyug20201: #GodMorningFriday

Sant Rampal Ji Maharaj is describing well what is written in our holy scriptures ?
Who is Supreme God?…",DadMandsour,madhya pradesh india,students,330,726,8876,False,"#GodMorningFriday

Sant Rampal Ji Maharaj is describing well what is written in our holy scriptures ?
Who is Supreme God?
 &amp; Who is worthy to be worshipped? 
✳️Must watch Sadhna TV  from 7:30 p.m. IST
Hindu muslim America iran china https://t.co/goZVKczlBv"
2020-02-28 01:51:24+00:00,"RT @GappistanRadio: @runjhunmehrotra Literally 4 din ki zindagi with Coronavirus around us, at least I will spend it tweeting :D",SanjayGpm,new delhi india,"Urban farmer, Nature lover",6002,6286,15209,False,"@runjhunmehrotra Literally 4 din ki zindagi with Coronavirus around us, at least I will spend it tweeting :D"
2020-02-28 01:51:22+00:00,"RT @Kaala_Nag: China Sends ""Army"" To Pakistan: 100,000 Ducks To Fight Locust Swarms 😂😂

Kaala_Nag: Niazi's is having fantastic plans to sol…",dksardana,india,"Mech Engr(75) from UOR, now IIT Roorkee.Power sector consultant. Sickulars,Pidis please stay away.RTs not endorsements. जननी जन्मभूमि स्वर्ग से महान है.",3862,1951,111261,False,"China Sends ""Army"" To Pakistan: 100,000 Ducks To Fight Locust Swarms 😂😂

Kaala_Nag: Niazi's is having fantastic plans to solve paxstan's debt. Don't believe me just watch the l video👇
 https://t.co/4PHPUrmw7w https://t.co/rFCWOloaQV"
2020-02-28 01:51:21+00:00,RT @choi_bts2: Bighit said Seoul Map of The Soul Tour concert which was scheduled on 4/11-12 &amp; 4/18-19 has been cancelled due to the preven…,SanAnusha,new delhi india,"In love with @BTS_twt 🎶🎵🎹
I wasn't here from the beginning, but I will be with you till the end and beyond

💝🌜🌟Choose kindness☀️🌛💝

🌈LGBTQ  supporter🌈",265,255,61189,False,Bighit said Seoul Map of The Soul Tour concert which was scheduled on 4/11-12 &amp; 4/18-19 has been cancelled due to the preventing the spread of COVID-19 (corona virus). The ticket fees will be refunded. @BTS_twt https://t.co/HAmk94KeNd
2020-02-28 01:51:16+00:00,RT @BNODesk: NEW: Lithuania reports first case of coronavirus https://t.co/eUoE2b20hL,Sohamchels,india,,484,1034,20580,False,NEW: Lithuania reports first case of coronavirus https://t.co/eUoE2b20hL
2020-02-28 01:51:15+00:00,"India added 3 billionaires a month in 2019; highest after US, China: Report https://t.co/PT2UL6fAH6  @wionews",vajapeyam,india,"When will Indians in general get out of ""DYNASTY POLITICS SYNDROME"",if at all they can? 😡😔😕😬",3222,4294,269753,False,
2020-02-28 01:51:11+00:00,"RT @dwnews: #Coronaviruses are passed on by droplet infection, the virus multiplies in the throat. What concrete measures can you take to p…",SaubashyaSur,india,PhD; Assistant Professor@Ramananda College Bankura University; Interests & Expertise in Bioinformatics # Formerly @liu_universitet @FU_Berlin @UmeaUniversity,333,655,15199,False,"#Coronaviruses are passed on by droplet infection, the virus multiplies in the throat. What concrete measures can you take to protect yourself and others from a droplet infection?

https://t.co/o3Y8a1a6rT"
2020-02-28 01:51:07+00:00,RT @BNODesk: NEW: Lithuania reports first case of coronavirus https://t.co/eUoE2b20hL,JatNationalist,india,Traditional Conservative. Hardcore Nationalist. Currently focused on the Coronavirus (COVID-19).,1577,702,10693,False,NEW: Lithuania reports first case of coronavirus https://t.co/eUoE2b20hL
2020-02-28 01:51:08+00:00,"RT @EddyElfenbein: Shares of $ZOOM are up 50% today because video conferencing is expected to benefit from the coronavirus. 

One small pro…",sridharpandu,chennai india,Founder & CTO Sastra Technologies | Product architect the AnyBank Platform,163,206,1238,False,"Shares of $ZOOM are up 50% today because video conferencing is expected to benefit from the coronavirus. 

One small problem. It's wrong company. Zoom is $ZM.

$ZOOM has been out of business for years. 

Score one for efficient markets!

cc @asymmetricinfo"
2020-02-28 01:50:58+00:00,"Thankfully, am not in North Korea with COVID 19 https://t.co/U9TFCCcDmF",SunderjiJB,bengaluru india,Full Time Trader. Quit Job in 2018. A Star Gazer. Living on an organic spaceship flying through space.  Work ☕ Pursue 🎯 Unwind ⛺ Explore🌌,20900,109,6151,False,
2020-02-28 01:50:57+00:00,RT @NorbertElekes: BREAKING: A patient's dog in Hong Kong tests weak positive for coronavirus.,kolkata_guy,india,"Indian, Bengali, Engineer, Traveller.",243,2931,13751,False,BREAKING: A patient's dog in Hong Kong tests weak positive for coronavirus.
2020-02-28 01:50:51+00:00,"RT @Pardeep34762578: #GodMorningFriday

Sant Rampal Ji Maharaj is describing well what is written in our holy scriptures ?
Who is Supreme G…",AnkitSi34195096,jaunpur india,"1⃣0⃣0⃣%Follow🔙
I am a student of B.Ed",3549,4765,30331,False,"#GodMorningFriday

Sant Rampal Ji Maharaj is describing well what is written in our holy scriptures ?
Who is Supreme God?
 &amp; Who is worthy to be worshipped? 
✳️Must watch Sadhna TV  from 7:30 p.m. IST
Hindu muslim America iran china https://t.co/D0JLioiXen"
2020-02-28 01:50:51+00:00,"RT @IlhanMN: Let this sink in: Mike Pence, who enabled the worst HIV outbreak in Indiana’s history, is leading the coronavirus response.

A…",ShaikAs64566574,bengaluru india,,90,234,6189,False,"Let this sink in: Mike Pence, who enabled the worst HIV outbreak in Indiana’s history, is leading the coronavirus response.

A real public health professional must step up to handle this. This is not a drill — lives are at stake."
2020-02-28 01:50:51+00:00,"RT @abhijitmajumder: Now imagine if the same barbarism was inflicted on an FBI sleuth in America, an FSB operative in Russia, an MSS offici…",sumanthjain,india,,168,388,33680,False,"Now imagine if the same barbarism was inflicted on an FBI sleuth in America, an FSB operative in Russia, an MSS official in China, a Mossad man in Israel, or a DGFI guy in Bangladesh. We know how they would respond. I want to see how India responds. #delhivoilence https://t.co/Bci4fcVWfI"
2020-02-28 01:50:00+00:00,"RT @imDipendraji: #GodMorningFriday
Sant Rampal Ji Maharaj is describing well what is written in our holy scriptures ?
Who is Supreme God?…",kumarvijay4657,madhya pradesh india,Kabir is supreme god.,296,811,3530,False,"#GodMorningFriday
Sant Rampal Ji Maharaj is describing well what is written in our holy scriptures ?
Who is Supreme God?
 &amp; Who is worthy to be worshipped? 
✳️Must watch Sadhna TV  from 7:30 p.m. IST
Hindu muslim America iran china https://t.co/7u1xciRVaI"
2020-02-28 01:49:52+00:00,"RT @TrumpWarRoom: CNN has spent days spreading panic about coronavirus. 

But last night, just as the White House was explaining the timeli…",SAMEER0107,mumbai india,"तेरा मेरा रिश्ता क्या?
काशी, मथुरा, अयोध्या!
 proudly followed by
 @TajinderBagga @KapilMishra_Ind ,@Shehzad_Ind",564,409,102209,False,"CNN has spent days spreading panic about coronavirus. 

But last night, just as the White House was explaining the timeline for a vaccine trial, CNN cut away to a townhall with Michael Bloomberg.

They’re whipping up hysteria just to hurt @RealDonaldTrump! https://t.co/AESNXIGZUv"
2020-02-28 01:49:39+00:00,India supends all flights coming from Iran amid coronavirus scare: DGCA https://t.co/6NK5mrKRAi,vajapeyam,india,"When will Indians in general get out of ""DYNASTY POLITICS SYNDROME"",if at all they can? 😡😔😕😬",3222,4294,269753,False,
2020-02-28 01:49:35+00:00,"Coronavirus could kill 45,000,000 and infect 60 per cent of global population https://t.co/ixF6aokqqI via @MetroUK",abhytawde,mumbai india,"@VU3OHE , Proud Indian, I Love My India🇮🇳  “The views expressed here are MY PERSONAL views and no way, it reflects the view of any organisation or Individual”",816,307,8060,False,
2020-02-28 01:49:07+00:00,"Opinion | Is there any relationship between the new #coronavirusoutbreak and #globalwarming? 

https://t.co/tAzkXnxNIl",FinancialXpress,new delhi india,"The #FinancialExpress - A complete up-to-date source for business news, #finance news, #stockmarket news, #economy & #financial news online. 
हिंदी में @fehindi",618230,41,350110,True,
2020-02-28 01:49:07+00:00,RT @Reuters: Breakingviews - Breakdown: Coronavirus goes global https://t.co/LXAllM5qbo https://t.co/UfTPnZEOKw,babagoswammi,mumbai india,भारत माता की जय। सर्व प्रथम भारतीय हूं। फिर हिंदू वह भी नागपुर से। 🚩🚩🚩🌞🚩🚩🚩,5135,5480,12289,False,Breakingviews - Breakdown: Coronavirus goes global https://t.co/LXAllM5qbo https://t.co/UfTPnZEOKw
2020-02-28 01:49:00+00:00,RT @imVertica: Makes sense with this message - “No country should assume it won’t get cases. That could be a fatal mistake.” Are you listen…,imVertica,new delhi india,Entrepreneur/ Speaker/ Mastering Scaling-up/ Helping WOMEN rise/ ASIA BOOK OF RECORD for WATER Aw/ Daily Reporting to little Daughter/ ♥️Singing/ Wouldbe Author,432,377,1847,False,"Makes sense with this message - “No country should assume it won’t get cases. That could be a fatal mistake.” Are you listening India?
#CoronaVirusUpdates #coronavirus #coronavirusindia https://t.co/D6T8nZULJp"
2020-02-28 01:48:41+00:00,"RT @Swapnasneha: @mmvora369 @caamresh Consumers, according to age and gender:-
1. Youth busy in CAA
2. Elderly in Corona
3. Women in delaye…",GyanKaPitara,barmer india,"Son, Husband, Father, real and simple..
Auth. Direct and Indirect Tax practitioner, *team AIMTPA*.
salaam|namaste",1016,873,28364,False,"@mmvora369 @caamresh Consumers, according to age and gender:-
1. Youth busy in CAA
2. Elderly in Corona
3. Women in delayed Nirbhaya rapists death penalty.

Very few are still speaking on economy, GST, tax pressure."
2020-02-28 01:48:42+00:00,"RT @OH_mes2: 256 new cases of Coronavirus in Korea 

There are a total of 2,022 cases in Korea",jojo_munu,india,,262,195,229472,False,"256 new cases of Coronavirus in Korea 

There are a total of 2,022 cases in Korea https://t.co/1WqOG0yIZN"
2020-02-28 01:48:24+00:00,"RT @CGTNOfficial: Latest on #CoronavirusOutbreak in China: 

Daily number of new recovered cases has exceeded new confirmed #COVID19 infect…",maverickgold7,jaipur india,"Fixed Income Trader, Macro Themes, Eurodollar/Euribor/Short Sterling STIRS.",787,109,225,False,"Latest on #CoronavirusOutbreak in China: 

Daily number of new recovered cases has exceeded new confirmed #COVID19 infections for nine straight days. https://t.co/vWcsNQpGZn"
2020-02-28 01:31:34+00:00,RT @AlexGabuev: Good dispatch on Moscow's reaction to #COVIDー19 and possible impact on China-Russia ties by @world_reporter &amp; Stepan Kravch…,subnut,gurgaon india,"Former Submariner, DGICG & CINCAN who retired as FOC-in-C Eastern Naval Command. Member USI,NMF, IIC& IDSA. On Governing Council NMF. RTs not endorsement.",2816,215,6599,False,Good dispatch on Moscow's reaction to #COVIDー19 and possible impact on China-Russia ties by @world_reporter &amp; Stepan Kravchenko via @business  https://t.co/8FYKO77Hi9
2020-02-28 01:04:31+00:00,"RT @twmentality1: Looky here @realDonaldTrump!👇

Several Iranian officials at the highest levels of Iranian government have tested positive…",Ensoilife,india,"Thamizhan , Siva Bhaktan, Nature lover , Father , Family Man ,  ... Will tweet my mind... 
If it offends you , Get lost!! 

RTs likes aren't endorsement!",186,280,10249,False,"Looky here @realDonaldTrump!👇

Several Iranian officials at the highest levels of Iranian government have tested positive for #coronavirus!

One Iranian official who tested positive for #COVIDー19 sat within a few feet of the Iranian president.

You are not immune to #COVIDー19! https://t.co/kpHDuXEqmr"
