created_at,full_text,screen_name,location,description,followers_count,friends_count,statuses_count,verified,full_retweet_text
2020-05-24 20:36:42+00:00,"RT @IshikaTech: The reward of goodness is nothing but goodness.(Al Quran 55:61)
These are unprecedented times that require unprecedented ef…",jainmanoj,kolkata india,"Manoj Jain, CEO of Ishika Technologies Pvt. Ltd. https://t.co/tjp1AlKuQb. Co-founder Ishika Events & Wedding Management https://t.co/W7SJygAce7",2135,1984,1789,False,"The reward of goodness is nothing but goodness.(Al Quran 55:61)
These are unprecedented times that require unprecedented efforts, make sure you help the one in need in any possible manner.
Eid Mubarak!
#EidalFitr2020  #EidAtHome  #EidMubarak #StayHome  #Kolkata #India #IshikaTech https://t.co/jkXcFDgCfv"
2020-05-24 20:36:43+00:00,RT @SanjayDhotreMP: Congratulations marvellous work keep it up all the best 🙏,YKoshle,new delhi india,"राजा रावी नम रुलया रूल गियो लोधी पठान
अकबर शाह ने न रुलया राणा और निर्बान",677,2436,13543,False,Congratulations marvellous work keep it up all the best 🙏 https://t.co/O9CtVBQa10
2020-05-24 20:36:45+00:00,"Plz take a look at the Hospital List with contact nos.
As someone somewhere might be searching for hospital beds for Covid +ve patients. @mybmc https://t.co/t69tDvNvsz",JustprakashW,mumbai india,"Shivsena Yuvasena member
president- maharashtra building & general  laubur sena, maharashtra",1552,346,4921,False,
2020-05-24 20:36:45+00:00,"RT @RaviShastriOfc: After me being given a dressing down in the social distancing huddle (meeting @ICC regulations), Skipper skipping off f…",JeetOffIcial6,mumbai india,"The official twitter account of jeet Das.
https://t.co/svsO2S69cb",255,140,92766,False,"After me being given a dressing down in the social distancing huddle (meeting @ICC regulations), Skipper skipping off for a ground inspection after a light drizzle 🤩🙌🏻 https://t.co/oro2SOhZZI"
2020-05-24 20:36:45+00:00,RT @saleha_xo: Sid wishing us all Eid Mubarak &amp; telling us all to stay home &amp; stay safe. Such a cutie 🥺❣✨ @sidharth_shukla #SidharthShukla…,Sid_My_Hero,india,"𝙄 𝙜𝙤𝙩 𝙡𝙞𝙠𝙚 𝙛𝙧𝙤𝙢 𝙎𝙞𝙙 𝙤𝙣 08/05/2020 😭❤️
ᴵ ᵃᵈᵒʳᵉ ʰⁱᵐ 🤗
@sidharth_shukla @ImRo45
𝐈𝐬 𝐥𝐨𝐯𝐞💕",1666,542,8060,False,Sid wishing us all Eid Mubarak &amp; telling us all to stay home &amp; stay safe. Such a cutie 🥺❣✨ @sidharth_shukla #SidharthShukla https://t.co/KKXdBoi9t7
2020-05-24 20:36:54+00:00,"To contain a pandemic as vicious as the Covid19, in a place as densely populated as Mumbai, is a nightmarish proposition.

Considering the trying circumstances, the MVA govt under the leadership of Uddhav Thackeray is doing a commendable job so far.
@AUThackeray https://t.co/zvTo9H3ysa",YangerLongkume2,dimapur nagaland india,Secretary @incnagaland,9605,6714,23587,True,
2020-05-24 20:36:55+00:00,"RT @OpIndia_com: “They want to show lesser Coronavirus cases”, alleges doctors after BMC issues show-cause notice to a Mumbai doctor for re…",WakeUpHindu,india,"don't forget,while on the earth, Gau, Gita, Ganga & the Saints will continue to insulted so God will continue show the devastating outbreak🔥
#WakeupHindu 🕉️🛕",1964,1919,114786,False,"“They want to show lesser Coronavirus cases”, alleges doctors after BMC issues show-cause notice to a Mumbai doctor for recommending COVID-19 test

https://t.co/vZizaWbhTn"
2020-05-24 20:37:01+00:00,"RT @atti_cus: Misleading. Maharshtra infections- 50k dead 1600. Gujarat infections 14k dead 850.

Guj HC slammed poor condition of hospital…",shams_z,new delhi india,"Moderately fiery. Resource-crunched cook. 'average'. part-time psycho. oily food connoisseur. Movies. AMU alum. chairman, Mediocre ekta manch.",3562,3589,200709,False,"Misleading. Maharshtra infections- 50k dead 1600. Gujarat infections 14k dead 850.

Guj HC slammed poor condition of hospitals- shows Modi’s failure as CM for 15 years. 

Maha has busiest airport+dharavi, has much greater population density https://t.co/CiIxbdy3O3"
2020-05-24 20:37:04+00:00,RT @Reuters: WATCH: Norwegian Prime Minister Erna Solberg and some of her ministers recorded a dance number while maintaining social distan…,sarfaraz_niyazi,kishanganj bihar india,Intention Researcher cum HUMAN RIGHTS & RTI Activist,348,261,11082,False,WATCH: Norwegian Prime Minister Erna Solberg and some of her ministers recorded a dance number while maintaining social distancing https://t.co/CnZOf6s0Wa
2020-05-24 20:37:09+00:00,"RT @ForeignAdviser: BREAKING NEWS:

Montenegro🇲🇪 is now #COVID19 free. 

Prime Minister @DuskoMarkovicCG with his team took careful and dec…",JharkhandRajya,india,Dedicated to : Conservation | Education | Livelihood | Sustainability | Positive News | Pictures | Rural Development | Farmers Welfare,7,2,25,False,"BREAKING NEWS:

Montenegro🇲🇪 is now #COVID19 free. 

Prime Minister @DuskoMarkovicCG with his team took careful and decisive actions to protect Montenegro from this unprecedented, global pandemic. https://t.co/1IQrPXZAD3"
2020-05-24 20:37:10+00:00,"RT @_YogendraYadav: This is worrisome. The least a Govt can do in a crisis is to be transparent.
https://t.co/44KuZkJFTf",Noor4Alam,new delhi india,"Go Slow But Keep Going.....Born in Mumbai, Brought up in UP,  Exploring life in Delhi.",81,528,1870,False,"This is worrisome. The least a Govt can do in a crisis is to be transparent.
https://t.co/44KuZkJFTf"
2020-05-24 20:37:12+00:00,"RT @Data2X: This rapid assessment examines how the impacts of #COVID19 are threatening women’s ability to access justice, reflecting on cha…",sridhartweet,roots in india usa uk,Academic-practitioner in Global Health Ethics and Justice. Author of Health Justice book | TEDx | Brown Harvard Cambridge..,3134,1994,6735,True,"This rapid assessment examines how the impacts of #COVID19 are threatening women’s ability to access justice, reflecting on challenges faced by women and girls of diverse backgrounds and socio-economic groups. Learn more, via @UN_Women https://t.co/UYVEVbFOpc https://t.co/ZWY8SaXumE"
2020-05-24 20:37:13+00:00,"RT @aubreyhirsch: That NYT front page names only 1% of the Americans who have died from Covid-19. I found that a bit difficult to grasp, so…",DreamzDrem,india,dreamer😊😊,121,280,49770,False,"That NYT front page names only 1% of the Americans who have died from Covid-19. I found that a bit difficult to grasp, so I copy/pasted it 100 times to get a sense of scale.  The first image below is what it would look like if you could see all 100,000 names. https://t.co/XteZFkT1Ze"
2020-05-24 20:37:14+00:00,"RT @ShefVaidya: I have stopped tracking Corona news in Maharashtra, it is deeply depressing. Praying for the well-being of the state and th…",tiwari_anil84,bengaluru india,"🚩शिवभक्त 🚩हर हर महादेव
My tweets is in like, nothing personal
A Math Teacher",15119,2106,308200,False,"I have stopped tracking Corona news in Maharashtra, it is deeply depressing. Praying for the well-being of the state and the people, especially the citizens of Mumbai."
2020-05-24 20:37:16+00:00,RT @wef: The World Bank predicts areas most at risk to coronavirus https://t.co/U8Yj7w69EF  #covid19 https://t.co/q1lOdFq2sd,0007_CJ,kavali india,"Post-doctoral Research Fellow | Ph.D.,  NIPER-Mohali | Medicinal chemistry | Politics Follower |",44,139,2837,False,The World Bank predicts areas most at risk to coronavirus https://t.co/U8Yj7w69EF  #covid19 https://t.co/q1lOdFq2sd
2020-05-24 20:37:17+00:00,"RT @EconomicTimes: Cancelled shipments, returned goods and a dearth of new orders have left China exporters in crisis as the #coronavirus h…",MOIZ44,india,"when heart dares to speak it needs no preparation, Retweets never Endorsed.",108,870,20062,False,"Cancelled shipments, returned goods and a dearth of new orders have left China exporters in crisis as the #coronavirus hits its trading partners worldwide -- accelerating a long-standing push towards domestic consumption.

https://t.co/7xT89n6DLv"
2020-05-24 20:37:17+00:00,"RT @bhushans60: @PranitChaudhary @OfficeofUT @AUThackeray Its been more than month since Consulates are not operating , which is making the…",SmRavinder,hyderabad india,,9,21,5263,False,"@PranitChaudhary @OfficeofUT @AUThackeray Its been more than month since Consulates are not operating , which is making the situation bad for the NRIs .
Many are waiting for Consulate to open so that they can do stamping.and go back.

Consider opening Consulates with social distancing"
2020-05-24 20:37:23+00:00,"RT @tribesindia: Be vocal about Local to make them Global
#VocalForLocalIndia
Let's stand together to support the artisans. Buy their Arts…",AbhijitOdisha,orissa india,"State Committee Member, Odisha @ThinkIndiaOD_ || City Jt. Secretary, Rourkela @ABVPVoice || NITian || Cricket Expert || Views r Personal",715,799,16742,False,"Be vocal about Local to make them Global
#VocalForLocalIndia
Let's stand together to support the artisans. Buy their Arts at our retail stores (https://t.co/7OhKecA71k) or
CLICK ON IMAGE FOR ONLINE SHOPPING
#stayhome #protectcommunity #Handicrafts
@pra87 @MundaArjun"
2020-05-24 20:37:28+00:00,RT @rohini_sgh: This is crazy.,VinayGohil4,mumbai india,"Graphic Designer, 
Social Activist,
Anti-Casteist, 
Populist Left,
Proud Atheist,
Only believe in Humanity,
The Voice of the Voiceless
#IndiaAgainstCAA_NRC_NPR",194,116,26010,False,This is crazy. https://t.co/a8KHZxOPyR
2020-05-24 20:37:28+00:00,"RT @UdaySRana: Close to 100,000 people have died in this country. 100,000. I can bet that a large number of the dead are from poorer commun…",iammajidalam,new delhi india,Journalist | Alumni @jamiamillia_ | @EUErasmusPlus Scholar at @SciencesPo,173,831,1015,False,"Close to 100,000 people have died in this country. 100,000. I can bet that a large number of the dead are from poorer communities and communities of colour. The rich get access to the best healthcare and they party like they know it. The system is truly broken. https://t.co/9X60aMHHFV"
2020-05-24 20:37:28+00:00,RT @FunMustBeHad: @projectmumbai1 Any of your partners working to fulfill emergency medical requirements? Would be great if you could point…,UmeshMane12,pune india,A human being | Retweets are not endorsement,84,943,580,False,"@projectmumbai1 Any of your partners working to fulfill emergency medical requirements? Would be great if you could point us to who can help, thanks! #COVID19 #CovidRelief https://t.co/Ex4PExhlfC"
2020-05-24 20:37:28+00:00,@jaganmsna @health_z_wealth this could have been us had we followed your hypothesis of no lockdown,salil_chadha,new delhi india,Passionate about stocks & investing. Man City Fan. MODI-fied,80,152,1151,False,
2020-05-24 20:37:37+00:00,"Well, this gon spike. Wait for it. https://t.co/CW4ugoUPF4",aarohara,ahmadabad city india,"Content Creator about The Reality of Life. Ex-Drummer | Guitarist | Vocalist | Music Composer | Worship Leader. 
Do we share the same interest? Let’s connect.",180,729,104,False,
2020-05-24 20:37:39+00:00,RT @cricketaakash: Touching 140k #Covid19 cases in India and some are saying that we will peak in July-August. What exactly are we looking…,JeetOffIcial6,mumbai india,"The official twitter account of jeet Das.
https://t.co/svsO2S69cb",255,140,92766,False,Touching 140k #Covid19 cases in India and some are saying that we will peak in July-August. What exactly are we looking at?? 😐😳
2020-05-24 20:37:42+00:00,"Wishing everyone a safe and  beautiful Eid al fitr 🌙
@VishalK90877259 
@Dilnawaz8672 
#StayHomeStaySafe 
#StayHome",VishalK90877259,india,"Hey welcome to the my world 

poetry writer, humanitarian 🙌✊

respect all religion🙏🕉☪🕎✝💟

Help other help yourself 🤝✊",11,137,280,False,
2020-05-24 20:37:43+00:00,"RT @ArushiS65716839: If student get affected by COVID-19 
who will take the responsibility? 
Please cancel final year exams.

#PromoteStude…",vk_office,chhattisgarh india,Official page of Vishal Kukreja | State president at Sindh Yuva Brigade Chhattisgarh | Member of Chhattisgarh Pradesh Youth Congress @cg_pyc,334,332,1843,False,"If student get affected by COVID-19 
who will take the responsibility? 
Please cancel final year exams.

#PromoteStudentsSaveFuture 

@LambaAlka @NehaBhagat_jk @SaveZiddi @Ziya_Khan121 @asmatasleem11 @IncKinju @jasmeen069 @maryada_maurya"
2020-05-24 20:37:49+00:00,People arguing with each other while taking mobile videos of each other. Why can't they just live the moment? https://t.co/JSkc7HnJ6t,Tom_Babu,kerala india,"Cinephile, Mood determined largely by LFC...",301,458,37556,False,
2020-05-24 20:37:50+00:00,RT @advsanjoy: In the last 60 odd days of lockdown this is the first visual I am seeing of migrants being chased to be given food and not t…,PushpendraVerma,bengaluru india,Computer Scientist @ Adobe,1284,70,271317,False,In the last 60 odd days of lockdown this is the first visual I am seeing of migrants being chased to be given food and not the other way round!  Wahe Guru! 🙏 https://t.co/dVr5Q1fbRq
2020-05-24 20:37:50+00:00,RT @AnushkaSharma: THIS is life 💜💜💜,JeetOffIcial6,mumbai india,"The official twitter account of jeet Das.
https://t.co/svsO2S69cb",255,140,92766,False,THIS is life 💜💜💜 https://t.co/tqovHreloo
2020-05-24 20:37:56+00:00,RT @dpradhanbjp: PM @narendramodi ji’s pre-emptive approach and strong measures have helped India respond better to the #Covid19 challenge.…,KishanCBarot,kheralu gujarat india,"राष्ट्र, धर्म, संघ, भाजपा  को मन समर्पित, तन समर्पित,
और यह जीवन समर्पित।।
वंदे मातरम्।। भारत माता की जय।। जय श्री राम।।",1105,463,58976,False,"PM @narendramodi ji’s pre-emptive approach and strong measures have helped India respond better to the #Covid19 challenge. 

Despite having a similar population as compared to the total population of the 15 countries most impacted by the novelcoronavirus, India has fared better. https://t.co/tilAFKYhxf"
2020-05-24 20:37:56+00:00,"RT @pathan_sumaya: #EidUlFitr prayers inside the garden of a house in Srinagar, Kashmir amid COVID19 maintaining social distance!!

#EidMub…",quaisarnahid,patna india,"ᴀʟʜᴀᴍᴅᴜʟɪʟʟᴀʜ ꜰᴏʀ ᴇᴠᴇʀʏᴛʜɪɴɢ♥️
                   ᴘʀᴏᴜᴅ ᴛᴏ ʙᴇ ᴀ ɪɴᴅɪᴀɴ ᴍᴜꜱʟɪᴍ🇮🇳♥️",544,381,4331,False,"#EidUlFitr prayers inside the garden of a house in Srinagar, Kashmir amid COVID19 maintaining social distance!!

#EidMubarak https://t.co/WSbFIEdawD"
2020-05-24 20:37:58+00:00,RT @dpradhanbjp: We discussed several aspects of the #Covid19 situation in the sub-continent and its impact on human health and economies.…,KishanCBarot,kheralu gujarat india,"राष्ट्र, धर्म, संघ, भाजपा  को मन समर्पित, तन समर्पित,
और यह जीवन समर्पित।।
वंदे मातरम्।। भारत माता की जय।। जय श्री राम।।",1105,463,58976,False,We discussed several aspects of the #Covid19 situation in the sub-continent and its impact on human health and economies. I elaborated how Hon. PM Shri @narendramodi has led from the front in fighting the pandemic and in mitigating the impact of the coronavirus challenge. https://t.co/lGC5NWUe7s
2020-05-24 20:38:02+00:00,"@KatrinaKaifKay Eid Mubarak ❤️😍☪️
Stay home and stay happy ...😍❤️💓",Prashan91879014,maharashtra india,"😍😇Weℓc๏ᴍe Ƭo ₥y W𝔬rld😊😘
                        Wish me 27th August.👑",0,13,5,False,
2020-05-24 20:38:04+00:00,RT @BJP4India: India has about 7.9 COVID cases per lakh population against the global average of 62. India's measures to contain the Corona…,KishanCBarot,kheralu gujarat india,"राष्ट्र, धर्म, संघ, भाजपा  को मन समर्पित, तन समर्पित,
और यह जीवन समर्पित।।
वंदे मातरम्।। भारत माता की जय।। जय श्री राम।।",1105,463,58976,False,India has about 7.9 COVID cases per lakh population against the global average of 62. India's measures to contain the Coronavirus are showing results. #IndiaFightsCorona https://t.co/hjx6Lj7EXP
2020-05-24 20:38:05+00:00,"Lockdown special 😋
#samosa #Lockdownextention #lockdownindia #homemade https://t.co/momlPVD4KT",Mahesh35635937,palghar india,"//18 y/o
//Mumbai 🌎",4,17,25,False,
2020-05-24 20:38:09+00:00,RT @samvadngo: Dear @ThaneCityPolice in this pandemic lot of efrauds happening and one of the most common is randomly calling people and ta…,UmeshMane12,pune india,A human being | Retweets are not endorsement,84,943,580,False,"Dear @ThaneCityPolice in this pandemic lot of efrauds happening and one of the most common is randomly calling people and taki g their OTP of @Paytm paytm is careless. We got such one call from +917908520985 paytm, confirm is it your executive ? Please take suo motu action"
2020-05-24 20:38:14+00:00,RT @misterpiyush: Akshay Kumar to play Sonu Sood in an upcoming movie on Lockdown.,MoreshwarPidad1,pune india,"Cyclist,
Patriot,
Rationalist,
Reader",48,1983,435,False,Akshay Kumar to play Sonu Sood in an upcoming movie on Lockdown.
2020-05-24 20:38:14+00:00,"True.Also Unplanned,in a jiffy kind, with NO MENTION OF WORKING CLASS &amp; DAILY WAGERS! A COMPLETE MESS. https://t.co/e7yv0ppyJ1",AshaaKiEkKiran,india,Freedom is My BirthRight.For A Cause I Fight.Expose Hypocrisy when I https://t.co/cU3uNTLNEK & Let Live is So Right .God please UNDO 2020,114,250,16873,False,
2020-05-24 20:38:15+00:00,RT @BJP4India: Watch Smt @nsitharaman in conversation with Shri @NalinSKohli on steps being taken by the Ministry of Finance and Corporate…,KishanCBarot,kheralu gujarat india,"राष्ट्र, धर्म, संघ, भाजपा  को मन समर्पित, तन समर्पित,
और यह जीवन समर्पित।।
वंदे मातरम्।। भारत माता की जय।। जय श्री राम।।",1105,463,58976,False,Watch Smt @nsitharaman in conversation with Shri @NalinSKohli on steps being taken by the Ministry of Finance and Corporate Affairs to combat the COVID-19 crisis. #IndiaFightsCorona https://t.co/94EmvBux3G
2020-05-24 20:38:15+00:00,RT @SamerthTrust: Support us by donating generously! Your contribution shall go towards ensuring families of daily wage earners who’s livel…,JkumarJayashree,bhopal india,Development Professional,155,231,772,False,"Support us by donating generously! Your contribution shall go towards ensuring families of daily wage earners who’s livelihood has been crippled due to the pandemic will have access to basic ration kits, potable water, basic hygiene kits and seeds to grow Kharif crops. https://t.co/L1tRwG8IE3"
2020-05-24 20:38:16+00:00,"RT @dpradhanbjp: Interacted with overseas Odia friends residing in South Korea, Japan and China. We discussed several aspects of the situat…",KishanCBarot,kheralu gujarat india,"राष्ट्र, धर्म, संघ, भाजपा  को मन समर्पित, तन समर्पित,
और यह जीवन समर्पित।।
वंदे मातरम्।। भारत माता की जय।। जय श्री राम।।",1105,463,58976,False,"Interacted with overseas Odia friends residing in South Korea, Japan and China. We discussed several aspects of the situation evolving out of the #Covid19 outbreak, measures our respective countries are adopting to control the virus and minimise its impact on health and economy. https://t.co/7RXqtInR2T"
2020-05-24 20:38:18+00:00,"RT @dpradhanbjp: We had a healthy exchange on new normals and life in the post-Covid world, role of automation and artificial intelligence…",KishanCBarot,kheralu gujarat india,"राष्ट्र, धर्म, संघ, भाजपा  को मन समर्पित, तन समर्पित,
और यह जीवन समर्पित।।
वंदे मातरम्।। भारत माता की जय।। जय श्री राम।।",1105,463,58976,False,"We had a healthy exchange on new normals and life in the post-Covid world, role of automation and artificial intelligence in enhancing agility and resilience of supply chains and reimagining business models to emerge winners in a post-pandemic economy."
2020-05-24 20:38:21+00:00,RT @Reuters: UK death toll from confirmed coronavirus cases rises by 118 https://t.co/lxJkRnHQWC https://t.co/LqVGjG146w,sarfaraz_niyazi,kishanganj bihar india,Intention Researcher cum HUMAN RIGHTS & RTI Activist,348,261,11082,False,UK death toll from confirmed coronavirus cases rises by 118 https://t.co/lxJkRnHQWC https://t.co/LqVGjG146w
2020-05-24 20:38:23+00:00,"@fatehshernu @ChimpSeek here, started my twitter journey only after lockdown started.",guy_productive,india,"When an opportunity presents itself, seize it!",232,78,785,False,
2020-05-24 20:38:25+00:00,Coronavirus vaccine developed in China shows positive results in the early trials https://t.co/bMooOvMZgO,real_freshtalk,india,"Welcome to the Official Page of FreshTalk.
We'll provide you with all the Trending News, Entertainment News, Sports News and Youtube News",8,1,1052,False,
2020-05-24 20:38:26+00:00,Coronavirus update: this drug worth Rs 5300 proved effective in fight with Covid-19 https://t.co/fa5XSZz17k,7TheHealth,delhi india,We are providing latest news and useful article from the world top websites in different style at https://t.co/qhQQJjxXaM.,108,133,49944,False,
2020-05-24 20:38:28+00:00,"My mom taught me to never laugh on someone else’s misfortune... But at some point, I just can’t help.. 
@thevirdas I’m feeling sorry for what has happened to you, but it was hilarious and you had equal share in it.. 🤣 https://t.co/oJsca6fYww",MasaniSoumya,bengaluru india,"Software engineer by profession... Bong till death... Love Cricket, Football, WWE and most important -- Standup comedy... A bit crazy ain't I 😉",42,130,127,False,
2020-05-24 20:38:30+00:00,"#Eid_Mubarak to everybody who is celebrating this day around the world.

Let's find strength and unity to pull us out of these challenging times.

Stay safe from #COVID19 and #HappyEid https://t.co/2FC39OoVMp",SumedhBengale,mumbai india,"Just love doing things differently.
♥️Interested in Science and Technology♥️
♥️Anime Fan♥️
♥️Manga Fan♥️",53,34,714,False,
2020-05-24 20:38:31+00:00,"RT @GabbbarSingh: American CDC says negligible chances of you getting infected with Coronavirus touching a surface, then what the hell we w…",RUMMesh_N,hyderabad india,"HyDeRaBaDi, tEcHiE, fOoDiE, NiGhT_OwL",104,410,4508,False,"American CDC says negligible chances of you getting infected with Coronavirus touching a surface, then what the hell we were washing our hands for?"
2020-05-24 20:38:38+00:00,"RT @himantabiswa: 📌Alert ~  14 new cases of #COVID19+ confirmed. 

5 Hojai; 5 Kamrup; 2 Kamrup Metro; 1 Nagaon; 1 East Karbi Anglong

↗️Tot…",thearjunchetry,shillong meghalaya india,"#MCA, #CHFI from Ec council #RHCSA AND #RHCE, #CCNA , #CISE, #Mobileforensics etc and dedicated to learn and teach law enforcement officers of the country",36,61,135,False,"📌Alert ~  14 new cases of #COVID19+ confirmed. 

5 Hojai; 5 Kamrup; 2 Kamrup Metro; 1 Nagaon; 1 East Karbi Anglong

↗️Total cases 392
↗️Recovered 57
↗️Active cases 328
↗️Deaths 04
↗️Migrated 03

Update 10:35 pm / May 24

#AssamCovidCount https://t.co/GNBFhy7rsF"
2020-05-24 20:38:39+00:00,"#EidUlFitr 
#lockdown 
#StayHomeStaySafe 
Eid mubaarak to my all loving friends 
May ALLAH (swt) Accepts your fast and accepts your all prayers https://t.co/gTWzAq594d",afarhan169,jodhpur india,"B£ |-|@¶¶¥ AπD |eT bE |-|@¶¶¥   °°°°°
   
    
      
    
   
   
   
Don't follow to unfollow",18,76,147,False,
2020-05-24 20:38:44+00:00,"RT @LeaArden: Excited to be covering tech &amp; trust in the pandemic times for @CovidAction this week. If you work in tech,and have some insig…",sectest9,hyderabad india,News Hub! Get the latest Security News & Updates!,31918,1,1877644,False,"Excited to be covering tech &amp; trust in the pandemic times for @CovidAction this week. If you work in tech,and have some insights to share DM me please #coronavirus #COVID19 #technology #journorequests"
2020-05-24 20:38:51+00:00,"RT @republic: #Modi1Year | There's an invisible enemy that is Corona, a visible enemy which is Pakistan, but the biggest enemy we are facin…",Manav_Brijwasi,new delhi india,"हिन्दू, जय श्री राम, भारत माता की जय। Office Secretary to Mrs. Meenakshi Lekhi, Member of Parliament New Delhi Lok Sabha & Chairperson, COPU",302,890,6434,False,"#Modi1Year | There's an invisible enemy that is Corona, a visible enemy which is Pakistan, but the biggest enemy we are facing is the enemy within: Srijan Pal Singh, CEO, Kalam Centre &amp; Policy Analyst https://t.co/IisBPFAXgs"
2020-05-24 20:56:03+00:00,"RT @OpIndia_com: “They want to show lesser Coronavirus cases”, alleges doctors after BMC issues show-cause notice to a Mumbai doctor for re…",ramsureshm10,new delhi india,stay blessed,95,722,7753,False,"“They want to show lesser Coronavirus cases”, alleges doctors after BMC issues show-cause notice to a Mumbai doctor for recommending COVID-19 test

https://t.co/vZizaWbhTn"
