created_at,full_text,screen_name,location,description,followers_count,friends_count,statuses_count,verified,full_retweet_text
2020-03-06 02:07:29+00:00,"RT @CutestFunniest: Corona virus jokes are more viral than the virus.

#coronavirusinindia",sravindking,goa india,"[ Dope || Trollmaker  ||  Underrated ]                                          
                 [ MSD || SRK || CR7 ] [ RJ || MH || GA ]  #bakchod #gattaparty",4858,81,60608,False,"Corona virus jokes are more viral than the virus.

#coronavirusinindia"
2020-03-06 02:07:30+00:00,RT @BesuraTaansane: Even gaumutra soap wouldnt have helped the kukur muⓣra face ... r@bid Hinduph0be mu!!i,_VivekSpeaks,uttar pradesh india,Advocate ! Strong Believer of simple lifestyle #Hinduism🙏🏻Nature Farmer 👩‍🌾 with Vedic Techniques.Writer! RTs not endorsement 😊My tweet in likes🙏🏻,933,306,53653,False,Even gaumutra soap wouldnt have helped the kukur muⓣra face ... r@bid Hinduph0be mu!!i https://t.co/m0IwNofqdB
2020-03-06 02:07:31+00:00,"RT @MisraNityanand: Israel PM has suggested Israel adopt the Indian way of greeting people.

To return the favour, I suggest India adopt th…",tomatofarmer023,india,,21,244,2257,False,"Israel PM has suggested Israel adopt the Indian way of greeting people.

To return the favour, I suggest India adopt the Israeli way of greeting terrorists. https://t.co/PcFCiR2Tyb"
2020-03-06 02:07:34+00:00,"RT @markminervini: With the indexes oversold and record low rates, the market could rally on any good news surrounding coronavirus. But kee…",Rajeshnms5555,india,Divine wisdom,85,1207,10647,False,"With the indexes oversold and record low rates, the market could rally on any good news surrounding coronavirus. But keep in mind, every major meltdown in history started as  an oversold condition. At this point, worsening news seems more likely. #volatility"
2020-03-06 02:07:36+00:00,"RT @KiranKS: Trend observed in Communist China now after Corona Virus:
1) Bathe multiple times.
2) Avoid meat.
3) Greet without touch.
4) B…",ArjunDares,india,Proud Indian | Proud Hindu | Sanatana Dharma | All lives Matter,362,258,109817,False,"Trend observed in Communist China now after Corona Virus:
1) Bathe multiple times.
2) Avoid meat.
3) Greet without touch.
4) Burn the dead.
5) Keep extra hygiene in kitchen.
6) Eat only freshly cooked food.

And these were mocked by Commies of India as ""Brahminical"" till now 🤔"
2020-03-06 02:07:37+00:00,RT @DDNewslive: #COVID2019 continues to wreak havoc in several countries as the total death toll crosses 3345; Britain registers its first…,gopalkumar1111,india,"All things bright and beautiful, Retweets are not endorsement, Views personal",70,87,9863,False,"#COVID2019 continues to wreak havoc in several countries as the total death toll crosses 3345; Britain registers its first #coronavirus related death; toll crosses 107 in Iran, Church in Bethlehem closed for pilgrims. https://t.co/7nNB4ZwBKK"
2020-03-06 02:07:38+00:00,"RT @YangerLongkume2: At least Coronavirus has managed to do something which no one else in India has been able to achieve so far.

Cancel o…",Zigzig61496468,india,"Being alive!!! Being grateful!!! 

Brain Aneurysm Survivor #mybattlewithbrainaneurysm",18,98,2893,False,"At least Coronavirus has managed to do something which no one else in India has been able to achieve so far.

Cancel one of PM Modi's foreign trip. https://t.co/LJvbUadXY7"
2020-03-06 02:07:39+00:00,RT @iimcomic: Corona Virus has probably reached Bombay but is still searching for a place to stay.,DishaMashelkar,goa india,"🐦Tweets are personal
🦢Self motivated Rangoli Artist
🐥How to guide creator
🐟Past: TV/Celeb/Entertainment Web Content Writer, Columnist, All India Radio",1005,920,18869,False,Corona Virus has probably reached Bombay but is still searching for a place to stay.
2020-03-06 02:07:44+00:00,"RT @RahulGandhi: The Health Minister saying that the Indian Govt has the #coronavirus crisis under control, is like the Capt of the Titanic…",MahendraDCM,deoghar india,"जिला परिषद सदस्य सह जिला योजना समिति सदस्य सह जिला कृषि एवं उघोग सभापति , सह कांग्रेस नेता देवीपुर देवघर (भावी प्रत्याशी मधुपुर MLA झारखंड)
@INCJHARKHAND @IYC",136,250,2384,False,"The Health Minister saying that the Indian Govt has the #coronavirus crisis under control, is like the Capt of the Titanic telling passengers not to panic as his ship was unsinkable. 

It's time the Govt made public an action plan backed by solid resources to tackle this crisis."
2020-03-06 02:07:44+00:00,"RT @retheeshraj10: Kerala is the only state in India which successfully stopped 3 deadly virus, Corona, Nipah and BJP.",iam_Satyandu,india,Movies | Music,267,1154,1046,False,"Kerala is the only state in India which successfully stopped 3 deadly virus, Corona, Nipah and BJP."
2020-03-06 02:07:45+00:00,"RT @seattletimes: In a sign of just how seriously the restaurant industry is taking the spread of coronavirus in America, Seattle-based Sta…",SSP79,bengaluru india,#MeinBhichowkidar,273,351,188897,False,"In a sign of just how seriously the restaurant industry is taking the spread of coronavirus in America, Seattle-based Starbucks said staff across its 14,000 U.S. sites are being told to wipe down busy areas of the store every eight minutes. https://t.co/fpTVV684Ix"
2020-03-06 02:07:50+00:00,"RT @willmacaskill: This is the single most helpful and easy-to-understand doc I've read on coronavirus, I'd strongly encourage reading it a…",asvs_kartheek,india,"Machine Learning..2%
Joor Pokes..6%
Food..92%",13,51,89,False,"This is the single most helpful and easy-to-understand doc I've read on coronavirus, I'd strongly encourage reading it and taking it seriously: https://t.co/2i10MNQHd3"
2020-03-06 02:07:57+00:00,RT @UnSubtleDesi: You just came back to India from some godforsaken planed abroad (reports say Italy?). Please follow protocol and get your…,iamvinu1978,india,A proud Indian; 🕉️Swamiye Saranamayyappa🕉️,84,221,7513,False,You just came back to India from some godforsaken planed abroad (reports say Italy?). Please follow protocol and get yourself quarantined first https://t.co/hLyaptHApH
2020-03-06 02:08:07+00:00,"RT @NCStinn: Scientists: you should wash your hands because of Coronavirus.

People: I'm gonna stop flying, hoard masks, work from home &amp; t…",SudhasIyer,bengaluru india,"CEO - The/Nudge Centre for Social Innovation. #NonProfit, #Startup. 
https://t.co/NUh6kJEIY9 is accepting applications.",629,314,1017,False,"Scientists: you should wash your hands because of Coronavirus.

People: I'm gonna stop flying, hoard masks, work from home &amp; totally rearrange my life.

Also Scientists: the #ClimateCrisis will kill millions - we must use clean power &amp; change how we get to work.

People: No way."
2020-03-06 02:08:18+00:00,RT @firstqiblah: Islamic Waqf crews sanitizing Masjid al-Aqsa with chemicals in response to the coronavirus. The Masjid remains open to wor…,imranafrica84,mumbai india,Mumbaikar | Indian | Sunni | Hanafi | Memon | Director of SEO Dept/ Chief Everything Officer @eBrandz,821,758,15345,False,Islamic Waqf crews sanitizing Masjid al-Aqsa with chemicals in response to the coronavirus. The Masjid remains open to worshippers #MasjidAlAqsa #Palestine #Jerusalem #AlQuds #coronavirus #corona #COVID19 https://t.co/QG81XnENHj
2020-03-06 02:08:19+00:00,"RT @AmyMek: German Policeman Dies After Assault by Turkish Migrant

Sadly, this is not surprising, this video shows how powerless police ar…",vera_anz,chennai india,"Love Thiruvannamalai, सनातन, science &tech enthusiast.Sarve Janah Sukhino Bhavantu.All belong to One.Arunachala.#BharatMataKiJai. like https://t.co/Op3njsoyxV",22618,22493,134841,False,"German Policeman Dies After Assault by Turkish Migrant

Sadly, this is not surprising, this video shows how powerless police are in Germany

Violent attacks by Migrants reached epidemic proportions &amp; Merkel's suicidal open-door migration policy is to blame
https://t.co/E1Nz1IGi3Q https://t.co/A5nzEjecOj"
2020-03-06 02:08:25+00:00,"RT @stayfrea_: ALERT‼️‼️‼️
The corona virus can be spread through money. If you have any money at home, put on some gloves, put all the mon…",TMadhapur,madhapur hyderabad india,"Restaurant Taste of Rajasthan Hyderabad; Taste of Rajasthan, Madhapur ;Get Menu, Reviews, Contact, Location, Phone Number, Maps .Order food like dal bati churma",45,206,566,False,"ALERT‼️‼️‼️
The corona virus can be spread through money. If you have any money at home, put on some gloves, put all the money in to a plastic bag and put it outside the front door tonight. I'm collecting all the plastic bags tonight for safety. Think of your health."
2020-03-06 02:08:28+00:00,"Coronavirus scare: Govt confirms community spread, readies flight for Iran, count is 30 (India in league with few countries like Korea &amp; Japan where virus has been spread locally from person to person) https://t.co/c4djKcdF27",NavroopSingh_,new delhi india,"IPR Attorney, co-author of #TheNewGlobalOrder & #KoreanPeninsula with @AsianWarrior, #5G #Huawei & India National Security, Music Lover, Poet, Astrologer.",28269,3443,723880,False,
2020-03-06 02:08:37+00:00,#Cuttack: #Coronavirus suspect stated to be an Irish national flees isolation ward set up at SCB Hospital; complaint lodged at Mangalabag PS #Odisha https://t.co/JY8RPiiAiq,otvnews,bhubaneshwar india,"If something on Odisha is not on https://t.co/tklvVwUTgF, it is unlikely to be elsewhere...

Join us on telegram:  https://t.co/Hu7tZ0QKiH",509750,277,150403,True,
2020-03-06 02:08:40+00:00,RT @mollywaggett: the scariest thing about COVID-19 is that it looks like a JIRA ticket,SkyPatel26,mumbai india,,253,626,4881,False,the scariest thing about COVID-19 is that it looks like a JIRA ticket
2020-03-06 02:08:41+00:00,"RT @Ashtalakshmi8: Why does Rafool always want to know all Action plans made by the Government 🤔  
Does he have a solution to the problem??…",vijalgope,india,"Non Political, MBA, Businessman, Hindu Nationalist.",8541,2615,113372,False,"Why does Rafool always want to know all Action plans made by the Government 🤔  
Does he have a solution to the problem?? 
Or create problems for the solution!! https://t.co/kFbKGkVL56"
2020-03-06 02:08:47+00:00,"RT @NCStinn: Scientists: you should wash your hands because of Coronavirus.

People: I'm gonna stop flying, hoard masks, work from home &amp; t…",sardaarjay,chandigarh india,"Sikh | Inquisitive | Engineer only on paper | Eternal daydreamer | Jack of none | Humorous sometimes | BVB,Barca,Messi",150,655,15343,False,"Scientists: you should wash your hands because of Coronavirus.

People: I'm gonna stop flying, hoard masks, work from home &amp; totally rearrange my life.

Also Scientists: the #ClimateCrisis will kill millions - we must use clean power &amp; change how we get to work.

People: No way."
2020-03-06 02:08:50+00:00,"RT @JacobCanfield: I decided to read almost every paper that exists on #CoronaVirus today.

My background is Biology and Neurology and I'm…",damnit_saladin,bengaluru india,Majoring in journalism. Make of that what you will.,52,658,784,False,"I decided to read almost every paper that exists on #CoronaVirus today.

My background is Biology and Neurology and I'm obsessed with catching parabolic trends early, data and medical research. 

Here is a thread with the latest research

Feel free to retweet or cite with credits"
2020-03-06 02:08:51+00:00,"RT @AmyMek: German Policeman Dies After Assault by Turkish Migrant

Sadly, this is not surprising, this video shows how powerless police ar…",Praveenshindhe,india,"Hindustani 🇮🇳
धैर्यं सर्वत्र साधनम् ||",316,345,35567,False,"German Policeman Dies After Assault by Turkish Migrant

Sadly, this is not surprising, this video shows how powerless police are in Germany

Violent attacks by Migrants reached epidemic proportions &amp; Merkel's suicidal open-door migration policy is to blame
https://t.co/E1Nz1IGi3Q https://t.co/A5nzEjecOj"
2020-03-06 02:08:56+00:00,"Sad day for music lovers! 😞
#coronavirus outbreak has led to cancellation of several music festivals around the world like Ultra Music Festival &amp; Tomorrowland Winter and reports say that more of them might get cancelled in future 😓",krascend,india,22 | DJ/Producer | Martin Garrix for life,1241,1315,12094,False,
2020-03-06 02:08:58+00:00,RT @ksrfablr: #KSRFA successfully started Day 1 #Coronavirus Society Awareness Workshop for Public @ MG Road Metro Station🤘🏻🇱🇺Thanku@Victor…,Arun51108761,tumkur india,"Iam a Great greatest THALAIVAR  fan devotee disciple  and a Soldier 😎🤘
 
Thalaivar  fan ah erukurdhe Gethu🤘",256,298,39193,False,#KSRFA successfully started Day 1 #Coronavirus Society Awareness Workshop for Public @ MG Road Metro Station🤘🏻🇱🇺Thanku@Victoria Hospital Team 🙏🏻📣 https://t.co/WXOjkDbXww
2020-03-06 02:09:00+00:00,"RT @alfadog_2300: @RahulGandhi If modiji is disturbed blame of Corona Virus will be on Nehur ,

Remember economy is already Nehru's fault…",VasanMSV,chennai india,"Periyarist, Rationalist , Anti Sanghi Karuppar Koottam in short!",2085,1400,36452,False,"@RahulGandhi If modiji is disturbed blame of Corona Virus will be on Nehur ,

Remember economy is already Nehru's fault  😂😂"
2020-03-06 02:09:02+00:00,The latest The Plus530 Daily! https://t.co/fSFJldkxex Thanks to @FanKungYan @ChemistryNathan @upursbetty #hongkong #china,plus530,india,Tweets from GMT +5:30 | #News updates | #Technology |  #SocialMedia | #Communities | #Nature | #Finance |  #Read #Write | #Healthcare | RT ≠ endorsement,1232,2292,16390,False,
2020-03-06 02:09:06+00:00,"RT @sambitswaraj: Namaste 🙏 Mr @IsraeliPM 
Great gesture by Israel",AnuragB33289007,uttar pradesh india,India First,71,418,1981,False,"Namaste 🙏 Mr @IsraeliPM 
Great gesture by Israel https://t.co/wTkZXhAvzV"
2020-03-06 02:09:06+00:00,RT @Advaidism: When you cancel your Holidays and Foreign trips due to CoronaVirus outbreak. https://t.co/QQxnvoDua6,k3v1nkn0w5,india,As always you look but you don't observe,530,801,24138,False,When you cancel your Holidays and Foreign trips due to CoronaVirus outbreak. https://t.co/QQxnvoDua6
2020-03-06 02:09:08+00:00,"Only 1 case of Corona in India and look at craze for masks!!
Daily 400 people die in road accidents &amp; no craze for Helmets🤔
@MoHFW_INDIA @nitin_gadkari",Being_Kamta,palghar india,"Proud to be INDIAN 🇮🇳
राष्ट्रहित सर्वोपरि🙏 ऋणी है देश के जवानों के 🙏🙏,

गर्व है भारतीय सेना पर 

I'm on Instagram as @kamta_tiwari_ji.",2528,1771,2498,False,
2020-03-06 02:09:13+00:00,Some Economic and Political Factors of Coronavirus Outbreak - Vladimir Terehov - https://t.co/wTMrRQXcua via @vijayvaani,vijayvaani,new delhi india,"Opinions on website are not necessarily subscribed or endorsed by the website. Tweets are personal reactions to unfolding events. Sandhya Jain, Editor",6013,107,74931,False,
2020-03-06 02:09:16+00:00,"RT @RahulGandhi: The Health Minister saying that the Indian Govt has the #coronavirus crisis under control, is like the Capt of the Titanic…",ashishb22772225,ahmadabad city india,,107,657,4398,False,"The Health Minister saying that the Indian Govt has the #coronavirus crisis under control, is like the Capt of the Titanic telling passengers not to panic as his ship was unsinkable. 

It's time the Govt made public an action plan backed by solid resources to tackle this crisis."
2020-03-06 02:09:17+00:00,RT @republic: COVID-19: 88 persons who came in contact with infected techie tested negative in Telangana https://t.co/Nr0ez4OCNF,sudheervermaa,pune india,,52,306,6974,False,COVID-19: 88 persons who came in contact with infected techie tested negative in Telangana https://t.co/Nr0ez4OCNF
2020-03-06 02:09:21+00:00,"The Pomeranian dog acquired the #coronavirus disease from its owner, a 60-year old woman living in Hong Kong https://t.co/GjjUDESvdU via @SirfNewsIndia",SauvikRaha,silchar india,"An ardent learner and an itinerant seeking Truth, seeking Darshan.",5,46,578,False,
2020-03-06 02:09:24+00:00,Some Economic and Political Factors of Coronavirus Outbreak - Vladimir Terehov   https://t.co/wTMrRQXcua via @vijayvaani,vijayvaani,new delhi india,"Opinions on website are not necessarily subscribed or endorsed by the website. Tweets are personal reactions to unfolding events. Sandhya Jain, Editor",6013,107,74931,False,
2020-03-06 02:09:29+00:00,RT @julialindau: I just landed at JFK after reporting on #coronavirus in Milan and Lombardy —the epicenter of Italy’s  outbreak— for @vicen…,ginsongeo,bengaluru india,Retailer. Books. Old Monk. Explore. Movie Buff. Chelsea FC . Guns n Roses. Asterix & Obelix. Nature. Pets. Peace. No to War. Alternative Music.,269,1057,15166,False,I just landed at JFK after reporting on #coronavirus in Milan and Lombardy —the epicenter of Italy’s  outbreak— for @vicenews. I walked right through US customs. They didn’t ask me where in Italy I went or if I came into contact with sick people. They didn’t ask me anything.
2020-03-06 02:09:31+00:00,"RT @NiteshNRane: I made these demands in vidhan Sabha on Coronavirus 
1.)N95 masks r sold at a very high price 
2.)hand washes r no more av…",santoshpparab,mumbai india,Helping Enterprise & SMB Customers from Cyber Attacks ॥ Data Theft Prevention ॥ Email Security ॥ Protection from Hackers ॥ Follower of @meNeeleshNRane,670,320,19932,False,"I made these demands in vidhan Sabha on Coronavirus 
1.)N95 masks r sold at a very high price 
2.)hand washes r no more available easily in the shops
3.)Colours used in Holi which r brought from China they should be banned!
  https://t.co/0yl8JkWAJD via @YouTube"
2020-03-06 02:09:36+00:00,RT @KyaUkhaadLega: The mortality rate for #CoronaVirus is around 3% but all we read/see is news related to deaths from it. We’ve never hear…,AjbaniAnkush,vododara india,"Nationalist, Proud Hindu. जय हिन्द। 🇮🇳
RT doesnt mean endorsement or agreement.",569,948,76516,False,The mortality rate for #CoronaVirus is around 3% but all we read/see is news related to deaths from it. We’ve never heard from the 97% who recovered from it who can tell us what to do if we get infected. Well done global media 👏🏻👍🏻
2020-03-06 02:09:36+00:00,"RT @balajis: We are now truly in World War V, the war against the virus.

A human adversary would be preferable. The virus needs no budget,…",mnishshetty1,bengaluru india,Geek.,202,733,3870,False,"We are now truly in World War V, the war against the virus.

A human adversary would be preferable. The virus needs no budget, runs 24/7, is fully decentralized, infinite morale.

We can’t win this with bombs, printing money, sarcastic articles. Only with science and technology. https://t.co/h34dv2XvMa"
2020-03-06 02:09:40+00:00,RT @AmericanGeo: Geographers are leading the charge in tracking the global spread of coronavirus and arming public health professionals and…,Aswani_Akella,hyderabad india,Geoenabler | Spatial Engineering and Technology Evangelist | Consultant,265,331,793,False,"Geographers are leading the charge in tracking the global spread of coronavirus and arming public health professionals and policy makers with the data they need to tackle the public health challenges ahead. #geographymatters

https://t.co/EBy4WFeX9L"
2020-03-06 02:09:40+00:00,"RT @iamsanasrk: On a lighter note. Bollywood is already planning a blockbuster Here is the outline of a new Bollywood movie in production
H…",iamBaikunthaSRK,bhubaneshwar india,"I💖@iamsrk 
#SRK💖 is My Idol
#Being 💖SRKian
#Bhkton_Ka_Baap 💪
#Cricket_Freak.
Big Fan of @ImRo45, #Rahul_Dravid, #Jacques_Kallis. 💖Indian🇮🇳 Cricket🏏 Team",758,2996,31343,False,"On a lighter note. Bollywood is already planning a blockbuster Here is the outline of a new Bollywood movie in production
Hero is a college student whose girlfriend is touring in China She gets infected with coronavirus &amp; has been quarantined in a high security hospital in China."
2020-03-06 02:09:48+00:00,"@SitaramYechury I think u didn't went to China after the virus attacked, they r killing the ppl who got attacked by virus without any mercy, if @narendramodi cancels his outdoor meetings for ppl safety , u will say "" He has fear of virus "", basically u ppl meant for crying. https://t.co/NWxDqNEdtJ",madhurimaluu,hyderabad india,Jai Sreeram # Bharat Mata ki jai,27,273,1115,False,
2020-03-06 02:09:49+00:00,"@RahulGandhi Italian imports are always dangerous to India. A few eg. Sonia Gandhi, you &amp; recently, the corona virus from Italian tourists. Next time you go abroad pls order a little bit of common sense. Guess you can never find it here in India.",DeepuPrabhu2109,bengaluru india,Smile while you still have teeth - this sums up a lot of things about me,60,183,725,False,
2020-03-06 02:09:49+00:00,Can India handle this kind of #coronavirusINDIA #COVID19india #coronavirus #COVID19 - what are the contingency plans by @MoHFW_INDIA @PMOIndia ? https://t.co/CazaiDMhh3,RitasArtCafe,india,"Hi, Welcome to my Art Cafe. Grab a cup of coffee (or tea, or whatever) and look at my artworks. If you want to buy any, please tweet to me.",7032,3656,99452,False,
2020-03-06 02:09:50+00:00,"I am standing side-by-side with @WHO as they help the world fight #COVID19. Through Being Safe, Smart &amp; Kind we will Be Ready for the new #coronavirus. Learn more at https://t.co/OTdQzmdqgC",drrajeshkumar26,chandigarh india,Community Physician,303,45,239,False,
2020-03-06 02:09:55+00:00,RT @rationalsquad: Rick Santelli on @CNBC just made the argument that we'd be better off if everyone got the #coronavirus right away and 2%…,ATamariya,bengaluru india,The price of anything is the amount of life you pay for it.,121,300,79834,False,"Rick Santelli on @CNBC just made the argument that we'd be better off if everyone got the #coronavirus right away and 2% of the world died off, so that financial markets could stabilize.

Rick likes Republicans, don't be like Rick. This should go viral.

#VoteBlueToSaveAmerica https://t.co/1orGoG6cWO"
2020-03-06 02:09:56+00:00,"RT @RexChapman: Coronavirus instructions. 
Wait for it...https://t.co/WvnKBwKUtb",javedhasnain,hyderabad india,,269,176,905,False,"Coronavirus instructions. 
Wait for it...https://t.co/WvnKBwKUtb"
2020-03-06 02:09:59+00:00,Israeli PM Netanyahu encourages Israelis to adopt India’s Namaste to avoid Coronavirus spread https://t.co/5WTftRMpDi,yuvaswapan,new delhi india,Chief Editor Of Yuva Swapan Yuva Soch (https://t.co/J1mR1CGvRt),2262,360,66342,False,
2020-03-06 02:10:07+00:00,"RT @MedasinMusic: So hear me out, once corona virus has infected most of the U.S. population, we should start having corona exclusive festi…",krascend,india,22 | DJ/Producer | Martin Garrix for life,1241,1315,12094,False,"So hear me out, once corona virus has infected most of the U.S. population, we should start having corona exclusive festivals where in order to attend you must HAVE coronavirus, so that you won’t be spreading it to the uninfected. Otherwise shit boutta get canceled left &amp; right"
2020-03-06 02:10:09+00:00,"RT @parveen1141995: #ShaheenBaghEmpty 
Biryani Over
Money Over
Delhi Election Over
Trump visit Over
PFI Over
Tahir Hussain Over
Sharjeel Im…",AyushJh11019192,mumbai india,civil engineering nationalist india first,1131,1097,65582,False,"#ShaheenBaghEmpty 
Biryani Over
Money Over
Delhi Election Over
Trump visit Over
PFI Over
Tahir Hussain Over
Sharjeel Imaam Over
Shahrukh Over
CAA Protest....kha h bhai...Jihadi Corona se Darr gye 😂😂"
2020-03-06 02:10:09+00:00,"RT @Wealth_Theory: POSITIVE Corona Virus news:

Active cases of the virus are declining thanks to China’s reported recoveries. https://t.co…",Venkatn86,chennai india,Human | Father 👨‍👩‍👧 | Indian🇮🇳 | Learning about businesses and economy | Investor | Optimist | Hindu 🕉️ | தமிழ்,68,66,1413,False,"POSITIVE Corona Virus news:

Active cases of the virus are declining thanks to China’s reported recoveries. https://t.co/NWRP3ecCHn"
2020-03-06 02:10:14+00:00,RT @PrisonPlanet: The man believed to be coronavirus patient zero in Italy is a Pakistani migrant refused to self-isolate after testing pos…,AjbaniAnkush,vododara india,"Nationalist, Proud Hindu. जय हिन्द। 🇮🇳
RT doesnt mean endorsement or agreement.",569,948,76516,False,"The man believed to be coronavirus patient zero in Italy is a Pakistani migrant refused to self-isolate after testing positive for the virus and continued to deliver food.

https://t.co/agsIYDXphd"
2020-03-06 02:10:19+00:00,RT @GargiRawat: In Parliament Gopal Yadav says the coronavirus will never reach 'dehaat' or rural India because they have so many Ayurvedic…,alizaved,jaunpur india,JAI HIND जय हिंद جی ہند | Law Graduate | Enterprenur | RTs are not an Endorsement | Proud Indian | Social Activist,556,3882,31867,False,In Parliament Gopal Yadav says the coronavirus will never reach 'dehaat' or rural India because they have so many Ayurvedic treatments there that will kill the virus .. So take care in the cities *yay* #coronavirusindia #COVID19
