created_at,full_text,screen_name,location,description,followers_count,friends_count,statuses_count,verified,full_retweet_text
2020-02-01 02:59:28+00:00,"RT @siddarth_jain: This is one of the most remarkable efforts of @narendramodi 's government. 

No matter where one is in the world, our na…",proud_hindu9,india,Zindgi to apne damm par hi jiyi jati hey..dusro k kandhe par tohh shirf janaje uthaye jate hey! BHARAT MATA KI JAI!!,1331,2602,5276,False,"This is one of the most remarkable efforts of @narendramodi 's government. 

No matter where one is in the world, our nation acts promptly, is always one of the first ones to respond and comes to the rescue of every citizen.

A big salute to @adgpi, @airindiain and @MoHFW_INDIA. https://t.co/E6hPqSGXLK"
2020-02-01 02:59:30+00:00,RT @ashoswai: Modi should send this moron to Wuhan with some cow dung and urine!  https://t.co/BDWNBqTi2m,Haneefa19723104,chennai india,Indian Police Service,40,264,2707,False,Modi should send this moron to Wuhan with some cow dung and urine!  https://t.co/BDWNBqTi2m
2020-02-01 02:59:31+00:00,"RT @siddarth_jain: This is one of the most remarkable efforts of @narendramodi 's government. 

No matter where one is in the world, our na…",Virajkirad1,pune india,#SwayamSewak A Proud Hindu.,92,203,16629,False,"This is one of the most remarkable efforts of @narendramodi 's government. 

No matter where one is in the world, our nation acts promptly, is always one of the first ones to respond and comes to the rescue of every citizen.

A big salute to @adgpi, @airindiain and @MoHFW_INDIA. https://t.co/E6hPqSGXLK"
2020-02-01 02:59:34+00:00,"RT @AskAnshul: Air India special flight to evacuate Indian citizens from China's Wuhan today.

Wuhan is the epicentre of coronavirus.

Salu…",SHANKAR67844274,agra india,Banker | Cluster Head | Traveller | Investment Advisor | #5amclub | PSU |   Pet lover | 🌲 💏 | Determined dreamer | Marketing | 10% procrastinator,224,548,8897,False,"Air India special flight to evacuate Indian citizens from China's Wuhan today.

Wuhan is the epicentre of coronavirus.

Salute to the 5 pilots, 15 crew members, 5 doctors &amp; 1 paramedical staff on-board who are carrying out this operation.

Pray for them and the Indian citizens."
2020-02-01 02:59:35+00:00,"RT @savitha_rao: Kudos to Indian govt . 

@narendramodi @DrSJaishankar",GyanveerSingh8,india,"Proud Indian I support my Armed forces Nation first unapologetically right unabashedly a Modi Fan
RTs not endorsement
Cogito Ergo Sum I think therefore I am",996,700,144028,False,"Kudos to Indian govt . 

@narendramodi @DrSJaishankar https://t.co/oYlaRz8TTj"
2020-02-01 02:59:36+00:00,"RT @MajorPoonia: All you need to know about #Coronavirus .We can prevent it.
Share for public awareness.🙏 https://t.co/CKj0Vkbyaz",hkverma737,pune india,INDIAN,469,2403,7002,False,"All you need to know about #Coronavirus .We can prevent it.
Share for public awareness.🙏 https://t.co/CKj0Vkbyaz"
2020-02-01 02:59:38+00:00,"Well, China continues to amaze every single time. https://t.co/weoZeFqLRy",agarwalkush17,mumbai india,"Venture and Growth Investing at Goldman Sachs Investment Partners. 
Views are personal",172,158,864,False,
2020-02-01 02:59:39+00:00,RT @Enigma7900: My sincere love and respect for them!,gohil__,gujarat india,"seeker, I like sleep",409,143,2446,False,My sincere love and respect for them! https://t.co/2CuvcMLP59
2020-02-01 02:59:40+00:00,"RT @IndurChhugani: India will, in the next 5 years, be the country which will wipe out all Pharma companies across the world.

India will e…",jaisingh_hada,india,colonel (veteran) independent views on matters of national interest,191,491,13063,False,"India will, in the next 5 years, be the country which will wipe out all Pharma companies across the world.

India will export 1st, only cow urine of Desi cows, with magical curing properties. 

Next on the list is Bhakt urine. It will change d world.
https://t.co/8aKT6eg7YG"
2020-02-01 02:59:42+00:00,"RT @HariHaraBhakta: @CGTNOfficial Just admit that Chinese biological weapon program has gone haywire.

Wild animals selling is going on for…",ChaanakyaBrf,india,,243,513,25651,False,"@CGTNOfficial Just admit that Chinese biological weapon program has gone haywire.

Wild animals selling is going on for eons, and nature has its own counter measures for it.

But this sudden outbreak and spread points to a different direction.

https://t.co/lAsHTzNfFD"
2020-02-01 02:59:43+00:00,"Corona virus being in the front line of managing stock markets world wide,we are no exception to that.Only a trigger from budget speech will give push to our markets.I personally have no big expectations from budget.
#nifty50 
#Budget2020 
#banknifty",OPTIONTRADINGE1,hyderabad india,I am a NSE certified Research and Technical analyst.,55,2,396,False,
2020-02-01 02:59:44+00:00,"RT @ABHIJIT_LS: Republic TV is as contagious as Corona Virus  .
Beware of it , get Ur self protected from it by unsubscribe it from your TV…",Meraj0107,hyderabad india,"Surviving with multiple health issues. 
Lumbar Disc Herniation, Cervical Spondylosis and Chronic Bronchitis.",106,530,28659,False,"Republic TV is as contagious as Corona Virus  .
Beware of it , get Ur self protected from it by unsubscribe it from your TV menu 😀"
2020-02-01 02:59:45+00:00,"RT @kaul_vivek: On Page 147 of Volume 1 of the Economic Survey is a fun fact. 
While China and Singapore require only four licenses to open…",Harshgo69703413,sirsa india,students,35,70,3608,False,"On Page 147 of Volume 1 of the Economic Survey is a fun fact. 
While China and Singapore require only four licenses to open a restaurant, India requires several more mandatory licenses and approvals: Delhi requires 26, Bangaluru 36, and Mumbai requires 22."
2020-02-01 02:59:50+00:00,"RT @seriousfunnyguy: When it comes to concern for its citizens, be it 4640 citizens from Yamen by @Gen_VKSingh or #coronarovirus exposed Wu…",vikeshsharma167,india,PROUD INDIAN...PROUD BIHARI...PROUD HUMAN...GRADUATED IN MECHANICAL ENGINEERING...,593,916,106287,False,"When it comes to concern for its citizens, be it 4640 citizens from Yamen by @Gen_VKSingh or #coronarovirus exposed Wuhan, @narendramodi Govt will not leave you alone..

A big salute to every person involved in this evacuation!!
@MEAIndia https://t.co/08TneD0r6t"
2020-02-01 02:59:53+00:00,A coronated prince and IIT grad help MHA seal Bodo peace accord | India News - Times of India https://t.co/9b38CgdpXS,HemantaTOI,bhubaneswar odisha india,"Hemanta Pradhan is a journalist with @timesofindia and writes on Indian Railways, Education, Agriculture and Tribal issues. Views expressed are personal.",2190,461,6723,False,
2020-02-01 02:59:54+00:00,RT @AnsariLadakh: Zee news and republic tv are the dreadful virus than Corona or swine flu epidemic in India. They spread venom in the enti…,BashaBhai2020,tiruchirapalli india,"Trading on Equity , currency, commodity,and also running a Real Estate Firm",404,4112,23433,False,"Zee news and republic tv are the dreadful virus than Corona or swine flu epidemic in India. They spread venom in the entire society and make them dead souls. 

#India2020"
2020-02-01 02:59:54+00:00,"First special Air India flight bringing back more than 300 Indian nationals from Wuhan lands in Delhi.

#CoronaVirus

https://t.co/I2hdLpBoUZ",airnewsalerts,new delhi india,"Official account of News Services Division, All India Radio.

हिंदी के समाचारों के लिए @AIRNewsHindi को फॉलो करें!
Follow @AIRNewsUrdu for news updates in Urdu",2317525,13,264963,True,
2020-02-01 02:59:55+00:00,Air India Flies Back 324 Indians From China's #Wuhan. #Coronavirus https://t.co/ZK8zegPRjj,avs_IND,new delhi india,"Biologically, Emotionally, Financially, Intellectually, N/E, Indian.........👽NationFirst | Himalaya | Parvati-Valley | Defence | Politics | MUFC | RT≠ENDT",4292,682,53067,False,
2020-02-01 02:59:56+00:00,"RT @MajorPoonia: All you need to know about #Coronavirus .We can prevent it.
Share for public awareness.🙏 https://t.co/CKj0Vkbyaz",govindmehta19,india,"National Swimmer, Entrepreneur ,interested in politics , Economics ,  ..",27,105,1854,False,"All you need to know about #Coronavirus .We can prevent it.
Share for public awareness.🙏 https://t.co/CKj0Vkbyaz"
2020-02-01 02:59:56+00:00,"RT @siddarth_jain: This is one of the most remarkable efforts of @narendramodi 's government. 

No matter where one is in the world, our na…",vikkythepatriot,india,"Religion-INDIA | Caste-Friendship | Belief-Secularism(Not Sickular) | Hate-Traitors,Lies & Congress(of course) | Nation First | All Views are personal",408,1239,16086,False,"This is one of the most remarkable efforts of @narendramodi 's government. 

No matter where one is in the world, our nation acts promptly, is always one of the first ones to respond and comes to the rescue of every citizen.

A big salute to @adgpi, @airindiain and @MoHFW_INDIA. https://t.co/E6hPqSGXLK"
2020-02-01 02:36:05+00:00,"RT @AskAnshul: Air India special flight to evacuate Indian citizens from China's Wuhan today.

Wuhan is the epicentre of coronavirus.

Salu…",PawanTiwKrishna,uttar pradesh india,believe in equality and unity among hindus. Proud Hindu,171,701,7091,False,"Air India special flight to evacuate Indian citizens from China's Wuhan today.

Wuhan is the epicentre of coronavirus.

Salute to the 5 pilots, 15 crew members, 5 doctors &amp; 1 paramedical staff on-board who are carrying out this operation.

Pray for them and the Indian citizens."
2020-02-01 02:59:58+00:00,RT @ashwani_mahajan: The article that precipitated the US Govt's decision to ban entry of foreign nationals coming via China into USA. @ash…,ManishJai_Hind,india,"भारतीय जनता पार्टी राष्ट्रीय किसान युवा मोर्चा कार्यसमिति सदस्य , जय हिंद मंच, BJP Samvad Call,",386,2888,4923,False,The article that precipitated the US Govt's decision to ban entry of foreign nationals coming via China into USA. @ashokatluri CC @narendramodi @AmitShah @DrSJaishankar @drharshvardhan https://t.co/pNhKxkSSj2
2020-02-01 02:35:52+00:00,RT @EOIBeijing: An Air India flight carrying 324 Indian nationals from the coronavirus hit Hubei Province of China took off from Wuhan in t…,joshmachine1973,india,"चंचल मन , अती रैंडम......RT is not endorsement. Travelling Salesman. Tech , History, Defense, Whiskey and Politics....",704,1756,149086,False,An Air India flight carrying 324 Indian nationals from the coronavirus hit Hubei Province of China took off from Wuhan in the early hours of Feb 1. Majority of the passengers were Indian students. We sincerely thank the Chinese government for facilitating this flight. (1/3)
2020-02-01 02:35:56+00:00,"RT @jamewils: ""Indian comedian Kunal Kamra banned from IndiGo and Air India after heckling BJP ally""

South China Morning Post gets the hea…",ramarun66,bangalore india,"Software developer, Current affairs enthusiast.",34,255,8731,False,"""Indian comedian Kunal Kamra banned from IndiGo and Air India after heckling BJP ally""

South China Morning Post gets the headline right.

When will our main stream journalists get it right?
https://t.co/ZpO7EKpwnx"
2020-02-01 02:35:57+00:00,RT @JChengWSJ: The world’s biggest tech companies are facing disruptions to their supply chains from prolonged factory closures and labor s…,NavroopSingh_,new delhi india,"IPR Attorney, Geo Political Analyst, co-author of two books #TheNewGlobalOrder & #KoreanPeninsula with @AsianWarrior, Music Lover, Poet. RTs ≠Endorsements",25280,3324,699584,False,"The world’s biggest tech companies are facing disruptions to their supply chains from prolonged factory closures and labor shortages in China, as the deadly coronavirus outbreak threatens the nation’s vast manufacturing network.
@DanStrumpf https://t.co/qCTM5gvTWq"
2020-02-01 02:35:58+00:00,RT @AjitsinhJagirda: Chinese tourism and trade will be hit if travel warnings are issued? Who would want to visit China even if no travel w…,desertfox61I,india,"Once a Soldier Always a Soldier
RT not endorsements",12150,2723,442524,False,Chinese tourism and trade will be hit if travel warnings are issued? Who would want to visit China even if no travel warning is there? https://t.co/HGBhkj7dNl
2020-02-01 02:35:39+00:00,"RT @sneheshphilip: To create and manage a facility for quarantine of approx 300 Indian students arriving from #Wuhan, China, Indian Army ha…",YusufDFI,bangalore india,"Editor, Indian Defence Forum https://t.co/xpbuZAFzVr Blogs at https://t.co/oHy4YvGhiz   YusufUnjhawala@mastodon.social",34433,1489,130445,True,"To create and manage a facility for quarantine of approx 300 Indian students arriving from #Wuhan, China, Indian Army has swiftly created a facility near Manesar where the students can be monitored for a duration of two weeks @ThePrintIndia #coronavirusindia https://t.co/tH4T4NgQuJ"
2020-02-01 02:35:46+00:00,"RT @AQUIBMIR7: Corona virus will die soon, as it is Made in China. And, it has no warranty 😅",koraboina_vijay,hyderabad india,"Telangana Jagruthi youth state convener
Telangana Body Builders Association State President",2181,310,4652,False,"Corona virus will die soon, as it is Made in China. And, it has no warranty 😅"
2020-02-01 02:35:46+00:00,"RT @casaurabh261: #GSTNfailed
China has built 57 Story Hospital in 19 days and we are not able to built a smooth GST portal in 31 months. T…",IamPrince167,new delhi india,Man on mission- to live the best possible life come what may.,599,385,65382,False,"#GSTNfailed
China has built 57 Story Hospital in 19 days and we are not able to built a smooth GST portal in 31 months. Then department is expecting to complete all compliance on time. What an Irony.🤔 #NirmalaSitharaman
#CBIC"
2020-02-01 02:35:22+00:00,RT @ANI: Delhi: #CoronaVirus screening will be conducted by a team of doctors at Delhi Airport for all the 324 Indians who have arrived in…,I_Pinaki,kolkata india,Writing autobiography is like advertising own self. FYI don't take my words seriously.,69,362,684,False,"Delhi: #CoronaVirus screening will be conducted by a team of doctors at Delhi Airport for all the 324 Indians who have arrived in the Air India special flight from Wuhan (China). Later on, if necessary, they will be put under medical observation. https://t.co/nhLnq2GIz8 https://t.co/NgGep1mM6q"
2020-02-01 02:35:27+00:00,"RT @VOANews: 📌 CORONAVIRUS UPDATE

🇨🇳 China

DEATHS  258

CONFIRMED CASES 

11,000 +

(VOA/AFP)",788abhishek,new delhi india,"#HumanityFirst
#Electrical_Engineer⚡💡
Always Ready to serve our country🇮🇳
#Beingagoodhuman
Be_a_good_person_but_dont_try_to_proof.",54,164,3571,False,"📌 CORONAVIRUS UPDATE

🇨🇳 China

DEATHS  258

CONFIRMED CASES 

11,000 +

(VOA/AFP)"
2020-02-01 02:35:15+00:00,"RT @AskAnshul: Air India special flight to evacuate Indian citizens from China's Wuhan today.

Wuhan is the epicentre of coronavirus.

Salu…",GodaHerchel,akola india,Citizen of India.,12,367,277,False,"Air India special flight to evacuate Indian citizens from China's Wuhan today.

Wuhan is the epicentre of coronavirus.

Salute to the 5 pilots, 15 crew members, 5 doctors &amp; 1 paramedical staff on-board who are carrying out this operation.

Pray for them and the Indian citizens."
2020-02-01 02:35:16+00:00,RT @ANI: Delhi: #CoronaVirus screening will be conducted by a team of doctors at Delhi Airport for all the 324 Indians who have arrived in…,rajjatkarekar,goa india,"Wanted to be a Pilot✈️, Got stuck in an alternate timeline",193,367,9132,False,"Delhi: #CoronaVirus screening will be conducted by a team of doctors at Delhi Airport for all the 324 Indians who have arrived in the Air India special flight from Wuhan (China). Later on, if necessary, they will be put under medical observation. https://t.co/nhLnq2GIz8 https://t.co/NgGep1mM6q"
2020-02-01 02:28:39+00:00,@chandan_khaoash @200_zoka @AirForceReviews @VinodDX9 @fighterpics @peterpobjecky @Sunkway_China @NEWZWARZ old name is Su-50,I30mki,india,"i am a Defence analyst of DFI.. News i post or Copy paste from Different forums,  ..🇷🇺🇮🇳, RT's are not my endorsements....",9867,249,36199,False,
2020-02-01 02:31:35+00:00,@I30mki @200_zoka @AirForceReviews @VinodDX9 @fighterpics @peterpobjecky @Sunkway_China @NEWZWARZ F-22 Raptor.,saptak__mondal,kolkata india,"I am a student who is interested in Geopolitics, Domestic Politics, Military tech and PC Games.",1420,655,7656,False,
2020-02-01 02:34:57+00:00,@iishitav Logic. WhatsApp works in China.,sandesh_samant,mumbai mh india,Politically Addicted 🇮🇳 | Writes on #InternationalRelations | Eccedentesiast | Traveller | Rail Freak | Love Himalayas | Strictly Personal Views,1620,2214,49388,False,
2020-02-01 02:34:59+00:00,RT @ANI: Delhi: #CoronaVirus screening will be conducted by a team of doctors at Delhi Airport for all the 324 Indians who have arrived in…,ujwalmokashi,bengaluru india,I give as good as I get,366,1576,6439,False,"Delhi: #CoronaVirus screening will be conducted by a team of doctors at Delhi Airport for all the 324 Indians who have arrived in the Air India special flight from Wuhan (China). Later on, if necessary, they will be put under medical observation. https://t.co/nhLnq2GIz8 https://t.co/NgGep1mM6q"
2020-02-01 02:35:01+00:00,RT @DrSJaishankar: Called Chinese State Councilor and Foreign Minister Wang Yi today to thank him for the cooperation extended by the Chine…,NavroopSingh_,new delhi india,"IPR Attorney, Geo Political Analyst, co-author of two books #TheNewGlobalOrder & #KoreanPeninsula with @AsianWarrior, Music Lover, Poet. RTs ≠Endorsements",25281,3324,699585,False,"Called Chinese State Councilor and Foreign Minister Wang Yi today to thank him for the cooperation extended by the Chinese government for the departure of Indian students and professionals from Wuhan. As China deals with the #coronavirus challenge, we agreed to stay in touch."
2020-02-01 02:23:44+00:00,According to these idiots everything can be cured by cow urine pls send this message in china hope people can save their lives https://t.co/syVxYWE9Me,singhgagan02,india,"Duniya k sabse bade star ka sabse bada Fan
#FanAccount",486,286,28144,False,
2020-02-01 02:23:47+00:00,#AirIndia @airindiain special flight carrying 324 #Indians from #Wuhan #China lands in Delhi. Hopefully all #Indians abroad are safe and healthy. Thanks to #GoI @PMOIndia @narendramodi for caring. #Coronavirus @drmonika_langeh @KhajuriaManu @MattLaemon @kakar_harsha https://t.co/yOPxMDKjHY,JaiHind_Sena,noida india,,67,225,927,False,
2020-02-01 02:23:48+00:00,"RT @sneheshphilip: To create and manage a facility for quarantine of approx 300 Indian students arriving from #Wuhan, China, Indian Army ha…",Abhi_Gosavi17,nashik india,Mbbs⚕️ Worked at CHN & KEM 🏥 Vedic paradigm🕉️   Nationalist🇮🇳    Egalitarian⚖️   Anime Otaku 🗿,911,205,64138,False,"To create and manage a facility for quarantine of approx 300 Indian students arriving from #Wuhan, China, Indian Army has swiftly created a facility near Manesar where the students can be monitored for a duration of two weeks @ThePrintIndia #coronavirusindia https://t.co/tH4T4NgQuJ"
2020-02-01 02:23:52+00:00,RT @EOIBeijing: An Air India flight carrying 324 Indian nationals from the coronavirus hit Hubei Province of China took off from Wuhan in t…,roopal01,india,Animal Lover. Singer. Avid Reader. Physics Freak. Nerd. Traveller. Shiva - The Consciousness of The Cosmos.,3351,3882,92404,False,An Air India flight carrying 324 Indian nationals from the coronavirus hit Hubei Province of China took off from Wuhan in the early hours of Feb 1. Majority of the passengers were Indian students. We sincerely thank the Chinese government for facilitating this flight. (1/3)
2020-02-01 02:23:27+00:00,"RT @AskAnshul: Air India special flight to evacuate Indian citizens from China's Wuhan today.

Wuhan is the epicentre of coronavirus.

Salu…",ca_vpsingh,new delhi india,"Chartered Accountant, from Sultanpur (U.P.) & Delhi. Alumnus - 'University of Delhi' & 'ICAI'.",483,1278,33714,False,"Air India special flight to evacuate Indian citizens from China's Wuhan today.

Wuhan is the epicentre of coronavirus.

Salute to the 5 pilots, 15 crew members, 5 doctors &amp; 1 paramedical staff on-board who are carrying out this operation.

Pray for them and the Indian citizens."
2020-02-01 02:23:38+00:00,@anoophilip South China employs the Indian unemployed. 😄😄😄😄😄 https://t.co/Wjp1X2Recp,TheBongHead,kolkata india,"Minority, Feminist, Communist ☭, Leftist, Liberal                    

Kidding. These are all jokes on us. [Parody] 🌻

[Security Researcher, IISc, IIM alumnus]",3145,391,37000,False,
2020-02-01 02:23:39+00:00,"RT @ANI: Air India special flight to depart today from Delhi for Wuhan (China) for the evacuation of Indians. According to Ashwani Lohani,…",ShyamJeeGupta3,india,"RTI Activist, Ex Executive Member Kanpur Bar Association, Kanpur Nagar..",38,80,3747,False,"Air India special flight to depart today from Delhi for Wuhan (China) for the evacuation of Indians. According to Ashwani Lohani, Air India, CMD, at least 400 Indians will be evacuated today. The flight will take off at 12 pm and will return by 2 am tomorrow. #Coronavirus https://t.co/oPtGU9ySAC"
2020-02-01 02:23:23+00:00,"Bull shit. The X is hardly informed. Mao screwed up China. Led China into doom. But for Deng Xiaoping and team China would be weaker than India today. I have no doubt Nehru misled, misgoverned and denied India it's due growth. Congress is a wasteful party IMO. https://t.co/TFaoqTxfQD",ShivaKap,tamilnadu india,RT=¥. Centre. People are important. Politicians are replaceable. Speak my mind. Speak Tamil & more. Humour. Tear the political nonsense. TRUTH MUST PREVAIL.,1643,395,224456,False,
2020-02-01 02:23:02+00:00,"@retheeshraj10 @indiatvnews Plz do something with these type of jokers
Plz send him to china and ask him to treat coronavirus pts with dung and urine
Mazak banadiya hai medicine ka😡😡😡",drmohsin_md,hyderabad india,"Proud Indian,
Certified Anti National & Urban Naxal by govt of India,Puncture wala
Doctor,
in tht order.
Hate communal politics so basically hate Bjp and rss",17,184,1957,False,
2020-02-01 02:23:03+00:00,"RT @karabhijee: India under threat? Delhi issues warning to China over ‘threats to our sovereignty’

According to Indian government officia…",Naveenku555,india,Yeh dil manger more,1042,1208,192632,False,"India under threat? Delhi issues warning to China over ‘threats to our sovereignty’

According to Indian government officials, approximately six Chinese research vessels have been spotted in the region this month.

https://t.co/WQq1ijUqgC"
2020-02-01 02:22:37+00:00,"RT @globaltimesnews: #Update: In total 11,791 confirmed cases of novel #coronavirus have been reported in China as of Jan 31, with 259 deat…",_neerajkr,delhi india,#Recruitment #HRTech #Operations #Equity #FinancialPlanning,92,326,3083,False,"#Update: In total 11,791 confirmed cases of novel #coronavirus have been reported in China as of Jan 31, with 259 deaths and 243 recovered. https://t.co/eF68pQkKIc"
2020-02-01 02:22:21+00:00,"RT @avarakai: @MoHFW_INDIA @PMOIndia @EOIBeijing Suddenly, Pakistan dumps China.

😂

https://t.co/hVHDloEZ4V",A31X64Vijay,india bharat,"Dreaming for a Strong, Powerful & Glorious 'Great-INDIA' (Akhand Bharat) ... in a Beautiful WORLD !!! .. RTs are Not Endorsements !",4109,4977,379624,False,"@MoHFW_INDIA @PMOIndia @EOIBeijing Suddenly, Pakistan dumps China.

😂

https://t.co/hVHDloEZ4V"
2020-02-01 02:22:23+00:00,RT @RanaAyyub: Only South China Morning Post got it right 👏 https://t.co/KPdWAEvKei,alisajid08,greater noida india,,94,551,7490,False,Only South China Morning Post got it right 👏 https://t.co/KPdWAEvKei
2020-02-01 02:22:25+00:00,"RT @RahulGandhi: In China, the Coronavirus has killed hundreds of people. My thoughts are with the families of the victims &amp; the millions w…",arunkumar_iyc,dharapuram india,"president,Tirupur South District youth congress",151,381,5138,False,"In China, the Coronavirus has killed hundreds of people. My thoughts are with the families of the victims &amp; the millions who have been forced into quarantine to prevent the spread of the virus. May they find the courage &amp; strength to persevere through this terrible ordeal."
2020-02-01 02:22:26+00:00,RT @DrSJaishankar: Called Chinese State Councilor and Foreign Minister Wang Yi today to thank him for the cooperation extended by the Chine…,rongame,mumbai india,"Social Sector Professional | Previously Chief Minister's Fellow under @Dev_Fadnavis | People, Politics and Positivity | Har Har Mahadev ॐ नमः शिवाय",633,1222,28260,False,"Called Chinese State Councilor and Foreign Minister Wang Yi today to thank him for the cooperation extended by the Chinese government for the departure of Indian students and professionals from Wuhan. As China deals with the #coronavirus challenge, we agreed to stay in touch."
2020-02-01 02:22:30+00:00,"RT @XHNews: Update on novel #coronavirus infection in China: https://t.co/jku2MMNSkc
-Total: 11,791 confirmed cases, 259 deaths, 136,987 cl…",selvasathyam,india,,1003,1156,40960,False,"Update on novel #coronavirus infection in China: https://t.co/jku2MMNSkc
-Total: 11,791 confirmed cases, 259 deaths, 136,987 close contacts traced, 243 discharged from hospital after recovery
-Friday: 2,102 new confirmed cases, 5,019 new suspected cases, and 46 deaths https://t.co/VvoxVAECHY"
