created_at,full_text,screen_name,location,description,followers_count,friends_count,statuses_count,verified,full_retweet_text
2020-03-15 18:05:04+00:00,RT @esaagar: Chinese Tycoon Who Criticized Xi’s Response to Coronavirus Has Vanished https://t.co/A72RibZVw8,rohitkhaware,jharkhand india,,39,238,6039,False,Chinese Tycoon Who Criticized Xi’s Response to Coronavirus Has Vanished https://t.co/A72RibZVw8
2020-03-15 18:05:08+00:00,"RT @SalmanNizami_: CANADA: No one should have to worry about paying rent, buying groceries, hospital expenses. We will help Canadians finan…",dreamer2671,india,,205,4464,8416,False,"CANADA: No one should have to worry about paying rent, buying groceries, hospital expenses. We will help Canadians financially; PM Justin Trudeau.

INDIA; Modi Govt has cancelled the notification of ex- gratia &amp; cost of hospitalisation of Coronavirus patients.

SHAME!"
2020-03-15 18:05:10+00:00,RT @Nidhi: This shows how serious Pakistan is in dealing with the Coronavirus. What a sorry state,Rajendr43212394,new delhi india,"Do not regret growing older, it is a privilege denied to many.",304,831,24427,False,This shows how serious Pakistan is in dealing with the Coronavirus. What a sorry state https://t.co/2eUtuQbRAT
2020-03-15 18:05:12+00:00,RT @ShashiTharoor: Iranian artist Danial Kheirkhah uses a creative way to instruct people how to wash their hands amid Coronavirus #COVID19…,Harshnamdev200,ujjain india,Activist | Engineer_by_profession | Political_by_intrest | Love_to_read | Hate_communal_parties | Social_Thinker |  Gandhiyan | Secular_Bhartiya | Congressman.,1033,629,24596,False,"Iranian artist Danial Kheirkhah uses a creative way to instruct people how to wash their hands amid Coronavirus #COVID19 outbreak. #Corona के पीछे हाथ धो कर पड़ जाइए, और हाँ हाथ ऐसे धोने हैं https://t.co/lo6uzFAZoR"
2020-03-15 18:05:12+00:00,RT @mattfrei: Italy records 368 new deaths in one day. Worse than the deadliest day in Wuhan.,chaitugooner,india,Arsenal Fan.Write on football & The Arsenal.Wrote for @starsports India during WC2014 & featured on @mintonsunday.Do other things to feed my stomach.,316,1184,35712,False,Italy records 368 new deaths in one day. Worse than the deadliest day in Wuhan.
2020-03-15 18:05:12+00:00,"RT @AmitShah: As Prime Minister of 1.25Bn people, PM @narendramodi has done a commendable job in getting together SAARC countries to combat…",RG83T4TWT,ahmadabad city india,,90,25,25751,False,"As Prime Minister of 1.25Bn people, PM @narendramodi has done a commendable job in getting together SAARC countries to combat COVID-19.
India has risen to the occasion and it was heartening to see regional cooperation to overcome the menace of Corona, which is impacting everyone."
2020-03-15 18:05:16+00:00,@RanaAyyub You idiots will only watch once it 1. Is in Oscars 2. Pandemic is going on.,Blueburnt_,bengaluru india,"@Sunrisers @Arsenal
Fluid on your idea of political spectrum",164,1110,4436,False,
2020-03-15 18:05:20+00:00,"RT @chandrarsrikant: What a misleading headline! 
 Ramdev said, ""There is no need to fear from coronavirus but strictly take precautions to…",anamikabhipraya,india,,87,578,11390,False,"What a misleading headline! 
 Ramdev said, ""There is no need to fear from coronavirus but strictly take precautions to prevent its spread and infection.When you are at public places or are travelling by bus, train and flight then you must use sanitizer for your hands."" https://t.co/h9LkX8FuZY"
2020-03-15 18:05:26+00:00,RT @narendramodi: Here are some of India’s efforts towards combatting the menace of COVID-19 Novel Coronavirus. https://t.co/G5WFZBx6HB,Sunitasawant19,mumbai india,INDIAN 🇮🇳  जय हिंद जय भारत। हिंदुत्व सागर है और सागर से गहरा कोई नही हिमालय से गंगासागर जीवन है।,195,306,7548,False,Here are some of India’s efforts towards combatting the menace of COVID-19 Novel Coronavirus. https://t.co/G5WFZBx6HB
2020-03-15 18:05:30+00:00,RT @Healthonics: Take precautionary measures! Stay safe! #CoronaVirusUpdates Situation in Europe is getting critical every passing day! #Sp…,GauriNeelima,mumbai india,"Proud INDIAN.Hindu.Shraddhavan.Professor by Profession.Student Forever...
Mother of a Daughter...
Interested in Economics,Politics,Religion...!!!",80,210,2350,False,Take precautionary measures! Stay safe! #CoronaVirusUpdates Situation in Europe is getting critical every passing day! #Spain reports 2000 new #COVID19 cases with &gt;100 deaths within 24 hours despite near-total nationwide lockdown! https://t.co/BzysEu5opS
2020-03-15 18:05:34+00:00,"RT @Sidsfangirl: People are tweeting about Corona and taking precautions and we are tweeting #OurHeroSid ? 
@sidharth_shukla ? Kya matalb?…",MrBiswa38357055,west bengal india,students,36,137,12008,False,"People are tweeting about Corona and taking precautions and we are tweeting #OurHeroSid ? 
@sidharth_shukla ? Kya matalb? What have you done?"
2020-03-15 18:05:38+00:00,RT @ANI: Italy hits one-day record with 368 new #coronavirus deaths: AFP news agency,Rajneesh1516,uttar pradesh india,"गर्व से कहिये हम हिन्दू हैं
💯%फालो बैक 🙏🙏",6663,6676,7079,False,Italy hits one-day record with 368 new #coronavirus deaths: AFP news agency
2020-03-15 18:05:39+00:00,"RT @NorbertElekes: BREAKING: Italy reports 3,590 new cases of coronavirus and 368 new deaths.

A total of 24,747 cases and 1,809 deaths.",TweetsByAkshat,india,"Civil Engineer, Movie & TV/Web Series Expert, Story Writer, Blogger & News Provider.",1645,20,205048,False,"BREAKING: Italy reports 3,590 new cases of coronavirus and 368 new deaths.

A total of 24,747 cases and 1,809 deaths."
2020-03-15 18:05:44+00:00,"RT @AskAnshul: Coronavirus:

Zafar Mirza, State Minister of Health of Pakistan, who raised Kashmir issue during SAARC video conference, acc…",gmscomputers,bikaner india,#SwadeshiWarrior,284,336,10232,False,"Coronavirus:

Zafar Mirza, State Minister of Health of Pakistan, who raised Kashmir issue during SAARC video conference, accused of smuggling 20 million face masks out of Pak 2 days ago.

Pharmacists Association complained to Pak PM's complaint cell.

FIA to probe against Mirza."
2020-03-15 18:05:48+00:00,"Voltage disco lounge khar violating 
And no fear of corona and govt 144 . @MumbaiPolice. @mybmcHealthDept 
@CMOMaharashtra 
@uddhavthackeray https://t.co/uOOxcfKvfx",HathodaPost,mumbai india,"An Investigation News Journal, we Have Just Tried To Explore The World From The Crime Base Country https://t.co/z4saufgcsc https://t.co/t5TY2iBFd1",300,2408,709,False,
2020-03-15 18:05:50+00:00,"RT @caughtoffside: Lorenzo Insigne has donated €100,000 to hospitals in Naples to help with the fight against coronavirus. 😷

Great gesture…",AmeyPanse,india,Awesomeness in my blood| Man United fan till I die| Foodie| Love to talk alot... Single piece ever manufacturered 😉😛,273,564,22653,False,"Lorenzo Insigne has donated €100,000 to hospitals in Naples to help with the fight against coronavirus. 😷

Great gesture from the Napoli star 👏👏👏 https://t.co/5guOND7wsd"
2020-03-15 18:05:54+00:00,"@TIME @nicolesjchung After mobile phones,corona has volunteered to make the humans unsocial🙄😶😶😶😶😶",forfewdaysonly,india,"submissive 😳😳
DELHI😷
followed by John Cena😍😎😎

Instagram = art.caption ❤️🤘",564,891,3021,False,
2020-03-15 18:05:56+00:00,RT @mattfrei: Italy records 368 new deaths in one day. Worse than the deadliest day in Wuhan.,ARYAJKASHYAP,assam india,"অসমীয়া.Lawyer.Work in progress.Retweets and likes are not necessarily endorsement.
'You may say I am a dreamer,but I am not the only one'",65,616,1417,False,Italy records 368 new deaths in one day. Worse than the deadliest day in Wuhan.
2020-03-15 18:06:01+00:00,RT @ANI: Italy hits one-day record with 368 new #coronavirus deaths: AFP news agency,chhalotre_ajay,india,"Senior Lead Software Engineer , Proud  Indian , Love Indian Army ,
A Patriot ,",352,867,30134,False,Italy hits one-day record with 368 new #coronavirus deaths: AFP news agency
2020-03-15 18:23:41+00:00,"RT @UN: One of the most important ways to protect yourself from #COVID19 is regular &amp; safe hand hygiene.

Join the @WHO #SafeHands challeng…",Shailes04893974,jabalpur india,Gratitude is the best attitude,25,59,673,False,"One of the most important ways to protect yourself from #COVID19 is regular &amp; safe hand hygiene.

Join the @WHO #SafeHands challenge &amp; learn more about what you can do to keep yourself and those around you safe: https://t.co/dXd4WQa2qa #coronavirus https://t.co/GtBWMQrZL2"
2020-03-15 18:23:43+00:00,RT @SewageInGanga: No discrimination at Manikarnika for  Cremation! All are same here! It’s sad that people are discriminating about cremat…,ShivKum12203872,varanasi india,"Work is worship
Master in Public Administration@BHU",102,67,4591,False,"No discrimination at Manikarnika for  Cremation! All are same here! It’s sad that people are discriminating about cremation of those infected with #Corona Those who leaving world finally, should be sent with dignity! https://t.co/7KclRF20lF"
2020-03-15 18:23:45+00:00,RT @narendramodi: Here are some of India’s efforts towards combatting the menace of COVID-19 Novel Coronavirus. https://t.co/G5WFZBx6HB,prashan97938045,surat india,Comman Man,117,329,7442,False,Here are some of India’s efforts towards combatting the menace of COVID-19 Novel Coronavirus. https://t.co/G5WFZBx6HB
2020-03-15 18:23:51+00:00,RT @elonmusk: The coronavirus panic is dumb,HimanshuMakhija,new delhi india,,64,864,209,False,The coronavirus panic is dumb
2020-03-15 18:23:54+00:00,WHAT? https://t.co/ZM4VaNcPd8,pratikprasenjit,new delhi india,"Alleged Journalist | Reportedly Reclusive | Admittedly Abrasive | Sporadic Singer | Bhobensoria in Delhi | Likes are bookmarks | Views, personal.",2110,833,42926,False,
2020-03-15 18:23:57+00:00,@lifestyleongo @realityshows123 Then u realize corona has given us work from home😅,sidra_kimadness,bengaluru india,,3,82,690,False,
2020-03-15 18:24:00+00:00,RT @BesuraTaansane: @narendramodi Govt has responded wt great alacrity resolve compassion &amp; set an example for rest of🌍 in every aspect of…,rajib4,india,,133,154,7786,False,"@narendramodi Govt has responded wt great alacrity resolve compassion &amp; set an example for rest of🌍 in every aspect of handling #coronavirus situation
1)Bring stranded🇮🇳's back
2)Tight screening &amp; quarantine measures
3)Timely lockdown of entry into🇮🇳
4)Social distancing measures https://t.co/81su0uaKhr"
2020-03-15 18:24:00+00:00,RT @_Rakesh_RC: 368 deaths due to #COVID-19 reported in 24 hours in Italy. 😢,kamlesh16meena,delhi india,"citizen of india, love constitution and Dr.B.R.ambedkar",318,291,16808,False,368 deaths due to #COVID-19 reported in 24 hours in Italy. 😢
2020-03-15 18:24:03+00:00,"RT @EzraNBC: Italy just announced 368 coronavirus deaths in ONE DAY.

This is not a developing nation, this is a modern country with hospit…",TheSRKian,nashik india,"Whether it's real life or twitter, I follow Shah Rukh Khan everywhere.",4466,990,115940,False,"Italy just announced 368 coronavirus deaths in ONE DAY.

This is not a developing nation, this is a modern country with hospitals that are equal if not superior to many of those in the US. https://t.co/7DXPQZZnni"
2020-03-15 18:24:04+00:00,"@PMOIndia sir, no help provided by official yet. https://t.co/Tv8aa33wTM",pkjuit,jaipur india,need change in me n my country,13,33,186,False,
2020-03-15 18:24:08+00:00,RT @narendramodi: Chalking out a plan to combat the COVID-19 Novel Coronavirus with SAARC leaders. https://t.co/l9H0Nidn6a,exhiliaration,india,,30,275,3674,False,Chalking out a plan to combat the COVID-19 Novel Coronavirus with SAARC leaders. https://t.co/l9H0Nidn6a
2020-03-15 18:24:10+00:00,"RT @sunandavashisht: Unsolicited advice to 24/7 news channels: Instead of neighbor’s pettiness,focus on India’s leadership in combating #CO…",h2eSid,pune india,"Social Entrepreneur | Proud Indian

Founder & CEO @h2epower @MPowerInside #HexisAG

Co-Founder #RCube 

#FuelCell #Battery #GoodEnergySolutions",2049,4892,14449,False,"Unsolicited advice to 24/7 news channels: Instead of neighbor’s pettiness,focus on India’s leadership in combating #COVIDー19, highlight India’s proactive efforts in containing and mitigating the virus. In such times, pettiness can only be answered by magnanimity."
2020-03-15 18:24:10+00:00,RT @gchikermane: Pakistan PM @ImranKhanPTI has chosen to devalue Pakistan and outsource his Prime Ministership to a hate-filled and virulen…,IndianHinduRW,india,"It’s time to think about rebuilding India, which got destroyed in last 100 years by opportunistic politics.",31,304,778,False,"Pakistan PM @ImranKhanPTI has chosen to devalue Pakistan and outsource his Prime Ministership to a hate-filled and virulent proxy who attempted, but failed, to infect the discussion on collective action against #CoronaVirus."
2020-03-15 18:24:16+00:00,RT @AdityaRajKaul: Students of Jammu &amp; Kashmir click photographs before boarding the aircraft at Tehran finally to return home to India. Ex…,imranrezaansari,srinagar india,اني أريد امانا يابن فاطمة مستمسكا بيدي من طارق الزمن | President @ajksa_| General Secretary @JKPC_ | Ex Cabinet Minister | Ex MLA | All my tweets are Personal,20488,501,4345,False,"Students of Jammu &amp; Kashmir click photographs before boarding the aircraft at Tehran finally to return home to India. Excitement to return home. Can’t imagine the trauma that they would have been facing till this rescue. Great efforts @dhamugaddam, @imranrezaansari! #COVIDー19 https://t.co/xBtZLKcfX7 https://t.co/oUK8zX3Mup"
2020-03-15 18:24:17+00:00,Day 4 without football: https://t.co/9T8mmYpLVN,theBangmanx,kolkata india,"“I don’t care wherever this numbness should lead me. And I don’t care, and I couldn’t care less”",335,212,26310,False,
2020-03-15 18:24:22+00:00,"RT @chandrarsrikant: What a misleading headline! 
 Ramdev said, ""There is no need to fear from coronavirus but strictly take precautions to…",rajeevkumar2104,new delhi india,,31,231,6724,False,"What a misleading headline! 
 Ramdev said, ""There is no need to fear from coronavirus but strictly take precautions to prevent its spread and infection.When you are at public places or are travelling by bus, train and flight then you must use sanitizer for your hands."" https://t.co/h9LkX8FuZY"
2020-03-15 18:24:23+00:00,"RT @ABPNews: ""When Iran Government refused to test Indians stranded in Iran for CoronaVirus, Prime Minister Narendra Modi sent an entire la…",Vaibhav20880135,nanded india,"Son, Brother, Citizen.",7,81,66,False,"""When Iran Government refused to test Indians stranded in Iran for CoronaVirus, Prime Minister Narendra Modi sent an entire lab from India along with Indian scientists to test his people &amp; donate the lab to Iran. Share Widely &amp; Feel proud as an Indian.""

https://t.co/yjflF45lKe"
2020-03-15 18:24:24+00:00,RT @davidasinclair: These ideas are testable. COVID-19 should correlate with HbA1c levels (seems true). Patients should have abnormalities…,Bhagawala1,punjab region india,"Young Entrepreneur 
 

Lives on the banks of satluj.....",46,199,1037,False,These ideas are testable. COVID-19 should correlate with HbA1c levels (seems true). Patients should have abnormalities in heme/porphyrin &amp; they might have higher levels of free iron in tissues &amp; blood. I will update with more info as it comes in. Stay safe. Below are links...
2020-03-15 18:24:25+00:00,RT @rishibagree: India should decide a TOTAL LOCK DOWN DATE . We should stop every movement for 10-15 days and all Covid 19 patient will be…,aditi3012,ahmadabad city india,Honored 2be followed by legendary @Loneranger9new ma'am😃,2693,4954,107723,False,"India should decide a TOTAL LOCK DOWN DATE . We should stop every movement for 10-15 days and all Covid 19 patient will be zeroed down.

This is the only way we can stop the spreading if #COVIDー19 in India."
2020-03-15 18:24:28+00:00,"RT @TwitterMoments: Italy reported 368 deaths from the novel coronavirus in the past 24 hours, hitting a new one-day record.
https://t.co/E…",DreamzDrem,india,dreamer😊😊,124,278,49436,False,"Italy reported 368 deaths from the novel coronavirus in the past 24 hours, hitting a new one-day record.
https://t.co/EDKEMPPhdt"
2020-03-15 18:24:28+00:00,RT @PiyushGoyal: Combating #Coronavirus: Watch the proactive efforts taken by Railways to sanitise things prone to passenger touch in train…,RajOsborne,india,जो देखता हूँ वही बोलने का आदी हूँ मैं अपने शहर का सब से बड़ा फ़सादी हूँ,189,1595,28813,False,"Combating #Coronavirus: Watch the proactive efforts taken by Railways to sanitise things prone to passenger touch in trains, making the journey more safe &amp; hygienic for all passengers. https://t.co/aE5vXUOmda"
2020-03-15 18:24:29+00:00,RT @sudhirchaudhary: Pakistan has once again lived up to its reputation of being a rogue nation. To raise #Kashmir at a #SAARC #coronavirus…,RanjitG73076797,bihar india,,71,409,1443,False,"Pakistan has once again lived up to its reputation of being a rogue nation. To raise #Kashmir at a #SAARC #coronavirus conference was cheap. It shows how low Pak can stoop to push its hateful agenda, even when Indian offers a helping hand. What a wasted opportunity for Islamabad!"
2020-03-15 18:24:31+00:00,"RT @rohshah07: #SarabhaiVsSarabhai episode in time of Corona.
Maya has mild symptoms of Corona and the entire family panics and decides to…",911511screwu,new delhi india,"Nationalist

Hindu

CA",136,1079,4418,False,"#SarabhaiVsSarabhai episode in time of Corona.
Maya has mild symptoms of Corona and the entire family panics and decides to self quarantine.
Indhravadhan starts dyeing his hair and starts acting young to prepare himself for the marriage market after Maya's death."
2020-03-15 18:24:40+00:00,"RT @ANI: Government sources: India is ready to send more Rapid Response Teams to #SAARC region, if asked; already one fully equipped team i…",ModifiedAkki,india,"Mahadev Devotee!!!!!
Proud Indian, Proud Bhakt (Mahadaev & Modi), Messi fan forever 😍😍",618,1052,167061,False,"Government sources: India is ready to send more Rapid Response Teams to #SAARC region, if asked; already one fully equipped team is in Maldives. Rapid Response Teams carry with them trained doctors as well as huge diagnostic equipment. #COVID19"
2020-03-15 18:24:41+00:00,"RT @goal: There had been rumours that two hotels owned by Cristiano Ronaldo would become hospitals to aid coronavirus relief.

However, a h…",_hxshxm,chennai india,va da en chips-u,26,240,3150,False,"There had been rumours that two hotels owned by Cristiano Ronaldo would become hospitals to aid coronavirus relief.

However, a hotel spokesperson told RTL Nieuws: ""We are a hotel. We are not going to be a hospital. It is a day like every other; we are and will remain a hotel."" https://t.co/r1IcQQm1wc"
2020-03-15 18:24:43+00:00,"RT @jamewils: It is everywhere, even in Kerala, temples, churches..no one listens or cares!",avistwiter,bengaluru south india,"lover of history & travelogues, food & films",52,49,77791,False,"It is everywhere, even in Kerala, temples, churches..no one listens or cares! https://t.co/YQz5jblTlA"
2020-03-15 18:24:44+00:00,RT @ANI: Italy hits one-day record with 368 new #coronavirus deaths: AFP news agency,IamGokulVJ,india,Fan of Thalapathy @actorvijay❤ Thala @msdhoni | @alluarjun | @urstrulyMahesh | SK | Kholi | OTFC,4983,3365,52545,False,Italy hits one-day record with 368 new #coronavirus deaths: AFP news agency
2020-03-15 18:24:52+00:00,RT @priyankachopra: We're all in this together. Let’s stay informed and do what we can to help stop the spread of #Covid19. Learn more with…,guptatripti37,rajasthan india,"Be Kind 

Lost soul for life 🎬

🇮🇳",2811,366,90732,False,We're all in this together. Let’s stay informed and do what we can to help stop the spread of #Covid19. Learn more with @GlblCtzn or visit the link in my bio. #coronavirus @WHO #who https://t.co/zDtfy1F6js
2020-03-15 18:24:53+00:00,"RT @Sanjaypasvan8: YOGI ADITYANATH JI
CM OF UP
1. MADE LAW THAT WHOSOEVER RIOTS AND CAUSES LOSS PAYS FOR DAMAGES.
2. INVOKED SECTION 3 OF E…",lalit11007,delhi india,,302,303,30697,False,"YOGI ADITYANATH JI
CM OF UP
1. MADE LAW THAT WHOSOEVER RIOTS AND CAUSES LOSS PAYS FOR DAMAGES.
2. INVOKED SECTION 3 OF EPIDEMIC DESEASE ACT SO THAT NO ONE CAN SPREAD #CORONAVIRUS INTENTIONALLY. 
A HINDU MONK DOING DUTY FOR MAA BHARTI.
योगी है तो UP है
#जोगीजी_वाह_जोगीजी https://t.co/somQJKe4wW"
2020-03-15 18:24:55+00:00,RT @rishibagree: India should decide a TOTAL LOCK DOWN DATE . We should stop every movement for 10-15 days and all Covid 19 patient will be…,Ravinde81180106,jaipur india,CIVIL Servant.ITS2K.Presently posted in Jaipur Telecom .Life is Beautiful .Do your best as god gives us back what we deserve.ChrishSainikSchoolDays,18,300,446,False,"India should decide a TOTAL LOCK DOWN DATE . We should stop every movement for 10-15 days and all Covid 19 patient will be zeroed down.

This is the only way we can stop the spreading if #COVIDー19 in India."
2020-03-15 18:24:57+00:00,"@anandmahindra The world is trying to see Corona off by 'Namaste'...
Always we remain at the core and so will be...",brahminpandit,patna bihar india,"I am from Patna(Bihar) https://t.co/I3FqnE8euw, I am 65(+) I obtained MA from Patna University in the year 1981.",4,104,567,False,
2020-03-15 18:24:57+00:00,"RT @ZeeNews: Italy hits one-day record with 368 new coronavirus deaths: official data

https://t.co/c5CiG3Ss1Z",amit000in,mumbai india,"Computer Network & Hardware Engineer  (💯% follow back) चमचे , लिम्ब्रान्डू और सेक्युलर कुत्ते दूर ही रहे 🚩 i don't believe any  politician...but Modi ✌️",1025,1239,12264,False,"Italy hits one-day record with 368 new coronavirus deaths: official data

https://t.co/c5CiG3Ss1Z"
2020-03-15 18:25:02+00:00,"RT @avarakai: Herd immunity, is the worst strategy right now. Unless Government has other plans.",akshaychandorka,nagpur india,,924,201,488545,False,"Herd immunity, is the worst strategy right now. Unless Government has other plans. https://t.co/KeXklkytPS"
2020-03-15 18:25:02+00:00,RT @Ateendriyo: Mask production is highly specialized procedure. It's not getting untrained prison workers and tying four strings of cloth…,SassyIndianGurl,mumbai india,,1122,1220,109822,False,"Mask production is highly specialized procedure. It's not getting untrained prison workers and tying four strings of cloth to a large rectangular bit of cloth...
Using such unhygienic, unscientific masks will be counterproductive, please avoid 🙏🏿🙏🏿🙏🏿 https://t.co/9qIDfZKIz2"
2020-03-15 18:25:04+00:00,RT @DannielB11: Corona Virus ain’t Shit my ex was more Toxic.,viratkohli_x,india,infj || hufflepuff,10133,678,85804,False,Corona Virus ain’t Shit my ex was more Toxic.
2020-03-15 18:25:05+00:00,"Fuck this city man
I don't wanna live in this city anymore https://t.co/g5doKdUyg2",Ronaldopedia,mumbai india,Hala Madrid Y Nada Mas,304,156,16296,False,
2020-03-15 18:25:06+00:00,RT @narendramodi: Would like to thank all distinguished SAARC leaders who joined today’s video conference to tackle COVID-19 Novel Coronavi…,Indarpanchal,udaipur rajasthan india,Live And Let Live,194,522,1674,False,Would like to thank all distinguished SAARC leaders who joined today’s video conference to tackle COVID-19 Novel Coronavirus and shared best practices from their respective nations to overcome this challenge as well as fruitful suggestions on creating a healthier region. https://t.co/RGYDrub4xq
2020-03-15 18:25:07+00:00,"Only he can defeat Corona virus.

Can you do it ?🤔
😂😂😂😂 https://t.co/CgHVaWGtsR",arun_shelly,india,"Photography, Music, Politics. 

Stay home Stay safe.",355,55,30193,False,
2020-03-15 18:25:07+00:00,"RT @TheShuchiSingh: After coronavirus, India needs to address this pan-demic. https://t.co/rH1f5R1gdB",rogueacademic88,mumbai india,Arm chair political pundit. Eternally hungry.,909,1035,32382,False,"After coronavirus, India needs to address this pan-demic. https://t.co/rH1f5R1gdB"
2020-03-15 18:25:11+00:00,RT @ANI: Italy hits one-day record with 368 new #coronavirus deaths: AFP news agency,i_m_adityaa,new delhi india,"#proudIndian🇮🇳 ..||||Be proud of yourself for how far you have come, and never stop pushing to be the best you can be.||||",390,259,13817,False,Italy hits one-day record with 368 new #coronavirus deaths: AFP news agency
2020-03-15 18:25:17+00:00,RT @Karv108: Pakistan should be out from SAARC.. Pakistan is never able to give anything for the welfare of humanity of this region except…,nvnt51,bihar india,भूमिहार ब्राह्मण #सनातनी पुत्र ! अहिंसा परमो धर्मः धर्म हिंसा तथैव च: ! अंतः अस्ति प्रारंभः ! #भगवामयी #हिंदुत्व #श्रीराम #जयहिन्द #जयभारत 🇮🇳🚩,916,205,6273,False,Pakistan should be out from SAARC.. Pakistan is never able to give anything for the welfare of humanity of this region except toxicity....This country let his citizens to die in China..
