created_at,full_text,screen_name,location,description,followers_count,friends_count,statuses_count,verified,full_retweet_text
2020-02-28 01:00:16+00:00,And you thought China was the only one with false narrative https://t.co/0NQGjl5kTY,SMahashur,pune india,"@algoanalytics, ML, AI, Finance, Markets, food and filter kapi",182,380,4072,False,
2020-02-28 01:00:32+00:00,"RT @realDonaldTrump: Just landed. India was great, trip very successful. Heading to the White House. Meetings and calls scheduled today. @C…",KrantikariDilli,new delhi india,"दिल्ली है दिल वालों की!
(Big Fan of Arvind Kejriwal and Jogi Adityanath Ji)",2675,2423,26195,False,"Just landed. India was great, trip very successful. Heading to the White House. Meetings and calls scheduled today. @CDCgov, @SecAzar and all doing a great job with respect to Coronavirus! Briefing this afternoon."
2020-02-28 01:00:34+00:00,"RT @allkpop: Suga donates over $82,000 to his hometown Daegu to aid Coronavirus prevention https://t.co/A3U26zwHqH https://t.co/lHbU1R9u61",capirala1995,india,,64,227,477,False,"Suga donates over $82,000 to his hometown Daegu to aid Coronavirus prevention https://t.co/A3U26zwHqH https://t.co/lHbU1R9u61"
2020-02-28 01:00:47+00:00,*ahem* 👇🏻 https://t.co/BRMbXB7fcN,rogue_ALA,madras india,#antifa #prolizzo #sweary #likereaaalysweary,9958,2519,6638,False,
2020-02-28 01:01:30+00:00,Curious to know why such hugh proportions are ‘unresolved’. Is the virus latent and causing low grade inflammation only and would re-emerge in case of immune compromise? https://t.co/nflQeedZW5,ShackAndTea_PhD,india australia,"Occasionally Frustrated Medical/Biomedical Research | RT = FYI, NOT Endorsement",68,740,10640,False,
2020-02-28 01:01:40+00:00,RT @CNBC: Biggest companies say coronavirus caused 'major decrease' in China demand: CFO survey https://t.co/Oqj0ERKU07,Akkisrr,new delhi india,A novice,93,662,4212,False,Biggest companies say coronavirus caused 'major decrease' in China demand: CFO survey https://t.co/Oqj0ERKU07
2020-02-28 01:01:47+00:00,"FYI @POTUS ...

#coronavirus is like #ClimateChange .
Need to act on both.
#ParisAgreement is #ClimateAction .
@USATODAY @VOANews @NASA @UN @UNEP @NatGeo @UCSUSA @sciam @SenateGOP @SenateDems @dwnews @RT_com @F24Debate @chinaorgcn @PIB_India @EUClimateAction @nytimes @cnnbrk @VP https://t.co/H3i9Ta3PtW",AngholichiGoli,earth india,"#अंघोळीचीगोळी घ्या सांगतो.ह्याने त्याग,बंधुभाव,प्रेम व बचत होते.#खिळेमुक्तझाडं,यात झाडांना सन्मान द्यायचा प्रयत्न करतो.
 Want @POTUS to b in #ParisAgreement.",610,1747,11715,False,
2020-02-28 01:01:53+00:00,RT @spectatorindex: JUST IN: 17 new coronavirus cases in Kuwait,iKrys74l,chandigarh india,Judge yourself..enjoy!,133,254,22752,False,JUST IN: 17 new coronavirus cases in Kuwait
2020-02-28 01:02:03+00:00,"RT @Earth_ToHeaven: #CoronaVirusUpdates
Diseases like cancer are being cured with true devotion. neither there will be  #coronavirus nor an…",Shiv61534738,garhmukteshwar india,"मुझे फोलो करें💯💯 follow back मिलेगा






https://t.co/6tLQYW5Y7B",971,2773,12275,False,"#CoronaVirusUpdates
Diseases like cancer are being cured with true devotion. neither there will be  #coronavirus nor any disease if we do true devotion which is available with Sant Rampal Ji Maharaj.
#coronavirusWHO
- Must Watch Sadhana TV 07:30PM (IST).
https://t.co/QmRymEYf2h"
2020-02-28 01:02:08+00:00,RT @Chopsyturvey: Coronavirus compared to Ebola and other viruses. This is serious https://t.co/3my2jBZckS,MLMANDOWARA,udaipur india,I AM RETIRED vice principal of college education RSS & Nationalist ideology follow BJP & follower of Modi but not blind bhakt of any.retweet is not endoresement,3326,1260,403267,False,Coronavirus compared to Ebola and other viruses. This is serious https://t.co/3my2jBZckS
2020-02-28 01:02:09+00:00,"U.S. Markets crash 5% today! #Nifty #nifty50 #NIFTYFUTURE   will open weak and may remain so, if no #coronavirus containment policies by global leaders come about!",NiftySpyder,india and usa,"International Options Trader since 2005 | Day & Swing Trading | Options Premium Seller | Futures & Spreads Trading | Delta Neutral, Positive Theta Strategist",8,39,10,False,
2020-02-28 01:02:12+00:00,"RT @CNBCnow: JUST IN: Starbucks now has 85% of its stores open across China as CEO Kevin Johnson says the situation is improving ""throughou…",StockUbuy,india,"Stock Investor,Whatever idea share on Twitter is my own investment Pick as an Investor for Long term, Don't Consider it as a Tip as not registered with SEBI.",3494,1018,12909,False,"JUST IN: Starbucks now has 85% of its stores open across China as CEO Kevin Johnson says the situation is improving ""throughout major parts"" of that country. https://t.co/7oJz1Oc1pf"
2020-02-28 01:02:30+00:00,"U.S. Health Workers Lacked Training, Protective Gear When Assisting Coronavirus Evacuees: Report https://t.co/l8HIdEyD2R",trendlynews_in,bengaluru india,"Trendly News | 100 Short News Everyday, Top Trending Topics, Videos & Popular News #trendly #trendlynews #trendlynewsin",25,299,10517,False,
2020-02-28 01:02:39+00:00,RT @CGTNOfficial: Live: Wuhan's Leishenshan Hospital sees more recovered patients #COVID-19 #coronavirus https://t.co/pIa9Rx9Bnd,ShashankNiku,kushinagar india,"Fun of any kind i like 
But some specials time i am still serious
(sc/st act= nota ..) supporter @Swamy39 party",1040,2761,17859,False,Live: Wuhan's Leishenshan Hospital sees more recovered patients #COVID-19 #coronavirus https://t.co/pIa9Rx9Bnd
2020-02-28 01:02:42+00:00,RT @EconomicTimes: Uncertain future? https://t.co/n18mfRDHoV,nikhilsarode123,india,Funny | Lovely | Honest | Observer | Opinions are personal | RT - not endorsement | True Lover | Emotional | True Friend |,352,2017,49566,False,Uncertain future? https://t.co/n18mfRDHoV
2020-02-28 01:02:59+00:00,"FYI @POTUS ...

#coronavirus is like #ClimateChange .
Need to act on both.
#ParisAgreement is #ClimateAction .
@USATODAY @VOANews @NASA @UN @UNEP @NatGeo @UCSUSA @sciam @SenateGOP @SenateDems @dwnews @RT_com @F24Debate @chinaorgcn @PIB_India @EUClimateAction @nytimes @cnnbrk @VP https://t.co/g7SEkUsy3f https://t.co/irctmezau6",AngholichiGoli,earth india,"#अंघोळीचीगोळी घ्या सांगतो.ह्याने त्याग,बंधुभाव,प्रेम व बचत होते.#खिळेमुक्तझाडं,यात झाडांना सन्मान द्यायचा प्रयत्न करतो.
 Want @POTUS to b in #ParisAgreement.",610,1747,11715,False,
2020-02-28 01:03:02+00:00,Trump mulls using sweeping powers to protect against coronavirus https://t.co/jjKsbJnyNQ https://t.co/siJIhOhNH7,AvinashRukmaiah,bengaluru india,"An Expertee with 8+ years of rich experience in handling @ATL & @BTL Marketing Activties. Analysing Customer Demand , Customer Delight Survey ,",31,73,1802,False,
2020-02-28 01:03:04+00:00,RT @willsmith: Fuck these assholes.,MRoopchand143,india,"Life ... 😌📸📽️😂📱💵😓🐦🎧... 


[DON'T WISH ME ON MY BIRTHDAY, BECAUSE I DON'T WANT FILTERED AND FAKE WISHES.]",1613,472,1001590,False,Fuck these assholes. https://t.co/FUeyWGlANJ
2020-02-28 01:03:04+00:00,"RT @pranavmistry: #India, let us all be as prepared  for a possible pandemic. I urge @MoHFW_INDIA, @drharshvardhan and everyone to take #co…",AMARPRABHAKAR13,rishikesh india,"सर्वे भवन्तु सुखिन:, सर्वे संतु निरामया।                                        सर्वे भद्राणि पश्यंतू, मा कश्चिद दुख  भागभवेत।।   पहाड़ी मानुष,",7,55,235,False,"#India, let us all be as prepared  for a possible pandemic. I urge @MoHFW_INDIA, @drharshvardhan and everyone to take #coronavirus extremely seriously. I have seen it first hand in #SouthKorea. #coronavirus is spreading here at unprecedented rate. Let us #Prepare #StaySafe."
2020-02-28 01:03:14+00:00,RT @FrescoLeon: Minor edits requested by other senators in response to Durbin-Lee deal should not scuttle a deal when we are all so close!!…,atperunad1,kerala india,,27,361,171,False,Minor edits requested by other senators in response to Durbin-Lee deal should not scuttle a deal when we are all so close!! The same doctors serving as first responders for Coronavirus should not face racist treatment by the very people they are working to protect! Make a deal!
2020-02-28 01:03:38+00:00,RT @JasonRaj1011: @MinhazMerchant I think the fault is entirely of the BJP leadership. They are incompetent in matters of influencing publi…,VikramKMalkani,bengaluru india,Observer of Indian politics. #IndiaFirst,442,67,27500,False,@MinhazMerchant I think the fault is entirely of the BJP leadership. They are incompetent in matters of influencing public opinion using journalists (Indian and foreign). China and Pakistan does a much better job (Chinese has budget of $10bn for influencing opinion). What is our MEA doing?
2020-02-28 01:04:01+00:00,"#BQMarketWrap | U.S. stocks fall most since August 2011 on #coronavirus angst.

Read: https://t.co/SCIjJhv0MG https://t.co/GpZbwbpAZd",BloombergQuint,mumbai india,"#India’s premier multi-platform #business and financial #news company.

For #BQBlue subscription queries email: support@bloombergquint.com",132355,144,194804,True,
2020-02-28 01:21:30+00:00,@AliHumdani @Bridge__z @SecPompeo @SpeakerPelosi @WSJ @CNN @nytimes I never called Concentration camps Jail...there is difference in detention camps and shelter homes....shelter homes is gir homeless people...detention centre is for curing extremism (according to china),Nidhipa,raipur india,"Accept the way I am or else go to Hell... Loves to Cook and Bake....Interested in Movies, cricket and Politics...Ex Techie... Currently Running Own School.",757,107,23535,False,
2020-02-28 01:22:14+00:00,"RT @businessinsider: How the coronavirus has impacted Hollywood movies like the next James Bond and 'Mission: Impossible,' and what could h…",TweetsByAkshat,india,"Movie Expert, Blogger, News Provider, Editor & Story Writer. My new book PRO GAME ON: Part-1 now available on NotionPress, Amazon & Flipkart.",1546,20,185197,False,"How the coronavirus has impacted Hollywood movies like the next James Bond and 'Mission: Impossible,' and what could happen next https://t.co/sygZ1i0YCi"
2020-02-28 01:22:23+00:00,Why COVID-19 is different from other coronaviruses https://t.co/UZKIOhG53d,WaYs2rOcK,new delhi india,Raj Gaur,42,49,18914,False,
2020-02-28 01:22:31+00:00,RT @Muralik79739498: Illness forces the Pope to cancel an event in Rome a day after showing solidarity with coronavirus sufferers and shaki…,AshutoshGawade4,pune india,Intuition! That's how it works...,28,114,3354,False,"Illness forces the Pope to cancel an event in Rome a day after showing solidarity with coronavirus sufferers and shaking hands with congregation at weekly audience.
OMG please call Indian Rice Bag Pastor's they will cure any illness by online.
https://t.co/15TKSyrkza"
2020-02-28 01:22:43+00:00,RT @China_Amb_India: We’re grateful for the medical relief provided by India to support our anti-epidemic efforts. A reflection of solidari…,MizSlay,india,🧡,120,155,9772,False,We’re grateful for the medical relief provided by India to support our anti-epidemic efforts. A reflection of solidarity and friendship b/t China and India. We’re also pleased to render assistance for the safe return of Indian nationals.
2020-02-28 01:23:26+00:00,"RT @nytimes: In the spread of yet another coronavirus, conservationists see a public health lesson: If you want to prevent epidemics that b…",iamsaaj,bengaluru india,Politics and Movies are my cup of tea and coffee ☕️,119,96,60462,False,"In the spread of yet another coronavirus, conservationists see a public health lesson: If you want to prevent epidemics that begin in animals, halt the global trade in wildlife.
https://t.co/iWDLlgcOKn"
2020-02-28 01:23:30+00:00,"2) Like China, India too has a NFU policy.",subnut,gurgaon india,"Former Submariner, DGICG & CINCAN who retired as FOC-in-C Eastern Naval Command. Member USI,NMF, IIC& IDSA. On Governing Council NMF. RTs not endorsement.",2816,215,6599,False,
2020-02-28 01:23:46+00:00,How bad is the coronavirus-sparked stock-market selloff? — the Dow industrials weekly skid would rank within its top 15 in its 124-year history https://t.co/yjgyZNLyzX,Siva_P_K,hyderabad india,Loves The Stock market. The information provided here is for education purposes only. I won't be responsible for any of your profit/loss in this channel.,85,545,2345,False,
2020-02-28 01:24:09+00:00,RT @CoronaVUpdates: “About 14% of recovered #coronavirus patients in Guangdong province tested positive again. The positive test result sug…,nikhilsarode123,india,Funny | Lovely | Honest | Observer | Opinions are personal | RT - not endorsement | True Lover | Emotional | True Friend |,352,2017,49566,False,"“About 14% of recovered #coronavirus patients in Guangdong province tested positive again. The positive test result suggests recovered patients may still carry the virus.” 
#COVID2019 #COVID19US"
2020-02-28 01:24:20+00:00,"RT @ARMYMAGofficial: Due to the recent coronavirus outbreak in SK, @BTS_twt' #MapOfTheSoulTour dates in Seoul have been canceled!

Tickets…",menti_longs,nagaland india,7 Purple 💜s @BTS_twt,425,379,93416,False,"Due to the recent coronavirus outbreak in SK, @BTS_twt' #MapOfTheSoulTour dates in Seoul have been canceled!

Tickets will be refunded in full through the tour's ticket agent, Interpak.

Stay safe Korea &amp; thank you @BigHitEnt for watching out for K-ARMY!

©️@SPOTLIGHTBTS https://t.co/pqkcNH5Ulx https://t.co/93MzlCiAtX"
2020-02-28 01:24:26+00:00,"Coronavirus: Mainland China reports 327 new confirmed cases, death toll reaches 2,788 https://t.co/BiQ8SPk5aE https://t.co/X81E5erIxr",WaYs2rOcK,new delhi india,Raj Gaur,42,49,18914,False,
2020-02-28 01:25:23+00:00,RT @safiranand: Media is going its best to spread more panic than needed. Ex South Korea reported no death today. Starbucks says 85 pct sto…,PatrickPmathias,mumbai india,"Info Tech is my Karma Bhoomi, Biz Transformation is my Passion, Markets are for learning, Changing Lives of Underprivileged - my soul fulfilment.",368,555,4023,False,"Media is going its best to spread more panic than needed. Ex South Korea reported no death today. Starbucks says 85 pct stores open in china now. Aarti ind says supplies started from china. 
Rather than showing recovery rate they are just on one side- panic"
2020-02-28 01:25:28+00:00,RT @jamescrabtree: What horror is this? India is building a network of detention camps to house those likely to be caught out in modis new…,Najurudeen,chennai india,"Senior Technical Specialist .

உண்மை மட்டுமே உயர்வு தரும்..!!சத்தியம் வென்றே தீரும்.

Truth Wins Always.",2343,2697,17793,False,"What horror is this? India is building a network of detention camps to house those likely to be caught out in modis new citizenship push - a state now sadly heading in a similar sinister direction to China's.

Vg visual outline of what is going on here: 

https://t.co/7ipQjCShEY https://t.co/lF1SIaVMwc"
2020-02-28 01:25:31+00:00,RT @Awake_Aileen: Safety is our priority. We can channel our sadness towards figuring out how we can help those that have been affected as…,HandiqueJunali,india,"Pursuing PhD in Chemical Science
BTS ARMY...OT7 💜💜💜💜💜💜💜
👉 Not a 🍰 pop fan",250,348,24955,False,"Safety is our priority. We can channel our sadness towards figuring out how we can help those that have been affected as well as with information campaigns to prevent further escalating this epidemic. @OneInAnARMY hope you can lead us here. 🙏
@BTS_twt @bts_bighit"
2020-02-28 01:25:39+00:00,RT @safiranand: Media is going its best to spread more panic than needed. Ex South Korea reported no death today. Starbucks says 85 pct sto…,prashantnshah72,surat india,interest in stocks only,497,674,3297,False,"Media is going its best to spread more panic than needed. Ex South Korea reported no death today. Starbucks says 85 pct stores open in china now. Aarti ind says supplies started from china. 
Rather than showing recovery rate they are just on one side- panic"
2020-02-28 01:25:47+00:00,"RT @yourlocalheroo: the BTS concerts in south korea have been cancelled due to coronavirus :( 

this is honestly so unfortunate, but it was…",ShreyaAdhikari_,orissa india,"💜OT7💜
사소한 게 사소하지 않게 만들어버런 너라는 별🥰
You Are The Star That Turns The Ordinaries Into Extraordinaries—BTS
❤방탄소년단💜BTS is life❤💜OT7💜
보라해💜이미 since 180527💜
❄🇮🇳",1197,1342,15878,False,"the BTS concerts in south korea have been cancelled due to coronavirus :( 

this is honestly so unfortunate, but it was done to protect everyone working on that tour, along with the people

we really all gotta stay safe out there y’all"
2020-02-28 01:26:18+00:00,U.S. markets are on track for the worst week since the 2009 financial crisis due global #pandemic #coronavirus,kamireddynrao,hyderabad india,Botanist and Nature loving. Avid reader and traveler.,195,45,5998,False,
2020-02-28 01:26:20+00:00,@NsBumb @FuckYouDown4 @RanaAyyub Dats y its facing Corona now..n dey r running to maulanas for prayers to cure,SabiraTakki,mumbai india,jeeyo aur jeene do...do pal ki hai zindagi...,56,94,15026,False,
2020-02-28 01:26:27+00:00,RT @timesofindia: Coronavirus: India stops Iranian carriers from flying to country temporarily https://t.co/iisAZ3c5Ei,KSainathRao1,mumbai india,,27,254,6227,False,Coronavirus: India stops Iranian carriers from flying to country temporarily https://t.co/iisAZ3c5Ei
2020-02-28 01:26:33+00:00,"RT @IUteamstarcandy: [TRANS] 200227 IU has donated 100 million won each to Good Neighbours and Korean Medical Association, a total of 200 m…",gogoi_moitry,duliajan india,,19,83,3908,False,"[TRANS] 200227 IU has donated 100 million won each to Good Neighbours and Korean Medical Association, a total of 200 million won to support Coronavirus Prevention

For more details about COVID-19: https://t.co/EMErBfXKjd

https://t.co/Di8u5Cdgs4 https://t.co/FcwthPLDZX"
2020-02-28 01:26:48+00:00,RT @CGTNOfficial: Live: Wuhan's Leishenshan Hospital sees more recovered patients #COVID-19 #coronavirus https://t.co/pIa9Rx9Bnd,rsisodiya726,ahmadabad city india,,3,168,22,False,Live: Wuhan's Leishenshan Hospital sees more recovered patients #COVID-19 #coronavirus https://t.co/pIa9Rx9Bnd
2020-02-28 01:26:53+00:00,"RT @KnottyCommander: IAF aircraft carries meds to Wuhan. To bring back 120 including 80 Indians.

Is it their job? No. But Indian Armed For…",a_d_a_rsh,india,"#Defence and #Geopolitics enthusiastic||
#RT no #endorsement || It always seems impossible until it's done|| 🚣",433,286,21544,False,"IAF aircraft carries meds to Wuhan. To bring back 120 including 80 Indians.

Is it their job? No. But Indian Armed Forces are always ready to do anything for the nation. 

Yet there are some who question their existence and actions. What a pity.

Jai Hind. Bravo IAF.❤️"
2020-02-28 01:27:00+00:00,RT @choi_bts2: Bighit said Seoul Map of The Soul Tour concert which was scheduled on 4/11-12 &amp; 4/18-19 has been cancelled due to the preven…,OT7_______,ratnagiri india,"I am me and I won't change myself for anyone... 😘😍💓💞
BTS 💜💜💜💜💜💜
Indian Army🇮🇳💜💜💜💜💜
Fan Account
EIGHT",547,856,70535,False,Bighit said Seoul Map of The Soul Tour concert which was scheduled on 4/11-12 &amp; 4/18-19 has been cancelled due to the preventing the spread of COVID-19 (corona virus). The ticket fees will be refunded. @BTS_twt https://t.co/HAmk94KeNd
2020-02-28 01:27:14+00:00,"#GodMorningFriday

Sant Rampal Ji Maharaj is describing well what is written in our holy scriptures ?
Who is Supreme God?
 &amp; Who is worthy to be worshipped? 
✳️Must watch Sadhna TV  from 7:30 p.m. IST
Hindu muslim America iran china https://t.co/goZVKczlBv",satyug20201,india,"परमात्मा के लिए कुछ भी असंभव नहीं लेकिन परमात्मा है कौन जाने इस वेबसाइट से प्रमाण के साथ।
work as a civil Engineer",39932,15850,38920,False,
2020-02-28 01:44:18+00:00,RT @BBCLBicker: The amazing doctors in Deagu here in South Korea sent us this. A picture of their new drive- thru coronavirus test facility…,dreamglow05,india,OT7 and a part time Doctor⚕,133,295,3685,False,The amazing doctors in Deagu here in South Korea sent us this. A picture of their new drive- thru coronavirus test facility. Such a clever idea and so quickly set up. #CoronavirusOutbreak (h/t @wj_bae ) https://t.co/07F83jkLK0
2020-02-28 01:44:24+00:00,"RT @CNBCnow: JUST IN: Starbucks now has 85% of its stores open across China as CEO Kevin Johnson says the situation is improving ""throughou…",J_a_i_chechani,ahmadabad city india,#Finance#Economy#Politics,205,768,2247,False,"JUST IN: Starbucks now has 85% of its stores open across China as CEO Kevin Johnson says the situation is improving ""throughout major parts"" of that country. https://t.co/7oJz1Oc1pf"
2020-02-28 01:44:29+00:00,RT @piersmorgan: This is...worrying.,praveenschumi,india,,280,764,17062,False,This is...worrying. https://t.co/lDuANzQNnr
2020-02-28 01:44:31+00:00,RT @Muralik79739498: Illness forces the Pope to cancel an event in Rome a day after showing solidarity with coronavirus sufferers and shaki…,narendraLalwan8,mumbai india,"a citizen of India ,Jai Hind",211,148,40223,False,"Illness forces the Pope to cancel an event in Rome a day after showing solidarity with coronavirus sufferers and shaking hands with congregation at weekly audience.
OMG please call Indian Rice Bag Pastor's they will cure any illness by online.
https://t.co/15TKSyrkza"
2020-02-28 01:45:01+00:00,"RT @satyug20201: #GodMorningFriday

Sant Rampal Ji Maharaj is describing well what is written in our holy scriptures ?
Who is Supreme God?…",AnkitSi34195096,jaunpur india,"1⃣0⃣0⃣%Follow🔙
I am a student of B.Ed",3549,4765,30331,False,"#GodMorningFriday

Sant Rampal Ji Maharaj is describing well what is written in our holy scriptures ?
Who is Supreme God?
 &amp; Who is worthy to be worshipped? 
✳️Must watch Sadhna TV  from 7:30 p.m. IST
Hindu muslim America iran china https://t.co/goZVKczlBv"
2020-02-28 01:45:23+00:00,RT @eugenegu: The coronavirus may spread like wildfire in the hospital setting as doctors unintentionally transfer the virus from one patie…,Tasavur,bengaluru india,"NETWORK ENGINEER | CCNP | LINUX | PYTHON | TECH SAVVY | Indian | Global Citizenship endorser | Democrats Fan.
Retweets are not endorsements",45,206,2080,False,"The coronavirus may spread like wildfire in the hospital setting as doctors unintentionally transfer the virus from one patient to the next. Telemedicine is now an important tool to treat patients at home without exposing doctors, nurses, and other patients to the coronavirus."
2020-02-28 01:45:33+00:00,"RT @NorbertElekes: Coronavirus update:

- 83,105 cases worldwide
- 36,514 recovered
- 2,858 deaths
- Most new cases in South Korea
- Growin…",Rohit48630359,new delhi india,"Life is unpredictable .. as it should be ..
Self Employed .. Business ...
Wholesaler of Selfie Kurtis ...
Wholesaler of Men's T-shirts",91,977,11046,False,"Coronavirus update:

- 83,105 cases worldwide
- 36,514 recovered
- 2,858 deaths
- Most new cases in South Korea
- Growing number in Italy
- First cases in Africa
- 51 countries reporting cases"
2020-02-28 01:45:34+00:00,RT @alimanfoo: Some coronavirus advice I've gleaned from folks who've worked in or studied other epidemics. Please take seriously and pass…,karthikg29,mumbai india,,47,290,6167,False,Some coronavirus advice I've gleaned from folks who've worked in or studied other epidemics. Please take seriously and pass on to family and friends...
2020-02-28 01:45:44+00:00,"RT @OH_mes2: Kang Daniel has donated 50 million won to Hope Bridge to help support those affected by the Coronavirus outbreak

https://t.co…",Sindhureal2,india,Trust in yourself. Spread love and happiness. Forgive and forget. Peace✌️,134,734,6041,False,"Kang Daniel has donated 50 million won to Hope Bridge to help support those affected by the Coronavirus outbreak

https://t.co/ZIW4vHc5Ec https://t.co/NXjj3i3Upv"
2020-02-28 01:45:52+00:00,@ronakshischild There is a case in China the doc who is treating the patients got infected himself while treating and died. Let's see wt they show here.,swasan_forver,kolkata india,"Dil me aane wale uss duniya tak saath rehete he ♥️😍

VAHE FAN😎 KHKT Is my drug
#FanAccount
le me dumb hui Yusra tere liye",2340,713,140823,False,
2020-02-28 01:46:00+00:00,"RT @AskAnshul: Coronavirus:

China is facing shortage of masks &amp; gloves

To help China, India has lifted ban on export of personal protecti…",Krishna12610763,jaipur india,"No wing except Human wing, Indian till I die, No blind support,blv in peace, Not your regular guy,Writer🔥🔥",81,169,6802,False,"Coronavirus:

China is facing shortage of masks &amp; gloves

To help China, India has lifted ban on export of personal protection equipments

India has allowed the immediate export of at least two large consignments of protective clothing including masks to China.

This is our India"
