created_at,full_text,screen_name,location,description,followers_count,friends_count,statuses_count,verified,full_retweet_text
2020-02-28 01:46:14+00:00,RT @jihadwatchRS: “Islamophobia” outbreak in UK: Muslim arrested for “Islamist-related” terror offenses https://t.co/dAyNYvrvdn,2367Mahadev,bengaluru india,"Liberal, Secular, against Homophobia, love refugees, kind hearted soul, Works for a Non profit that helps in refugee resettlement : ~ Sarcasm is implied :P",62,136,21780,False,“Islamophobia” outbreak in UK: Muslim arrested for “Islamist-related” terror offenses https://t.co/dAyNYvrvdn
2020-02-28 01:46:19+00:00,"On Thursday, California Gov. Gavin Newsom said the state is monitoring 8,400 people for coronavirus.",VikasSa06882686,mumbai india,Assistant Vice President - Equity Technical Analyst at Nirmal Bang Securities. Love equity market . Tweets are personal.RT's do not mean endorsement.🇮🇳🇮🇳,588,144,1097,False,
2020-02-28 01:46:20+00:00,"In India, With a 15% only income tax on new manufacturing, push for self sufficiency amidst coronavirus fears could mean serious economic uptick in works https://t.co/cdrR5qY2R6",sanjayjain2012,india,SEBI registered Research Analyst. May have self interest in my tweets/views however RT do not mean necessary endorsement,472,195,8957,False,
2020-02-28 01:46:22+00:00,"#Chinese tech investors have put an estimated $4 bn into #Indian start-ups. 18 of #India’s 30 unicorns are #China-funded. #TikTok-200 mn subscribers has overtaken #YouTube in India. #Alibaba, #Tencent &amp; #ByteDance rival #US #Facebook, #Amazon &amp; Google

https://t.co/BwbYmaDiEv https://t.co/2H1EsFIh6A",anshu217,india,"Authored two books on China; Interests- China, West Asia, Pakistan; National security, Space, Deterrence, Military Strategy, Technology- Quantum, AI, Drone, ISR",206,111,2370,False,
2020-02-28 01:46:28+00:00,"Yes because he's coronavirus originated in India and even more dangerous than coronavirus originated in china. 
Present in the brains of those rioters!! It's an ideology sir. Aap bimari ki jad smjhiye, 
Kher aap doctor thodi hain!! https://t.co/m1cc2JLB2Y",Shikha23870793,uttar pradesh india,"Law student 🎓
Aspiring writer ✒",25,27,39,False,
2020-02-28 01:46:29+00:00,"#GodMorningFriday
Sant Rampal Ji Maharaj is describing well what is written in our holy scriptures ?
Who is Supreme God?
 &amp; Who is worthy to be worshipped? 
✳️Must watch Sadhna TV  from 7:30 p.m. IST
Hindu muslim America iran china https://t.co/7u1xciRVaI",imDipendraji,madhya pradesh india,"who is read god ??👇   please read the
precious book to know 👉 https://t.co/MYFzaRkjXA

🙏 👌😊kabir is real god😊🙏
https://t.co/rqN4FMQuys",19140,2134,18611,False,
2020-02-28 01:46:35+00:00,"RT @Chellaney: Trump is still gushing over his India visit, calling India an ""incredible country"" and Modi ""a great gentleman, great leader…",SSP79,bengaluru india,#MeinBhichowkidar,259,281,169870,False,"Trump is still gushing over his India visit, calling India an ""incredible country"" and Modi ""a great gentleman, great leader"" and saying ""Our relationship with India is extraordinary right now."" At the news conference on coronavirus, he said, ""It’s a great country. A long trip."""
2020-02-28 01:46:35+00:00,RT @TarekFatah: Islamic cleric discovers a cure for #CoronaVirus by mixing fresh camel piss and cow's milk and drinking it straight while i…,Rampravesh199,kolkata india,I am civil engineering student,61,688,1157,False,Islamic cleric discovers a cure for #CoronaVirus by mixing fresh camel piss and cow's milk and drinking it straight while its desert warm. #CoronavirusOutbreak https://t.co/GyPIs0Z1WF
2020-02-28 01:46:49+00:00,RT @AlinejadMasih: Her name is Elham Sheykhi. This young  Iran’s female futsal player is the latest victim of #CoronaVirus in Iran. She was…,RajeshChazed,hyderabad india,Retweets are not necessarily endorsement,66,47,4827,False,"Her name is Elham Sheykhi. This young  Iran’s female futsal player is the latest victim of #CoronaVirus in Iran. She was only 23 years old. Meanwhile,
Iran's officials are trying to cover up Corona deaths by lying and underreporting them.

The situation is very serious https://t.co/1MMcFFwdzE"
2020-02-28 01:47:04+00:00,"RT @mediaindiagroup: Following a shortage in supply from China due to #CoronavirusOutbreak, leading consumer electronics companies in India…",_varshasingh_,mumbai india,Principal Correspondent at Media India Group,24,137,897,False,"Following a shortage in supply from China due to #CoronavirusOutbreak, leading consumer electronics companies in India including @LGIndia @myvoltas @SamsungIndia @IndiaHaier &amp; @PanasonicIndia have decided to hike the prices by 3-4%. @DoC_GoI @MEAIndia @EOIBeijing #MediaIndiaGroup"
2020-02-28 01:47:25+00:00,Damn. https://t.co/YG3iOpPoMB,bangtanchai_,india,It's such a relief that they are 7.,1267,194,81042,False,
2020-02-28 01:47:31+00:00,You are only as strong as your weakest link. https://t.co/Ecp9wNicbV,mainakconnect,delhi india,"CEO @sefconnect | @Acumen and @TeachForIndia Fellow

/tweets are personal/",598,535,3444,False,
2020-02-28 01:48:01+00:00,RT @delsi3107: @AnandWrites A man that came back from a business meeting in China went to the hospital to checked himself up for the corona…,ATamariya,bengaluru india,The price of anything is the amount of life you pay for it.,99,235,65407,False,"@AnandWrites A man that came back from a business meeting in China went to the hospital to checked himself up for the coronavirus, just in case and went back home with a bill of $3270!!
https://t.co/jRJjFeetLk"
2020-02-28 01:48:02+00:00,"RT @imDipendraji: #GodMorningFriday
Sant Rampal Ji Maharaj is describing well what is written in our holy scriptures ?
Who is Supreme God?…",arpna0dass,haryana india,Follow back,921,425,36056,False,"#GodMorningFriday
Sant Rampal Ji Maharaj is describing well what is written in our holy scriptures ?
Who is Supreme God?
 &amp; Who is worthy to be worshipped? 
✳️Must watch Sadhna TV  from 7:30 p.m. IST
Hindu muslim America iran china https://t.co/7u1xciRVaI"
2020-02-28 01:48:16+00:00,RT @ms_rana: Coronavirus is least of Delhi's worry right now ... chowkidar-virus has already claimed several lives in Delhi riots.,JanLokPaal,india,"TEST MORE
Tampered EVMs wala Delayed LockDown2 Topple MP Govt
India will get Real PM only with PAPER BALLET",6396,2512,368146,False,Coronavirus is least of Delhi's worry right now ... chowkidar-virus has already claimed several lives in Delhi riots.
2020-02-28 01:48:21+00:00,RT @alimanfoo: Some coronavirus advice I've gleaned from folks who've worked in or studied other epidemics. Please take seriously and pass…,HemantPatel32,chhattisgarh india,"जो भी मैं, कहना चाहूँ.. बरबाद करे अल्फाज़ मेरे..",558,643,72513,False,Some coronavirus advice I've gleaned from folks who've worked in or studied other epidemics. Please take seriously and pass on to family and friends...
2020-02-28 01:48:24+00:00,"@narendramodi Sir , what are your plans if coronavirus come to India
, To overcome spreading ..",Avinash11905134,bengaluru india,"YouTube channel 
YouTuber",13,22,2,False,
2020-02-28 01:48:47+00:00,Novel coronavirus marches on outside China https://t.co/JIjw913N4q https://t.co/0z7FeNo9j5,RPrasad12,chennai india,"Science Editor @The_Hindu. Ph.D from IIT, Bombay. Facebook: /prasad.ravindranath Email: prasad.thehindu@gmail.com",5538,1119,9017,False,
2020-02-28 01:48:55+00:00,"RT @TrumpWarRoom: CNN has spent days spreading panic about coronavirus. 

But last night, just as the White House was explaining the timeli…",TheUjjwal_Gupta,new delhi india,"Nation First , Indian 🇮🇳

बिहारी",511,553,12362,False,"CNN has spent days spreading panic about coronavirus. 

But last night, just as the White House was explaining the timeline for a vaccine trial, CNN cut away to a townhall with Michael Bloomberg.

They’re whipping up hysteria just to hurt @RealDonaldTrump! https://t.co/AESNXIGZUv"
2020-02-28 01:48:55+00:00,RT @shoaib100mph: All the people who are involved in the price hike of face masks for protection from Corona Virus should be shameful of th…,junaid7082,chandigarh india,AAP National Social Media Team || News Freak  || Politics || Cricket || @stevesmith49 || Die Hard Fan Of @arvindkejriwal Sir !!  #LageRahoKejriwal,1094,972,27678,False,"All the people who are involved in the price hike of face masks for protection from Corona Virus should be shameful of this act. This is the time to show some substance as a nation.  Help each other. Facilitate each other.  
#coronavirus #Pakistan"
2020-02-28 01:49:06+00:00,"RT @PeptideScience: Vaccines for the coronavirus may prevent replication, but no pure anti-viral mechanism will reverse cell damage in mult…",maheshb2101,bengaluru india,Equity Investor,109,413,5789,False,"Vaccines for the coronavirus may prevent replication, but no pure anti-viral mechanism will reverse cell damage in multiple organs.

Reversing the development of fibrosis in multiple organs, and the cytokine storm that precedes it, should be prioritized…

https://t.co/TVhUiTp0Yt"
2020-02-28 01:49:18+00:00,"RT @GreatGameIndia: How CCP covered-up #Coronavirus - interview with a former  virologist.
https://t.co/6KuSBVJAFC",M9Thakur,india,,153,399,16933,False,"How CCP covered-up #Coronavirus - interview with a former  virologist.
https://t.co/6KuSBVJAFC"
2020-02-28 01:50:03+00:00,INDIA Has to Create 16% of World GDP as INDIA is Having 16% of World POPULATION whereas INDIA is Creating 3% of World GDP and LIVING with 2300 USD Per Capita Income  as Against USA Per Capita Income of 62300 USD &amp; World Per Capita Income of 12000 USD https://t.co/ZHowcJSBtC https://t.co/4SHVS31vMA,mvkmovva,hyderabad india,"STRATAGIST 

Create HEAVEN on EARTH",1,862,7766,False,
2020-02-28 01:50:06+00:00,"@SurabhiUpadhyay With no positive cases of coronavirus in India,  still indian markets have reacted so badly. What will be the impact even if one such case is reported? How it will react ?",dinubhansali,india,"Looking to the world a peaceful place to live and create happiness around.
All tweets are personal thoughts.",57,395,1076,False,
2020-02-28 01:50:07+00:00,"RT @PeptideScience: Vaccines for the coronavirus may prevent replication, but no pure anti-viral mechanism will reverse cell damage in mult…",NKPyo,mumbai india,"Holistic reality designer | #XR(#AR/#VR/#MR) & #AI |
No self-identity | Philosophy, history, art and education | Read before you reply: https://t.co/4dSxuXMHgG",480,1461,3052,False,"Vaccines for the coronavirus may prevent replication, but no pure anti-viral mechanism will reverse cell damage in multiple organs.

Reversing the development of fibrosis in multiple organs, and the cytokine storm that precedes it, should be prioritized…

https://t.co/TVhUiTp0Yt"
2020-02-28 01:50:14+00:00,"RT @WHO: @DrTedros ""We are at a decisive point.

For the past 2 days, the number of new #COVID19 cases reported in the rest of the 🌍 has ex…",TypicallyTaha,india usa,23 • MPH’20 @Harvard • MD’19 @DalMedSchool • 👶🏼🧠👩🏽‍⚕️ - to be • CEO @ChildAwarePro • Global Youth Ambassador @Theirworld • @DianaAward holder | Views Own,626,2708,2256,False,"@DrTedros ""We are at a decisive point.

For the past 2 days, the number of new #COVID19 cases reported in the rest of the 🌍 has exceeded the number of new cases in 🇨🇳. 

And in the past 24h, 7 countries have reported cases for the first time: 🇧🇷, 🇬🇪, 🇬🇷, 🇲🇰, 🇳🇴, 🇵🇰 &amp; 🇷🇴""-@DrTedros"
2020-02-28 01:50:22+00:00,"RT @krishraghav: For The @NewYorker, I drew a comic about cooking under the COVID-19 quarantine in China. I watched over 30hrs of vlogs and…",urvashi_aneja,goa india,"Founding Director, @tandem_research; Associate Fellow Chatham House",1201,785,1206,False,"For The @NewYorker, I drew a comic about cooking under the COVID-19 quarantine in China. I watched over 30hrs of vlogs and videos to amplify stories of boredom, resilience, disquiet, creativity, loneliness and all of the Instant Noodles: 

https://t.co/lxE2L2tzdP"
2020-02-28 01:59:47+00:00,RT @MiningAnalysts: #Copper prices slipped as rising inventories indicated demand remained weak amid a fast-spreading #coronavirus outbreak…,maheshb2101,bengaluru india,Equity Investor,109,413,5789,False,"#Copper prices slipped as rising inventories indicated demand remained weak amid a fast-spreading #coronavirus outbreak that has threatened to dent global economic growth.
https://t.co/FOXINqufzg"
2020-02-28 01:59:41+00:00,"RT @_prashantnair: Tobias M Levkovich of Citi -&gt; With stocks off &gt; 10% in a wk’s time, there’s a great deal of interest on where to find a…",CNBCTV18Live,india,The CNBC-TV18 news ticker on Twitter. The news breaks here first.,769224,549,907720,True,"Tobias M Levkovich of Citi -&gt; With stocks off &gt; 10% in a wk’s time, there’s a great deal of interest on where to find a tangible bottom. We would suggest that such thoughts in and of themselves do not imply that the correction is over.

@CNBCTV18Live #coronavirus"
2020-02-28 01:59:30+00:00,RT @realDonaldTrump: “Anti-Trump Network @CNN doing whatever it can to stoke a national Coronavirus panic. The far left Network pretty much…,vishu6522,mohali india,"#Dialysis Technician
#Hometown Uttrakhand (Paudi Garhwal)
GarhwaLan+Punjaban0😁
*SimpliCity Is A High Profile🌼",54,85,850,False,“Anti-Trump Network @CNN doing whatever it can to stoke a national Coronavirus panic. The far left Network pretty much ignoring anyone who they interview who doesn’t blame President Trump.” @trish_regan @FoxNews Media refuses to discuss the great job our professionals are doing!
2020-02-28 01:59:31+00:00,RT @CNBCnow: Dow set to drop 400+ points at the open as worst week since the financial crisis continues; 10-year Treasury yield hits new re…,contrainvestor,india,"Contrarian-Long Term-Value Investor, Avid reader, Cricket & Travel",87,950,4352,False,"Dow set to drop 400+ points at the open as worst week since the financial crisis continues; 10-year Treasury yield hits new record low of 1.27%
https://t.co/qZLiXD9Ayh https://t.co/GmsBUM3wRN"
2020-02-28 01:59:19+00:00,RT @JohnArnoldFndtn: Coronavirus treatment or vaccine seems like perfect use case for a prize fund. $10 billion prize to first company that…,ratanhack,bengaluru india,"Always looking for learning opportunities.
Product Manager. Ex- Entrepreneur.
Future. Startups. Internet.
Founded @revolutrapp",174,961,8018,False,Coronavirus treatment or vaccine seems like perfect use case for a prize fund. $10 billion prize to first company that makes effective drug and freely licenses the IP globally.
2020-02-28 01:59:18+00:00,RT @China_Amb_India: We’re grateful for the medical relief provided by India to support our anti-epidemic efforts. A reflection of solidari…,iamPagarwal,purnia india,"ॐ भूर् भुवः स्वः
तत् सवितुर्वरेण्यं
भर्गो देवस्य धीमहि
धियो यो नः प्रचोदयात्…",73,987,3381,False,We’re grateful for the medical relief provided by India to support our anti-epidemic efforts. A reflection of solidarity and friendship b/t China and India. We’re also pleased to render assistance for the safe return of Indian nationals.
2020-02-28 01:59:14+00:00,"RT @charliekirk11: Elizabeth Warren just introduced a bill to redirect funds from border security to fight the Coronavirus

She wants to op…",JamesChhetri7,aizawl india,,255,665,86859,False,"Elizabeth Warren just introduced a bill to redirect funds from border security to fight the Coronavirus

She wants to open the border to stop the spread of a pandemic?

Democrats are politicizing a global health crisis just to own Trump

They hate him more than they love America"
2020-02-28 01:59:10+00:00,RT @choi_bts2: Bighit said Seoul Map of The Soul Tour concert which was scheduled on 4/11-12 &amp; 4/18-19 has been cancelled due to the preven…,sonia_soram,imphal india,"💜💜💜💜💜💜💜

Only @bts_twt 💖💪💙 oT7

LoveYourself  LoveMyself  Peace

fan account💜",1328,1349,108462,False,Bighit said Seoul Map of The Soul Tour concert which was scheduled on 4/11-12 &amp; 4/18-19 has been cancelled due to the preventing the spread of COVID-19 (corona virus). The ticket fees will be refunded. @BTS_twt https://t.co/HAmk94KeNd
2020-02-28 01:59:10+00:00,"RT @USATODAY: Corona is getting flak on social media for an ill-timed ""coming ashore soon"" campaign for its hard seltzer.
https://t.co/4tDj…",SaurabhJoshi,new delhi india,"Editor, @StratPost & @DelhiDurbar. Sciency. Lapsed lawyer. Fascinated by flight. Lucky. Not normally a nice guy. Tweets are mine. Retweets are somebody else's.",6337,2256,64949,True,"Corona is getting flak on social media for an ill-timed ""coming ashore soon"" campaign for its hard seltzer.
https://t.co/4tDjpoc2T7"
2020-02-28 01:59:02+00:00,RT @MailOnline: Now a DOG tests positive for coronavirus: Patient’s pet Pomeranian comes down with the disease in Hong Kong https://t.co/jk…,gulfkannadiga,udupi india,https://t.co/Sqsy9ADJnY is Gulf's first Kannada News Website which connects Kannadigas in Gulf with their homeland since 2000..Now Relaunched in June 2017 & 2020!,2151,1324,101056,False,Now a DOG tests positive for coronavirus: Patient’s pet Pomeranian comes down with the disease in Hong Kong https://t.co/jkJLkeHxn3
2020-02-28 01:58:56+00:00,"RT @AndyBiotech: CDC finally expanded their testing criteria for #COVID19
https://t.co/oJDftuqyDd

It's an improvement over the prior narro…",Equateall,india,"Educationist, Startup / Product Consultant, Mentor, Career Coach.
eTestZone: India's Largest Performance Rewards for IIT JEE / NEET / CET. Open to ALL students.",7752,1122,256881,False,"CDC finally expanded their testing criteria for #COVID19
https://t.co/oJDftuqyDd

It's an improvement over the prior narrow criteria, though think at some point travel history no longer matters with cases now everywhere and you have to test everyone with fever and signs/symptoms. https://t.co/5y1QzZNFqK"
2020-02-28 01:58:45+00:00,RT @realDonaldTrump: “Anti-Trump Network @CNN doing whatever it can to stoke a national Coronavirus panic. The far left Network pretty much…,RajuSinghVerma1,bhilwara india,"भाजपा युवा मोर्चा पुर्व जिला सहमिडिया प्रभारी, भीलवाड़ा, राजस्थान",80,226,1667,False,“Anti-Trump Network @CNN doing whatever it can to stoke a national Coronavirus panic. The far left Network pretty much ignoring anyone who they interview who doesn’t blame President Trump.” @trish_regan @FoxNews Media refuses to discuss the great job our professionals are doing!
2020-02-28 01:58:37+00:00,"RT @doolsetbangtan: Amid the concerns over the spread of COVID-19, Map of the Soul Tour - Seoul Concert (April 11, 12, 18 &amp; 19) has been ca…",Priya_Bangtan,india,"BTS PAVED THE WAY 💜
#ot7 
#방탄소년단 #bts 💜
#loveyourself #mots7",315,505,25447,False,"Amid the concerns over the spread of COVID-19, Map of the Soul Tour - Seoul Concert (April 11, 12, 18 &amp; 19) has been cancelled. https://t.co/JaolJO3jM9"
2020-02-28 01:58:37+00:00,"RT @abhijitmajumder: Now imagine if the same barbarism was inflicted on an FBI sleuth in America, an FSB operative in Russia, an MSS offici…",Sumit2350,india,JAI HIND.,176,699,5895,False,"Now imagine if the same barbarism was inflicted on an FBI sleuth in America, an FSB operative in Russia, an MSS official in China, a Mossad man in Israel, or a DGFI guy in Bangladesh. We know how they would respond. I want to see how India responds. #delhivoilence https://t.co/Bci4fcVWfI"
2020-02-28 01:58:32+00:00,"RT @abhijitmajumder: Now imagine if the same barbarism was inflicted on an FBI sleuth in America, an FSB operative in Russia, an MSS offici…",PratapVijender,new delhi india,"#स्वयंसेवक @rssorg #मंडल_कॉलेज_विद्यार्थी_कर्यप्रमुख
Biomedical engineer",173,91,22085,False,"Now imagine if the same barbarism was inflicted on an FBI sleuth in America, an FSB operative in Russia, an MSS official in China, a Mossad man in Israel, or a DGFI guy in Bangladesh. We know how they would respond. I want to see how India responds. #delhivoilence https://t.co/Bci4fcVWfI"
2020-02-28 01:58:19+00:00,RT @DavidInglesTV: A Hong Kong dog has now tested positive for the coronavirus https://t.co/4rrqSrnq63,macroguru9,hong kong dubai bali india,"CIO at Macro Family Office, Ex Sell side EM Trader. 
Wharton Alumni
Supporter of Indian Cricket & Modi.
Not a signal seller
We do managed accounts.",3552,1122,10397,False,A Hong Kong dog has now tested positive for the coronavirus https://t.co/4rrqSrnq63
2020-02-28 01:58:17+00:00,RT @realDonaldTrump: “Anti-Trump Network @CNN doing whatever it can to stoke a national Coronavirus panic. The far left Network pretty much…,bornrajaa,new delhi india,STAND FOR TRUTH | JOURNALIST |,288,363,7758,False,“Anti-Trump Network @CNN doing whatever it can to stoke a national Coronavirus panic. The far left Network pretty much ignoring anyone who they interview who doesn’t blame President Trump.” @trish_regan @FoxNews Media refuses to discuss the great job our professionals are doing!
2020-02-28 01:58:15+00:00,"RT @Earth_ToHeaven: #CoronaVirusUpdates
True devotion which is available with Saint Rampal Ji Maharaj , can cure #coronavirus and all incur…",DiaaRathod,india,"#MustListen_Satsang By #SaintRampalJi Maharaj

#Kabir is #Supreme god #Satlok",796,1104,2347,False,"#CoronaVirusUpdates
True devotion which is available with Saint Rampal Ji Maharaj , can cure #coronavirus and all incurable diseases.
Coz God is with those who follow true devotion.
#coronavirusinpakistan 
- Must Watch Sadhana TV 07:30PM (IST).
@WHO 
https://t.co/QmRymEYf2h"
2020-02-28 01:58:13+00:00,RT @realDonaldTrump: “Anti-Trump Network @CNN doing whatever it can to stoke a national Coronavirus panic. The far left Network pretty much…,MyCultureSocie1,prayagraj india,"My Culture SO. A/c NO.50416679102, ifsc no - ALLA0213288 ,Branch-Phaphamau 📿9335576763,😰9415576763 W -My Culture😱😨",201,419,4454,False,“Anti-Trump Network @CNN doing whatever it can to stoke a national Coronavirus panic. The far left Network pretty much ignoring anyone who they interview who doesn’t blame President Trump.” @trish_regan @FoxNews Media refuses to discuss the great job our professionals are doing!
2020-02-28 01:58:11+00:00,RT @PornesianPotato: #MAP_OF_THE_SOUL_7 Tour in Seoul has been cancelled due to the Corona virus outbreak. https://t.co/iwdSud6MuX,RJpacaya,coimbatore india,"Army💜
OT7 forever💜
My Charmander❤️
Moon Lover🌙🌕
Can't hold me down coz you know I'm a Fighter!",224,761,1347,False,#MAP_OF_THE_SOUL_7 Tour in Seoul has been cancelled due to the Corona virus outbreak. https://t.co/iwdSud6MuX
2020-02-28 01:58:08+00:00,"RT @DivyaSoti: Recently, China threw out three @wsj reporters for ""racist reporting"". Why can't India do the same after @wsj's false report…",Abhayisnow,new delhi india,"Tweets, RTs, likes only meant to provoke thought. Do not act on them.  No offense intended. Tweets, RTs, likes are not endorsements.",51,235,41557,False,"Recently, China threw out three @wsj reporters for ""racist reporting"". Why can't India do the same after @wsj's false reporting of Delhi riots? https://t.co/hvfLMpsvR0"
2020-02-28 01:58:06+00:00,"RT @abhijitmajumder: Now imagine if the same barbarism was inflicted on an FBI sleuth in America, an FSB operative in Russia, an MSS offici…",Maratha4India,india,"I am specially special.........
And Proud to be an INDIAN🇮🇳
Jai Hind ..............",114,17,18891,False,"Now imagine if the same barbarism was inflicted on an FBI sleuth in America, an FSB operative in Russia, an MSS official in China, a Mossad man in Israel, or a DGFI guy in Bangladesh. We know how they would respond. I want to see how India responds. #delhivoilence https://t.co/Bci4fcVWfI"
2020-02-28 01:58:04+00:00,RT @choi_bts2: Bighit said Seoul Map of The Soul Tour concert which was scheduled on 4/11-12 &amp; 4/18-19 has been cancelled due to the preven…,BTS_NEIndia,n e india,"■BTS NORTHEAST INDIA FANBASE




















REGIONAL ASSOCIATE OF @bangtan_india


 



■https://t.co/DXlRrFJ3AZ…",2940,142,18607,False,Bighit said Seoul Map of The Soul Tour concert which was scheduled on 4/11-12 &amp; 4/18-19 has been cancelled due to the preventing the spread of COVID-19 (corona virus). The ticket fees will be refunded. @BTS_twt https://t.co/HAmk94KeNd
2020-02-28 01:57:59+00:00,"RT @R_H_Ebright: ""South Korea..tested over 39,000 people""

""CDC’s website says it’s tested just 445 people""",almostinfamous,hyderabad india,"🤔retweets are confusions🤔

🌟 i apologise for the inconvenience 🌟

photos only account at @photosbyaditya

the 6 million fav man",2701,2436,234746,False,"""South Korea..tested over 39,000 people""

""CDC’s website says it’s tested just 445 people"""
2020-02-28 01:57:57+00:00,"@mehreenzahra @WHO Is the deaths rates reported by China is true ? Nope. Death rate may be more than million.
Today WHO report justify it .",ratanraj2020,india london,"Anesthesiologist and Critical Care

  Hope for Best Health Care in India.   

   Health Budget for next 5 years@ 15%",278,1528,12075,False,
