created_at,full_text,screen_name,location,description,followers_count,friends_count,statuses_count,verified,full_retweet_text
2020-02-14 01:00:00+00:00,"#FrontPage | With a #coronavirus scare, good Chinese companies are not tapping the bond market actively. The issue size of Chinese companies has come down to $100 million, or even as low as $5 million.

@anuproy05 &amp; Krishna Kant  
#CoronavirusOutbreak

https://t.co/nGT89xGka9",bsindia,india,"Latest updates #news #LIVE coverage on #economy #companies #markets #politics and #technology from India's leading business daily
https://t.co/VVl6HGuvvc",1887795,379,276441,True,
2020-02-14 01:00:00+00:00,"RT @AP: BREAKING: China reports 254 new deaths and a spike in virus cases of 15,152, after new methodology applied in Hubei province.",satishkoundal,himachal pradesh india,"हम रहें न रहें देश रहना चाहिए, देश है तो हम हैं , सबसे पहले देश फिर पार्टी फिर गांव फिर परिबार, सबको मोदी जी जैसा बनना होगा तभी बदलाब आएगा ,सबका साथ सबका विकास",833,5000,31991,False,"BREAKING: China reports 254 new deaths and a spike in virus cases of 15,152, after new methodology applied in Hubei province."
2020-02-14 01:00:07+00:00,RT @WIONews: Several airlines have stopped flying to China. But Pakistan has resumed its flights. Pakistan is yet to report a case of the c…,nagabhushanb,india,"||प्रज्ञानम् ब्रह्म|| ➡️I seek Truth⬅️ ||Bharatiya🇮🇳|| || Jai Maa Bharati|| ||Vande Mataram||  **RTs &❤️are not Endorsements** Tweets in ಕನ್ನಡ, हिंदी, English",1300,1575,63141,False,"Several airlines have stopped flying to China. But Pakistan has resumed its flights. Pakistan is yet to report a case of the coronavirus, but it doesn't have strict screening and quarantine measures in place.
@palkisu tells you how Pakistan is vulnerable to a coronavirus epidemic https://t.co/AJrCRTeeH1"
2020-02-14 01:00:11+00:00,"RT @TrulyMonica: Saying Namaste instead of shaking hands

Cremating dead body instead of burying 

Eating Satvik vegetarian food instead of…",bhakumchi,hyderabad india and sfo us,"Doctor by profession, politics is passion.",37,116,2119,False,"Saying Namaste instead of shaking hands

Cremating dead body instead of burying 

Eating Satvik vegetarian food instead of animals full of diseases

Our civilisation’s record of keeping us trouble-free is very underrated 😃 https://t.co/wgYwfa7CgK"
2020-02-14 01:00:28+00:00,"RT @TrulyMonica: Saying Namaste instead of shaking hands

Cremating dead body instead of burying 

Eating Satvik vegetarian food instead of…",Arhar0514,india,"Tough times never last, tough people do! 
#GoCorona!",111,396,4641,False,"Saying Namaste instead of shaking hands

Cremating dead body instead of burying 

Eating Satvik vegetarian food instead of animals full of diseases

Our civilisation’s record of keeping us trouble-free is very underrated 😃 https://t.co/wgYwfa7CgK"
2020-02-14 01:00:29+00:00,@RichaChadha They eat non veg and #coronavairus come from that meet in China then #Islamic religion follower are saying that virus come in China because #china banded #Burqas so #Allah punish China so #Allah don’t know muslim also live in China 😂😂😂this is really thinking of #21century,agarwal_ishanvi,pune india,"You've gotta dance like there's nobody watching, Love like you'll never be hurt, Sing like there's nobody listening, And live like it's heaven on earth.",285,445,3524,False,
2020-02-14 01:00:32+00:00,Didn't see a single video with Sun and shadows from #wuhan .. it's raining in Singapore and Indonesia for weeks .. no vitamin D = coronavirus,IndianNewsViews,india,https://t.co/Dhudik6wM5,579,549,34160,False,
2020-02-14 01:00:36+00:00,@_nirajshah I agree where the epidemic will spread the next is the big question,Nileshthetrader,mumbai india,X Equity Sales guy now an active trader,7,189,801,False,
2020-02-14 01:00:59+00:00,"RT @RPrasad12: Coronavirus: Saliva of COVID-19 patients contain virus, study finds https://t.co/5y0WEtaz2J https://t.co/hxWhjr9WF0",PVmysore,mysore india,Retired scientist. Grandma,23,204,4292,False,"Coronavirus: Saliva of COVID-19 patients contain virus, study finds https://t.co/5y0WEtaz2J https://t.co/hxWhjr9WF0"
2020-02-14 01:01:50+00:00,RT @RajeIyer: And he doesnt want US president visiting India. Why not settle your pappus and pappinis in Cuba or Wuhan China bl00dy lal ch*…,BeCuriousAll,india,Anxious Bored,399,1096,37257,False,"And he doesnt want US president visiting India. Why not settle your pappus and pappinis in Cuba or Wuhan China bl00dy lal ch*ddi M0r0n Sitaram yechury!
@realDonaldTrump @USAGov  @USAndIndia @USAmbIndia 
Can you please take care of this guy who is going to agitate against Trump's"
2020-02-14 01:01:55+00:00,"They don't have any economist in their team, whatever dream they get nigth time, they just implement,like Demo, Corporate tax cut then cry for Income tax revenue https://t.co/DCScAKqePM",krdave,mumbai india,"Engineer,Country First,One abuse & blocked,tweets personal opinion,Tweets for national social cause and interaction with friends.RTs are not endorsement,",13010,9312,145853,False,
2020-02-14 01:01:59+00:00,RT @ImtiazMadmood: Saying greetings instead of shaking hands. Not eating animals but only vegetarian. Cremating the dead instead of burying…,hamugurjar,jaipur india,"hard-core HINDU !
RSS & subramanian swamy follower.",21,17,4961,False,"Saying greetings instead of shaking hands. Not eating animals but only vegetarian. Cremating the dead instead of burying them.

Since Corona virus the world is becoming Hindu?"
2020-02-14 01:02:20+00:00,RT @ANI: China reports 116 more deaths in coronavirus epicentre: AFP news agency.,nemityadav1,raipur chhattisgarh india,Common looking people are the best in the world: that is the reason the Lord makes so many of them.,1264,706,308201,False,China reports 116 more deaths in coronavirus epicentre: AFP news agency.
2020-02-14 01:02:22+00:00,RT @ImtiazMadmood: Saying greetings instead of shaking hands. Not eating animals but only vegetarian. Cremating the dead instead of burying…,ManiShankarIyer,body india heart pakistan,"Parody account. Proud sycophant. Arrogant elite. Oh shutup. So bloody what? Modi will not become PM, but he can set up a tea stall!",3101,111,8768,False,"Saying greetings instead of shaking hands. Not eating animals but only vegetarian. Cremating the dead instead of burying them.

Since Corona virus the world is becoming Hindu?"
2020-02-14 01:02:39+00:00,"RT @PDChina: China's #Hubei Province, the epicenter of #COVID19, reported 116 new deaths, 690 hospital discharges and, under a new standard…",PrinceJWesley,chennai india,"Agnostic Person, Widower.",127,315,1802,False,"China's #Hubei Province, the epicenter of #COVID19, reported 116 new deaths, 690 hospital discharges and, under a new standard, 4,823 new confirmed cases on Feb. 13. More details:
 
- 51,986 confirmed cases (incl. 15,384 clinical cases)
- 36,719 hospitalized https://t.co/o2cSiWVUqN"
2020-02-14 01:02:57+00:00,RT @ANI: China reports 116 more deaths in coronavirus epicentre: AFP news agency.,ReadIndyan,singapore hyderabad india,Entrepreneur / IT / Banking / Engr / Politics / Business / Sports / Rural Education / Pharma. Teacher to some and student of many. Dad.,521,771,84330,False,China reports 116 more deaths in coronavirus epicentre: AFP news agency.
2020-02-14 01:02:59+00:00,RT @PTI_News: Final sample collection of 404 inmates at ITBP #coronavirus quarantine facility in New Delhi being carried out to determine i…,nemityadav1,raipur chhattisgarh india,Common looking people are the best in the world: that is the reason the Lord makes so many of them.,1264,706,308201,False,Final sample collection of 404 inmates at ITBP #coronavirus quarantine facility in New Delhi being carried out to determine if they can be discharged over next few days: Senior official
2020-02-14 01:03:27+00:00,"China Expands Chaotic Dragnet in Coronavirus Crackdown

By BY AMY QIN via NYT World

visit https://t.co/QeX5vke1Hs to read more https://t.co/AFvMOgtVpz",greatindiablog,india,Great India Blogs is about open journalism and latest news about most happening incidents in India which affects Indians.,19,51,3751,False,
2020-02-14 01:03:28+00:00,"Coronavirus live updates: China’s Hubei province reports 116 more deaths and 4,823 new cases   https://t.co/WSnBYDyOg5 https://t.co/zerdNFnKnl",jollymampilly,india kerala,"Age 52, Working in FACT Ltd. Graduate , MBA - Hrm, Counselor, Studying M. Sc. Psychology.",1593,2385,35976,False,
2020-02-14 01:03:36+00:00,"RT @RadioFreeAsia: ""[You] are not a politician, because you don't actually have any ideas, or a clear direction in which you want to take t…",TYCJigme,india,"Activist/musician/former President at Tibetan Youth Congress, the largest Tibetan NGO in exile working for the freedom and independence of Tibet.",1337,161,949,False,"""[You] are not a politician, because you don't actually have any ideas, or a clear direction in which you want to take this country,"" Xu wrote. 

https://t.co/i1nt9xJVEe"
2020-02-14 01:03:44+00:00,"RT @VishnuNDTV: How Air India rose to the occasion to rescue hundreds from Wuhan. Our exclusive with Capt Amitabh Singh.

https://t.co/FsNk…",DThinkinIndian,india,"सुखदुःखे समे कृत्वा लाभालाभौ जयाजयौ।
ततो युद्धाय युज्यस्व नैवं पापमवाप्स्यसि॥",90,302,13388,False,"How Air India rose to the occasion to rescue hundreds from Wuhan. Our exclusive with Capt Amitabh Singh.

https://t.co/FsNkrlf8jg

Shared via NDTV News App (Android - https://t.co/c2uSlWlb3b | iPhone - https://t.co/GN49E8tUM6 )"
2020-02-14 01:03:50+00:00,"RT @SanjeevSanskrit: Vedic Rishis were smart. 
Namaste is safer than handshake. 
Sattvik food is safer than animals causing all forms of vi…",rahulrash18,india,"चाणक्य चंद्रगुप्त फिर बनाएंगे गौरवशाली भारत
🇮🇳",376,227,75446,False,"Vedic Rishis were smart. 
Namaste is safer than handshake. 
Sattvik food is safer than animals causing all forms of virus outbreaks. 
Gauseva is better than beef - most polluting, unhealthy, poverty-inducing.
Water is good for drinking, alcohol is good for washing hands &amp; toilets https://t.co/IyqtdRpqq4"
2020-02-14 01:04:00+00:00,"Indian IT firms ready for some slowdown in Q4 revenue growth due to coronavirus impact.

https://t.co/KxqJeMeVyT",TimesNow,india,TIMES NOW is India’s most watched English news channel. Follow for lightning fast #BreakingNews and #Alerts.,9432245,393,504386,True,
2020-02-14 01:04:03+00:00,"RT @UberFacts: In 2014, a group of single people in China bought every odd-numbered seat at a movie theater on Valentine's Day so that coup…",RaviMishra46,bhopal india,Electrical Engineer; Amateur Astronomer,708,1482,11993,False,"In 2014, a group of single people in China bought every odd-numbered seat at a movie theater on Valentine's Day so that couples couldn't sit together."
2020-02-14 01:04:07+00:00,RT @spectatorindex: BREAKING: Coronavirus death toll reaches 1483,rupeshsonalkar,kolhapur india,★★Welcome To My Account★★,70,142,3611,False,BREAKING: Coronavirus death toll reaches 1483
2020-02-14 01:04:26+00:00,"RT @russian_market: Community officers around China beat dogs to death to stop coronavirus https://t.co/C2WzF9mzvA 

😡😡😡😡😡😡😡",RitasArtCafe,india,"Hi, Welcome to my Art Cafe. Grab a cup of coffee (or tea, or whatever) and look at my artworks. If you want to buy any, please tweet to me.",7133,3618,98894,False,"Community officers around China beat dogs to death to stop coronavirus https://t.co/C2WzF9mzvA 

😡😡😡😡😡😡😡"
2020-02-14 01:04:34+00:00,"Decades ago in a debate competition I said that any single celled organism (bacteria or a minute virus ) can become a threat to entire humanity (In the context of human arrogance )
It can even bring down economies I said . Judges were not convinced . SARS came later &amp; now CORONA",KarunaGopal1,hyderabad india,"Special Invitee BJP State Exec Committee TS | Member Sub Committee BJP National Manifesto | President FFC | MRICS ,UK | IVLP Fellow | Harvard Kennedy School USA",38545,713,14191,False,
2020-02-14 01:04:48+00:00,"RT @TIinExile: Fool.

Maharaja consulted the people's assembly of Jammu and Kashmir.

The then prime minister of Jammu Kashmir, Mehr Chand…",Deewana__Dil,new delhi india,Proud Indian🇮🇳 | Viratian❤ | Cricket lover🏏 | Music lover🎶 | Kbhi-Kbhar Shayar✒| RW🚩,116,82,18027,False,"Fool.

Maharaja consulted the people's assembly of Jammu and Kashmir.

The then prime minister of Jammu Kashmir, Mehr Chand Mahajan approved the move.

Even Sheikh Abdullah welcomed the move then.

Even when the country was under a brutal invasion, he followed the due process. https://t.co/BVnWlYjn3k"
2020-02-14 01:04:56+00:00,@_YogendraYadav You shameless sweet talking hypocrite! इस the EVM working now!? Why is AAP quiet on EVM tampering? The commie coronavirus is more lethal than the real one in China. Introspect and change your outlook. Grow up. Anarchy and falsehood has not taken anybody anywhere in the long run.,NKashyap11,india,सत्यं சிவம் Sundaram ll,2,17,478,False,
2020-02-14 01:05:04+00:00,RT @ImtiazMadmood: Saying greetings instead of shaking hands. Not eating animals but only vegetarian. Cremating the dead instead of burying…,N_S_Kamble,navi mumbai india,,1,48,644,False,"Saying greetings instead of shaking hands. Not eating animals but only vegetarian. Cremating the dead instead of burying them.

Since Corona virus the world is becoming Hindu?"
2020-02-14 01:05:21+00:00,RT @agarwal_ishanvi: They eat non veg and #coronavairus come from that meet in China then #Islamic religion follower are saying that virus…,undrtyu,india,"Dharma not hvng equal word inEnglis values,laws of univers2b followd so it is eternal=Sanaathan not changes wt time Hindu is culture best lifestyle not religion",381,3206,20961,False,They eat non veg and #coronavairus come from that meet in China then #Islamic religion follower are saying that virus come in China because #china banded #Burqas so #Allah punish China so #Allah don’t know muslim also live in China 😂😂😂this is really thinking of #21century
2020-02-14 01:05:28+00:00,RT @DongleBookPro: Launch of D79 and March 10th event will be delayed due to the current situation of Corona Virus and further delays facto…,ajit1989,india,,203,651,8957,False,Launch of D79 and March 10th event will be delayed due to the current situation of Corona Virus and further delays factory side
2020-02-14 01:05:31+00:00,"RT @srivatsayb: Personally monitored Demonetization
❌100+ people died in queues

Personally monitored GST
❌GST became most complicated tax…",GousBagwan5,aurad india,being human,136,214,23677,False,"Personally monitored Demonetization
❌100+ people died in queues

Personally monitored GST
❌GST became most complicated tax

Personally monitored Economy
❌Lowest growth &amp; highest unemployment in 45 yrs

Now, Modi is personally monitoring Corona Virus. Be afraid, be very afraid. https://t.co/8AgJoFg5An"
2020-02-14 01:05:41+00:00,"RT @TIinExile: Fool.

Maharaja consulted the people's assembly of Jammu and Kashmir.

The then prime minister of Jammu Kashmir, Mehr Chand…",SameerTripathy,pune india,"Software professional, tweets and replies are purely personal. RTs are not  endorsements.",42,82,7602,False,"Fool.

Maharaja consulted the people's assembly of Jammu and Kashmir.

The then prime minister of Jammu Kashmir, Mehr Chand Mahajan approved the move.

Even Sheikh Abdullah welcomed the move then.

Even when the country was under a brutal invasion, he followed the due process. https://t.co/BVnWlYjn3k"
2020-02-14 01:05:48+00:00,"RT @Pun_Starr: Health Minister Harshvardhan has said, PM Modi is personally monitoring Coronavirus.

Considering that the last time Modiji…",harishchilwal,india,Mad pahadi .,171,437,9844,False,"Health Minister Harshvardhan has said, PM Modi is personally monitoring Coronavirus.

Considering that the last time Modiji personally monitored anything, it was the economy, this isn't a very comforting thought."
2020-02-14 01:06:10+00:00,"RT @Vijayabaskarofl: #CoronaVirus Update: The Virologylab at #KingsInstitute,Chennai is setup as per guidelines from Health Ministry &amp; is f…",vijay_rang,kanchipuram india,"Having a great aim.,Acquiring a essential knowledge.,Crack the Target.,.,.. mission vj IPS",19,77,1887,False,"#CoronaVirus Update: The Virologylab at #KingsInstitute,Chennai is setup as per guidelines from Health Ministry &amp; is fully functional. Blood samples &amp; throat swab for #nCoV2019 can be tested starting tomorrow (2nd,Feb). This is a major initiative from #TNGovt against n-CoV. #CVB https://t.co/KZFSgncYVT"
2020-02-14 01:06:18+00:00,"RT @bsindia: #FrontPage | With a #coronavirus scare, good Chinese companies are not tapping the bond market actively. The issue size of Chi…",vkyvarma,new delhi india,"Founder - Cognizance IP  • My personal interests : Analytics, Artificial Intelligence, Reading, Patent News,   Company page: @cognizanceip",435,1434,703,False,"#FrontPage | With a #coronavirus scare, good Chinese companies are not tapping the bond market actively. The issue size of Chinese companies has come down to $100 million, or even as low as $5 million.

@anuproy05 &amp; Krishna Kant  
#CoronavirusOutbreak

https://t.co/nGT89xGka9"
2020-02-14 01:06:31+00:00,"RT @spectatorindex: BREAKING: 116 new coronavirus deaths in Hubei Province, China.",Brio1s,india,,27,79,2455,False,"BREAKING: 116 new coronavirus deaths in Hubei Province, China."
2020-02-14 01:07:00+00:00,"RT @Roflindian: One week ago, there was this little piece of news that the whole world missed. Major General Chen Wei, China's top bioweapo…",PenduShehari,delhi india,"~Ki Jaana Mein Kaun~ Travelling to take a journey into myself. And yes, I preach enroute.",11607,733,38164,False,"One week ago, there was this little piece of news that the whole world missed. Major General Chen Wei, China's top bioweapons expert, was quietly sent to Wuhan to take over the P4 lab. The military was asked to assist her in whatever way possible to contain the 2019-ConV outbreak https://t.co/6MjVXQIBFC"
2020-02-14 01:07:09+00:00,RT @KarunaGopal1: Decades ago in a debate competition I said that any single celled organism (bacteria or a minute virus ) can become a thr…,Pandey__shivam,ayodhya india,"Namo bhakt and Rss follow back 🙏

 proud tobe INDIAN🇮🇳 modi bhakt blessed to be followed by @officeofRKsingh @SuPriyoBabul @kapilmishra_IND",2455,4941,41844,False,"Decades ago in a debate competition I said that any single celled organism (bacteria or a minute virus ) can become a threat to entire humanity (In the context of human arrogance )
It can even bring down economies I said . Judges were not convinced . SARS came later &amp; now CORONA"
2020-02-14 01:07:13+00:00,"RT @sunandavashisht: Say Namaste, become vegetarian and save the planet:)",Priyesh4U2,new delhi india,"Mechanical Engineer, Meditator & Seeker of Knowledge",385,1159,5219,False,"Say Namaste, become vegetarian and save the planet:) https://t.co/hQfLoyk70R"
2020-02-14 01:07:17+00:00,RT @XpressHyderabad: A lift has been dedicated to Corona virus patients at Gandhi Hospital on Wednesday. @Vinaymadapu #Hyderabad #coronavir…,Vinaymadapu,hyderabad india,photojournalist,192,324,190,False,A lift has been dedicated to Corona virus patients at Gandhi Hospital on Wednesday. @Vinaymadapu #Hyderabad #coronavirusindia https://t.co/g7cMtQ1uPX
2020-02-14 01:07:46+00:00,"RT @sunandavashisht: Say Namaste, become vegetarian and save the planet:)",PawanDurani,panun kashmir india,"You are all you have to offer the world. Know yourself, love yourself and be yourself. || Anything retweeted is not adopted as a statement of fact ||",53507,583,165918,True,"Say Namaste, become vegetarian and save the planet:) https://t.co/hQfLoyk70R"
2020-02-14 01:08:08+00:00,RT @spectatorindex: BREAKING: Coronavirus death toll reaches 1483,Harjeet_Insan_,haryana india,"I love you (Satnam,Mastan,Meet).",7215,7822,15611,False,BREAKING: Coronavirus death toll reaches 1483
2020-02-14 01:08:10+00:00,"RT @sunandavashisht: Say Namaste, become vegetarian and save the planet:)",astitvamm,bengaluru south india,ಕನ್ನಡಿಗ | 24 | Design Engineer | Gay | Vegetarian | RCBian | Solo Traveller |,98,498,9251,False,"Say Namaste, become vegetarian and save the planet:) https://t.co/hQfLoyk70R"
2020-02-14 01:08:14+00:00,@republic CPIM's sciamachy against American Imperialism cost Bengal too dearly. Now this Trojan Horse of China is on to the whole of India with the same evil motive. Alert @tathagata2 @DrSJaishankar,DhrubaBasu,kolkata india,Former Press Secretary to the Governor of West Bengal (RTs are not endorsements),78,163,9396,False,
2020-02-14 01:08:15+00:00,"RT @AP: BREAKING: China reports 254 new deaths and a spike in virus cases of 15,152, after new methodology applied in Hubei province.",mervinkajar,mumbai india,"Instagram : _mervin_kajar |
YouTube: CCC KAJAR",799,315,37671,False,"BREAKING: China reports 254 new deaths and a spike in virus cases of 15,152, after new methodology applied in Hubei province."
2020-02-14 01:08:18+00:00,"RT @spectatorindex: BREAKING: 116 new coronavirus deaths in Hubei Province, China.",Harjeet_Insan_,haryana india,"I love you (Satnam,Mastan,Meet).",7215,7822,15611,False,"BREAKING: 116 new coronavirus deaths in Hubei Province, China."
2020-02-14 01:08:18+00:00,"RT @jonathanjosephs: Have you heard of #Guanxi?

Dr Barbara Wang of @Ashridge_Biz has been explaining to @bbcaaron how #China's networking…",prbashnkr,india worldwide,"Motorsport Management. FIA, F1. F3, F4, MRF Challenge. Business Innovation. Marketing. Electric Mobility. Automotive, EV, Lithium. Futurist. Trainer. Speaker.",6450,933,9570,False,"Have you heard of #Guanxi?

Dr Barbara Wang of @Ashridge_Biz has been explaining to @bbcaaron how #China's networking art is spreading to businesses around the world

https://t.co/YQ1cEO1k5o https://t.co/zvxpHV7g6R"
2020-02-14 01:08:22+00:00,"RT @TIinExile: Fool.

Maharaja consulted the people's assembly of Jammu and Kashmir.

The then prime minister of Jammu Kashmir, Mehr Chand…",travikant,durg india,"Born hindu, Modi bhakt, love to comment & RTs are not endorsement",460,1196,74988,False,"Fool.

Maharaja consulted the people's assembly of Jammu and Kashmir.

The then prime minister of Jammu Kashmir, Mehr Chand Mahajan approved the move.

Even Sheikh Abdullah welcomed the move then.

Even when the country was under a brutal invasion, he followed the due process. https://t.co/BVnWlYjn3k"
2020-02-14 01:08:23+00:00,RT @SOliver2020: When he heard about Coronavirus ... Caution and prevention are essential ... https://t.co/K4mvBzwVtJ,Sukesh99475574,india,,3658,5001,241769,False,When he heard about Coronavirus ... Caution and prevention are essential ... https://t.co/K4mvBzwVtJ
2020-02-14 01:08:25+00:00,"RT @Arun2981: He personally monitored Demonetisation 

Personally monitored GST 

Personally monitored Kashmir 

Ab darr lag raha hai.... g…",1953Surya,india,ख्याल अपना अपना !जो ठीक लगे वो ही सही !,321,421,20205,False,"He personally monitored Demonetisation 

Personally monitored GST 

Personally monitored Kashmir 

Ab darr lag raha hai.... god bless India 🇮🇳 https://t.co/LUe4TGD5up"
2020-02-14 01:08:35+00:00,"RT @TrulyMonica: Saying Namaste instead of shaking hands

Cremating dead body instead of burying 

Eating Satvik vegetarian food instead of…",A_Truly_Indian,india,"proud Indian, karmyogi",43,372,2633,False,"Saying Namaste instead of shaking hands

Cremating dead body instead of burying 

Eating Satvik vegetarian food instead of animals full of diseases

Our civilisation’s record of keeping us trouble-free is very underrated 😃 https://t.co/wgYwfa7CgK"
2020-02-14 01:08:39+00:00,"RT @XHNews: Novel coronavirus advice, facts and prevention tips explained with sand painting in 150 seconds https://t.co/Cap8Gu4ADW",Brio1s,india,,27,79,2455,False,"Novel coronavirus advice, facts and prevention tips explained with sand painting in 150 seconds https://t.co/Cap8Gu4ADW"
2020-02-14 01:08:40+00:00,RT @sumanthraman: The big issue with #coronavirus is that the tests to detect it are apparently only 30-40% accurate. So a patient with the…,Nathan_KB,tenkasi india,"Mechanical Engineer, Desalination Specialist, Hockey fan, car freak, fast n furious, bird lover, gardens, forests, mountains, rivers I love. RT = Agree.",193,134,12705,False,The big issue with #coronavirus is that the tests to detect it are apparently only 30-40% accurate. So a patient with the virus is only 30-40% likely to be identified and may well slip through quarantine. ☹️☹️
2020-02-14 01:08:42+00:00,"RT @UberFacts: In 2014, a group of single people in China bought every odd-numbered seat at a movie theater on Valentine's Day so that coup…",rasamgirl,bengaluru india,"As curious as George. Heart Tamil, spirit Global.",1592,655,6984,False,"In 2014, a group of single people in China bought every odd-numbered seat at a movie theater on Valentine's Day so that couples couldn't sit together."
