created_at,full_text,screen_name,location,description,followers_count,friends_count,statuses_count,verified,full_retweet_text
2020-02-16 22:00:08+00:00,"RT @HitmanAuba: Goal - CORONAVIRUS
Assist - tbc

Aston Villa 2-3 Spurs (90+4 mins)

#FPL #AVLTOT",_Forever_Red,gurgaon india,Liverpool and all that jazz.. #YNWA #AllezAllezAllez 🎶,638,2713,25561,False,"Goal - CORONAVIRUS
Assist - tbc

Aston Villa 2-3 Spurs (90+4 mins)

#FPL #AVLTOT"
2020-02-16 22:00:09+00:00,RT @MarianKeyes: This is SO SWEET 😜😜😜😜,LabannyaR,india,I'm a journalist. An avid reader. Blogger. A book reviewer. I write sometimes something on my own.,317,1214,1886,False,This is SO SWEET 😜😜😜😜 https://t.co/HV1hoH3DcE
2020-02-16 22:01:05+00:00,"RT @callumtwalker: What do you mean ""Finally""?",praveenraja0,navi mumbai india,Boycott chai ☕ since 2014 ⚖,49,259,1655,False,"What do you mean ""Finally""? https://t.co/YFsZ7oOaLl"
2020-02-16 22:01:14+00:00,"Maharashtra: Govt to lodge FIR against people spreading rumour linking poultry meat to coronavirus spread

https://t.co/mCXqamQ5yK",IndianExpress,india,"The Indian Express brings to you latest news from India and the world, breaking round the clock. On telegram: https://t.co/NEjcxYKpGy",3433953,342,664777,True,
2020-02-16 22:02:03+00:00,RT @zoo_bear: WTF is this SHIT!,ksn7dec,hyderabad india,"Live life to the fullest. Also don't forget you have responsibilities towards your family,frnds and country. #ProudIndian",28,12,11893,False,WTF is this SHIT! https://t.co/FVwdz7R6ci
2020-02-16 22:02:17+00:00,RT @newscomauHQ: Researchers say a facility where a worker was covered in bat blood and urine may be ground zero for the coronavirus outbre…,shaarng,new delhi india,"The bow of Bhagavan Ram, the axe of Bhagavan Parshuram, the Sudarshan of Bhagavan Krsna. सीधे तो ""राम"", पलटे तो ""परशुराम""|",738,100,80481,False,"Researchers say a facility where a worker was covered in bat blood and urine may be ground zero for the coronavirus outbreak.
https://t.co/Eq9blZJp4L"
2020-02-16 22:03:09+00:00,RT @AdityaRajKaul: Globally designated terrorist Masood Azhar of Pakistani terror group Jaish e Muhammad has gone missing. Pakistan has inf…,RaviBrahmbhat14,ahmedabad gujarat india,A tolerant Hindu & A Proud Nationalist !!! RT not Endorsements !!!,244,2119,41142,False,Globally designated terrorist Masood Azhar of Pakistani terror group Jaish e Muhammad has gone missing. Pakistan has informed Financial Action Task Force (FATF). This is Pakistan mocking the global community including their so called 'iron brother' China. Old habits die hard.
2020-02-16 22:04:22+00:00,"@WHO My idea to kill corona virus.
Any live matter can't survive without oxygen. If we fill Infected People Lungs with Nitrogen (A chemically Inert Gas) for some Seconds or minutes we can kill it in body. Like wise repeated assisted N2 breath iterations will help to kill it.",ikishore1118,ongole india,"BE in Mechanical Engineering,
PGD in Power Plant Engineering,
Entrepreneur",13,23,104,False,
2020-02-16 22:04:31+00:00,RT @CHICHI_YASU614: During Lunar new year Japan was the most popular country to travel among Chinese people. Chinese and Japanese goverment…,Sunil_Twitz,bengaluru india,Let’s join hands together to raise our voice for the development of most neglected north Karnataka.,741,4842,13389,False,During Lunar new year Japan was the most popular country to travel among Chinese people. Chinese and Japanese goverment did not restrict immigration. Now many Japanese are carrying virus and they started to go out.#coronavirusinjapan #coronavirus
2020-02-16 22:05:33+00:00,"RT @ndtv: #Coronavirus could damage global growth in 2020, says IMF.
https://t.co/e56lCsBWo6 https://t.co/oQ0DhpHOzm",ROHITRAJAK2013,india,"working for public welfare(service before self)
|Electrical and electronics engineer|views are personal",35,397,1332,False,"#Coronavirus could damage global growth in 2020, says IMF.
https://t.co/e56lCsBWo6 https://t.co/oQ0DhpHOzm"
2020-02-16 22:06:08+00:00,RT @newscomauHQ: Researchers say a facility where a worker was covered in bat blood and urine may be ground zero for the coronavirus outbre…,YouCantSeecid,pune india,"MBA Finance from @scmhrd.pune. Right Liberal. Humour enthusiast. Chelsea fan. Politics, history, culture, economics.",57,1212,8865,False,"Researchers say a facility where a worker was covered in bat blood and urine may be ground zero for the coronavirus outbreak.
https://t.co/Eq9blZJp4L"
2020-02-16 22:06:45+00:00,RT @Kari81709371: Retweet if you think #Shaheenbaghvirus is more dangerous than #coronavirus For India,SitanshuDesai,india,"This Bird Tweets Less But , Likes Other Tweeting . #NaModified",456,1295,173356,False,Retweet if you think #Shaheenbaghvirus is more dangerous than #coronavirus For India
2020-02-16 22:07:15+00:00,RT @justinbieber: @JBieberCharts Thank you China,BRohitian,lucknow india,"@justinbieber has followed me on 15Sep/19 and msgged me on 16Sep.2019 
he texted me dat he love me 2 i.e.we both love each other & he knows my existence !!bye👍",1298,1328,20247,False,@JBieberCharts Thank you China
2020-02-16 22:07:31+00:00,"RT @ImtiazMadmood: US announces shifting of 200 companies production from China to India.

India reduces tax to 15% less than China, Malays…",Me_Nitesh_,mumbai india,I would rather be hated for who I am than loved for who I am not.,276,523,66741,False,"US announces shifting of 200 companies production from China to India.

India reduces tax to 15% less than China, Malaysia and Singapore.

More businesses are expected to come to India.

US leaves terrorism production in Pakistan domain."
2020-02-16 22:08:00+00:00,RT @spectatorindex: JUST IN: Fourty Americans who are on board the cruise ship in Japan have been infected with coronavirus,bigmouthspeaks,india,RTs are not endorsements.,422,2191,99265,False,JUST IN: Fourty Americans who are on board the cruise ship in Japan have been infected with coronavirus
2020-02-16 22:09:02+00:00,"RT @jaavedjaaferi: Maybe they were being punished for making noise in the library, or not returning books on time 😶. Were they also taking…",JGhatode,india,"Combo of madness and happiness!!! Football lover, music and movie addict, a great Apple fanboy and also an #AAPtard",104,396,8396,False,"Maybe they were being punished for making noise in the library, or not returning books on time 😶. Were they also taking caution in advance against the corona virus 😷?
Jamia Protesters Release Video Of Cops Attacking Students In Library https://t.co/XrFuZiXrpu"
2020-02-16 22:09:03+00:00,"RT @MYXYXYM: I was talking to an old muslim friend from Pakistan about coronavirus.

He: hey you know, they can find the cure in Quran.

Me…",_Shan_Kar_,india,That awkward moment when inadvertantly you hurt the sentiments of someone very badly.,1025,1260,23808,False,"I was talking to an old muslim friend from Pakistan about coronavirus.

He: hey you know, they can find the cure in Quran.

Me: No way, seriously?

He: that's how they found the cure for AIDS.

My friend is uneducated."
2020-02-16 22:09:05+00:00,Overwatch League moves matches to South Korea after coronavirus outbreak https://t.co/xq6vZTHs00 https://t.co/yP2RT0b2Qq,Pradeep06055013,india,Content Management expert,1,5,1476,False,
2020-02-16 22:11:39+00:00,"RT @KimagureGolf9: CKS581(B744 N716CK) departed Tokyo/Haneda IAP at 2147z for Kelly Field TX.
#DiamondPrincess #Coronavirus #evacuation htt…",SanjivRanjanJh1,delhi ncr india,"stone edAged,views sunrays,follows Eternity Planners, Security&Zones, 'Yayavar'.
Tested DNA- Himalayan Vedic.
all cards on the table- always up
All That Jhazz🎺",460,800,20542,False,"CKS581(B744 N716CK) departed Tokyo/Haneda IAP at 2147z for Kelly Field TX.
#DiamondPrincess #Coronavirus #evacuation https://t.co/aYn0xWIIH6"
2020-02-16 22:13:13+00:00,RT @newscomauHQ: Researchers say a facility where a worker was covered in bat blood and urine may be ground zero for the coronavirus outbre…,kollsrini,vishakhapatnam india,"Witty, funny and has a Straight view of the world!!! Interests in #Spirituality #Meditation #Humanity #Humor #Stockmarkets. Life is simple. Take it easy!!",219,619,12638,False,"Researchers say a facility where a worker was covered in bat blood and urine may be ground zero for the coronavirus outbreak.
https://t.co/Eq9blZJp4L"
2020-02-16 22:13:18+00:00,"RT @RT_com: Blogger faces up to 5 years in prison after brutal #coronavirus prank on #Moscow subway

DETAILS: https://t.co/9cfUBAPyEH https…",ishwaracdas,rohini delhi india,Holiest of Holy Hindu Terrorist.,331,159,71150,False,"Blogger faces up to 5 years in prison after brutal #coronavirus prank on #Moscow subway

DETAILS: https://t.co/9cfUBAPyEH https://t.co/xRtVdFo51g"
2020-02-16 22:14:40+00:00,RT @jasonyng: Creative Hong Kong people have come up with a variety of ways to minimize the spread of #coronavirus. Here’s one: using dispo…,sivanvad,india australia,Data integration professional interested in politics and economics.,55,1026,945,False,Creative Hong Kong people have come up with a variety of ways to minimize the spread of #coronavirus. Here’s one: using disposable bamboo sticks instead of fingers to push elevator buttons. https://t.co/nptzs33ZHc
2020-02-16 22:16:13+00:00,"RT @callumtwalker: What do you mean ""Finally""?",DoDuniPaanch,india,"All hail His Grace, The Indian Iron Man, Lord of No Kingdoms.",488,485,5117,False,"What do you mean ""Finally""? https://t.co/YFsZ7oOaLl"
2020-02-16 22:16:51+00:00,"RT @djbaskin: Made this service that prints your face on an N95 mask, so you can protect people from viral epidemics while still being able…",drapurvagarg,india,Head Neck Surgeon & Anti-tobacco crusader. Retweets are not endorsements,441,2625,18022,False,"Made this service that prints your face on an N95 mask, so you can protect people from viral epidemics while still being able to unlock your phone.

😷+👃🏻👃🏽👃🏿👄=🔓

https://t.co/SXslSjoiMz https://t.co/rByMBwdPB8"
2020-02-16 22:17:42+00:00,"Welcome address by Matt Pearce CEO Talk 2 Media &amp; Events. Despite the advisories and scare of Coronavirus, the industry attended in good strength. Show must go on! @AIMEMelbourne https://t.co/PCyBqX9wn5",CandidIndia,india,"Deepika Chowdhry is the Founder of Candid India, a Delhi based PR and marketing representation company.",1830,1373,2046,False,
2020-02-16 22:18:18+00:00,RT @acorn: How farm output in the US has grown even as the number of farmers has declined. This story has played out in China too. This is…,sanjaykharwar,india,,140,127,39749,False,How farm output in the US has grown even as the number of farmers has declined. This story has played out in China too. This is the transition India must make if we are to become a middle income country. https://t.co/Fez3zKYUyn
2020-02-16 22:19:52+00:00,RT @Kari81709371: Retweet if you think #Shaheenbaghvirus is more dangerous than #coronavirus For India,Alok06897183,west bengal india,@alokdas,48,700,292,False,Retweet if you think #Shaheenbaghvirus is more dangerous than #coronavirus For India
2020-02-16 22:20:00+00:00,"On Saturday, Manipur’s popular musician Guru Rewben Mashangva took to the stage and performed a song on #coronavirus, urged the people of China and Wuhan to stay strong.

(reports @utpal_parashar)

https://t.co/H152WzCRiP",htTweets,india,"One of India's largest media companies. Latest news from around the world. Retweets are not endorsements

Telegram: https://t.co/oRjuzAvYUY",7297864,128,691694,True,
2020-02-16 22:20:35+00:00,RT @davidfrawleyved: Good that India is no longer a weak state that allows itself to be pushed around by other countries or kowtow to the f…,indiahkmishra,bhubaneswar odisha india,"Retd. Prof. Dr. in Economics. Odisha Development&SmartCity Dev. Educationist.Administrator.Chairman. Mentor.SocialService.Twts Personal,RTs not Endorsement.",131,568,25076,False,"Good that India is no longer a weak state that allows itself to be pushed around by other countries or kowtow to the foreign media. If Congress and the Left still had their way India's foreign policy would require approval by NYT, BBC, if not China or Pakistan."
2020-02-16 22:21:02+00:00,Forty Americans from cruise ship have coronavirus https://t.co/6cDiSQf2RR https://t.co/dOqULeIMcx,avpnews_live,bihar india,,212,4,2319,False,
2020-02-16 22:21:45+00:00,"RT @bravobravosunny: The hospital does not accept  the coronavirus patients, countless people are self-isolated, died at home, and do not c…",BeingMaverick_,india,"Follows you;

not left or right just correct and politically incorrect",35,625,7675,False,"The hospital does not accept  the coronavirus patients, countless people are self-isolated, died at home, and do not count the official death toll. #coronavirus #COVID-19 #wuhan＃肺炎＃武汉 https://t.co/7xvlnGTHtf"
2020-02-16 22:22:16+00:00,"RT @Che_guevara_in: Corona is not a virus, but avatar for the protection of poor creatures. they have come to give the message of death and…",savitasingh36,delhi india,Working with an MNC!! 🐠 ‘’Only dead fish go with the flow”!! R u alive???,509,206,21998,False,"Corona is not a virus, but avatar for the protection of poor creatures. they have come to give the message of death and punishment to the one who eats them,""

Meanwhile India is the largest exporter of beef in the world.
#Coronavirius
https://t.co/g8QgH8dnvD"
2020-02-16 22:23:03+00:00,RT @NHSuk: The Government and NHS are well prepared to deal with coronavirus.,ravii_m1,mumbai india,"Truth is Truth, Not biased, Realistic, Logical, Support for Good cause....",70,558,252,False,The Government and NHS are well prepared to deal with coronavirus.
2020-02-16 22:23:10+00:00,The coronavirus block disrupts the food supply for birds and animals at the Wuhan Zoo https://t.co/yiK5fCeYCC,WaYs2rOcK,new delhi india,Raj Gaur,42,49,18891,False,
2020-02-16 22:25:03+00:00,"#Coronavirus: a first municipality placed in quarantine in Vietnam

https://t.co/b77cf9YDzs",EasternHerald,india,"An international news herald promoting free speech, and protecting democracy.
Editor @MANooriBajwa.
Also on https://t.co/0tZj2H7gBI",148,8,5918,False,
2020-02-16 22:28:37+00:00,"RT @ImtiazMadmood: US announces shifting of 200 companies production from China to India.

India reduces tax to 15% less than China, Malays…",sejal_joshi1990,sikkim india,Asewaro 🙏🏼 #PrakritiPujak#Natureworshipper.,297,293,3689,False,"US announces shifting of 200 companies production from China to India.

India reduces tax to 15% less than China, Malaysia and Singapore.

More businesses are expected to come to India.

US leaves terrorism production in Pakistan domain."
2020-02-16 22:29:23+00:00,"RT @RUMAANSHAIKH: Forty years ago written fiction thriller by American writer, Is it great coincidence or mystery?? It reflect totally toda…",BeingMaverick_,india,"Follows you;

not left or right just correct and politically incorrect",35,625,7675,False,"Forty years ago written fiction thriller by American writer, Is it great coincidence or mystery?? It reflect totally today's scenario..!#Coronavirus https://t.co/JW3Au7kuxd"
2020-02-16 22:29:25+00:00,"RT @desimojito: Rahul Kanwal did a sting operation in january which was filmed in Oct 2019. 

Jamia video came out of December 2019 where s…",finepatriot1,navi mumbai india,Sports Government and Politics,198,582,31132,False,"Rahul Kanwal did a sting operation in january which was filmed in Oct 2019. 

Jamia video came out of December 2019 where students were in library with masks because of Corona Virus. 

Indian sequal of Back to Future"
2020-02-16 22:30:37+00:00,RT @jaavedjaaferi: Scary shit. This 1981 fiction novel is a major food for thought for the conspiracy theories on the #coronavirus  https:/…,dgr8onerip,india,"A Socialist at heart, Capitalist by profession and Economist at the soul!",191,148,4997,False,Scary shit. This 1981 fiction novel is a major food for thought for the conspiracy theories on the #coronavirus  https://t.co/80Pzgsae7O
2020-02-16 22:31:35+00:00,RT @Sohailk44748483: The WHO team is trying to stop the death toll due to #Coronavirus in China.Bcs the number of deaths due to Coronavirus…,BeingMaverick_,india,"Follows you;

not left or right just correct and politically incorrect",35,625,7675,False,The WHO team is trying to stop the death toll due to #Coronavirus in China.Bcs the number of deaths due to Coronavirus is increasing.I pray for Coronavirus patient.#coronavirusupdates https://t.co/vk60XXT1QU
2020-02-16 22:31:37+00:00,@AirAsiaSupport Your support chat takes days to respond. I can't believe you call it more extrinsic and viable. You have to seriously open up a chatroom atleast for awhile due to this corona virus infliction and possible surge in concerns.,Sebastian_joc,bengaluru india,#pursuinglifetech..,4,139,58,False,
2020-02-16 22:32:18+00:00,RT @jeffielam: Cathay to cut flights to mainland China by 90 per cent amid virus woes https://t.co/BevBwE5bdJ,SingerAbhiRajK4,india,"#singer / #songwriter #official account along with singer and songwriter, i am also a #Nationalist 🇮🇳",142,201,3244,False,Cathay to cut flights to mainland China by 90 per cent amid virus woes https://t.co/BevBwE5bdJ
2020-02-16 22:34:11+00:00,"RT @Sohailk44748483: China is doing its best to stop this virus and we also want it here.
I'm emotional after watching the video on China.#…",BeingMaverick_,india,"Follows you;

not left or right just correct and politically incorrect",35,625,7675,False,"China is doing its best to stop this virus and we also want it here.
I'm emotional after watching the video on China.#ChinaVirus #FightVirus #coronavirus https://t.co/m2iEHWMgAL"
2020-02-16 22:34:21+00:00,New post (COVID-19: China’s coronavirus costs rise as some industries remain closed) has been published on ApzWeb - https://t.co/o2xwo8xgYY https://t.co/RB0nUUtrfb,Vsplusonline,india,Web Hosting India | Web Hosting Space Unlimited | Free Domain Registration | Top Hosting India | Unlimited Domains | Reseller | VPS | Dedicated Server,152,32,39724,False,
2020-02-16 22:34:25+00:00,"RT @economics: -China, Asia bulk up economy defenses against the coronavirus 
-China's fiscal coffers are depleted just as the virus spurs…",jaypatelz2,gandhinagar india,backup,99,1591,4459,False,"-China, Asia bulk up economy defenses against the coronavirus 
-China's fiscal coffers are depleted just as the virus spurs spending
-IMF's Georgieva says a lack of reforms is hurting the global economy
Here's a rundown of your top economic news today https://t.co/pr1lfusx15"
2020-02-16 22:34:26+00:00,COVID-19: China’s coronavirus costs rise as some industries remain closed https://t.co/o2xwo8xgYY,Vsplusonline,india,Web Hosting India | Web Hosting Space Unlimited | Free Domain Registration | Top Hosting India | Unlimited Domains | Reseller | VPS | Dedicated Server,152,32,39724,False,
2020-02-16 22:34:35+00:00,"RT @The_World_Is_Y: 😱😱😱😱😱😱😱😱😱
Somebody is telling us an important message😲😷
#coronavirus #CoronavirusOutbreak #coronavirusjapan #coronaviru…",malapati,india,Passionate Supporter of Integral Humanism,269,417,112148,False,"😱😱😱😱😱😱😱😱😱
Somebody is telling us an important message😲😷
#coronavirus #CoronavirusOutbreak #coronavirusjapan #coronaviruschina #Coronavirusmexico #coronaviruswuhan #coronavirusthailand #coronavirusitalia #coronavirususa #coronaviruscanada #coronavirusfrance 
#COVID19 https://t.co/W9N4fDzsqk"
2020-02-16 22:34:39+00:00,@drharshvardhan  sir please have a ban and scanning for other counties returned people as well. many people visiting Thailand and Singapore as well. https://t.co/TC0mJ7plCE,DuttaVish,mumbai india,Citizen of India who thinks as Mango people.,41,180,194,False,
2020-02-16 22:35:14+00:00,RT @AdityaRajKaul: Globally designated terrorist Masood Azhar of Pakistani terror group Jaish e Muhammad has gone missing. Pakistan has inf…,mksharma4269,india,"Human first, Indian foremost.",720,605,108647,False,Globally designated terrorist Masood Azhar of Pakistani terror group Jaish e Muhammad has gone missing. Pakistan has informed Financial Action Task Force (FATF). This is Pakistan mocking the global community including their so called 'iron brother' China. Old habits die hard.
2020-02-16 22:36:41+00:00,"RT @Trinitydraco1: @The_World_Is_Y I couldn't watch this without tears streaming down my face.  Her suffering, the people of China's suffer…",malapati,india,Passionate Supporter of Integral Humanism,269,417,112148,False,"@The_World_Is_Y I couldn't watch this without tears streaming down my face.  Her suffering, the people of China's suffering is OUR suffering. It's HUMAN suffering, and sacrifice and courage and everything that makes us what we are. From one human being to another, I stand with you."
2020-02-16 22:37:02+00:00,"Outbreak of Coronavirus caused havoc in China, So far 1665 dead, first death outside Asia https://t.co/XDMxEBAffG https://t.co/JmhI17RvW0",Pawan05258Kumar,goa india,"part time web designer, music lover",488,34,16845,False,
2020-02-16 22:37:13+00:00,"RT @AscendedEagle: @The_World_Is_Y TRANSLATION:

""#Coronavirus was manufactured as an excuse to crackdown on all Hong Kong riot dissenters.…",malapati,india,Passionate Supporter of Integral Humanism,269,417,112148,False,"@The_World_Is_Y TRANSLATION:

""#Coronavirus was manufactured as an excuse to crackdown on all Hong Kong riot dissenters...

Americans denounce #Communism but mindlessly consume Chinese product, helping China get wealthy from sweatshop slave labor, making you supporters of communism and the CCP!"""
2020-02-16 22:38:16+00:00,Coronavirus: Forty infected Americans among cruise ship evacuees https://t.co/TKjVgDAG11 https://t.co/XgpQY4yI0M,jobgujnews3,india,,31,250,20272,False,
2020-02-16 22:39:00+00:00,"RT @barrymcalpin: #CoronavirusOutbreak #Coronavirius #ChinaWuHan 
This poor woman is telling what is really going on in China. You can real…",malapati,india,Passionate Supporter of Integral Humanism,269,417,112148,False,"#CoronavirusOutbreak #Coronavirius #ChinaWuHan 
This poor woman is telling what is really going on in China. You can really feel her pain. wow. serious. 

https://t.co/xh1g4YWhZP"
2020-02-16 22:39:05+00:00,@80suburbia @thundersloth818 This is how I imagine the coronavirus looks under a microscope.,bisonskins,dc india la,"Writer, filmmaker, & Sports Lover. Father, Husband, and Honey Do list completer first though. Mumbo Sauce, Redskins, and R.E. Hollywood won't keep DC out of me!",279,519,23541,False,
2020-02-16 22:39:14+00:00,RT @IAMIRONMAN7: Singapore. Cargo ships everywhere. Global economy has stopped. #singapore #cnbc #wuhan #coronavirus #covid19 #shanghai #WH…,r_venkat,bengaluru india,Lost in time and space!,277,609,1956,False,Singapore. Cargo ships everywhere. Global economy has stopped. #singapore #cnbc #wuhan #coronavirus #covid19 #shanghai #WHO #CDC #WSJ https://t.co/PSY1DKDxzf
2020-02-16 22:39:43+00:00,RT @WHO: Studies to assess the epidemiology &amp; clinical characteristics of #COVID19 cases in different settings are critical to furthering o…,WHOSEARO,new delhi india,World Health Organization Regional Office for South-East Asia (SEARO) Country accounts: @WHOIndonesia @WHOMaldives @WHOThailand @WHOTimorLeste @WHOSriLanka,80593,742,8836,True,"Studies to assess the epidemiology &amp; clinical characteristics of #COVID19 cases in different settings are critical to furthering our understanding of this #coronavirus &amp; associated disease.

WHO Situation Report 16 February 2020 https://t.co/VZlogNGd0o https://t.co/YM2vTA8Oci"
2020-02-16 22:39:47+00:00,"RT @callumtwalker: What do you mean ""Finally""?",inmessionante69,india,"Sex is intimate and sacred. Your body is a temple, you shouldn't share it with anyone who thinks Ronaldo is better than Messi.",247,308,7345,False,"What do you mean ""Finally""? https://t.co/YFsZ7oOaLl"
2020-02-16 22:39:58+00:00,"RT @WHO: Several early #COVID19 investigation master protocols or master forms are available for countries to use.
More information can be…",WHOSEARO,new delhi india,World Health Organization Regional Office for South-East Asia (SEARO) Country accounts: @WHOIndonesia @WHOMaldives @WHOThailand @WHOTimorLeste @WHOSriLanka,80593,742,8836,True,"Several early #COVID19 investigation master protocols or master forms are available for countries to use.
More information can be found here https://t.co/fr959Bp9mc

#coronavirus https://t.co/4rk7gElr1U"
2020-02-16 22:41:35+00:00,RT @amann3003: Coming to a steet near you 😷#COVID2019 #Coronavirustruth #kungflu #CoronarvirusOutbreak #Coronavirius #coronaviruswuhan #Cor…,malapati,india,Passionate Supporter of Integral Humanism,269,417,112148,False,Coming to a steet near you 😷#COVID2019 #Coronavirustruth #kungflu #CoronarvirusOutbreak #Coronavirius #coronaviruswuhan #CoronaOutbreak #2019nC0V #COVIDー19 #CDC #WuFlu #coronavirususa #CoronaVirusCanada #ChinaWuHan https://t.co/MYSEh8DM3D
2020-02-16 22:42:36+00:00,Trump Effort to Keep U.S. Tech Out of China Alarms American Firms https://t.co/HUb18RhqV7,somsirsa,chandigarh india,"Technophile, AI Faculty, Mental Health Advocate, @JUFET alum, 

Appointments at 👉
https://t.co/BzXQ3mIfBS",810,1714,361488,False,
2020-02-16 22:42:52+00:00,"#Coronavirus has a new name; #COVID19 - but what do we really know about it? What is #Coronavirus ? #hospital_iris explains:

https://t.co/COCFQPzG3u https://t.co/WtBr5ZLnEp",hospital_iris,kolkata india,"IRIS HOSPITAL is a NABH certified multispeciality hospital in Kolkata with modern infrastructure, 24*7 Emergency and have facility of 180 beds.",2,0,6,False,
